"No.","Time","Source","Destination","Protocol","Length","Info"
"36","5.093353","2a0d:6fc2:5560:c200:15f4:c1ab:865a:2377","2a03:2880:f276:cd:face:b00c:0:167","TLSv1.2","147","Application Data"
"38","5.179349","2a03:2880:f276:cd:face:b00c:0:167","2a0d:6fc2:5560:c200:15f4:c1ab:865a:2377","TCP","74","443  >  51017 [ACK] Seq=1 Ack=74 Win=5500 Len=0"
"49","9.788596","2a0d:6fc2:5560:c200:15f4:c1ab:865a:2377","2a03:2880:f276:cd:face:b00c:0:167","TLSv1.2","340","Application Data"
"50","9.844621","2a03:2880:f276:cd:face:b00c:0:167","2a0d:6fc2:5560:c200:15f4:c1ab:865a:2377","TCP","74","443  >  51017 [ACK] Seq=1 Ack=340 Win=5500 Len=0"
"53","10.018833","2a03:2880:f276:cd:face:b00c:0:167","2a0d:6fc2:5560:c200:15f4:c1ab:865a:2377","TLSv1.2","188","Application Data"
"54","10.062967","2a0d:6fc2:5560:c200:15f4:c1ab:865a:2377","2a03:2880:f276:cd:face:b00c:0:167","TCP","74","51017  >  443 [ACK] Seq=340 Ack=115 Win=1030 Len=0"
"58","10.283285","2a03:2880:f276:cd:face:b00c:0:167","2a0d:6fc2:5560:c200:15f4:c1ab:865a:2377","TLSv1.2","172","Application Data"
"59","10.286072","2a0d:6fc2:5560:c200:15f4:c1ab:865a:2377","2a03:2880:f276:cd:face:b00c:0:167","TLSv1.2","170","Application Data"
"61","10.309662","2a03:2880:f276:cd:face:b00c:0:167","2a0d:6fc2:5560:c200:15f4:c1ab:865a:2377","TLSv1.2","174","Application Data"
"62","10.313847","2a0d:6fc2:5560:c200:15f4:c1ab:865a:2377","2a03:2880:f276:cd:face:b00c:0:167","TLSv1.2","172","Application Data"
"63","10.342586","2a03:2880:f276:cd:face:b00c:0:167","2a0d:6fc2:5560:c200:15f4:c1ab:865a:2377","TCP","74","443  >  51017 [ACK] Seq=313 Ack=436 Win=5500 Len=0"
"64","10.370807","2a03:2880:f276:cd:face:b00c:0:167","2a0d:6fc2:5560:c200:15f4:c1ab:865a:2377","TCP","74","443  >  51017 [ACK] Seq=313 Ack=534 Win=5500 Len=0"
"67","10.533216","2a03:2880:f276:cd:face:b00c:0:167","2a0d:6fc2:5560:c200:15f4:c1ab:865a:2377","TLSv1.2","171","Application Data"
"68","10.535806","2a0d:6fc2:5560:c200:15f4:c1ab:865a:2377","2a03:2880:f276:cd:face:b00c:0:167","TLSv1.2","170","Application Data"
"69","10.592860","2a03:2880:f276:cd:face:b00c:0:167","2a0d:6fc2:5560:c200:15f4:c1ab:865a:2377","TCP","74","443  >  51017 [ACK] Seq=410 Ack=630 Win=5500 Len=0"
"235","22.264893","2a03:2880:f276:cd:face:b00c:0:167","2a0d:6fc2:5560:c200:15f4:c1ab:865a:2377","TCP","1466","443  >  51017 [ACK] Seq=410 Ack=630 Win=5500 Len=1392 [TCP segment of a reassembled PDU]"
"236","22.264893","2a03:2880:f276:cd:face:b00c:0:167","2a0d:6fc2:5560:c200:15f4:c1ab:865a:2377","TLSv1.2","195","Application Data"
"237","22.264983","2a0d:6fc2:5560:c200:15f4:c1ab:865a:2377","2a03:2880:f276:cd:face:b00c:0:167","TCP","74","51017  >  443 [ACK] Seq=630 Ack=1923 Win=1033 Len=0"
"238","22.265099","2a03:2880:f276:cd:face:b00c:0:167","2a0d:6fc2:5560:c200:15f4:c1ab:865a:2377","TCP","1466","443  >  51017 [ACK] Seq=1923 Ack=630 Win=5500 Len=1392 [TCP segment of a reassembled PDU]"
"239","22.265099","2a03:2880:f276:cd:face:b00c:0:167","2a0d:6fc2:5560:c200:15f4:c1ab:865a:2377","TLSv1.2","1466","Application Data"
"240","22.265099","2a03:2880:f276:cd:face:b00c:0:167","2a0d:6fc2:5560:c200:15f4:c1ab:865a:2377","TLSv1.2","1103","Application Data"
"241","22.265154","2a0d:6fc2:5560:c200:15f4:c1ab:865a:2377","2a03:2880:f276:cd:face:b00c:0:167","TCP","74","51017  >  443 [ACK] Seq=630 Ack=5736 Win=1033 Len=0"
"242","22.369203","2a0d:6fc2:5560:c200:15f4:c1ab:865a:2377","2a03:2880:f276:cd:face:b00c:0:167","TLSv1.2","168","Application Data"
"266","22.404041","2a0d:6fc2:5560:c200:15f4:c1ab:865a:2377","2a03:2880:f276:cd:face:b00c:0:167","TLSv1.2","180","Application Data"
"289","22.425251","2a03:2880:f276:cd:face:b00c:0:167","2a0d:6fc2:5560:c200:15f4:c1ab:865a:2377","TCP","74","443  >  51017 [ACK] Seq=5736 Ack=724 Win=5500 Len=0"
"293","22.461052","2a03:2880:f276:cd:face:b00c:0:167","2a0d:6fc2:5560:c200:15f4:c1ab:865a:2377","TCP","74","443  >  51017 [ACK] Seq=5736 Ack=830 Win=5500 Len=0"
"303","22.556796","2a03:2880:f276:cd:face:b00c:0:167","2a0d:6fc2:5560:c200:15f4:c1ab:865a:2377","TLSv1.2","167","Application Data"
"376","22.601623","2a0d:6fc2:5560:c200:15f4:c1ab:865a:2377","2a03:2880:f276:cd:face:b00c:0:167","TCP","74","51017  >  443 [ACK] Seq=830 Ack=5829 Win=1032 Len=0"
"562","23.298414","2a03:2880:f276:cd:face:b00c:0:167","2a0d:6fc2:5560:c200:15f4:c1ab:865a:2377","TLSv1.2","174","Application Data"
"563","23.300920","2a0d:6fc2:5560:c200:15f4:c1ab:865a:2377","2a03:2880:f276:cd:face:b00c:0:167","TLSv1.2","173","Application Data"
"564","23.358014","2a03:2880:f276:cd:face:b00c:0:167","2a0d:6fc2:5560:c200:15f4:c1ab:865a:2377","TCP","74","443  >  51017 [ACK] Seq=5929 Ack=929 Win=5500 Len=0"
"568","23.894223","2a0d:6fc2:5560:c200:15f4:c1ab:865a:2377","2a03:2880:f276:cd:face:b00c:0:167","TLSv1.2","147","Application Data"
"569","23.951319","2a03:2880:f276:cd:face:b00c:0:167","2a0d:6fc2:5560:c200:15f4:c1ab:865a:2377","TCP","74","443  >  51017 [ACK] Seq=5929 Ack=1002 Win=5500 Len=0"
"837","33.904563","2a0d:6fc2:5560:c200:15f4:c1ab:865a:2377","2a03:2880:f276:cd:face:b00c:0:167","TLSv1.2","147","Application Data"
"838","33.961344","2a03:2880:f276:cd:face:b00c:0:167","2a0d:6fc2:5560:c200:15f4:c1ab:865a:2377","TCP","74","443  >  51017 [ACK] Seq=5929 Ack=1075 Win=5500 Len=0"
"890","39.547825","2a0d:6fc2:5560:c200:15f4:c1ab:865a:2377","2a03:2880:f276:cd:face:b00c:0:167","TLSv1.2","1047","Application Data"
"891","39.603653","2a03:2880:f276:cd:face:b00c:0:167","2a0d:6fc2:5560:c200:15f4:c1ab:865a:2377","TCP","74","443  >  51017 [ACK] Seq=5929 Ack=2048 Win=5500 Len=0"
"894","39.741080","2a03:2880:f276:cd:face:b00c:0:167","2a0d:6fc2:5560:c200:15f4:c1ab:865a:2377","TLSv1.2","188","Application Data"
"895","39.784332","2a0d:6fc2:5560:c200:15f4:c1ab:865a:2377","2a03:2880:f276:cd:face:b00c:0:167","TCP","74","51017  >  443 [ACK] Seq=2048 Ack=6043 Win=1031 Len=0"
"898","40.023618","2a03:2880:f276:cd:face:b00c:0:167","2a0d:6fc2:5560:c200:15f4:c1ab:865a:2377","TLSv1.2","172","Application Data"
"899","40.025644","2a0d:6fc2:5560:c200:15f4:c1ab:865a:2377","2a03:2880:f276:cd:face:b00c:0:167","TLSv1.2","170","Application Data"
"900","40.041851","2a03:2880:f276:cd:face:b00c:0:167","2a0d:6fc2:5560:c200:15f4:c1ab:865a:2377","TLSv1.2","174","Application Data"
"901","40.046099","2a0d:6fc2:5560:c200:15f4:c1ab:865a:2377","2a03:2880:f276:cd:face:b00c:0:167","TLSv1.2","172","Application Data"
"902","40.052770","2a03:2880:f276:cd:face:b00c:0:167","2a0d:6fc2:5560:c200:15f4:c1ab:865a:2377","TLSv1.2","134","Application Data"
"903","40.081748","2a03:2880:f276:cd:face:b00c:0:167","2a0d:6fc2:5560:c200:15f4:c1ab:865a:2377","TCP","74","443  >  51017 [ACK] Seq=6301 Ack=2144 Win=5500 Len=0"
"906","40.096543","2a0d:6fc2:5560:c200:15f4:c1ab:865a:2377","2a03:2880:f276:cd:face:b00c:0:167","TCP","74","51017  >  443 [ACK] Seq=2242 Ack=6301 Win=1030 Len=0"
"907","40.103336","2a03:2880:f276:cd:face:b00c:0:167","2a0d:6fc2:5560:c200:15f4:c1ab:865a:2377","TCP","74","443  >  51017 [ACK] Seq=6301 Ack=2242 Win=5500 Len=0"
"908","40.107472","2a03:2880:f276:cd:face:b00c:0:167","2a0d:6fc2:5560:c200:15f4:c1ab:865a:2377","TLSv1.2","171","Application Data"
"909","40.110213","2a0d:6fc2:5560:c200:15f4:c1ab:865a:2377","2a03:2880:f276:cd:face:b00c:0:167","TLSv1.2","170","Application Data"
"910","40.218016","2a03:2880:f276:cd:face:b00c:0:167","2a0d:6fc2:5560:c200:15f4:c1ab:865a:2377","TCP","74","443  >  51017 [ACK] Seq=6398 Ack=2338 Win=5500 Len=0"
"962","42.610403","2a03:2880:f276:cd:face:b00c:0:167","2a0d:6fc2:5560:c200:15f4:c1ab:865a:2377","TLSv1.2","154","Application Data"
"966","42.664356","2a0d:6fc2:5560:c200:15f4:c1ab:865a:2377","2a03:2880:f276:cd:face:b00c:0:167","TCP","74","51017  >  443 [ACK] Seq=2338 Ack=6478 Win=1030 Len=0"
"996","43.714039","2a03:2880:f276:cd:face:b00c:0:167","2a0d:6fc2:5560:c200:15f4:c1ab:865a:2377","TLSv1.2","137","Application Data"
"997","43.782282","2a0d:6fc2:5560:c200:15f4:c1ab:865a:2377","2a03:2880:f276:cd:face:b00c:0:167","TCP","74","51017  >  443 [ACK] Seq=2338 Ack=6541 Win=1029 Len=0"
"1026","46.479152","2a03:2880:f276:cd:face:b00c:0:167","2a0d:6fc2:5560:c200:15f4:c1ab:865a:2377","TLSv1.2","345","Application Data"
"1027","46.514175","2a0d:6fc2:5560:c200:15f4:c1ab:865a:2377","2a03:2880:f276:cd:face:b00c:0:167","TLSv1.2","149","Application Data"
"1028","46.571879","2a03:2880:f276:cd:face:b00c:0:167","2a0d:6fc2:5560:c200:15f4:c1ab:865a:2377","TCP","74","443  >  51017 [ACK] Seq=6812 Ack=2413 Win=5500 Len=0"
"1029","47.356884","2a03:2880:f276:cd:face:b00c:0:167","2a0d:6fc2:5560:c200:15f4:c1ab:865a:2377","TLSv1.2","174","Application Data"
"1030","47.359625","2a0d:6fc2:5560:c200:15f4:c1ab:865a:2377","2a03:2880:f276:cd:face:b00c:0:167","TLSv1.2","173","Application Data"
"1033","47.415315","2a03:2880:f276:cd:face:b00c:0:167","2a0d:6fc2:5560:c200:15f4:c1ab:865a:2377","TCP","74","443  >  51017 [ACK] Seq=6912 Ack=2512 Win=5500 Len=0"
"1036","47.902501","2a03:2880:f276:cd:face:b00c:0:167","2a0d:6fc2:5560:c200:15f4:c1ab:865a:2377","TLSv1.2","154","Application Data"
"1037","47.945425","2a0d:6fc2:5560:c200:15f4:c1ab:865a:2377","2a03:2880:f276:cd:face:b00c:0:167","TCP","74","51017  >  443 [ACK] Seq=2512 Ack=6992 Win=1028 Len=0"
"1051","50.254924","2a03:2880:f276:cd:face:b00c:0:167","2a0d:6fc2:5560:c200:15f4:c1ab:865a:2377","TLSv1.2","359","Application Data"
"1052","50.294750","2a0d:6fc2:5560:c200:15f4:c1ab:865a:2377","2a03:2880:f276:cd:face:b00c:0:167","TCP","74","51017  >  443 [ACK] Seq=2512 Ack=7277 Win=1033 Len=0"
"1055","50.318411","2a0d:6fc2:5560:c200:15f4:c1ab:865a:2377","2a03:2880:f276:cd:face:b00c:0:167","TLSv1.2","168","Application Data"
"1056","50.328482","2a0d:6fc2:5560:c200:15f4:c1ab:865a:2377","2a03:2880:f276:cd:face:b00c:0:167","TLSv1.2","180","Application Data"
"1057","50.374468","2a03:2880:f276:cd:face:b00c:0:167","2a0d:6fc2:5560:c200:15f4:c1ab:865a:2377","TCP","74","443  >  51017 [ACK] Seq=7277 Ack=2606 Win=5500 Len=0"
"1058","50.384695","2a03:2880:f276:cd:face:b00c:0:167","2a0d:6fc2:5560:c200:15f4:c1ab:865a:2377","TCP","74","443  >  51017 [ACK] Seq=7277 Ack=2712 Win=5500 Len=0"
"1059","50.481482","2a03:2880:f276:cd:face:b00c:0:167","2a0d:6fc2:5560:c200:15f4:c1ab:865a:2377","TLSv1.2","167","Application Data"
"1062","50.533270","2a0d:6fc2:5560:c200:15f4:c1ab:865a:2377","2a03:2880:f276:cd:face:b00c:0:167","TCP","74","51017  >  443 [ACK] Seq=2712 Ack=7370 Win=1032 Len=0"
"1152","63.891075","2a03:2880:f276:cd:face:b00c:0:167","2a0d:6fc2:5560:c200:15f4:c1ab:865a:2377","TLSv1.2","136","Application Data"
"1153","63.944114","2a0d:6fc2:5560:c200:15f4:c1ab:865a:2377","2a03:2880:f276:cd:face:b00c:0:167","TCP","74","51017  >  443 [ACK] Seq=2712 Ack=7432 Win=1032 Len=0"
"1255","66.367137","2a0d:6fc2:5560:c200:15f4:c1ab:865a:2377","2a03:2880:f276:cd:face:b00c:0:167","TCP","1466","51017  >  443 [ACK] Seq=2712 Ack=7432 Win=1032 Len=1392 [TCP segment of a reassembled PDU]"
"1256","66.367137","2a0d:6fc2:5560:c200:15f4:c1ab:865a:2377","2a03:2880:f276:cd:face:b00c:0:167","TCP","1466","51017  >  443 [ACK] Seq=4104 Ack=7432 Win=1032 Len=1392 [TCP segment of a reassembled PDU]"
"1257","66.367137","2a0d:6fc2:5560:c200:15f4:c1ab:865a:2377","2a03:2880:f276:cd:face:b00c:0:167","TCP","1466","51017  >  443 [ACK] Seq=5496 Ack=7432 Win=1032 Len=1392 [TCP segment of a reassembled PDU]"
"1258","66.367137","2a0d:6fc2:5560:c200:15f4:c1ab:865a:2377","2a03:2880:f276:cd:face:b00c:0:167","TLSv1.2","921","Application Data"
"1259","66.423132","2a03:2880:f276:cd:face:b00c:0:167","2a0d:6fc2:5560:c200:15f4:c1ab:865a:2377","TCP","74","443  >  51017 [ACK] Seq=7432 Ack=5496 Win=5492 Len=0"
"1260","66.423275","2a03:2880:f276:cd:face:b00c:0:167","2a0d:6fc2:5560:c200:15f4:c1ab:865a:2377","TCP","74","443  >  51017 [ACK] Seq=7432 Ack=7735 Win=5492 Len=0"
"1261","66.613199","2a03:2880:f276:cd:face:b00c:0:167","2a0d:6fc2:5560:c200:15f4:c1ab:865a:2377","TLSv1.2","188","Application Data"
"1262","66.664169","2a0d:6fc2:5560:c200:15f4:c1ab:865a:2377","2a03:2880:f276:cd:face:b00c:0:167","TCP","74","51017  >  443 [ACK] Seq=7735 Ack=7546 Win=1032 Len=0"
"1263","66.839179","2a0d:6fc2:5560:c200:15f4:c1ab:865a:2377","2a03:2880:f276:cd:face:b00c:0:167","TCP","1466","51017  >  443 [ACK] Seq=7735 Ack=7546 Win=1032 Len=1392 [TCP segment of a reassembled PDU]"
"1264","66.839179","2a0d:6fc2:5560:c200:15f4:c1ab:865a:2377","2a03:2880:f276:cd:face:b00c:0:167","TCP","1466","51017  >  443 [ACK] Seq=9127 Ack=7546 Win=1032 Len=1392 [TCP segment of a reassembled PDU]"
"1265","66.839179","2a0d:6fc2:5560:c200:15f4:c1ab:865a:2377","2a03:2880:f276:cd:face:b00c:0:167","TCP","1466","51017  >  443 [ACK] Seq=10519 Ack=7546 Win=1032 Len=1392 [TCP segment of a reassembled PDU]"
"1266","66.839179","2a0d:6fc2:5560:c200:15f4:c1ab:865a:2377","2a03:2880:f276:cd:face:b00c:0:167","TLSv1.2","921","Application Data"
"1267","66.895291","2a03:2880:f276:cd:face:b00c:0:167","2a0d:6fc2:5560:c200:15f4:c1ab:865a:2377","TCP","74","443  >  51017 [ACK] Seq=7546 Ack=12758 Win=5481 Len=0"
"1268","66.906338","2a03:2880:f276:cd:face:b00c:0:167","2a0d:6fc2:5560:c200:15f4:c1ab:865a:2377","TLSv1.2","172","Application Data"
"1269","66.934030","2a03:2880:f276:cd:face:b00c:0:167","2a0d:6fc2:5560:c200:15f4:c1ab:865a:2377","TLSv1.2","174","Application Data"
"1270","66.934074","2a0d:6fc2:5560:c200:15f4:c1ab:865a:2377","2a03:2880:f276:cd:face:b00c:0:167","TCP","74","51017  >  443 [ACK] Seq=12758 Ack=7744 Win=1031 Len=0"
"1273","67.034452","2a03:2880:f276:cd:face:b00c:0:167","2a0d:6fc2:5560:c200:15f4:c1ab:865a:2377","TLSv1.2","188","Application Data"
"1274","67.039072","2a03:2880:f276:cd:face:b00c:0:167","2a0d:6fc2:5560:c200:15f4:c1ab:865a:2377","TLSv1.2","171","Application Data"
"1275","67.039133","2a0d:6fc2:5560:c200:15f4:c1ab:865a:2377","2a03:2880:f276:cd:face:b00c:0:167","TCP","74","51017  >  443 [ACK] Seq=12758 Ack=7955 Win=1030 Len=0"
"1276","67.058188","2a0d:6fc2:5560:c200:15f4:c1ab:865a:2377","2a03:2880:f276:cd:face:b00c:0:167","TLSv1.2","170","Application Data"
"1277","67.058287","2a0d:6fc2:5560:c200:15f4:c1ab:865a:2377","2a03:2880:f276:cd:face:b00c:0:167","TLSv1.2","172","Application Data"
"1278","67.058316","2a0d:6fc2:5560:c200:15f4:c1ab:865a:2377","2a03:2880:f276:cd:face:b00c:0:167","TLSv1.2","170","Application Data"
"1279","67.114319","2a03:2880:f276:cd:face:b00c:0:167","2a0d:6fc2:5560:c200:15f4:c1ab:865a:2377","TCP","74","443  >  51017 [ACK] Seq=7955 Ack=13048 Win=5500 Len=0"
"1280","67.309811","2a03:2880:f276:cd:face:b00c:0:167","2a0d:6fc2:5560:c200:15f4:c1ab:865a:2377","TLSv1.2","172","Application Data"
"1281","67.312714","2a0d:6fc2:5560:c200:15f4:c1ab:865a:2377","2a03:2880:f276:cd:face:b00c:0:167","TLSv1.2","170","Application Data"
"1282","67.324099","2a03:2880:f276:cd:face:b00c:0:167","2a0d:6fc2:5560:c200:15f4:c1ab:865a:2377","TLSv1.2","174","Application Data"
"1283","67.329286","2a0d:6fc2:5560:c200:15f4:c1ab:865a:2377","2a03:2880:f276:cd:face:b00c:0:167","TLSv1.2","172","Application Data"
"1284","67.385350","2a03:2880:f276:cd:face:b00c:0:167","2a0d:6fc2:5560:c200:15f4:c1ab:865a:2377","TCP","74","443  >  51017 [ACK] Seq=8153 Ack=13242 Win=5500 Len=0"
"1285","67.483234","2a03:2880:f276:cd:face:b00c:0:167","2a0d:6fc2:5560:c200:15f4:c1ab:865a:2377","TLSv1.2","171","Application Data"
"1286","67.484599","2a0d:6fc2:5560:c200:15f4:c1ab:865a:2377","2a03:2880:f276:cd:face:b00c:0:167","TLSv1.2","170","Application Data"
"1287","67.580675","2a03:2880:f276:cd:face:b00c:0:167","2a0d:6fc2:5560:c200:15f4:c1ab:865a:2377","TCP","74","443  >  51017 [ACK] Seq=8250 Ack=13338 Win=5500 Len=0"
"1290","68.089511","2a03:2880:f276:cd:face:b00c:0:167","2a0d:6fc2:5560:c200:15f4:c1ab:865a:2377","TLSv1.2","156","Application Data"
"1291","68.144660","2a0d:6fc2:5560:c200:15f4:c1ab:865a:2377","2a03:2880:f276:cd:face:b00c:0:167","TCP","74","51017  >  443 [ACK] Seq=13338 Ack=8332 Win=1029 Len=0"
"1395","78.091774","2a03:2880:f276:cd:face:b00c:0:167","2a0d:6fc2:5560:c200:15f4:c1ab:865a:2377","TLSv1.2","156","Application Data"
"1396","78.138497","2a0d:6fc2:5560:c200:15f4:c1ab:865a:2377","2a03:2880:f276:cd:face:b00c:0:167","TCP","74","51017  >  443 [ACK] Seq=13338 Ack=8414 Win=1028 Len=0"
"1420","81.356196","2a03:2880:f276:cd:face:b00c:0:167","2a0d:6fc2:5560:c200:15f4:c1ab:865a:2377","TLSv1.2","154","Application Data"
"1421","81.397858","2a0d:6fc2:5560:c200:15f4:c1ab:865a:2377","2a03:2880:f276:cd:face:b00c:0:167","TCP","74","51017  >  443 [ACK] Seq=13338 Ack=8494 Win=1028 Len=0"
"1424","82.287163","2a03:2880:f276:cd:face:b00c:0:167","2a0d:6fc2:5560:c200:15f4:c1ab:865a:2377","TLSv1.2","844","Application Data"
"1425","82.328828","2a0d:6fc2:5560:c200:15f4:c1ab:865a:2377","2a03:2880:f276:cd:face:b00c:0:167","TCP","74","51017  >  443 [ACK] Seq=13338 Ack=9264 Win=1033 Len=0"
"1447","82.405773","2a0d:6fc2:5560:c200:15f4:c1ab:865a:2377","2a03:2880:f276:cd:face:b00c:0:167","TLSv1.2","168","Application Data"
"1463","82.437729","2a0d:6fc2:5560:c200:15f4:c1ab:865a:2377","2a03:2880:f276:cd:face:b00c:0:167","TLSv1.2","180","Application Data"
"1464","82.461625","2a03:2880:f276:cd:face:b00c:0:167","2a0d:6fc2:5560:c200:15f4:c1ab:865a:2377","TCP","74","443  >  51017 [ACK] Seq=9264 Ack=13432 Win=5500 Len=0"
"1472","82.493502","2a03:2880:f276:cd:face:b00c:0:167","2a0d:6fc2:5560:c200:15f4:c1ab:865a:2377","TCP","74","443  >  51017 [ACK] Seq=9264 Ack=13538 Win=5500 Len=0"
"1477","82.592551","2a03:2880:f276:cd:face:b00c:0:167","2a0d:6fc2:5560:c200:15f4:c1ab:865a:2377","TLSv1.2","167","Application Data"
"1498","82.632410","2a0d:6fc2:5560:c200:15f4:c1ab:865a:2377","2a03:2880:f276:cd:face:b00c:0:167","TCP","74","51017  >  443 [ACK] Seq=13538 Ack=9357 Win=1032 Len=0"
"1517","83.172733","2a03:2880:f276:cd:face:b00c:0:167","2a0d:6fc2:5560:c200:15f4:c1ab:865a:2377","TLSv1.2","174","Application Data"
"1518","83.205707","2a03:2880:f276:cd:face:b00c:0:167","2a0d:6fc2:5560:c200:15f4:c1ab:865a:2377","TLSv1.2","174","Application Data"
"1519","83.205775","2a0d:6fc2:5560:c200:15f4:c1ab:865a:2377","2a03:2880:f276:cd:face:b00c:0:167","TCP","74","51017  >  443 [ACK] Seq=13538 Ack=9557 Win=1031 Len=0"
"1523","83.246910","2a0d:6fc2:5560:c200:15f4:c1ab:865a:2377","2a03:2880:f276:cd:face:b00c:0:167","TLSv1.2","173","Application Data"
"1546","83.256705","2a0d:6fc2:5560:c200:15f4:c1ab:865a:2377","2a03:2880:f276:cd:face:b00c:0:167","TLSv1.2","173","Application Data"
"1558","83.302776","2a03:2880:f276:cd:face:b00c:0:167","2a0d:6fc2:5560:c200:15f4:c1ab:865a:2377","TCP","74","443  >  51017 [ACK] Seq=9557 Ack=13637 Win=5500 Len=0"
"1559","83.312487","2a03:2880:f276:cd:face:b00c:0:167","2a0d:6fc2:5560:c200:15f4:c1ab:865a:2377","TCP","74","443  >  51017 [ACK] Seq=9557 Ack=13736 Win=5500 Len=0"
"1582","83.348719","2a0d:6fc2:5560:c200:15f4:c1ab:865a:2377","2a03:2880:f276:cd:face:b00c:0:167","TLSv1.2","149","Application Data"
"1615","83.404423","2a03:2880:f276:cd:face:b00c:0:167","2a0d:6fc2:5560:c200:15f4:c1ab:865a:2377","TCP","74","443  >  51017 [ACK] Seq=9557 Ack=13811 Win=5500 Len=0"
"1850","93.366218","2a0d:6fc2:5560:c200:15f4:c1ab:865a:2377","2a03:2880:f276:cd:face:b00c:0:167","TLSv1.2","149","Application Data"
"1851","93.421945","2a03:2880:f276:cd:face:b00c:0:167","2a0d:6fc2:5560:c200:15f4:c1ab:865a:2377","TCP","74","443  >  51017 [ACK] Seq=9557 Ack=13886 Win=5500 Len=0"
"1871","94.967367","2a0d:6fc2:5560:c200:15f4:c1ab:865a:2377","2a03:2880:f276:cd:face:b00c:0:167","TLSv1.2","147","Application Data"
"1872","95.023974","2a03:2880:f276:cd:face:b00c:0:167","2a0d:6fc2:5560:c200:15f4:c1ab:865a:2377","TCP","74","443  >  51017 [ACK] Seq=9557 Ack=13959 Win=5500 Len=0"
"1918","95.601548","2a0d:6fc2:5560:c200:15f4:c1ab:865a:2377","2a03:2880:f276:cd:face:b00c:0:167","TLSv1.2","809","Application Data"
"1919","95.657505","2a03:2880:f276:cd:face:b00c:0:167","2a0d:6fc2:5560:c200:15f4:c1ab:865a:2377","TCP","74","443  >  51017 [ACK] Seq=9557 Ack=14694 Win=5500 Len=0"
"1922","95.785773","2a03:2880:f276:cd:face:b00c:0:167","2a0d:6fc2:5560:c200:15f4:c1ab:865a:2377","TLSv1.2","188","Application Data"
"1923","95.831288","2a0d:6fc2:5560:c200:15f4:c1ab:865a:2377","2a03:2880:f276:cd:face:b00c:0:167","TCP","74","51017  >  443 [ACK] Seq=14694 Ack=9671 Win=1031 Len=0"
"1926","96.063701","2a03:2880:f276:cd:face:b00c:0:167","2a0d:6fc2:5560:c200:15f4:c1ab:865a:2377","TLSv1.2","172","Application Data"
"1927","96.066042","2a0d:6fc2:5560:c200:15f4:c1ab:865a:2377","2a03:2880:f276:cd:face:b00c:0:167","TLSv1.2","170","Application Data"
"1928","96.072704","2a03:2880:f276:cd:face:b00c:0:167","2a0d:6fc2:5560:c200:15f4:c1ab:865a:2377","TLSv1.2","174","Application Data"
"1929","96.079714","2a0d:6fc2:5560:c200:15f4:c1ab:865a:2377","2a03:2880:f276:cd:face:b00c:0:167","TLSv1.2","172","Application Data"
"1930","96.122552","2a03:2880:f276:cd:face:b00c:0:167","2a0d:6fc2:5560:c200:15f4:c1ab:865a:2377","TCP","74","443  >  51017 [ACK] Seq=9869 Ack=14790 Win=5500 Len=0"
"1931","96.135940","2a03:2880:f276:cd:face:b00c:0:167","2a0d:6fc2:5560:c200:15f4:c1ab:865a:2377","TCP","74","443  >  51017 [ACK] Seq=9869 Ack=14888 Win=5500 Len=0"
"1932","96.238911","2a03:2880:f276:cd:face:b00c:0:167","2a0d:6fc2:5560:c200:15f4:c1ab:865a:2377","TLSv1.2","171","Application Data"
"1933","96.241032","2a0d:6fc2:5560:c200:15f4:c1ab:865a:2377","2a03:2880:f276:cd:face:b00c:0:167","TLSv1.2","170","Application Data"
"1934","96.296824","2a03:2880:f276:cd:face:b00c:0:167","2a0d:6fc2:5560:c200:15f4:c1ab:865a:2377","TCP","74","443  >  51017 [ACK] Seq=9966 Ack=14984 Win=5500 Len=0"
