"No.","Time","Source","Destination","Protocol","Length","Info"
"131","0.515013","10.100.102.58","162.159.128.235","TLSv1.2","115","Application Data"
"133","0.518216","162.159.128.235","10.100.102.58","TLSv1.2","158","Application Data"
"140","0.534765","10.100.102.58","162.159.130.235","TLSv1.2","115","Application Data"
"143","0.541282","162.159.128.235","10.100.102.58","TLSv1.2","111","Application Data"
"144","0.541329","10.100.102.58","162.159.128.235","TCP","54","58168  >  443 [ACK] Seq=62 Ack=162 Win=511 Len=0"
"145","0.546294","162.159.130.235","10.100.102.58","TLSv1.2","111","Application Data"
"159","0.587318","10.100.102.58","162.159.130.235","TCP","54","58169  >  443 [ACK] Seq=62 Ack=58 Win=511 Len=0"
"225","0.831262","162.159.128.235","10.100.102.58","TLSv1.2","158","Application Data"
"238","0.876474","10.100.102.58","162.159.128.235","TCP","54","58168  >  443 [ACK] Seq=62 Ack=266 Win=511 Len=0"
"356","1.210757","157.240.195.56","10.100.102.58","TLSv1.2","142","Application Data"
"357","1.213013","10.100.102.58","157.240.195.56","TLSv1.2","126","Application Data"
"382","1.292889","157.240.195.56","10.100.102.58","TCP","60","443  >  58100 [ACK] Seq=89 Ack=73 Win=2168 Len=0"
"474","1.618043","10.100.102.58","162.159.128.235","TLSv1.2","144","Application Data"
"489","1.665435","162.159.128.235","10.100.102.58","TCP","60","443  >  58168 [ACK] Seq=266 Ack=152 Win=8 Len=0"
"557","1.997942","10.100.102.58","162.159.128.235","TLSv1.2","144","Application Data"
"563","2.007757","162.159.128.235","10.100.102.58","TCP","60","443  >  58168 [ACK] Seq=266 Ack=242 Win=7 Len=0"
"1100","4.015757","34.117.65.55","10.100.102.58","TLSv1.2","78","Application Data"
"1101","4.016152","10.100.102.58","34.117.65.55","TLSv1.2","82","Application Data"
"1103","4.018049","10.100.102.58","162.159.128.235","TLSv1.2","144","Application Data"
"1104","4.021551","162.159.128.235","10.100.102.58","TCP","60","443  >  58168 [ACK] Seq=266 Ack=332 Win=7 Len=0"
"1105","4.023482","34.117.65.55","10.100.102.58","TCP","60","443  >  58116 [ACK] Seq=25 Ack=29 Win=272 Len=0"
"1150","4.174470","10.100.102.58","162.159.128.235","TLSv1.2","144","Application Data"
"1151","4.179523","162.159.128.235","10.100.102.58","TCP","60","443  >  58168 [ACK] Seq=266 Ack=422 Win=7 Len=0"
"1440","5.271805","10.100.102.58","162.159.128.235","TLSv1.2","144","Application Data"
"1442","5.278308","162.159.128.235","10.100.102.58","TCP","60","443  >  58168 [ACK] Seq=266 Ack=512 Win=7 Len=0"
"1445","5.294108","10.100.102.58","162.159.128.235","TLSv1.2","144","Application Data"
"1447","5.304456","162.159.128.235","10.100.102.58","TCP","60","443  >  58168 [ACK] Seq=266 Ack=602 Win=7 Len=0"
"1498","5.522284","10.100.102.58","162.159.128.235","TLSv1.2","115","Application Data"
"1504","5.536999","10.100.102.58","162.159.130.235","TLSv1.2","115","Application Data"
"1505","5.537032","162.159.128.235","10.100.102.58","TCP","60","443  >  58168 [ACK] Seq=266 Ack=663 Win=7 Len=0"
"1507","5.541728","162.159.128.235","10.100.102.58","TLSv1.2","111","Application Data"
"1508","5.548171","162.159.130.235","10.100.102.58","TLSv1.2","111","Application Data"
"1518","5.592439","10.100.102.58","162.159.128.235","TCP","54","58168  >  443 [ACK] Seq=663 Ack=323 Win=511 Len=0"
"1519","5.592522","10.100.102.58","162.159.130.235","TCP","54","58169  >  443 [ACK] Seq=123 Ack=115 Win=511 Len=0"
"1644","6.073854","10.100.102.58","162.159.128.235","TLSv1.2","144","Application Data"
"1653","6.118722","162.159.128.235","10.100.102.58","TCP","60","443  >  58168 [ACK] Seq=323 Ack=753 Win=8 Len=0"
"1658","6.131480","10.100.102.58","162.159.128.235","TLSv1.2","144","Application Data"
"1660","6.137137","162.159.128.235","10.100.102.58","TCP","60","443  >  58168 [ACK] Seq=323 Ack=843 Win=7 Len=0"
"1707","6.378128","10.100.102.58","157.240.195.56","TLSv1.2","160","Application Data"
"1723","6.451991","157.240.195.56","10.100.102.58","TCP","60","443  >  58100 [ACK] Seq=89 Ack=179 Win=2168 Len=0"
"1740","6.552300","157.240.195.56","10.100.102.58","TLSv1.2","147","Application Data"
"1749","6.597299","10.100.102.58","157.240.195.56","TCP","54","58100  >  443 [ACK] Seq=179 Ack=182 Win=511 Len=0"
"1776","6.694693","10.100.102.58","162.159.128.235","TLSv1.2","144","Application Data"
"1783","6.699540","162.159.128.235","10.100.102.58","TCP","60","443  >  58168 [ACK] Seq=323 Ack=933 Win=7 Len=0"
"1850","6.993564","10.100.102.58","162.159.128.235","TLSv1.2","144","Application Data"
"1851","6.997218","162.159.128.235","10.100.102.58","TCP","60","443  >  58168 [ACK] Seq=323 Ack=1023 Win=7 Len=0"
"2692","10.173786","10.100.102.58","157.240.195.56","TCP","1446","58100  >  443 [ACK] Seq=179 Ack=182 Win=511 Len=1392 [TCP segment of a reassembled PDU]"
"2693","10.173786","10.100.102.58","157.240.195.56","TCP","1446","58100  >  443 [ACK] Seq=1571 Ack=182 Win=511 Len=1392 [TCP segment of a reassembled PDU]"
"2694","10.173786","10.100.102.58","157.240.195.56","TCP","1446","58100  >  443 [ACK] Seq=2963 Ack=182 Win=511 Len=1392 [TCP segment of a reassembled PDU]"
"2695","10.173786","10.100.102.58","157.240.195.56","TLSv1.2","757","Application Data"
"2715","10.263964","157.240.195.56","10.100.102.58","TCP","60","443  >  58100 [ACK] Seq=182 Ack=2963 Win=2190 Len=0"
"2716","10.263964","157.240.195.56","10.100.102.58","TCP","60","443  >  58100 [ACK] Seq=182 Ack=5058 Win=2206 Len=0"
"2723","10.269908","13.107.42.14","10.100.102.58","TLSv1.2","100","Application Data"
"2725","10.273689","10.100.102.58","13.107.42.14","TLSv1.2","96","Application Data"
"2726","10.273746","10.100.102.58","13.107.42.14","TLSv1.2","96","Application Data"
"2729","10.280658","13.107.42.14","10.100.102.58","TCP","60","443  >  58207 [ACK] Seq=47 Ack=85 Win=16385 Len=0"
"2765","10.399117","157.240.195.56","10.100.102.58","TLSv1.2","168","Application Data"
"2774","10.446785","10.100.102.58","157.240.195.56","TCP","54","58100  >  443 [ACK] Seq=5058 Ack=296 Win=511 Len=0"
"2797","10.524778","10.100.102.58","162.159.128.235","TLSv1.2","115","Application Data"
"2799","10.529306","162.159.128.235","10.100.102.58","TCP","60","443  >  58168 [ACK] Seq=323 Ack=1084 Win=7 Len=0"
"2803","10.533311","162.159.128.235","10.100.102.58","TLSv1.2","111","Application Data"
"2806","10.534339","10.100.102.58","162.159.130.235","TLSv1.2","115","Application Data"
"2808","10.548351","162.159.130.235","10.100.102.58","TLSv1.2","111","Application Data"
"2817","10.576589","10.100.102.58","162.159.128.235","TCP","54","58168  >  443 [ACK] Seq=1084 Ack=380 Win=510 Len=0"
"2820","10.595559","10.100.102.58","162.159.130.235","TCP","54","58169  >  443 [ACK] Seq=184 Ack=172 Win=510 Len=0"
"2878","10.693685","157.240.195.56","10.100.102.58","TLSv1.2","152","Application Data"
"2880","10.695655","10.100.102.58","157.240.195.56","TLSv1.2","150","Application Data"
"2899","10.716853","157.240.195.56","10.100.102.58","TLSv1.2","154","Application Data"
"2900","10.719552","157.240.195.56","10.100.102.58","TLSv1.2","151","Application Data"
"2901","10.719595","10.100.102.58","157.240.195.56","TCP","54","58100  >  443 [ACK] Seq=5154 Ack=591 Win=515 Len=0"
"2902","10.720928","10.100.102.58","157.240.195.56","TLSv1.2","152","Application Data"
"2903","10.726181","10.100.102.58","157.240.195.56","TLSv1.2","150","Application Data"
"2927","10.767685","157.240.195.56","10.100.102.58","TCP","60","443  >  58100 [ACK] Seq=591 Ack=5154 Win=2206 Len=0"
"2944","10.789119","157.240.195.56","10.100.102.58","TCP","60","443  >  58100 [ACK] Seq=591 Ack=5252 Win=2206 Len=0"
"2953","10.804192","157.240.195.56","10.100.102.58","TCP","60","443  >  58100 [ACK] Seq=591 Ack=5348 Win=2206 Len=0"
"3663","12.856273","162.159.128.235","10.100.102.58","TLSv1.2","158","Application Data"
"3673","12.898720","10.100.102.58","162.159.128.235","TCP","54","58168  >  443 [ACK] Seq=1084 Ack=484 Win=510 Len=0"
"4012","14.516940","10.100.102.58","144.2.15.25","TCP","55","58363  >  443 [ACK] Seq=1 Ack=1 Win=514 Len=1 [TCP segment of a reassembled PDU]"
"4051","14.700383","144.2.15.25","10.100.102.58","TCP","66","443  >  58363 [ACK] Seq=1 Ack=2 Win=822 Len=0 SLE=1 SRE=2"
"4065","14.785366","162.159.128.235","10.100.102.58","TLSv1.2","158","Application Data"
"4075","14.832725","10.100.102.58","162.159.128.235","TCP","54","58168  >  443 [ACK] Seq=1084 Ack=588 Win=510 Len=0"
"4145","15.188994","10.100.102.58","108.174.10.20","TCP","55","58370  >  443 [ACK] Seq=1 Ack=1 Win=514 Len=1 [TCP segment of a reassembled PDU]"
"4173","15.347555","10.100.102.58","172.217.22.37","TCP","55","58206  >  443 [ACK] Seq=1 Ack=1 Win=507 Len=1 [TCP segment of a reassembled PDU]"
"4175","15.351622","108.174.10.20","10.100.102.58","TCP","66","443  >  58370 [ACK] Seq=1 Ack=2 Win=822 Len=0 SLE=1 SRE=2"
"4177","15.356674","172.217.22.37","10.100.102.58","TCP","66","443  >  58206 [ACK] Seq=1 Ack=2 Win=615 Len=0 SLE=1 SRE=2"
"4204","15.513670","10.100.102.58","162.159.128.235","TLSv1.2","115","Application Data"
"4210","15.534575","162.159.128.235","10.100.102.58","TLSv1.2","111","Application Data"
"4211","15.535051","10.100.102.58","162.159.130.235","TLSv1.2","115","Application Data"
"4213","15.544442","162.159.130.235","10.100.102.58","TLSv1.2","111","Application Data"
"4219","15.582408","10.100.102.58","162.159.128.235","TCP","54","58168  >  443 [ACK] Seq=1145 Ack=645 Win=509 Len=0"
"4221","15.590545","10.100.102.58","162.159.130.235","TCP","54","58169  >  443 [ACK] Seq=245 Ack=229 Win=510 Len=0"
"4920","19.461149","162.159.128.235","10.100.102.58","TLSv1.2","158","Application Data"
"4933","19.507132","10.100.102.58","162.159.128.235","TCP","54","58168  >  443 [ACK] Seq=1145 Ack=749 Win=509 Len=0"
"4995","19.764682","162.159.128.235","10.100.102.58","TLSv1.2","158","Application Data"
"5005","19.806864","10.100.102.58","162.159.128.235","TCP","54","58168  >  443 [ACK] Seq=1145 Ack=853 Win=509 Len=0"
"5206","20.513244","10.100.102.58","162.159.128.235","TLSv1.2","115","Application Data"
"5208","20.522246","162.159.128.235","10.100.102.58","TLSv1.2","111","Application Data"
"5213","20.537125","10.100.102.58","162.159.130.235","TLSv1.2","115","Application Data"
"5215","20.546704","162.159.130.235","10.100.102.58","TLSv1.2","111","Application Data"
"5221","20.568839","10.100.102.58","162.159.128.235","TCP","54","58168  >  443 [ACK] Seq=1206 Ack=910 Win=508 Len=0"
"5226","20.596681","10.100.102.58","162.159.130.235","TCP","54","58169  >  443 [ACK] Seq=306 Ack=286 Win=510 Len=0"
"5529","21.449829","157.240.195.56","10.100.102.58","TLSv1.2","142","Application Data"
"5532","21.454267","10.100.102.58","157.240.195.56","TLSv1.2","126","Application Data"
"5569","21.535249","157.240.195.56","10.100.102.58","TCP","60","443  >  58100 [ACK] Seq=679 Ack=5420 Win=2206 Len=0"
"5648","21.671645","157.240.195.56","10.100.102.58","TLSv1.2","543","[TCP Previous segment not captured] , Ignored Unknown Record"
"5649","21.671645","157.240.195.56","10.100.102.58","TCP","1078","[TCP Out-Of-Order] 443  >  58100 [ACK] Seq=679 Ack=5420 Win=2206 Len=1024"
"5650","21.671645","157.240.195.56","10.100.102.58","TCP","1078","443  >  58100 [ACK] Seq=2192 Ack=5420 Win=2206 Len=1024 [TCP segment of a reassembled PDU]"
"5651","21.671645","157.240.195.56","10.100.102.58","TCP","1078","443  >  58100 [PSH, ACK] Seq=3216 Ack=5420 Win=2206 Len=1024 [TCP segment of a reassembled PDU]"
"5652","21.671645","157.240.195.56","10.100.102.58","TLSv1.2","891","Application Data, Application Data"
"5653","21.671753","10.100.102.58","157.240.195.56","TCP","66","[TCP Dup ACK 5532#1] 58100  >  443 [ACK] Seq=5420 Ack=679 Win=515 Len=0 SLE=1703 SRE=2192"
"5654","21.671853","10.100.102.58","157.240.195.56","TCP","54","58100  >  443 [ACK] Seq=5420 Ack=2192 Win=516 Len=0"
"5655","21.671894","10.100.102.58","157.240.195.56","TCP","54","58100  >  443 [ACK] Seq=5420 Ack=5077 Win=516 Len=0"
"5731","21.791499","10.100.102.58","157.240.195.56","TLSv1.2","148","Application Data"
"5764","21.850102","10.100.102.58","157.240.195.56","TLSv1.2","160","Application Data"
"5767","21.867375","157.240.195.56","10.100.102.58","TCP","60","443  >  58100 [ACK] Seq=5077 Ack=5514 Win=2206 Len=0"
"5801","21.918411","157.240.195.56","10.100.102.58","TCP","60","443  >  58100 [ACK] Seq=5077 Ack=5620 Win=2206 Len=0"
"5852","22.022166","157.240.195.56","10.100.102.58","TLSv1.2","147","Application Data"
"5875","22.062810","10.100.102.58","157.240.195.56","TCP","54","58100  >  443 [ACK] Seq=5620 Ack=5170 Win=516 Len=0"
"6090","22.538271","157.240.195.56","10.100.102.58","TLSv1.2","154","Application Data"
"6093","22.540921","10.100.102.58","157.240.195.56","TLSv1.2","153","Application Data"
"6095","22.554470","10.100.102.58","199.232.82.208","TCP","55","58252  >  443 [ACK] Seq=1 Ack=1 Win=3586 Len=1 [TCP segment of a reassembled PDU]"
"6109","22.594570","162.159.128.235","10.100.102.58","TLSv1.2","158","Application Data"
"6123","22.616173","157.240.195.56","10.100.102.58","TCP","60","443  >  58100 [ACK] Seq=5270 Ack=5719 Win=2206 Len=0"
"6124","22.616173","199.232.82.208","10.100.102.58","TCP","66","443  >  58252 [ACK] Seq=1 Ack=2 Win=291 Len=0 SLE=1 SRE=2"
"6141","22.646951","10.100.102.58","162.159.128.235","TCP","54","58168  >  443 [ACK] Seq=1206 Ack=1014 Win=514 Len=0"
"6214","22.833504","10.100.102.58","162.159.136.234","TLSv1.2","97","Application Data"
"6216","22.837287","162.159.136.234","10.100.102.58","TCP","60","443  >  58134 [ACK] Seq=1 Ack=44 Win=7 Len=0"
"6292","22.985963","162.159.136.234","10.100.102.58","TLSv1.2","86","Application Data"
"6333","23.032967","10.100.102.58","162.159.136.234","TCP","54","58134  >  443 [ACK] Seq=44 Ack=33 Win=513 Len=0"
"6426","23.153361","10.100.102.58","162.159.128.235","TLSv1.2","144","Application Data"
"6450","23.195497","10.100.102.58","162.159.128.235","TLSv1.2","144","Application Data"
"6451","23.201963","162.159.128.235","10.100.102.58","TCP","60","443  >  58168 [ACK] Seq=1014 Ack=1296 Win=8 Len=0"
"6463","23.212266","162.159.128.235","10.100.102.58","TCP","60","443  >  58168 [ACK] Seq=1014 Ack=1386 Win=7 Len=0"
"6574","23.395956","162.159.128.235","10.100.102.58","TLSv1.2","158","Application Data"
"6609","23.446471","10.100.102.58","162.159.128.235","TCP","54","58168  >  443 [ACK] Seq=1386 Ack=1118 Win=513 Len=0"
"6960","24.124839","10.100.102.58","34.84.0.87","TCP","55","58239  >  443 [ACK] Seq=1 Ack=1 Win=514 Len=1 [TCP segment of a reassembled PDU]"
"6972","24.158211","162.159.128.235","10.100.102.58","TLSv1.2","158","Application Data"
"6997","24.202553","10.100.102.58","162.159.128.235","TCP","54","58168  >  443 [ACK] Seq=1386 Ack=1222 Win=513 Len=0"
"7094","24.377722","34.84.0.87","10.100.102.58","TCP","66","443  >  58239 [ACK] Seq=1 Ack=2 Win=501 Len=0 SLE=1 SRE=2"
"7124","24.447558","162.159.128.235","10.100.102.58","TLSv1.2","158","Application Data"
"7148","24.488614","10.100.102.58","162.159.128.235","TCP","54","58168  >  443 [ACK] Seq=1386 Ack=1326 Win=512 Len=0"
"7458","25.270125","13.107.42.14","10.100.102.58","TLSv1.2","100","Application Data"
"7462","25.273485","10.100.102.58","13.107.42.14","TLSv1.2","96","Application Data"
"7463","25.273544","10.100.102.58","13.107.42.14","TLSv1.2","96","Application Data"
"7464","25.279490","13.107.42.14","10.100.102.58","TCP","60","443  >  58207 [ACK] Seq=93 Ack=169 Win=16385 Len=0"
"7544","25.511814","10.100.102.58","162.159.128.235","TLSv1.2","115","Application Data"
"7549","25.516716","162.159.128.235","10.100.102.58","TCP","60","443  >  58168 [ACK] Seq=1326 Ack=1447 Win=7 Len=0"
"7550","25.522967","162.159.128.235","10.100.102.58","TLSv1.2","111","Application Data"
"7559","25.535991","10.100.102.58","162.159.130.235","TLSv1.2","115","Application Data"
"7563","25.545426","162.159.130.235","10.100.102.58","TLSv1.2","111","Application Data"
"7570","25.570542","10.100.102.58","162.159.128.235","TCP","54","58168  >  443 [ACK] Seq=1447 Ack=1383 Win=512 Len=0"
"7579","25.594978","10.100.102.58","162.159.130.235","TCP","54","58169  >  443 [ACK] Seq=367 Ack=343 Win=510 Len=0"
"8180","27.473907","13.107.42.12","10.100.102.58","TCP","60","443  >  58374 [RST, ACK] Seq=1 Ack=1 Win=0 Len=0"
"8504","28.422886","162.159.128.235","10.100.102.58","TLSv1.2","158","Application Data"
"8527","28.467335","10.100.102.58","162.159.128.235","TCP","54","58168  >  443 [ACK] Seq=1447 Ack=1487 Win=512 Len=0"
"8775","29.171734","162.159.128.235","10.100.102.58","TLSv1.2","158","Application Data"
"8794","29.217076","10.100.102.58","162.159.128.235","TCP","54","58168  >  443 [ACK] Seq=1447 Ack=1591 Win=511 Len=0"
"8838","29.343691","162.159.128.235","10.100.102.58","TLSv1.2","158","Application Data"
"8854","29.390860","10.100.102.58","162.159.128.235","TCP","54","58168  >  443 [ACK] Seq=1447 Ack=1695 Win=511 Len=0"
"9117","30.073055","10.100.102.58","13.107.42.14","TCP","1494","58207  >  443 [ACK] Seq=169 Ack=93 Win=514 Len=1440 [TCP segment of a reassembled PDU]"
"9118","30.073055","10.100.102.58","13.107.42.14","TCP","1494","58207  >  443 [ACK] Seq=1609 Ack=93 Win=514 Len=1440 [TCP segment of a reassembled PDU]"
"9119","30.073055","10.100.102.58","13.107.42.14","TCP","1494","58207  >  443 [ACK] Seq=3049 Ack=93 Win=514 Len=1440 [TCP segment of a reassembled PDU]"
"9120","30.073055","10.100.102.58","13.107.42.14","TLSv1.2","361","Application Data"
"9121","30.073161","10.100.102.58","13.107.42.14","TLSv1.2","422","Application Data"
"9126","30.078658","13.107.42.14","10.100.102.58","TCP","60","443  >  58207 [ACK] Seq=93 Ack=5164 Win=16386 Len=0"
"9127","30.080247","162.159.128.235","10.100.102.58","TLSv1.2","158","Application Data"
"9143","30.126611","10.100.102.58","162.159.128.235","TCP","54","58168  >  443 [ACK] Seq=1447 Ack=1799 Win=510 Len=0"
"9213","30.235328","13.107.42.14","10.100.102.58","TLSv1.2","927","[TCP Previous segment not captured] , Ignored Unknown Record"
"9214","30.235328","13.107.42.14","10.100.102.58","TCP","1506","[TCP Out-Of-Order] 443  >  58207 [ACK] Seq=93 Ack=5164 Win=16386 Len=1452"
"9216","30.235378","10.100.102.58","13.107.42.14","TCP","66","[TCP Dup ACK 7462#1] 58207  >  443 [ACK] Seq=5164 Ack=93 Win=514 Len=0 SLE=1545 SRE=2418"
"9217","30.235429","10.100.102.58","13.107.42.14","TCP","54","58207  >  443 [ACK] Seq=5164 Ack=2418 Win=517 Len=0"
"9281","30.409490","10.100.102.58","157.240.195.56","TCP","1446","58100  >  443 [ACK] Seq=5719 Ack=5270 Win=515 Len=1392 [TCP segment of a reassembled PDU]"
"9282","30.409490","10.100.102.58","157.240.195.56","TCP","1446","58100  >  443 [ACK] Seq=7111 Ack=5270 Win=515 Len=1392 [TCP segment of a reassembled PDU]"
"9283","30.409490","10.100.102.58","157.240.195.56","TCP","1446","58100  >  443 [ACK] Seq=8503 Ack=5270 Win=515 Len=1392 [TCP segment of a reassembled PDU]"
"9284","30.409490","10.100.102.58","157.240.195.56","TLSv1.2","773","Application Data"
"9308","30.484107","157.240.195.56","10.100.102.58","TCP","60","443  >  58100 [ACK] Seq=5270 Ack=7111 Win=2217 Len=0"
"9309","30.484107","157.240.195.56","10.100.102.58","TCP","60","443  >  58100 [ACK] Seq=5270 Ack=9895 Win=2239 Len=0"
"9310","30.484107","157.240.195.56","10.100.102.58","TCP","60","443  >  58100 [ACK] Seq=5270 Ack=10614 Win=2250 Len=0"
"9318","30.513180","10.100.102.58","162.159.128.235","TLSv1.2","115","Application Data"
"9320","30.528928","162.159.128.235","10.100.102.58","TLSv1.2","111","Application Data"
"9326","30.537159","10.100.102.58","162.159.130.235","TLSv1.2","115","Application Data"
"9330","30.551231","162.159.130.235","10.100.102.58","TLSv1.2","111","Application Data"
"9340","30.577132","10.100.102.58","162.159.128.235","TCP","54","58168  >  443 [ACK] Seq=1508 Ack=1856 Win=510 Len=0"
"9345","30.595435","10.100.102.58","162.159.130.235","TCP","54","58169  >  443 [ACK] Seq=428 Ack=400 Win=510 Len=0"
"9358","30.635530","157.240.195.56","10.100.102.58","TLSv1.2","168","Application Data"
"9370","30.676917","10.100.102.58","157.240.195.56","TCP","54","58100  >  443 [ACK] Seq=10614 Ack=5384 Win=515 Len=0"
"9434","30.891988","157.240.195.56","10.100.102.58","TLSv1.2","134","Application Data"
"9454","30.928562","157.240.195.56","10.100.102.58","TLSv1.2","152","Application Data"
"9455","30.928602","10.100.102.58","157.240.195.56","TCP","54","58100  >  443 [ACK] Seq=10614 Ack=5562 Win=514 Len=0"
"9456","30.931652","10.100.102.58","157.240.195.56","TLSv1.2","150","Application Data"
"9466","30.943278","157.240.195.56","10.100.102.58","TLSv1.2","154","Application Data"
"9473","30.949086","10.100.102.58","157.240.195.56","TLSv1.2","152","Application Data"
"9495","30.999501","157.240.195.56","10.100.102.58","TCP","60","443  >  58100 [ACK] Seq=5662 Ack=10710 Win=2250 Len=0"
"9513","31.020068","157.240.195.56","10.100.102.58","TCP","60","443  >  58100 [ACK] Seq=5662 Ack=10808 Win=2250 Len=0"
"9562","31.129562","157.240.195.56","10.100.102.58","TLSv1.2","151","Application Data"
"9563","31.132143","10.100.102.58","157.240.195.56","TLSv1.2","150","Application Data"
"9601","31.201987","157.240.195.56","10.100.102.58","TCP","60","443  >  58100 [ACK] Seq=5759 Ack=10904 Win=2250 Len=0"
"9757","31.553066","162.159.128.235","10.100.102.58","TLSv1.2","158","Application Data"
"9777","31.600676","10.100.102.58","162.159.128.235","TCP","54","58168  >  443 [ACK] Seq=1508 Ack=1960 Win=510 Len=0"
"9861","31.815708","10.100.102.58","157.240.195.56","TCP","1446","58100  >  443 [ACK] Seq=10904 Ack=5759 Win=513 Len=1392 [TCP segment of a reassembled PDU]"
"9862","31.815708","10.100.102.58","157.240.195.56","TCP","1446","58100  >  443 [ACK] Seq=12296 Ack=5759 Win=513 Len=1392 [TCP segment of a reassembled PDU]"
"9863","31.815708","10.100.102.58","157.240.195.56","TCP","1446","58100  >  443 [ACK] Seq=13688 Ack=5759 Win=513 Len=1392 [TCP segment of a reassembled PDU]"
"9864","31.815708","10.100.102.58","157.240.195.56","TCP","1446","58100  >  443 [ACK] Seq=15080 Ack=5759 Win=513 Len=1392 [TCP segment of a reassembled PDU]"
"9865","31.815708","10.100.102.58","157.240.195.56","TLSv1.2","709","Application Data"
"9903","31.853379","10.100.102.58","157.240.195.56","TCP","66","58389  >  443 [SYN] Seq=0 Win=64240 Len=0 MSS=1460 WS=256 SACK_PERM"
"9924","31.891765","157.240.195.56","10.100.102.58","TCP","60","443  >  58100 [ACK] Seq=5759 Ack=17127 Win=2298 Len=0"
"9939","31.920102","157.240.195.56","10.100.102.58","TCP","66","443  >  58389 [SYN, ACK] Seq=0 Ack=1 Win=65535 Len=0 MSS=1392 SACK_PERM WS=256"
"9940","31.920178","10.100.102.58","157.240.195.56","TCP","54","58389  >  443 [ACK] Seq=1 Ack=1 Win=132096 Len=0"
"9941","31.920467","10.100.102.58","157.240.195.56","TLSv1.3","571","Client Hello"
"9959","31.986649","157.240.195.56","10.100.102.58","TCP","60","443  >  58389 [ACK] Seq=1 Ack=518 Win=66816 Len=0"
"9960","31.987455","157.240.195.56","10.100.102.58","TLSv1.3","266","Server Hello, Change Cipher Spec, Application Data"
"9961","31.988079","10.100.102.58","157.240.195.56","TLSv1.3","118","Change Cipher Spec, Application Data"
"9962","31.988377","10.100.102.58","157.240.195.56","TLSv1.3","152","Application Data"
"9963","31.989108","10.100.102.58","157.240.195.56","TLSv1.3","523","Application Data"
"9964","31.989299","10.100.102.58","157.240.195.56","TLSv1.3","967","Application Data"
"9965","31.989506","10.100.102.58","157.240.195.56","TLSv1.3","177","Application Data"
"9966","31.989593","10.100.102.58","157.240.195.56","TLSv1.3","967","Application Data"
"9967","31.992103","157.240.195.56","10.100.102.58","TLSv1.2","118","Application Data"
"9984","32.036922","10.100.102.58","157.240.195.56","TCP","54","58100  >  443 [ACK] Seq=17127 Ack=5823 Win=513 Len=0"
"9990","32.061426","157.240.195.56","10.100.102.58","TCP","60","443  >  58389 [ACK] Seq=213 Ack=680 Win=66816 Len=0"
"9991","32.061426","157.240.195.56","10.100.102.58","TLSv1.3","225","Application Data"
"9992","32.061426","157.240.195.56","10.100.102.58","TLSv1.3","128","Application Data"
"9993","32.061426","157.240.195.56","10.100.102.58","TLSv1.3","85","Application Data"
"9994","32.061426","157.240.195.56","10.100.102.58","TCP","60","443  >  58389 [ACK] Seq=489 Ack=2062 Win=69632 Len=0"
"9995","32.061426","157.240.195.56","10.100.102.58","TCP","60","443  >  58389 [ACK] Seq=489 Ack=3098 Win=71424 Len=0"
"9996","32.061426","157.240.195.56","10.100.102.58","TLSv1.3","102","Application Data"
"9997","32.061543","10.100.102.58","157.240.195.56","TCP","54","58389  >  443 [ACK] Seq=3098 Ack=537 Win=131584 Len=0"
"9998","32.061757","10.100.102.58","157.240.195.56","TLSv1.3","85","Application Data"
"10017","32.098407","162.159.128.235","10.100.102.58","TLSv1.2","158","Application Data"
"10018","32.098856","157.240.195.56","10.100.102.58","TLSv1.3","543","Application Data"
"10041","32.147020","10.100.102.58","162.159.128.235","TCP","54","58168  >  443 [ACK] Seq=1508 Ack=2064 Win=509 Len=0"
"10042","32.147096","10.100.102.58","157.240.195.56","TCP","54","58389  >  443 [ACK] Seq=3129 Ack=1026 Win=131072 Len=0"
"10054","32.170156","157.240.195.56","10.100.102.58","TCP","60","443  >  58389 [ACK] Seq=1026 Ack=3129 Win=71424 Len=0"
"10099","32.304044","157.240.195.56","10.100.102.58","TLSv1.3","260","Application Data"
"10108","32.346441","10.100.102.58","157.240.195.56","TCP","54","58389  >  443 [ACK] Seq=3129 Ack=1232 Win=130816 Len=0"
"10330","33.041466","162.159.128.235","10.100.102.58","TLSv1.2","158","Application Data"
"10346","33.092482","10.100.102.58","162.159.128.235","TCP","54","58168  >  443 [ACK] Seq=1508 Ack=2168 Win=509 Len=0"
"10631","34.159311","162.159.128.235","10.100.102.58","TLSv1.2","158","Application Data"
"10642","34.207111","10.100.102.58","162.159.128.235","TCP","54","58168  >  443 [ACK] Seq=1508 Ack=2272 Win=509 Len=0"
"10657","34.264215","184.30.25.86","10.100.102.58","TLSv1.2","85","Encrypted Alert"
"10658","34.264215","184.30.25.86","10.100.102.58","TCP","60","443  >  58275 [FIN, ACK] Seq=32 Ack=1 Win=501 Len=0"
"10659","34.264303","10.100.102.58","184.30.25.86","TCP","54","58275  >  443 [ACK] Seq=1 Ack=33 Win=1021 Len=0"
"10919","35.517287","10.100.102.58","162.159.128.235","TLSv1.2","115","Application Data"
"10924","35.533369","10.100.102.58","162.159.130.235","TLSv1.2","115","Application Data"
"10925","35.540803","162.159.130.235","10.100.102.58","TLSv1.2","111","Application Data"
"10928","35.557616","162.159.128.235","10.100.102.58","TLSv1.2","111","Application Data"
"10933","35.584694","157.240.195.56","10.100.102.58","TLSv1.2","342","Application Data"
"10934","35.587018","10.100.102.58","162.159.130.235","TCP","54","58169  >  443 [ACK] Seq=489 Ack=457 Win=509 Len=0"
"10940","35.604423","10.100.102.58","162.159.128.235","TCP","54","58168  >  443 [ACK] Seq=1569 Ack=2329 Win=508 Len=0"
"10947","35.632394","10.100.102.58","157.240.195.56","TCP","54","58100  >  443 [ACK] Seq=17127 Ack=6111 Win=512 Len=0"
"10948","35.633514","10.100.102.58","157.240.195.56","TLSv1.2","153","Application Data"
"10959","35.708944","157.240.195.56","10.100.102.58","TCP","60","443  >  58100 [ACK] Seq=6111 Ack=17226 Win=2298 Len=0"
"11229","36.747456","157.240.195.56","10.100.102.58","TLSv1.2","154","Application Data"
"11230","36.749958","10.100.102.58","157.240.195.56","TLSv1.2","153","Application Data"
"11245","36.823100","157.240.195.56","10.100.102.58","TCP","60","443  >  58100 [ACK] Seq=6211 Ack=17325 Win=2298 Len=0"
"11931","40.263315","13.107.42.14","10.100.102.58","TLSv1.2","100","Application Data"
"11934","40.266911","10.100.102.58","13.107.42.14","TLSv1.2","96","Application Data"
"11935","40.267019","10.100.102.58","13.107.42.14","TLSv1.2","96","Application Data"
"11936","40.271955","13.107.42.14","10.100.102.58","TCP","60","443  >  58207 [ACK] Seq=2464 Ack=5206 Win=16385 Len=0"
"11937","40.273052","13.107.42.14","10.100.102.58","TCP","60","443  >  58207 [ACK] Seq=2464 Ack=5248 Win=16385 Len=0"
"11984","40.518445","10.100.102.58","162.159.128.235","TLSv1.2","115","Application Data"
"11987","40.526340","162.159.128.235","10.100.102.58","TLSv1.2","111","Application Data"
"11993","40.537565","10.100.102.58","162.159.130.235","TLSv1.2","115","Application Data"
"11994","40.547033","162.159.130.235","10.100.102.58","TLSv1.2","111","Application Data"
"12001","40.575160","10.100.102.58","162.159.128.235","TCP","54","58168  >  443 [ACK] Seq=1630 Ack=2386 Win=508 Len=0"
"12002","40.576290","10.100.102.58","162.159.128.235","TLSv1.2","144","Application Data"
"12006","40.594415","10.100.102.58","162.159.130.235","TCP","54","58169  >  443 [ACK] Seq=550 Ack=514 Win=509 Len=0"
"12010","40.624188","162.159.128.235","10.100.102.58","TCP","60","443  >  58168 [ACK] Seq=2386 Ack=1720 Win=8 Len=0"
"12052","40.714134","10.100.102.58","162.159.128.235","TLSv1.2","144","Application Data"
"12058","40.720767","162.159.128.235","10.100.102.58","TCP","60","443  >  58168 [ACK] Seq=2386 Ack=1810 Win=7 Len=0"
"12320","41.215423","157.240.195.56","10.100.102.58","TCP","1078","443  >  58100 [ACK] Seq=6211 Ack=17325 Win=2298 Len=1024 [TCP segment of a reassembled PDU]"
"12321","41.215423","157.240.195.56","10.100.102.58","TLSv1.2","543","Application Data"
"12322","41.215502","10.100.102.58","157.240.195.56","TCP","54","58100  >  443 [ACK] Seq=17325 Ack=7724 Win=516 Len=0"
"12325","41.216839","157.240.195.56","10.100.102.58","TLSv1.2","1078","[TCP Previous segment not captured] , Ignored Unknown Record"
"12326","41.216839","157.240.195.56","10.100.102.58","TCP","1078","[TCP Out-Of-Order] 443  >  58100 [ACK] Seq=7724 Ack=17325 Win=2298 Len=1024"
"12327","41.216916","10.100.102.58","157.240.195.56","TCP","66","[TCP Dup ACK 12322#1] 58100  >  443 [ACK] Seq=17325 Ack=7724 Win=516 Len=0 SLE=8748 SRE=9772"
"12328","41.217005","10.100.102.58","157.240.195.56","TCP","54","58100  >  443 [ACK] Seq=17325 Ack=9772 Win=516 Len=0"
"12332","41.220714","157.240.195.56","10.100.102.58","TLSv1.2","875","Ignored Unknown Record"
"12349","41.264368","10.100.102.58","157.240.195.56","TCP","54","58100  >  443 [ACK] Seq=17325 Ack=10593 Win=513 Len=0"
"12384","41.327784","10.100.102.58","157.240.195.56","TLSv1.2","148","Application Data"
"12422","41.388249","10.100.102.58","157.240.195.56","TLSv1.2","160","Application Data"
"12425","41.395441","157.240.195.56","10.100.102.58","TCP","60","443  >  58100 [ACK] Seq=10593 Ack=17419 Win=2298 Len=0"
"12453","41.458366","157.240.195.56","10.100.102.58","TCP","60","443  >  58100 [ACK] Seq=10593 Ack=17525 Win=2298 Len=0"
"12506","41.573164","157.240.195.56","10.100.102.58","TLSv1.2","147","Application Data"
"12530","41.616673","10.100.102.58","157.240.195.56","TCP","54","58100  >  443 [ACK] Seq=17525 Ack=10686 Win=512 Len=0"
"12588","41.755742","10.100.102.58","162.159.128.235","TLSv1.2","144","Application Data"
"12590","41.759045","162.159.128.235","10.100.102.58","TCP","60","443  >  58168 [ACK] Seq=2386 Ack=1900 Win=7 Len=0"
"12650","41.898029","10.100.102.58","162.159.128.235","TLSv1.2","144","Application Data"
"12654","41.903147","162.159.128.235","10.100.102.58","TCP","60","443  >  58168 [ACK] Seq=2386 Ack=1990 Win=7 Len=0"
"12793","42.356650","10.100.102.58","20.199.120.85","TLSv1.2","97","Application Data"
"12815","42.419344","20.199.120.85","10.100.102.58","TLSv1.2","228","Application Data"
"12829","42.460548","10.100.102.58","20.199.120.85","TCP","54","58054  >  443 [ACK] Seq=44 Ack=175 Win=512 Len=0"
"12870","42.607998","10.100.102.58","204.79.197.203","TCP","54","58378  >  443 [RST, ACK] Seq=1 Ack=1 Win=0 Len=0"
"12881","42.637523","10.100.102.58","162.159.128.235","TLSv1.2","144","Application Data"
"12884","42.646301","162.159.128.235","10.100.102.58","TCP","60","443  >  58168 [ACK] Seq=2386 Ack=2080 Win=7 Len=0"
"13040","43.428778","10.100.102.58","140.82.114.26","TCP","55","58174  >  443 [ACK] Seq=1 Ack=1 Win=514 Len=1 [TCP segment of a reassembled PDU]"
"13073","43.572237","140.82.114.26","10.100.102.58","TCP","66","443  >  58174 [ACK] Seq=1 Ack=2 Win=74 Len=0 SLE=1 SRE=2"
"13135","43.898793","10.100.102.58","162.159.128.235","TLSv1.2","144","Application Data"
"13140","43.903277","162.159.128.235","10.100.102.58","TCP","60","443  >  58168 [ACK] Seq=2386 Ack=2170 Win=7 Len=0"
"13187","44.088907","10.100.102.58","13.107.42.14","TLSv1.2","378","Application Data"
"13188","44.089036","10.100.102.58","13.107.42.14","TLSv1.2","1126","Application Data"
"13190","44.094470","13.107.42.14","10.100.102.58","TCP","60","443  >  58207 [ACK] Seq=2464 Ack=5572 Win=16384 Len=0"
"13191","44.094974","13.107.42.14","10.100.102.58","TCP","60","443  >  58207 [ACK] Seq=2464 Ack=6644 Win=16386 Len=0"
"13230","44.271401","13.107.42.14","10.100.102.58","TLSv1.2","528","Application Data"
"13243","44.312306","10.100.102.58","13.107.42.14","TCP","54","58207  >  443 [ACK] Seq=6644 Ack=2938 Win=515 Len=0"
"13299","44.597718","10.100.102.58","162.159.128.235","TLSv1.2","144","Application Data"
"13305","44.605379","162.159.128.235","10.100.102.58","TCP","60","443  >  58168 [ACK] Seq=2386 Ack=2260 Win=7 Len=0"
"13410","45.035869","10.100.102.58","162.159.128.235","TLSv1.2","144","Application Data"
"13413","45.041470","162.159.128.235","10.100.102.58","TCP","60","443  >  58168 [ACK] Seq=2386 Ack=2350 Win=7 Len=0"
"13535","45.524426","10.100.102.58","162.159.128.235","TLSv1.2","115","Application Data"
"13537","45.528998","162.159.128.235","10.100.102.58","TCP","60","443  >  58168 [ACK] Seq=2386 Ack=2411 Win=7 Len=0"
"13542","45.533284","10.100.102.58","162.159.130.235","TLSv1.2","115","Application Data"
"13543","45.535248","162.159.128.235","10.100.102.58","TLSv1.2","111","Application Data"
"13546","45.544468","162.159.130.235","10.100.102.58","TLSv1.2","111","Application Data"
"13557","45.585266","10.100.102.58","162.159.128.235","TCP","54","58168  >  443 [ACK] Seq=2411 Ack=2443 Win=514 Len=0"
"13558","45.585377","10.100.102.58","162.159.130.235","TCP","54","58169  >  443 [ACK] Seq=611 Ack=571 Win=509 Len=0"
"14202","48.018549","10.100.102.58","162.159.128.235","TLSv1.2","144","Application Data"
"14218","48.068501","162.159.128.235","10.100.102.58","TCP","60","443  >  58168 [ACK] Seq=2443 Ack=2501 Win=8 Len=0"
"14223","48.095325","10.100.102.58","172.217.22.37","TLSv1.2","1466","Ignored Unknown Record"
"14224","48.095325","10.100.102.58","172.217.22.37","TLSv1.2","1466","Ignored Unknown Record"
"14225","48.095325","10.100.102.58","172.217.22.37","TLSv1.2","503","Ignored Unknown Record"
"14226","48.095425","10.100.102.58","172.217.22.37","TLSv1.2","93","Application Data"
"14227","48.095451","10.100.102.58","172.217.22.37","TLSv1.2","164","Application Data"
"14229","48.101607","172.217.22.37","10.100.102.58","TCP","60","443  >  58206 [ACK] Seq=1 Ack=1414 Win=627 Len=0"
"14230","48.101607","172.217.22.37","10.100.102.58","TCP","60","443  >  58206 [ACK] Seq=1 Ack=2826 Win=638 Len=0"
"14231","48.101607","172.217.22.37","10.100.102.58","TCP","60","443  >  58206 [ACK] Seq=1 Ack=3314 Win=649 Len=0"
"14232","48.101607","172.217.22.37","10.100.102.58","TCP","60","443  >  58206 [ACK] Seq=1 Ack=3424 Win=649 Len=0"
"14233","48.101607","172.217.22.37","10.100.102.58","TLSv1.2","93","Application Data"
"14234","48.101702","10.100.102.58","172.217.22.37","TCP","54","58206  >  443 [ACK] Seq=3424 Ack=40 Win=512 Len=0"
"14251","48.153721","10.100.102.58","162.159.128.235","TLSv1.2","144","Application Data"
"14252","48.162539","162.159.128.235","10.100.102.58","TCP","60","443  >  58168 [ACK] Seq=2443 Ack=2591 Win=7 Len=0"
"14318","48.390427","172.217.22.37","10.100.102.58","TLSv1.2","587","Application Data"
"14319","48.390427","172.217.22.37","10.100.102.58","TLSv1.2","596","Application Data"
"14320","48.390511","10.100.102.58","172.217.22.37","TCP","54","58206  >  443 [ACK] Seq=3424 Ack=1115 Win=508 Len=0"
"14321","48.391085","10.100.102.58","172.217.22.37","TLSv1.2","89","Application Data"
"14324","48.393958","172.217.22.37","10.100.102.58","TLSv1.2","246","Application Data"
"14325","48.393958","172.217.22.37","10.100.102.58","TLSv1.2","93","Application Data"
"14326","48.394038","10.100.102.58","172.217.22.37","TCP","54","58206  >  443 [ACK] Seq=3459 Ack=1346 Win=507 Len=0"
"14327","48.394742","10.100.102.58","172.217.22.37","TLSv1.2","93","Application Data"
"14332","48.401142","172.217.22.37","10.100.102.58","TCP","60","443  >  58206 [ACK] Seq=1346 Ack=3498 Win=649 Len=0"
"14793","50.178444","10.100.102.58","157.240.195.56","TCP","1446","58100  >  443 [ACK] Seq=17525 Ack=10686 Win=512 Len=1392 [TCP segment of a reassembled PDU]"
"14794","50.178444","10.100.102.58","157.240.195.56","TCP","1446","58100  >  443 [ACK] Seq=18917 Ack=10686 Win=512 Len=1392 [TCP segment of a reassembled PDU]"
"14795","50.178444","10.100.102.58","157.240.195.56","TCP","1446","58100  >  443 [ACK] Seq=20309 Ack=10686 Win=512 Len=1392 [TCP segment of a reassembled PDU]"
"14796","50.178444","10.100.102.58","157.240.195.56","TLSv1.2","757","Application Data"
"14822","50.332470","10.100.102.58","157.240.195.56","TCP","1446","[TCP Retransmission] 58100  >  443 [PSH, ACK] Seq=21012 Ack=10686 Win=512 Len=1392"
"14853","50.387032","157.240.195.56","10.100.102.58","TCP","60","443  >  58100 [ACK] Seq=10686 Ack=22404 Win=2337 Len=0"
"14870","50.442906","157.240.195.56","10.100.102.58","TCP","60","[TCP Dup ACK 14853#1] 443  >  58100 [ACK] Seq=10686 Ack=22404 Win=2337 Len=0"
"14874","50.446681","157.240.195.56","10.100.102.58","TLSv1.2","168","Application Data"
"14879","50.486957","10.100.102.58","157.240.195.56","TCP","54","58100  >  443 [ACK] Seq=22404 Ack=10800 Win=512 Len=0"
"14882","50.522597","10.100.102.58","162.159.128.235","TLSv1.2","115","Application Data"
"14884","50.537451","10.100.102.58","162.159.130.235","TLSv1.2","115","Application Data"
"14899","50.571947","162.159.128.235","10.100.102.58","TCP","60","443  >  58168 [ACK] Seq=2443 Ack=2652 Win=7 Len=0"
"14910","50.647214","162.159.128.235","10.100.102.58","TLSv1.2","111","Application Data"
"14917","50.647214","162.159.130.235","10.100.102.58","TLSv1.2","111","Application Data"
"14936","50.690676","10.100.102.58","162.159.128.235","TCP","54","58168  >  443 [ACK] Seq=2652 Ack=2500 Win=513 Len=0"
"14937","50.690786","10.100.102.58","162.159.130.235","TCP","54","58169  >  443 [ACK] Seq=672 Ack=628 Win=509 Len=0"
"15024","50.850204","157.240.195.56","10.100.102.58","TLSv1.2","152","Application Data"
"15025","50.850204","157.240.195.56","10.100.102.58","TLSv1.2","154","Application Data"
"15026","50.850286","10.100.102.58","157.240.195.56","TCP","54","58100  >  443 [ACK] Seq=22404 Ack=10998 Win=511 Len=0"
"15032","50.853306","10.100.102.58","157.240.195.56","TLSv1.2","150","Application Data"
"15034","50.859164","10.100.102.58","157.240.195.56","TLSv1.2","152","Application Data"
"15095","50.991728","157.240.195.56","10.100.102.58","TCP","60","443  >  58100 [ACK] Seq=10998 Ack=22500 Win=2337 Len=0"
"15096","50.991728","157.240.195.56","10.100.102.58","TCP","60","443  >  58100 [ACK] Seq=10998 Ack=22598 Win=2337 Len=0"
"15747","53.117301","157.240.195.56","10.100.102.58","TLSv1.2","151","Application Data"
"15748","53.120018","10.100.102.58","157.240.195.56","TLSv1.2","150","Application Data"
"15766","53.193123","157.240.195.56","10.100.102.58","TCP","60","443  >  58100 [ACK] Seq=11095 Ack=22694 Win=2337 Len=0"
"15895","53.557810","10.100.102.58","162.159.128.235","TLSv1.2","144","Application Data"
"15921","53.604909","162.159.128.235","10.100.102.58","TCP","60","443  >  58168 [ACK] Seq=2500 Ack=2742 Win=8 Len=0"
"15924","53.618062","10.100.102.58","162.159.128.235","TLSv1.2","144","Application Data"
"15925","53.624432","162.159.128.235","10.100.102.58","TCP","60","443  >  58168 [ACK] Seq=2500 Ack=2832 Win=7 Len=0"
"16337","55.281752","13.107.42.14","10.100.102.58","TLSv1.2","100","Application Data"
"16338","55.284819","10.100.102.58","13.107.42.14","TLSv1.2","96","Application Data"
"16339","55.284966","10.100.102.58","13.107.42.14","TLSv1.2","96","Application Data"
"16341","55.293345","13.107.42.14","10.100.102.58","TCP","60","443  >  58207 [ACK] Seq=2984 Ack=6728 Win=16385 Len=0"
"16395","55.525498","10.100.102.58","162.159.128.235","TLSv1.2","115","Application Data"
"16396","55.529389","162.159.128.235","10.100.102.58","TCP","60","443  >  58168 [ACK] Seq=2500 Ack=2893 Win=7 Len=0"
"16401","55.535208","10.100.102.58","162.159.130.235","TLSv1.2","115","Application Data"
"16402","55.535431","162.159.128.235","10.100.102.58","TLSv1.2","111","Application Data"
"16403","55.545397","162.159.130.235","10.100.102.58","TLSv1.2","111","Application Data"
"16413","55.576595","10.100.102.58","162.159.128.235","TCP","54","58168  >  443 [ACK] Seq=2893 Ack=2557 Win=513 Len=0"
"16415","55.592480","10.100.102.58","162.159.130.235","TCP","54","58169  >  443 [ACK] Seq=733 Ack=685 Win=508 Len=0"
"17027","58.282032","140.82.114.26","10.100.102.58","TLSv1.2","80","Application Data"
"17028","58.282328","10.100.102.58","140.82.114.26","TLSv1.2","84","Ignored Unknown Record"
"17059","58.426162","140.82.114.26","10.100.102.58","TCP","60","443  >  58174 [ACK] Seq=27 Ack=32 Win=74 Len=0"
"17350","59.707092","10.100.102.58","144.2.15.25","TCP","55","[TCP Keep-Alive] 58363  >  443 [ACK] Seq=1 Ack=1 Win=514 Len=1"
"17379","59.886273","144.2.15.25","10.100.102.58","TCP","66","[TCP Keep-Alive ACK] 443  >  58363 [ACK] Seq=1 Ack=2 Win=822 Len=0 SLE=1 SRE=2"
"17406","59.991401","10.100.102.58","162.159.128.235","TLSv1.2","144","Application Data"
"17421","60.037870","162.159.128.235","10.100.102.58","TCP","60","443  >  58168 [ACK] Seq=2557 Ack=2983 Win=8 Len=0"
"17473","60.313719","10.100.102.58","162.159.128.235","TLSv1.2","144","Application Data"
"17474","60.320364","162.159.128.235","10.100.102.58","TCP","60","443  >  58168 [ACK] Seq=2557 Ack=3073 Win=7 Len=0"
"17483","60.356516","10.100.102.58","108.174.10.20","TCP","55","[TCP Keep-Alive] 58370  >  443 [ACK] Seq=1 Ack=1 Win=514 Len=1"
"17567","60.517765","10.100.102.58","162.159.128.235","TLSv1.2","115","Application Data"
"17568","60.518209","108.174.10.20","10.100.102.58","TCP","66","[TCP Keep-Alive ACK] 443  >  58370 [ACK] Seq=1 Ack=2 Win=822 Len=0 SLE=1 SRE=2"
"17570","60.523723","162.159.128.235","10.100.102.58","TCP","60","443  >  58168 [ACK] Seq=2557 Ack=3134 Win=7 Len=0"
"17572","60.531050","162.159.128.235","10.100.102.58","TLSv1.2","111","Application Data"
"17573","60.532371","10.100.102.58","162.159.130.235","TLSv1.2","115","Application Data"
"17578","60.541172","162.159.130.235","10.100.102.58","TLSv1.2","111","Application Data"
"17604","60.578431","10.100.102.58","162.159.128.235","TCP","54","58168  >  443 [ACK] Seq=3134 Ack=2614 Win=513 Len=0"
"17610","60.586927","10.100.102.58","162.159.130.235","TCP","54","58169  >  443 [ACK] Seq=794 Ack=742 Win=508 Len=0"
"17675","60.737197","10.100.102.58","162.159.128.235","TLSv1.2","144","Application Data"
"17706","60.783607","162.159.128.235","10.100.102.58","TCP","60","443  >  58168 [ACK] Seq=2614 Ack=3224 Win=8 Len=0"
"17794","60.946514","157.240.195.56","10.100.102.58","TLSv1.2","543","[TCP Previous segment not captured] , Ignored Unknown Record"
"17795","60.946514","157.240.195.56","10.100.102.58","TCP","1078","[TCP Out-Of-Order] 443  >  58100 [ACK] Seq=11095 Ack=22694 Win=2337 Len=1024"
"17796","60.946514","157.240.195.56","10.100.102.58","TLSv1.2","1078","[TCP Previous segment not captured] , Ignored Unknown Record"
"17797","60.946514","157.240.195.56","10.100.102.58","TCP","1078","[TCP Out-Of-Order] 443  >  58100 [ACK] Seq=12608 Ack=22694 Win=2337 Len=1024"
"17798","60.946514","157.240.195.56","10.100.102.58","TLSv1.2","875","Ignored Unknown Record"
"17799","60.946600","10.100.102.58","157.240.195.56","TCP","66","[TCP Dup ACK 15748#1] 58100  >  443 [ACK] Seq=22694 Ack=11095 Win=511 Len=0 SLE=12119 SRE=12608"
"17800","60.946684","10.100.102.58","157.240.195.56","TCP","54","58100  >  443 [ACK] Seq=22694 Ack=12608 Win=516 Len=0"
"17801","60.946722","10.100.102.58","157.240.195.56","TCP","66","[TCP Dup ACK 17800#1] 58100  >  443 [ACK] Seq=22694 Ack=12608 Win=516 Len=0 SLE=13632 SRE=14656"
"17802","60.946753","10.100.102.58","157.240.195.56","TCP","54","58100  >  443 [ACK] Seq=22694 Ack=14656 Win=516 Len=0"
"17829","60.997083","10.100.102.58","157.240.195.56","TCP","54","58100  >  443 [ACK] Seq=22694 Ack=15477 Win=513 Len=0"
"17859","61.065621","10.100.102.58","157.240.195.56","TLSv1.2","148","Application Data"
"17891","61.115529","10.100.102.58","157.240.195.56","TLSv1.2","160","Application Data"
"17897","61.136623","157.240.195.56","10.100.102.58","TCP","60","443  >  58100 [ACK] Seq=15477 Ack=22788 Win=2337 Len=0"
"17926","61.203568","157.240.195.56","10.100.102.58","TCP","60","443  >  58100 [ACK] Seq=15477 Ack=22894 Win=2337 Len=0"
"17942","61.238258","10.100.102.58","162.159.128.235","TLSv1.2","144","Application Data"
"17951","61.245016","162.159.128.235","10.100.102.58","TCP","60","443  >  58168 [ACK] Seq=2614 Ack=3314 Win=7 Len=0"
"17971","61.294150","157.240.195.56","10.100.102.58","TLSv1.2","147","Application Data"
"17995","61.337313","10.100.102.58","157.240.195.56","TCP","54","58100  >  443 [ACK] Seq=22894 Ack=15570 Win=512 Len=0"
"18136","61.618391","10.100.102.58","162.159.128.235","TLSv1.2","144","Application Data"
"18137","61.626977","162.159.128.235","10.100.102.58","TCP","60","443  >  58168 [ACK] Seq=2614 Ack=3404 Win=7 Len=0"
"18161","61.697156","10.100.102.58","162.159.128.235","TLSv1.2","144","Application Data"
"18169","61.707933","162.159.128.235","10.100.102.58","TCP","60","443  >  58168 [ACK] Seq=2614 Ack=3494 Win=7 Len=0"
"18590","63.109137","157.240.195.56","10.100.102.58","TLSv1.2","154","Application Data"
"18591","63.111590","10.100.102.58","157.240.195.56","TLSv1.2","153","Application Data"
"18610","63.181164","157.240.195.56","10.100.102.58","TCP","60","443  >  58100 [ACK] Seq=15670 Ack=22993 Win=2337 Len=0"
"18844","64.097899","10.100.102.58","162.159.136.234","TLSv1.2","97","Application Data"
"18849","64.104590","162.159.136.234","10.100.102.58","TCP","60","443  >  58134 [ACK] Seq=33 Ack=87 Win=7 Len=0"
"18885","64.255515","162.159.136.234","10.100.102.58","TLSv1.2","86","Application Data"
"18894","64.296757","10.100.102.58","162.159.136.234","TCP","54","58134  >  443 [ACK] Seq=87 Ack=65 Win=513 Len=0"
"18955","64.508368","162.159.128.235","10.100.102.58","TLSv1.2","158","Application Data"
"18972","64.552644","10.100.102.58","162.159.128.235","TCP","54","58168  >  443 [ACK] Seq=3494 Ack=2718 Win=512 Len=0"
"19243","65.259263","10.100.102.58","162.159.128.235","TLSv1.2","144","Application Data"
"19246","65.263014","162.159.128.235","10.100.102.58","TCP","60","443  >  58168 [ACK] Seq=2718 Ack=3584 Win=7 Len=0"
"19291","65.376980","10.100.102.58","162.159.128.235","TLSv1.2","144","Application Data"
"19292","65.382738","162.159.128.235","10.100.102.58","TCP","60","443  >  58168 [ACK] Seq=2718 Ack=3674 Win=7 Len=0"
"19324","65.517608","10.100.102.58","162.159.128.235","TLSv1.2","115","Application Data"
"19326","65.521082","162.159.128.235","10.100.102.58","TCP","60","443  >  58168 [ACK] Seq=2718 Ack=3735 Win=7 Len=0"
"19329","65.536280","162.159.128.235","10.100.102.58","TLSv1.2","111","Application Data"
"19334","65.537788","10.100.102.58","162.159.130.235","TLSv1.2","115","Application Data"
"19348","65.552690","162.159.130.235","10.100.102.58","TLSv1.2","111","Application Data"
"19368","65.587362","10.100.102.58","162.159.128.235","TCP","54","58168  >  443 [ACK] Seq=3735 Ack=2775 Win=512 Len=0"
"19371","65.594675","10.100.102.58","162.159.130.235","TCP","54","58169  >  443 [ACK] Seq=855 Ack=799 Win=514 Len=0"
"19570","65.925771","162.159.128.235","10.100.102.58","TLSv1.2","158","Application Data"
"19591","65.967122","10.100.102.58","162.159.128.235","TCP","54","58168  >  443 [ACK] Seq=3735 Ack=2879 Win=512 Len=0"
"19676","66.123301","157.240.195.56","10.100.102.58","TCP","543","[TCP Previous segment not captured] 443  >  58100 [PSH, ACK] Seq=16694 Ack=22993 Win=2337 Len=489"
"19677","66.123301","157.240.195.56","10.100.102.58","TCP","1078","[TCP Out-Of-Order] 443  >  58100 [ACK] Seq=15670 Ack=22993 Win=2337 Len=1024"
"19678","66.123379","10.100.102.58","157.240.195.56","TCP","66","[TCP Dup ACK 18591#1] 58100  >  443 [ACK] Seq=22993 Ack=15670 Win=512 Len=0 SLE=16694 SRE=17183"
"19679","66.123473","10.100.102.58","157.240.195.56","TCP","54","58100  >  443 [ACK] Seq=22993 Ack=17183 Win=516 Len=0"
"19680","66.124873","157.240.195.56","10.100.102.58","TCP","1078","443  >  58100 [ACK] Seq=17183 Ack=22993 Win=2337 Len=1024 [TCP segment of a reassembled PDU]"
"19681","66.124873","157.240.195.56","10.100.102.58","TCP","1078","443  >  58100 [PSH, ACK] Seq=18207 Ack=22993 Win=2337 Len=1024 [TCP segment of a reassembled PDU]"
"19682","66.124957","10.100.102.58","157.240.195.56","TCP","54","58100  >  443 [ACK] Seq=22993 Ack=19231 Win=516 Len=0"
"19683","66.125295","157.240.195.56","10.100.102.58","TLSv1.2","875","Application Data, Application Data"
"19688","66.174128","10.100.102.58","157.240.195.56","TCP","54","58100  >  443 [ACK] Seq=22993 Ack=20052 Win=513 Len=0"
"19691","66.220152","10.100.102.58","157.240.195.56","TLSv1.2","148","Application Data"
"19768","66.252678","10.100.102.58","157.240.195.56","TLSv1.2","160","Application Data"
"19799","66.288232","157.240.195.56","10.100.102.58","TCP","60","443  >  58100 [ACK] Seq=20052 Ack=23087 Win=2337 Len=0"
"19829","66.354109","157.240.195.56","10.100.102.58","TCP","60","443  >  58100 [ACK] Seq=20052 Ack=23193 Win=2337 Len=0"
"19856","66.403670","157.240.195.56","10.100.102.58","TCP","1078","443  >  58100 [ACK] Seq=20052 Ack=23193 Win=2337 Len=1024 [TCP segment of a reassembled PDU]"
"19857","66.403670","157.240.195.56","10.100.102.58","TLSv1.2","543","Application Data"
"19858","66.403670","157.240.195.56","10.100.102.58","TCP","1078","443  >  58100 [ACK] Seq=21565 Ack=23193 Win=2337 Len=1024 [TCP segment of a reassembled PDU]"
"19859","66.403670","157.240.195.56","10.100.102.58","TCP","1078","443  >  58100 [PSH, ACK] Seq=22589 Ack=23193 Win=2337 Len=1024 [TCP segment of a reassembled PDU]"
"19860","66.403749","10.100.102.58","157.240.195.56","TCP","54","58100  >  443 [ACK] Seq=23193 Ack=23613 Win=516 Len=0"
"19861","66.403826","157.240.195.56","10.100.102.58","TLSv1.2","875","Application Data, Application Data"
"19874","66.424700","157.240.195.56","10.100.102.58","TLSv1.2","147","Application Data"
"19875","66.424726","10.100.102.58","157.240.195.56","TCP","54","58100  >  443 [ACK] Seq=23193 Ack=24527 Win=512 Len=0"
"19901","66.481270","10.100.102.58","157.240.195.56","TLSv1.2","148","Application Data"
"19911","66.494014","10.100.102.58","157.240.195.56","TLSv1.2","160","Application Data"
"19950","66.555341","157.240.195.56","10.100.102.58","TCP","60","443  >  58100 [ACK] Seq=24527 Ack=23287 Win=2337 Len=0"
"19952","66.561837","157.240.195.56","10.100.102.58","TCP","60","443  >  58100 [ACK] Seq=24527 Ack=23393 Win=2337 Len=0"
"20005","66.666604","157.240.195.56","10.100.102.58","TLSv1.2","147","Application Data"
"20036","66.717279","10.100.102.58","157.240.195.56","TCP","54","58100  >  443 [ACK] Seq=23393 Ack=24620 Win=512 Len=0"
"20143","66.937424","162.159.128.235","10.100.102.58","TLSv1.2","158","Application Data"
"20163","66.984519","10.100.102.58","162.159.128.235","TCP","54","58168  >  443 [ACK] Seq=3735 Ack=2983 Win=511 Len=0"
"20422","67.628422","10.100.102.58","199.232.82.208","TCP","55","[TCP Keep-Alive] 58252  >  443 [ACK] Seq=1 Ack=1 Win=3586 Len=1"
"20443","67.686398","199.232.82.208","10.100.102.58","TCP","66","[TCP Keep-Alive ACK] 443  >  58252 [ACK] Seq=1 Ack=2 Win=291 Len=0 SLE=1 SRE=2"
"20456","67.725497","162.159.128.235","10.100.102.58","TLSv1.2","158","Application Data"
"20475","67.770539","10.100.102.58","162.159.128.235","TCP","54","58168  >  443 [ACK] Seq=3735 Ack=3087 Win=511 Len=0"
"20535","67.946629","162.159.128.235","10.100.102.58","TLSv1.2","158","Application Data"
"20550","67.994603","10.100.102.58","162.159.128.235","TCP","54","58168  >  443 [ACK] Seq=3735 Ack=3191 Win=511 Len=0"
"21030","69.386401","10.100.102.58","34.84.0.87","TCP","55","[TCP Keep-Alive] 58239  >  443 [ACK] Seq=1 Ack=1 Win=514 Len=1"
"21116","69.639971","34.84.0.87","10.100.102.58","TCP","66","[TCP Keep-Alive ACK] 443  >  58239 [ACK] Seq=1 Ack=2 Win=501 Len=0 SLE=1 SRE=2"
"21148","69.738520","162.159.128.235","10.100.102.58","TLSv1.2","158","Application Data"
"21161","69.784492","10.100.102.58","162.159.128.235","TCP","54","58168  >  443 [ACK] Seq=3735 Ack=3295 Win=510 Len=0"
"21320","70.260977","13.107.42.14","10.100.102.58","TLSv1.2","100","Application Data"
"21321","70.263399","10.100.102.58","13.107.42.14","TLSv1.2","96","Application Data"
"21322","70.263566","10.100.102.58","13.107.42.14","TLSv1.2","96","Application Data"
"21330","70.268860","13.107.42.14","10.100.102.58","TCP","60","443  >  58207 [ACK] Seq=3030 Ack=6770 Win=16385 Len=0"
"21331","70.270388","13.107.42.14","10.100.102.58","TCP","60","443  >  58207 [ACK] Seq=3030 Ack=6812 Win=16385 Len=0"
"21401","70.525839","10.100.102.58","162.159.128.235","TLSv1.2","115","Application Data"
"21409","70.535133","10.100.102.58","162.159.130.235","TLSv1.2","115","Application Data"
"21410","70.538912","162.159.128.235","10.100.102.58","TLSv1.2","111","Application Data"
"21411","70.545108","162.159.130.235","10.100.102.58","TLSv1.2","111","Application Data"
"21423","70.596224","10.100.102.58","162.159.128.235","TCP","54","58168  >  443 [ACK] Seq=3796 Ack=3352 Win=510 Len=0"
"21424","70.596306","10.100.102.58","162.159.130.235","TCP","54","58169  >  443 [ACK] Seq=916 Ack=856 Win=513 Len=0"
