"No.","Time","Source","Destination","Protocol","Length","Info"
"1","0.000000","2a00:a041:3b1d:ce00:a1e5:af73:6ded:393e","2a03:2880:f258:c8:face:b00c:0:167","TLSv1.2","140","Application Data"
"2","0.083763","2a03:2880:f258:c8:face:b00c:0:167","2a00:a041:3b1d:ce00:a1e5:af73:6ded:393e","TCP","74","443  >  63153 [ACK] Seq=1 Ack=67 Win=1185 Len=0"
"17","0.543132","2a00:a041:3b1d:ce00:a1e5:af73:6ded:393e","2a03:2880:f258:c8:face:b00c:0:167","TLSv1.2","140","Application Data"
"18","0.621388","2a03:2880:f258:c8:face:b00c:0:167","2a00:a041:3b1d:ce00:a1e5:af73:6ded:393e","TCP","74","443  >  63153 [ACK] Seq=1 Ack=133 Win=1185 Len=0"
"19","0.714456","2a03:2880:f258:c8:face:b00c:0:167","2a00:a041:3b1d:ce00:a1e5:af73:6ded:393e","TLSv1.2","147","Application Data"
"21","0.758091","2a00:a041:3b1d:ce00:a1e5:af73:6ded:393e","2a03:2880:f258:c8:face:b00c:0:167","TCP","74","63153  >  443 [ACK] Seq=133 Ack=74 Win=1022 Len=0"
"29","2.089955","2a03:2880:f258:c8:face:b00c:0:167","2a00:a041:3b1d:ce00:a1e5:af73:6ded:393e","TLSv1.2","134","Application Data"
"31","2.142761","2a00:a041:3b1d:ce00:a1e5:af73:6ded:393e","2a03:2880:f258:c8:face:b00c:0:167","TCP","74","63153  >  443 [ACK] Seq=133 Ack=134 Win=1027 Len=0"
"133","8.286921","2a00:a041:3b1d:ce00:a1e5:af73:6ded:393e","2a03:2880:f258:c8:face:b00c:0:167","TLSv1.2","143","Application Data"
"134","8.366475","2a03:2880:f258:c8:face:b00c:0:167","2a00:a041:3b1d:ce00:a1e5:af73:6ded:393e","TCP","74","443  >  63153 [ACK] Seq=134 Ack=202 Win=1185 Len=0"
"135","8.459428","2a03:2880:f258:c8:face:b00c:0:167","2a00:a041:3b1d:ce00:a1e5:af73:6ded:393e","TLSv1.2","145","Application Data"
"136","8.499827","2a00:a041:3b1d:ce00:a1e5:af73:6ded:393e","2a03:2880:f258:c8:face:b00c:0:167","TCP","74","63153  >  443 [ACK] Seq=202 Ack=205 Win=1027 Len=0"
"150","11.459599","2a03:2880:f258:c8:face:b00c:0:167","2a00:a041:3b1d:ce00:a1e5:af73:6ded:393e","TCP","1466","443  >  63153 [ACK] Seq=205 Ack=202 Win=1185 Len=1392 [TCP segment of a reassembled PDU]"
"151","11.459599","2a03:2880:f258:c8:face:b00c:0:167","2a00:a041:3b1d:ce00:a1e5:af73:6ded:393e","TLSv1.2","195","Application Data"
"152","11.459619","2a00:a041:3b1d:ce00:a1e5:af73:6ded:393e","2a03:2880:f258:c8:face:b00c:0:167","TCP","74","63153  >  443 [ACK] Seq=202 Ack=1718 Win=1027 Len=0"
"153","11.462655","2a03:2880:f258:c8:face:b00c:0:167","2a00:a041:3b1d:ce00:a1e5:af73:6ded:393e","TCP","1466","443  >  63153 [ACK] Seq=1718 Ack=202 Win=1185 Len=1392 [TCP segment of a reassembled PDU]"
"154","11.462655","2a03:2880:f258:c8:face:b00c:0:167","2a00:a041:3b1d:ce00:a1e5:af73:6ded:393e","TLSv1.2","1466","Application Data"
"155","11.462666","2a00:a041:3b1d:ce00:a1e5:af73:6ded:393e","2a03:2880:f258:c8:face:b00c:0:167","TCP","74","63153  >  443 [ACK] Seq=202 Ack=4502 Win=1027 Len=0"
"156","11.463363","2a03:2880:f258:c8:face:b00c:0:167","2a00:a041:3b1d:ce00:a1e5:af73:6ded:393e","TLSv1.2","648","Application Data"
"157","11.518038","2a00:a041:3b1d:ce00:a1e5:af73:6ded:393e","2a03:2880:f258:c8:face:b00c:0:167","TCP","74","63153  >  443 [ACK] Seq=202 Ack=5076 Win=1025 Len=0"
"160","11.619261","2a00:a041:3b1d:ce00:a1e5:af73:6ded:393e","2a03:2880:f258:c8:face:b00c:0:167","TLSv1.2","148","Application Data"
"161","11.651827","2a00:a041:3b1d:ce00:a1e5:af73:6ded:393e","2a03:2880:f258:c8:face:b00c:0:167","TLSv1.2","168","Application Data"
"162","11.654517","2a00:a041:3b1d:ce00:a1e5:af73:6ded:393e","2a03:2880:f258:c8:face:b00c:0:167","TLSv1.2","180","Application Data"
"184","11.697944","2a03:2880:f258:c8:face:b00c:0:167","2a00:a041:3b1d:ce00:a1e5:af73:6ded:393e","TCP","74","443  >  63153 [ACK] Seq=5076 Ack=276 Win=1185 Len=0"
"195","11.729496","2a03:2880:f258:c8:face:b00c:0:167","2a00:a041:3b1d:ce00:a1e5:af73:6ded:393e","TCP","74","443  >  63153 [ACK] Seq=5076 Ack=370 Win=1185 Len=0"
"197","11.734830","2a03:2880:f258:c8:face:b00c:0:167","2a00:a041:3b1d:ce00:a1e5:af73:6ded:393e","TCP","74","443  >  63153 [ACK] Seq=5076 Ack=476 Win=1185 Len=0"
"200","11.793907","2a03:2880:f258:c8:face:b00c:0:167","2a00:a041:3b1d:ce00:a1e5:af73:6ded:393e","TLSv1.2","1078","Application Data"
"203","11.829507","2a03:2880:f258:c8:face:b00c:0:167","2a00:a041:3b1d:ce00:a1e5:af73:6ded:393e","TLSv1.2","167","Application Data"
"204","11.829598","2a00:a041:3b1d:ce00:a1e5:af73:6ded:393e","2a03:2880:f258:c8:face:b00c:0:167","TCP","74","63153  >  443 [ACK] Seq=476 Ack=6173 Win=1027 Len=0"
"617","22.259831","2a03:2880:f258:c8:face:b00c:0:167","2a00:a041:3b1d:ce00:a1e5:af73:6ded:393e","TCP","74","[TCP ACKed unseen segment] 443  >  63153 [ACK] Seq=6173 Ack=3260 Win=1207 Len=0"
"618","22.259831","2a03:2880:f258:c8:face:b00c:0:167","2a00:a041:3b1d:ce00:a1e5:af73:6ded:393e","TCP","74","443  >  63153 [ACK] Seq=6173 Ack=3388 Win=1207 Len=0"
"619","22.445254","2a03:2880:f258:c8:face:b00c:0:167","2a00:a041:3b1d:ce00:a1e5:af73:6ded:393e","TLSv1.2","188","Application Data"
"620","22.492510","2a00:a041:3b1d:ce00:a1e5:af73:6ded:393e","2a03:2880:f258:c8:face:b00c:0:167","TCP","74","[TCP Previous segment not captured] 63153  >  443 [ACK] Seq=3388 Ack=6287 Win=1027 Len=0"
"622","22.862251","2a03:2880:f258:c8:face:b00c:0:167","2a00:a041:3b1d:ce00:a1e5:af73:6ded:393e","TLSv1.2","172","[TCP ACKed unseen segment] , Application Data"
"623","22.864556","2a00:a041:3b1d:ce00:a1e5:af73:6ded:393e","2a03:2880:f258:c8:face:b00c:0:167","TLSv1.2","170","Application Data"
"624","22.898524","2a03:2880:f258:c8:face:b00c:0:167","2a00:a041:3b1d:ce00:a1e5:af73:6ded:393e","TLSv1.2","174","Application Data"
"625","22.904753","2a00:a041:3b1d:ce00:a1e5:af73:6ded:393e","2a03:2880:f258:c8:face:b00c:0:167","TLSv1.2","172","Application Data"
"626","22.943701","2a03:2880:f258:c8:face:b00c:0:167","2a00:a041:3b1d:ce00:a1e5:af73:6ded:393e","TCP","74","443  >  63153 [ACK] Seq=6485 Ack=3484 Win=1207 Len=0"
"627","22.984417","2a03:2880:f258:c8:face:b00c:0:167","2a00:a041:3b1d:ce00:a1e5:af73:6ded:393e","TCP","74","443  >  63153 [ACK] Seq=6485 Ack=3582 Win=1207 Len=0"
"630","23.342281","2a03:2880:f258:c8:face:b00c:0:167","2a00:a041:3b1d:ce00:a1e5:af73:6ded:393e","TLSv1.2","171","Application Data"
"631","23.344108","2a00:a041:3b1d:ce00:a1e5:af73:6ded:393e","2a03:2880:f258:c8:face:b00c:0:167","TLSv1.2","170","Application Data"
"632","23.425212","2a03:2880:f258:c8:face:b00c:0:167","2a00:a041:3b1d:ce00:a1e5:af73:6ded:393e","TCP","74","443  >  63153 [ACK] Seq=6582 Ack=3678 Win=1207 Len=0"
"664","31.271799","2a03:2880:f258:c8:face:b00c:0:167","2a00:a041:3b1d:ce00:a1e5:af73:6ded:393e","TCP","1466","443  >  63153 [ACK] Seq=6582 Ack=3678 Win=1207 Len=1392 [TCP segment of a reassembled PDU]"
"665","31.271799","2a03:2880:f258:c8:face:b00c:0:167","2a00:a041:3b1d:ce00:a1e5:af73:6ded:393e","TLSv1.2","195","Application Data"
"666","31.271841","2a00:a041:3b1d:ce00:a1e5:af73:6ded:393e","2a03:2880:f258:c8:face:b00c:0:167","TCP","74","63153  >  443 [ACK] Seq=3678 Ack=8095 Win=1027 Len=0"
"667","31.274833","2a03:2880:f258:c8:face:b00c:0:167","2a00:a041:3b1d:ce00:a1e5:af73:6ded:393e","TCP","1466","443  >  63153 [ACK] Seq=8095 Ack=3678 Win=1207 Len=1392 [TCP segment of a reassembled PDU]"
"668","31.275512","2a03:2880:f258:c8:face:b00c:0:167","2a00:a041:3b1d:ce00:a1e5:af73:6ded:393e","TLSv1.2","1466","Application Data"
"669","31.275522","2a00:a041:3b1d:ce00:a1e5:af73:6ded:393e","2a03:2880:f258:c8:face:b00c:0:167","TCP","74","63153  >  443 [ACK] Seq=3678 Ack=10879 Win=1027 Len=0"
"670","31.276261","2a03:2880:f258:c8:face:b00c:0:167","2a00:a041:3b1d:ce00:a1e5:af73:6ded:393e","TLSv1.2","648","Application Data"
"671","31.323075","2a00:a041:3b1d:ce00:a1e5:af73:6ded:393e","2a03:2880:f258:c8:face:b00c:0:167","TCP","74","63153  >  443 [ACK] Seq=3678 Ack=11453 Win=1025 Len=0"
"672","31.358833","2a00:a041:3b1d:ce00:a1e5:af73:6ded:393e","2a03:2880:f258:c8:face:b00c:0:167","TLSv1.2","168","Application Data"
"673","31.384382","2a00:a041:3b1d:ce00:a1e5:af73:6ded:393e","2a03:2880:f258:c8:face:b00c:0:167","TLSv1.2","180","Application Data"
"674","31.437868","2a03:2880:f258:c8:face:b00c:0:167","2a00:a041:3b1d:ce00:a1e5:af73:6ded:393e","TCP","74","443  >  63153 [ACK] Seq=11453 Ack=3772 Win=1207 Len=0"
"675","31.463659","2a03:2880:f258:c8:face:b00c:0:167","2a00:a041:3b1d:ce00:a1e5:af73:6ded:393e","TCP","74","443  >  63153 [ACK] Seq=11453 Ack=3878 Win=1207 Len=0"
"676","31.557807","2a03:2880:f258:c8:face:b00c:0:167","2a00:a041:3b1d:ce00:a1e5:af73:6ded:393e","TLSv1.2","167","Application Data"
"677","31.603245","2a00:a041:3b1d:ce00:a1e5:af73:6ded:393e","2a03:2880:f258:c8:face:b00c:0:167","TCP","74","63153  >  443 [ACK] Seq=3878 Ack=11546 Win=1025 Len=0"
"731","41.482857","2a03:2880:f258:c8:face:b00c:0:167","2a00:a041:3b1d:ce00:a1e5:af73:6ded:393e","TCP","74","[TCP ACKed unseen segment] 443  >  63153 [ACK] Seq=11546 Ack=6662 Win=1229 Len=0"
"732","41.482857","2a03:2880:f258:c8:face:b00c:0:167","2a00:a041:3b1d:ce00:a1e5:af73:6ded:393e","TCP","74","443  >  63153 [ACK] Seq=11546 Ack=6790 Win=1229 Len=0"
"733","41.619727","2a03:2880:f258:c8:face:b00c:0:167","2a00:a041:3b1d:ce00:a1e5:af73:6ded:393e","TLSv1.2","188","Application Data"
"734","41.669918","2a00:a041:3b1d:ce00:a1e5:af73:6ded:393e","2a03:2880:f258:c8:face:b00c:0:167","TCP","74","[TCP Previous segment not captured] 63153  >  443 [ACK] Seq=6790 Ack=11660 Win=1024 Len=0"
"735","41.972086","2a03:2880:f258:c8:face:b00c:0:167","2a00:a041:3b1d:ce00:a1e5:af73:6ded:393e","TLSv1.2","172","[TCP ACKed unseen segment] , Application Data"
"736","41.974181","2a00:a041:3b1d:ce00:a1e5:af73:6ded:393e","2a03:2880:f258:c8:face:b00c:0:167","TLSv1.2","170","Application Data"
"737","42.005909","2a03:2880:f258:c8:face:b00c:0:167","2a00:a041:3b1d:ce00:a1e5:af73:6ded:393e","TLSv1.2","174","Application Data"
"738","42.011683","2a00:a041:3b1d:ce00:a1e5:af73:6ded:393e","2a03:2880:f258:c8:face:b00c:0:167","TLSv1.2","172","Application Data"
"739","42.052855","2a03:2880:f258:c8:face:b00c:0:167","2a00:a041:3b1d:ce00:a1e5:af73:6ded:393e","TCP","74","443  >  63153 [ACK] Seq=11858 Ack=6886 Win=1229 Len=0"
"741","42.090569","2a03:2880:f258:c8:face:b00c:0:167","2a00:a041:3b1d:ce00:a1e5:af73:6ded:393e","TCP","74","443  >  63153 [ACK] Seq=11858 Ack=6984 Win=1229 Len=0"
"743","42.484348","2a03:2880:f258:c8:face:b00c:0:167","2a00:a041:3b1d:ce00:a1e5:af73:6ded:393e","TLSv1.2","171","Application Data"
"744","42.486532","2a00:a041:3b1d:ce00:a1e5:af73:6ded:393e","2a03:2880:f258:c8:face:b00c:0:167","TLSv1.2","170","Application Data"
"745","42.565162","2a03:2880:f258:c8:face:b00c:0:167","2a00:a041:3b1d:ce00:a1e5:af73:6ded:393e","TCP","74","443  >  63153 [ACK] Seq=11955 Ack=7080 Win=1229 Len=0"
"829","47.906879","2a03:2880:f258:c8:face:b00c:0:167","2a00:a041:3b1d:ce00:a1e5:af73:6ded:393e","TLSv1.2","174","Application Data"
"830","47.908585","2a00:a041:3b1d:ce00:a1e5:af73:6ded:393e","2a03:2880:f258:c8:face:b00c:0:167","TLSv1.2","173","Application Data"
"831","47.956808","2a03:2880:f258:c8:face:b00c:0:167","2a00:a041:3b1d:ce00:a1e5:af73:6ded:393e","TLSv1.2","174","Application Data"
"832","47.958524","2a00:a041:3b1d:ce00:a1e5:af73:6ded:393e","2a03:2880:f258:c8:face:b00c:0:167","TLSv1.2","173","Application Data"
"833","47.986865","2a03:2880:f258:c8:face:b00c:0:167","2a00:a041:3b1d:ce00:a1e5:af73:6ded:393e","TCP","74","443  >  63153 [ACK] Seq=12155 Ack=7179 Win=1229 Len=0"
"864","48.036787","2a03:2880:f258:c8:face:b00c:0:167","2a00:a041:3b1d:ce00:a1e5:af73:6ded:393e","TCP","74","443  >  63153 [ACK] Seq=12155 Ack=7278 Win=1229 Len=0"
"904","50.898550","2a03:2880:f258:c8:face:b00c:0:167","2a00:a041:3b1d:ce00:a1e5:af73:6ded:393e","TLSv1.2","151","Application Data"
"905","50.952631","2a00:a041:3b1d:ce00:a1e5:af73:6ded:393e","2a03:2880:f258:c8:face:b00c:0:167","TCP","74","63153  >  443 [ACK] Seq=7278 Ack=12232 Win=1022 Len=0"
"907","51.444738","2a03:2880:f258:c8:face:b00c:0:167","2a00:a041:3b1d:ce00:a1e5:af73:6ded:393e","TCP","1466","443  >  63153 [ACK] Seq=12232 Ack=7278 Win=1229 Len=1392 [TCP segment of a reassembled PDU]"
"908","51.444738","2a03:2880:f258:c8:face:b00c:0:167","2a00:a041:3b1d:ce00:a1e5:af73:6ded:393e","TLSv1.2","195","Application Data"
"909","51.444762","2a00:a041:3b1d:ce00:a1e5:af73:6ded:393e","2a03:2880:f258:c8:face:b00c:0:167","TCP","74","63153  >  443 [ACK] Seq=7278 Ack=13745 Win=1027 Len=0"
"910","51.449363","2a03:2880:f258:c8:face:b00c:0:167","2a00:a041:3b1d:ce00:a1e5:af73:6ded:393e","TCP","1466","443  >  63153 [ACK] Seq=13745 Ack=7278 Win=1229 Len=1392 [TCP segment of a reassembled PDU]"
"911","51.449363","2a03:2880:f258:c8:face:b00c:0:167","2a00:a041:3b1d:ce00:a1e5:af73:6ded:393e","TLSv1.2","1466","Application Data"
"912","51.449374","2a00:a041:3b1d:ce00:a1e5:af73:6ded:393e","2a03:2880:f258:c8:face:b00c:0:167","TCP","74","63153  >  443 [ACK] Seq=7278 Ack=16529 Win=1027 Len=0"
"913","51.450145","2a03:2880:f258:c8:face:b00c:0:167","2a00:a041:3b1d:ce00:a1e5:af73:6ded:393e","TLSv1.2","632","Application Data"
"914","51.493622","2a00:a041:3b1d:ce00:a1e5:af73:6ded:393e","2a03:2880:f258:c8:face:b00c:0:167","TCP","74","63153  >  443 [ACK] Seq=7278 Ack=17087 Win=1025 Len=0"
"915","51.558412","2a00:a041:3b1d:ce00:a1e5:af73:6ded:393e","2a03:2880:f258:c8:face:b00c:0:167","TLSv1.2","168","Application Data"
"916","51.613650","2a00:a041:3b1d:ce00:a1e5:af73:6ded:393e","2a03:2880:f258:c8:face:b00c:0:167","TLSv1.2","180","Application Data"
"917","51.638346","2a03:2880:f258:c8:face:b00c:0:167","2a00:a041:3b1d:ce00:a1e5:af73:6ded:393e","TCP","74","443  >  63153 [ACK] Seq=17087 Ack=7372 Win=1229 Len=0"
"918","51.693164","2a03:2880:f258:c8:face:b00c:0:167","2a00:a041:3b1d:ce00:a1e5:af73:6ded:393e","TCP","74","443  >  63153 [ACK] Seq=17087 Ack=7478 Win=1229 Len=0"
"919","51.787736","2a03:2880:f258:c8:face:b00c:0:167","2a00:a041:3b1d:ce00:a1e5:af73:6ded:393e","TLSv1.2","167","Application Data"
"921","51.839537","2a00:a041:3b1d:ce00:a1e5:af73:6ded:393e","2a03:2880:f258:c8:face:b00c:0:167","TCP","74","63153  >  443 [ACK] Seq=7478 Ack=17180 Win=1025 Len=0"
"928","52.270931","2a03:2880:f258:c8:face:b00c:0:167","2a00:a041:3b1d:ce00:a1e5:af73:6ded:393e","TCP","1466","443  >  63153 [ACK] Seq=17180 Ack=7478 Win=1229 Len=1392 [TCP segment of a reassembled PDU]"
"929","52.270931","2a03:2880:f258:c8:face:b00c:0:167","2a00:a041:3b1d:ce00:a1e5:af73:6ded:393e","TLSv1.2","195","Application Data"
"930","52.270952","2a00:a041:3b1d:ce00:a1e5:af73:6ded:393e","2a03:2880:f258:c8:face:b00c:0:167","TCP","74","63153  >  443 [ACK] Seq=7478 Ack=18693 Win=1027 Len=0"
"931","52.275401","2a03:2880:f258:c8:face:b00c:0:167","2a00:a041:3b1d:ce00:a1e5:af73:6ded:393e","TCP","1466","443  >  63153 [ACK] Seq=18693 Ack=7478 Win=1229 Len=1392 [TCP segment of a reassembled PDU]"
"932","52.275426","2a03:2880:f258:c8:face:b00c:0:167","2a00:a041:3b1d:ce00:a1e5:af73:6ded:393e","TLSv1.2","1466","Application Data"
"933","52.275435","2a00:a041:3b1d:ce00:a1e5:af73:6ded:393e","2a03:2880:f258:c8:face:b00c:0:167","TCP","74","63153  >  443 [ACK] Seq=7478 Ack=21477 Win=1027 Len=0"
"934","52.276258","2a03:2880:f258:c8:face:b00c:0:167","2a00:a041:3b1d:ce00:a1e5:af73:6ded:393e","TLSv1.2","632","Application Data"
"937","52.321249","2a00:a041:3b1d:ce00:a1e5:af73:6ded:393e","2a03:2880:f258:c8:face:b00c:0:167","TCP","74","63153  >  443 [ACK] Seq=7478 Ack=22035 Win=1025 Len=0"
"938","52.344095","2a00:a041:3b1d:ce00:a1e5:af73:6ded:393e","2a03:2880:f258:c8:face:b00c:0:167","TLSv1.2","168","Application Data"
"939","52.363234","2a00:a041:3b1d:ce00:a1e5:af73:6ded:393e","2a03:2880:f258:c8:face:b00c:0:167","TLSv1.2","180","Application Data"
"940","52.423083","2a03:2880:f258:c8:face:b00c:0:167","2a00:a041:3b1d:ce00:a1e5:af73:6ded:393e","TCP","74","443  >  63153 [ACK] Seq=22035 Ack=7572 Win=1229 Len=0"
"943","52.442405","2a03:2880:f258:c8:face:b00c:0:167","2a00:a041:3b1d:ce00:a1e5:af73:6ded:393e","TCP","74","443  >  63153 [ACK] Seq=22035 Ack=7678 Win=1229 Len=0"
"946","52.542366","2a03:2880:f258:c8:face:b00c:0:167","2a00:a041:3b1d:ce00:a1e5:af73:6ded:393e","TLSv1.2","167","Application Data"
"948","52.585870","2a00:a041:3b1d:ce00:a1e5:af73:6ded:393e","2a03:2880:f258:c8:face:b00c:0:167","TCP","74","63153  >  443 [ACK] Seq=7678 Ack=22128 Win=1025 Len=0"
"987","55.247126","2a03:2880:f258:c8:face:b00c:0:167","2a00:a041:3b1d:ce00:a1e5:af73:6ded:393e","TLSv1.2","151","Application Data"
"988","55.293583","2a00:a041:3b1d:ce00:a1e5:af73:6ded:393e","2a03:2880:f258:c8:face:b00c:0:167","TCP","74","63153  >  443 [ACK] Seq=7678 Ack=22205 Win=1024 Len=0"
"1048","61.069093","2a03:2880:f258:c8:face:b00c:0:167","2a00:a041:3b1d:ce00:a1e5:af73:6ded:393e","TCP","74","[TCP ACKed unseen segment] 443  >  63153 [ACK] Seq=22205 Ack=10462 Win=1250 Len=0"
"1049","61.069093","2a03:2880:f258:c8:face:b00c:0:167","2a00:a041:3b1d:ce00:a1e5:af73:6ded:393e","TCP","74","443  >  63153 [ACK] Seq=22205 Ack=10590 Win=1250 Len=0"
"1050","61.249655","2a03:2880:f258:c8:face:b00c:0:167","2a00:a041:3b1d:ce00:a1e5:af73:6ded:393e","TLSv1.2","188","Application Data"
"1051","61.297482","2a00:a041:3b1d:ce00:a1e5:af73:6ded:393e","2a03:2880:f258:c8:face:b00c:0:167","TCP","74","[TCP Previous segment not captured] 63153  >  443 [ACK] Seq=10590 Ack=22319 Win=1024 Len=0"
"1053","61.513489","2a03:2880:f258:c8:face:b00c:0:167","2a00:a041:3b1d:ce00:a1e5:af73:6ded:393e","TLSv1.2","172","[TCP ACKed unseen segment] , Application Data"
"1054","61.548130","2a03:2880:f258:c8:face:b00c:0:167","2a00:a041:3b1d:ce00:a1e5:af73:6ded:393e","TLSv1.2","174","Application Data"
"1055","61.548153","2a00:a041:3b1d:ce00:a1e5:af73:6ded:393e","2a03:2880:f258:c8:face:b00c:0:167","TCP","74","[TCP Previous segment not captured] 63153  >  443 [ACK] Seq=13502 Ack=22517 Win=1023 Len=0"
"1056","61.553802","2a03:2880:f258:c8:face:b00c:0:167","2a00:a041:3b1d:ce00:a1e5:af73:6ded:393e","TCP","74","[TCP ACKed unseen segment] 443  >  63153 [ACK] Seq=22517 Ack=13374 Win=1272 Len=0"
"1057","61.553802","2a03:2880:f258:c8:face:b00c:0:167","2a00:a041:3b1d:ce00:a1e5:af73:6ded:393e","TCP","74","443  >  63153 [ACK] Seq=22517 Ack=13502 Win=1272 Len=0"
"1066","61.650347","2a03:2880:f258:c8:face:b00c:0:167","2a00:a041:3b1d:ce00:a1e5:af73:6ded:393e","TCP","74","[TCP ACKed unseen segment] 443  >  63153 [ACK] Seq=22517 Ack=16286 Win=1294 Len=0"
"1067","61.650347","2a03:2880:f258:c8:face:b00c:0:167","2a00:a041:3b1d:ce00:a1e5:af73:6ded:393e","TCP","74","443  >  63153 [ACK] Seq=22517 Ack=16726 Win=1305 Len=0"
"1078","61.695792","2a03:2880:f258:c8:face:b00c:0:167","2a00:a041:3b1d:ce00:a1e5:af73:6ded:393e","TLSv1.2","188","Application Data"
"1080","61.709860","2a00:a041:3b1d:ce00:a1e5:af73:6ded:393e","2a03:2880:f258:c8:face:b00c:0:167","TLSv1.2","170","[TCP Previous segment not captured] , Application Data"
"1081","61.709948","2a00:a041:3b1d:ce00:a1e5:af73:6ded:393e","2a03:2880:f258:c8:face:b00c:0:167","TLSv1.2","172","Application Data"
"1095","61.745777","2a03:2880:f258:c8:face:b00c:0:167","2a00:a041:3b1d:ce00:a1e5:af73:6ded:393e","TLSv1.2","137","[TCP ACKed unseen segment] , Application Data"
"1100","61.788003","2a03:2880:f258:c8:face:b00c:0:167","2a00:a041:3b1d:ce00:a1e5:af73:6ded:393e","TCP","74","443  >  63153 [ACK] Seq=22694 Ack=16822 Win=1305 Len=0"
"1101","61.788212","2a00:a041:3b1d:ce00:a1e5:af73:6ded:393e","2a03:2880:f258:c8:face:b00c:0:167","TCP","86","64030  >  443 [SYN] Seq=0 Win=64800 Len=0 MSS=1440 WS=256 SACK_PERM"
"1102","61.789681","2a03:2880:f258:c8:face:b00c:0:167","2a00:a041:3b1d:ce00:a1e5:af73:6ded:393e","TCP","74","443  >  63153 [ACK] Seq=22694 Ack=16920 Win=1305 Len=0"
"1103","61.794742","2a00:a041:3b1d:ce00:a1e5:af73:6ded:393e","2a03:2880:f258:c8:face:b00c:0:167","TCP","74","63153  >  443 [ACK] Seq=16920 Ack=22694 Win=1022 Len=0"
"1110","61.873074","2a03:2880:f258:c8:face:b00c:0:167","2a00:a041:3b1d:ce00:a1e5:af73:6ded:393e","TCP","86","443  >  64030 [SYN, ACK] Seq=0 Ack=1 Win=65535 Len=0 MSS=1392 SACK_PERM WS=256"
"1111","61.873129","2a00:a041:3b1d:ce00:a1e5:af73:6ded:393e","2a03:2880:f258:c8:face:b00c:0:167","TCP","74","64030  >  443 [ACK] Seq=1 Ack=1 Win=262912 Len=0"
"1113","61.881407","2a00:a041:3b1d:ce00:a1e5:af73:6ded:393e","2a03:2880:f258:c8:face:b00c:0:167","TLSv1.3","591","Client Hello"
"1123","61.929564","2a00:a041:3b1d:ce00:a1e5:af73:6ded:393e","2a03:2880:f258:c8:face:b00c:0:167","TCP","86","64031  >  443 [SYN] Seq=0 Win=64800 Len=0 MSS=1440 WS=256 SACK_PERM"
"1124","61.929711","2a00:a041:3b1d:ce00:a1e5:af73:6ded:393e","2a03:2880:f258:c8:face:b00c:0:167","TCP","86","64032  >  443 [SYN] Seq=0 Win=64800 Len=0 MSS=1440 WS=256 SACK_PERM"
"1127","61.955683","2a03:2880:f258:c8:face:b00c:0:167","2a00:a041:3b1d:ce00:a1e5:af73:6ded:393e","TLSv1.2","172","Application Data"
"1128","61.956467","2a03:2880:f258:c8:face:b00c:0:167","2a00:a041:3b1d:ce00:a1e5:af73:6ded:393e","TCP","74","443  >  64030 [ACK] Seq=1 Ack=518 Win=66816 Len=0"
"1129","61.956467","2a03:2880:f258:c8:face:b00c:0:167","2a00:a041:3b1d:ce00:a1e5:af73:6ded:393e","TLSv1.3","286","Server Hello, Change Cipher Spec, Application Data"
"1130","61.956810","2a00:a041:3b1d:ce00:a1e5:af73:6ded:393e","2a03:2880:f258:c8:face:b00c:0:167","TLSv1.3","138","Change Cipher Spec, Application Data"
"1131","61.957053","2a00:a041:3b1d:ce00:a1e5:af73:6ded:393e","2a03:2880:f258:c8:face:b00c:0:167","TLSv1.3","172","Application Data"
"1132","61.957547","2a00:a041:3b1d:ce00:a1e5:af73:6ded:393e","2a03:2880:f258:c8:face:b00c:0:167","TLSv1.3","567","Application Data"
"1133","61.957647","2a00:a041:3b1d:ce00:a1e5:af73:6ded:393e","2a03:2880:f258:c8:face:b00c:0:167","TLSv1.3","1050","Application Data"
"1134","61.957762","2a00:a041:3b1d:ce00:a1e5:af73:6ded:393e","2a03:2880:f258:c8:face:b00c:0:167","TLSv1.3","196","Application Data"
"1135","61.957823","2a00:a041:3b1d:ce00:a1e5:af73:6ded:393e","2a03:2880:f258:c8:face:b00c:0:167","TLSv1.3","1050","Application Data"
"1136","61.958549","2a00:a041:3b1d:ce00:a1e5:af73:6ded:393e","2a03:2880:f258:c8:face:b00c:0:167","TLSv1.2","170","Application Data"
"1137","61.981970","2a03:2880:f258:c8:face:b00c:0:167","2a00:a041:3b1d:ce00:a1e5:af73:6ded:393e","TLSv1.2","174","Application Data"
"1138","61.981993","2a00:a041:3b1d:ce00:a1e5:af73:6ded:393e","2a03:2880:f258:c8:face:b00c:0:167","TCP","74","63153  >  443 [ACK] Seq=17016 Ack=22892 Win=1027 Len=0"
"1139","61.986066","2a00:a041:3b1d:ce00:a1e5:af73:6ded:393e","2a03:2880:f258:c8:face:b00c:0:167","TLSv1.2","172","Application Data"
"1140","62.007298","2a03:2880:f258:c8:face:b00c:0:167","2a00:a041:3b1d:ce00:a1e5:af73:6ded:393e","TCP","86","443  >  64031 [SYN, ACK] Seq=0 Ack=1 Win=65535 Len=0 MSS=1392 SACK_PERM WS=256"
"1141","62.008143","2a03:2880:f258:c8:face:b00c:0:167","2a00:a041:3b1d:ce00:a1e5:af73:6ded:393e","TCP","86","443  >  64032 [SYN, ACK] Seq=0 Ack=1 Win=65535 Len=0 MSS=1392 SACK_PERM WS=256"
"1142","62.008175","2a00:a041:3b1d:ce00:a1e5:af73:6ded:393e","2a03:2880:f258:c8:face:b00c:0:167","TCP","74","64032  >  443 [ACK] Seq=1 Ack=1 Win=262912 Len=0"
"1143","62.008610","2a00:a041:3b1d:ce00:a1e5:af73:6ded:393e","2a03:2880:f258:c8:face:b00c:0:167","TLSv1.3","591","Client Hello"
"1144","62.036626","2a03:2880:f258:c8:face:b00c:0:167","2a00:a041:3b1d:ce00:a1e5:af73:6ded:393e","TCP","74","443  >  64030 [ACK] Seq=213 Ack=1173 Win=67840 Len=0"
"1145","62.036626","2a03:2880:f258:c8:face:b00c:0:167","2a00:a041:3b1d:ce00:a1e5:af73:6ded:393e","TCP","74","443  >  64030 [ACK] Seq=213 Ack=2271 Win=69632 Len=0"
"1146","62.036626","2a03:2880:f258:c8:face:b00c:0:167","2a00:a041:3b1d:ce00:a1e5:af73:6ded:393e","TLSv1.3","245","Application Data"
"1147","62.037331","2a03:2880:f258:c8:face:b00c:0:167","2a00:a041:3b1d:ce00:a1e5:af73:6ded:393e","TLSv1.3","148","Application Data"
"1148","62.037331","2a03:2880:f258:c8:face:b00c:0:167","2a00:a041:3b1d:ce00:a1e5:af73:6ded:393e","TLSv1.3","131","Application Data"
"1149","62.037364","2a00:a041:3b1d:ce00:a1e5:af73:6ded:393e","2a03:2880:f258:c8:face:b00c:0:167","TCP","74","64030  >  443 [ACK] Seq=3247 Ack=515 Win=262400 Len=0"
"1150","62.037565","2a00:a041:3b1d:ce00:a1e5:af73:6ded:393e","2a03:2880:f258:c8:face:b00c:0:167","TLSv1.3","105","Application Data"
"1151","62.041157","2a03:2880:f258:c8:face:b00c:0:167","2a00:a041:3b1d:ce00:a1e5:af73:6ded:393e","TCP","74","443  >  63153 [ACK] Seq=22892 Ack=17016 Win=1305 Len=0"
"1152","62.061198","2a03:2880:f258:c8:face:b00c:0:167","2a00:a041:3b1d:ce00:a1e5:af73:6ded:393e","TLSv1.3","562","Application Data"
"1153","62.062118","2a03:2880:f258:c8:face:b00c:0:167","2a00:a041:3b1d:ce00:a1e5:af73:6ded:393e","TLSv1.3","276","Application Data"
"1154","62.062141","2a00:a041:3b1d:ce00:a1e5:af73:6ded:393e","2a03:2880:f258:c8:face:b00c:0:167","TCP","74","64030  >  443 [ACK] Seq=3278 Ack=1205 Win=261632 Len=0"
"1155","62.065701","2a03:2880:f258:c8:face:b00c:0:167","2a00:a041:3b1d:ce00:a1e5:af73:6ded:393e","TCP","74","443  >  63153 [ACK] Seq=22892 Ack=17114 Win=1305 Len=0"
"1156","62.065701","2a03:2880:f258:c8:face:b00c:0:167","2a00:a041:3b1d:ce00:a1e5:af73:6ded:393e","TCP","74","[TCP Dup ACK 1155#1] 443  >  63153 [ACK] Seq=22892 Ack=17114 Win=1305 Len=0"
"1159","62.087273","2a03:2880:f258:c8:face:b00c:0:167","2a00:a041:3b1d:ce00:a1e5:af73:6ded:393e","TCP","74","443  >  64032 [ACK] Seq=1 Ack=518 Win=66816 Len=0"
"1160","62.087273","2a03:2880:f258:c8:face:b00c:0:167","2a00:a041:3b1d:ce00:a1e5:af73:6ded:393e","TLSv1.3","1466","Server Hello, Change Cipher Spec, Application Data"
"1161","62.087273","2a03:2880:f258:c8:face:b00c:0:167","2a00:a041:3b1d:ce00:a1e5:af73:6ded:393e","TLSv1.3","1083","Application Data"
"1162","62.087311","2a00:a041:3b1d:ce00:a1e5:af73:6ded:393e","2a03:2880:f258:c8:face:b00c:0:167","TCP","74","64032  >  443 [ACK] Seq=518 Ack=2402 Win=262912 Len=0"
"1163","62.088026","2a00:a041:3b1d:ce00:a1e5:af73:6ded:393e","2a03:2880:f258:c8:face:b00c:0:167","TLSv1.3","138","Change Cipher Spec, Application Data"
"1165","62.136598","2a03:2880:f258:c8:face:b00c:0:167","2a00:a041:3b1d:ce00:a1e5:af73:6ded:393e","TLSv1.2","171","Application Data"
"1167","62.151190","2a03:2880:f258:c8:face:b00c:0:167","2a00:a041:3b1d:ce00:a1e5:af73:6ded:393e","TLSv1.2","171","Application Data"
"1168","62.152717","2a03:2880:f258:c8:face:b00c:0:167","2a00:a041:3b1d:ce00:a1e5:af73:6ded:393e","TCP","74","443  >  64030 [ACK] Seq=1205 Ack=3278 Win=71680 Len=0"
"1169","62.164412","2a03:2880:f258:c8:face:b00c:0:167","2a00:a041:3b1d:ce00:a1e5:af73:6ded:393e","TLSv1.3","245","Application Data"
"1170","62.164412","2a03:2880:f258:c8:face:b00c:0:167","2a00:a041:3b1d:ce00:a1e5:af73:6ded:393e","TLSv1.3","148","Application Data"
"1171","62.164439","2a00:a041:3b1d:ce00:a1e5:af73:6ded:393e","2a03:2880:f258:c8:face:b00c:0:167","TCP","74","64032  >  443 [ACK] Seq=582 Ack=2647 Win=262656 Len=0"
"1172","62.201369","2a00:a041:3b1d:ce00:a1e5:af73:6ded:393e","2a03:2880:f258:c8:face:b00c:0:167","TCP","74","[TCP Previous segment not captured] 63153  >  443 [ACK] Seq=20026 Ack=23086 Win=1026 Len=0"
"1173","62.228153","2a03:2880:f258:c8:face:b00c:0:167","2a00:a041:3b1d:ce00:a1e5:af73:6ded:393e","TCP","74","[TCP ACKed unseen segment] 443  >  63153 [ACK] Seq=23086 Ack=19898 Win=1326 Len=0"
"1174","62.228153","2a03:2880:f258:c8:face:b00c:0:167","2a00:a041:3b1d:ce00:a1e5:af73:6ded:393e","TCP","74","443  >  63153 [ACK] Seq=23086 Ack=20026 Win=1326 Len=0"
"1175","62.386913","2a03:2880:f258:c8:face:b00c:0:167","2a00:a041:3b1d:ce00:a1e5:af73:6ded:393e","TLSv1.2","188","Application Data"
"1176","62.432433","2a00:a041:3b1d:ce00:a1e5:af73:6ded:393e","2a03:2880:f258:c8:face:b00c:0:167","TCP","74","63153  >  443 [ACK] Seq=20026 Ack=23200 Win=1026 Len=0"
"1177","62.479277","2a00:a041:3b1d:ce00:a1e5:af73:6ded:393e","2a03:2880:f258:c8:face:b00c:0:167","TLSv1.2","170","Application Data"
"1178","62.479354","2a00:a041:3b1d:ce00:a1e5:af73:6ded:393e","2a03:2880:f258:c8:face:b00c:0:167","TLSv1.2","170","Application Data"
"1179","62.558834","2a03:2880:f258:c8:face:b00c:0:167","2a00:a041:3b1d:ce00:a1e5:af73:6ded:393e","TCP","74","443  >  63153 [ACK] Seq=23200 Ack=20122 Win=1326 Len=0"
"1180","62.558834","2a03:2880:f258:c8:face:b00c:0:167","2a00:a041:3b1d:ce00:a1e5:af73:6ded:393e","TCP","74","443  >  63153 [ACK] Seq=23200 Ack=20218 Win=1326 Len=0"
"1182","62.773535","2a03:2880:f258:c8:face:b00c:0:167","2a00:a041:3b1d:ce00:a1e5:af73:6ded:393e","TLSv1.2","172","Application Data"
"1183","62.777916","2a00:a041:3b1d:ce00:a1e5:af73:6ded:393e","2a03:2880:f258:c8:face:b00c:0:167","TLSv1.2","170","Application Data"
"1184","62.817358","2a03:2880:f258:c8:face:b00c:0:167","2a00:a041:3b1d:ce00:a1e5:af73:6ded:393e","TLSv1.2","174","Application Data"
"1185","62.821434","2a00:a041:3b1d:ce00:a1e5:af73:6ded:393e","2a03:2880:f258:c8:face:b00c:0:167","TLSv1.2","172","Application Data"
"1186","62.857482","2a03:2880:f258:c8:face:b00c:0:167","2a00:a041:3b1d:ce00:a1e5:af73:6ded:393e","TCP","74","443  >  63153 [ACK] Seq=23398 Ack=20314 Win=1326 Len=0"
"1187","62.900414","2a03:2880:f258:c8:face:b00c:0:167","2a00:a041:3b1d:ce00:a1e5:af73:6ded:393e","TCP","74","443  >  63153 [ACK] Seq=23398 Ack=20412 Win=1326 Len=0"
"1188","63.039970","2a03:2880:f258:c8:face:b00c:0:167","2a00:a041:3b1d:ce00:a1e5:af73:6ded:393e","TCP","86","[TCP Retransmission] 443  >  64031 [SYN, ACK] Seq=0 Ack=1 Win=65535 Len=0 MSS=1392 SACK_PERM WS=256"
"1190","63.312709","2a03:2880:f258:c8:face:b00c:0:167","2a00:a041:3b1d:ce00:a1e5:af73:6ded:393e","TLSv1.2","171","Application Data"
"1191","63.335849","2a03:2880:f258:c8:face:b00c:0:167","2a00:a041:3b1d:ce00:a1e5:af73:6ded:393e","TCP","74","[TCP ACKed unseen segment] 443  >  63153 [ACK] Seq=23495 Ack=23196 Win=1348 Len=0"
"1192","63.335849","2a03:2880:f258:c8:face:b00c:0:167","2a00:a041:3b1d:ce00:a1e5:af73:6ded:393e","TCP","74","443  >  63153 [ACK] Seq=23495 Ack=23324 Win=1348 Len=0"
"1193","63.354059","2a00:a041:3b1d:ce00:a1e5:af73:6ded:393e","2a03:2880:f258:c8:face:b00c:0:167","TCP","74","[TCP Previous segment not captured] 63153  >  443 [ACK] Seq=23324 Ack=23495 Win=1025 Len=0"
"1194","63.488189","2a03:2880:f258:c8:face:b00c:0:167","2a00:a041:3b1d:ce00:a1e5:af73:6ded:393e","TLSv1.2","188","[TCP ACKed unseen segment] , Application Data"
"1196","63.601266","2a03:2880:f258:c8:face:b00c:0:167","2a00:a041:3b1d:ce00:a1e5:af73:6ded:393e","TCP","74","[TCP ACKed unseen segment] 443  >  63153 [ACK] Seq=23609 Ack=24716 Win=1359 Len=0"
"1197","63.601988","2a03:2880:f258:c8:face:b00c:0:167","2a00:a041:3b1d:ce00:a1e5:af73:6ded:393e","TCP","74","443  >  63153 [ACK] Seq=23609 Ack=26108 Win=1370 Len=0"
"1198","63.601988","2a03:2880:f258:c8:face:b00c:0:167","2a00:a041:3b1d:ce00:a1e5:af73:6ded:393e","TCP","74","443  >  63153 [ACK] Seq=23609 Ack=26236 Win=1370 Len=0"
"1199","63.755009","2a03:2880:f258:c8:face:b00c:0:167","2a00:a041:3b1d:ce00:a1e5:af73:6ded:393e","TLSv1.2","188","Application Data"
"1200","63.755009","2a03:2880:f258:c8:face:b00c:0:167","2a00:a041:3b1d:ce00:a1e5:af73:6ded:393e","TLSv1.2","172","Application Data"
"1201","63.755036","2a00:a041:3b1d:ce00:a1e5:af73:6ded:393e","2a03:2880:f258:c8:face:b00c:0:167","TCP","74","[TCP Previous segment not captured] 63153  >  443 [ACK] Seq=26236 Ack=23821 Win=1024 Len=0"
"1202","63.768245","2a00:a041:3b1d:ce00:a1e5:af73:6ded:393e","2a03:2880:f258:c8:face:b00c:0:167","TLSv1.2","170","Application Data"
"1203","63.768367","2a00:a041:3b1d:ce00:a1e5:af73:6ded:393e","2a03:2880:f258:c8:face:b00c:0:167","TLSv1.2","170","Application Data"
"1204","63.778115","2a03:2880:f258:c8:face:b00c:0:167","2a00:a041:3b1d:ce00:a1e5:af73:6ded:393e","TLSv1.2","174","[TCP ACKed unseen segment] , Application Data"
"1205","63.826599","2a00:a041:3b1d:ce00:a1e5:af73:6ded:393e","2a03:2880:f258:c8:face:b00c:0:167","TLSv1.2","172","Application Data"
"1206","63.847311","2a03:2880:f258:c8:face:b00c:0:167","2a00:a041:3b1d:ce00:a1e5:af73:6ded:393e","TCP","74","443  >  63153 [ACK] Seq=23921 Ack=26332 Win=1370 Len=0"
"1207","63.847311","2a03:2880:f258:c8:face:b00c:0:167","2a00:a041:3b1d:ce00:a1e5:af73:6ded:393e","TCP","74","443  >  63153 [ACK] Seq=23921 Ack=26428 Win=1370 Len=0"
"1208","63.905512","2a03:2880:f258:c8:face:b00c:0:167","2a00:a041:3b1d:ce00:a1e5:af73:6ded:393e","TCP","74","443  >  63153 [ACK] Seq=23921 Ack=26526 Win=1370 Len=0"
"1209","64.014278","2a03:2880:f258:c8:face:b00c:0:167","2a00:a041:3b1d:ce00:a1e5:af73:6ded:393e","TLSv1.2","172","Application Data"
"1210","64.016762","2a00:a041:3b1d:ce00:a1e5:af73:6ded:393e","2a03:2880:f258:c8:face:b00c:0:167","TLSv1.2","170","Application Data"
"1211","64.045768","2a03:2880:f258:c8:face:b00c:0:167","2a00:a041:3b1d:ce00:a1e5:af73:6ded:393e","TLSv1.2","174","Application Data"
"1212","64.051992","2a00:a041:3b1d:ce00:a1e5:af73:6ded:393e","2a03:2880:f258:c8:face:b00c:0:167","TLSv1.2","172","Application Data"
"1213","64.095186","2a03:2880:f258:c8:face:b00c:0:167","2a00:a041:3b1d:ce00:a1e5:af73:6ded:393e","TCP","74","443  >  63153 [ACK] Seq=24119 Ack=26622 Win=1370 Len=0"
"1214","64.130421","2a03:2880:f258:c8:face:b00c:0:167","2a00:a041:3b1d:ce00:a1e5:af73:6ded:393e","TCP","74","443  >  63153 [ACK] Seq=24119 Ack=26720 Win=1370 Len=0"
"1215","64.382052","2a03:2880:f258:c8:face:b00c:0:167","2a00:a041:3b1d:ce00:a1e5:af73:6ded:393e","TLSv1.2","171","Application Data"
"1216","64.387048","2a00:a041:3b1d:ce00:a1e5:af73:6ded:393e","2a03:2880:f258:c8:face:b00c:0:167","TLSv1.2","170","Application Data"
"1217","64.404541","2a03:2880:f258:c8:face:b00c:0:167","2a00:a041:3b1d:ce00:a1e5:af73:6ded:393e","TLSv1.2","171","Application Data"
"1218","64.404584","2a00:a041:3b1d:ce00:a1e5:af73:6ded:393e","2a03:2880:f258:c8:face:b00c:0:167","TCP","74","63153  >  443 [ACK] Seq=26816 Ack=24313 Win=1027 Len=0"
"1219","64.465811","2a03:2880:f258:c8:face:b00c:0:167","2a00:a041:3b1d:ce00:a1e5:af73:6ded:393e","TCP","74","443  >  63153 [ACK] Seq=24313 Ack=26816 Win=1370 Len=0"
"1221","64.555132","2a03:2880:f258:c8:face:b00c:0:167","2a00:a041:3b1d:ce00:a1e5:af73:6ded:393e","TCP","74","[TCP ACKed unseen segment] 443  >  63153 [ACK] Seq=24313 Ack=28208 Win=1381 Len=0"
"1222","64.555132","2a03:2880:f258:c8:face:b00c:0:167","2a00:a041:3b1d:ce00:a1e5:af73:6ded:393e","TCP","74","443  >  63153 [ACK] Seq=24313 Ack=29600 Win=1392 Len=0"
"1223","64.557376","2a03:2880:f258:c8:face:b00c:0:167","2a00:a041:3b1d:ce00:a1e5:af73:6ded:393e","TCP","74","443  >  63153 [ACK] Seq=24313 Ack=29728 Win=1392 Len=0"
"1224","64.709759","2a03:2880:f258:c8:face:b00c:0:167","2a00:a041:3b1d:ce00:a1e5:af73:6ded:393e","TLSv1.2","188","Application Data"
"1225","64.725637","2a00:a041:3b1d:ce00:a1e5:af73:6ded:393e","2a03:2880:f258:c8:face:b00c:0:167","TLSv1.2","170","[TCP Previous segment not captured] , Application Data"
"1226","64.810064","2a03:2880:f258:c8:face:b00c:0:167","2a00:a041:3b1d:ce00:a1e5:af73:6ded:393e","TCP","74","[TCP ACKed unseen segment] 443  >  63153 [ACK] Seq=24427 Ack=29824 Win=1392 Len=0"
"1228","64.959726","2a03:2880:f258:c8:face:b00c:0:167","2a00:a041:3b1d:ce00:a1e5:af73:6ded:393e","TCP","74","[TCP ACKed unseen segment] 443  >  63153 [ACK] Seq=24427 Ack=31216 Win=1403 Len=0"
"1229","64.959726","2a03:2880:f258:c8:face:b00c:0:167","2a00:a041:3b1d:ce00:a1e5:af73:6ded:393e","TCP","74","443  >  63153 [ACK] Seq=24427 Ack=32608 Win=1413 Len=0"
"1230","64.959726","2a03:2880:f258:c8:face:b00c:0:167","2a00:a041:3b1d:ce00:a1e5:af73:6ded:393e","TCP","74","443  >  63153 [ACK] Seq=24427 Ack=32736 Win=1413 Len=0"
"1231","64.975130","2a03:2880:f258:c8:face:b00c:0:167","2a00:a041:3b1d:ce00:a1e5:af73:6ded:393e","TLSv1.2","172","Application Data"
"1232","65.000449","2a03:2880:f258:c8:face:b00c:0:167","2a00:a041:3b1d:ce00:a1e5:af73:6ded:393e","TLSv1.2","174","Application Data"
"1233","65.000511","2a00:a041:3b1d:ce00:a1e5:af73:6ded:393e","2a03:2880:f258:c8:face:b00c:0:167","TCP","74","[TCP Previous segment not captured] 63153  >  443 [ACK] Seq=32736 Ack=24625 Win=1026 Len=0"
"1236","65.080515","2a03:2880:f258:c8:face:b00c:0:167","2a00:a041:3b1d:ce00:a1e5:af73:6ded:393e","TCP","86","[TCP Retransmission] 443  >  64031 [SYN, ACK] Seq=0 Ack=1 Win=65535 Len=0 MSS=1392 SACK_PERM WS=256"
"1237","65.088256","2a03:2880:f258:c8:face:b00c:0:167","2a00:a041:3b1d:ce00:a1e5:af73:6ded:393e","TLSv1.2","188","[TCP ACKed unseen segment] , Application Data"
"1240","65.103003","2a00:a041:3b1d:ce00:a1e5:af73:6ded:393e","2a03:2880:f258:c8:face:b00c:0:167","TLSv1.2","170","Application Data"
"1241","65.103058","2a00:a041:3b1d:ce00:a1e5:af73:6ded:393e","2a03:2880:f258:c8:face:b00c:0:167","TLSv1.2","172","Application Data"
"1244","65.183617","2a03:2880:f258:c8:face:b00c:0:167","2a00:a041:3b1d:ce00:a1e5:af73:6ded:393e","TCP","74","443  >  63153 [ACK] Seq=24739 Ack=32930 Win=1413 Len=0"
"1252","65.351320","2a03:2880:f258:c8:face:b00c:0:167","2a00:a041:3b1d:ce00:a1e5:af73:6ded:393e","TLSv1.2","172","Application Data"
"1253","65.354949","2a00:a041:3b1d:ce00:a1e5:af73:6ded:393e","2a03:2880:f258:c8:face:b00c:0:167","TLSv1.2","170","Application Data"
"1254","65.365843","2a03:2880:f258:c8:face:b00c:0:167","2a00:a041:3b1d:ce00:a1e5:af73:6ded:393e","TLSv1.2","174","Application Data"
"1255","65.374087","2a00:a041:3b1d:ce00:a1e5:af73:6ded:393e","2a03:2880:f258:c8:face:b00c:0:167","TLSv1.2","172","Application Data"
"1256","65.455139","2a03:2880:f258:c8:face:b00c:0:167","2a00:a041:3b1d:ce00:a1e5:af73:6ded:393e","TCP","74","443  >  63153 [ACK] Seq=24937 Ack=33124 Win=1413 Len=0"
"1257","65.572959","2a03:2880:f258:c8:face:b00c:0:167","2a00:a041:3b1d:ce00:a1e5:af73:6ded:393e","TLSv1.2","171","Application Data"
"1258","65.574753","2a00:a041:3b1d:ce00:a1e5:af73:6ded:393e","2a03:2880:f258:c8:face:b00c:0:167","TLSv1.2","170","Application Data"
"1259","65.607455","2a03:2880:f258:c8:face:b00c:0:167","2a00:a041:3b1d:ce00:a1e5:af73:6ded:393e","TLSv1.2","171","Application Data"
"1260","65.609296","2a00:a041:3b1d:ce00:a1e5:af73:6ded:393e","2a03:2880:f258:c8:face:b00c:0:167","TLSv1.2","170","Application Data"
"1266","65.688224","2a03:2880:f258:c8:face:b00c:0:167","2a00:a041:3b1d:ce00:a1e5:af73:6ded:393e","TCP","74","443  >  63153 [ACK] Seq=25131 Ack=33316 Win=1413 Len=0"
"1271","66.589749","2a03:2880:f258:c8:face:b00c:0:167","2a00:a041:3b1d:ce00:a1e5:af73:6ded:393e","TCP","74","[TCP ACKed unseen segment] 443  >  63153 [ACK] Seq=25131 Ack=36100 Win=1435 Len=0"
"1272","66.638985","2a03:2880:f258:c8:face:b00c:0:167","2a00:a041:3b1d:ce00:a1e5:af73:6ded:393e","TCP","74","443  >  63153 [ACK] Seq=25131 Ack=36228 Win=1435 Len=0"
"1273","66.750601","2a03:2880:f258:c8:face:b00c:0:167","2a00:a041:3b1d:ce00:a1e5:af73:6ded:393e","TLSv1.2","188","Application Data"
"1275","66.869061","2a03:2880:f258:c8:face:b00c:0:167","2a00:a041:3b1d:ce00:a1e5:af73:6ded:393e","TCP","74","443  >  63153 [ACK] Seq=25245 Ack=37620 Win=1446 Len=0"
"1276","66.870568","2a03:2880:f258:c8:face:b00c:0:167","2a00:a041:3b1d:ce00:a1e5:af73:6ded:393e","TCP","74","443  >  63153 [ACK] Seq=25245 Ack=39012 Win=1457 Len=0"
"1277","66.870568","2a03:2880:f258:c8:face:b00c:0:167","2a00:a041:3b1d:ce00:a1e5:af73:6ded:393e","TCP","74","443  >  63153 [ACK] Seq=25245 Ack=39140 Win=1457 Len=0"
"1278","66.999742","2a03:2880:f258:c8:face:b00c:0:167","2a00:a041:3b1d:ce00:a1e5:af73:6ded:393e","TLSv1.2","188","Application Data"
"1279","67.042707","2a00:a041:3b1d:ce00:a1e5:af73:6ded:393e","2a03:2880:f258:c8:face:b00c:0:167","TCP","74","[TCP Previous segment not captured] 63153  >  443 [ACK] Seq=39140 Ack=25359 Win=1023 Len=0"
"1280","67.057722","2a03:2880:f258:c8:face:b00c:0:167","2a00:a041:3b1d:ce00:a1e5:af73:6ded:393e","TLSv1.2","172","[TCP ACKed unseen segment] , Application Data"
"1281","67.066725","2a00:a041:3b1d:ce00:a1e5:af73:6ded:393e","2a03:2880:f258:c8:face:b00c:0:167","TLSv1.2","170","Application Data"
"1282","67.072186","2a03:2880:f258:c8:face:b00c:0:167","2a00:a041:3b1d:ce00:a1e5:af73:6ded:393e","TLSv1.2","174","Application Data"
"1283","67.085683","2a00:a041:3b1d:ce00:a1e5:af73:6ded:393e","2a03:2880:f258:c8:face:b00c:0:167","TLSv1.2","172","Application Data"
"1284","67.153668","2a03:2880:f258:c8:face:b00c:0:167","2a00:a041:3b1d:ce00:a1e5:af73:6ded:393e","TCP","74","443  >  63153 [ACK] Seq=25557 Ack=39236 Win=1457 Len=0"
"1285","67.167492","2a03:2880:f258:c8:face:b00c:0:167","2a00:a041:3b1d:ce00:a1e5:af73:6ded:393e","TCP","74","443  >  63153 [ACK] Seq=25557 Ack=39334 Win=1457 Len=0"
"1286","67.259032","2a03:2880:f258:c8:face:b00c:0:167","2a00:a041:3b1d:ce00:a1e5:af73:6ded:393e","TLSv1.2","172","Application Data"
"1287","67.261118","2a00:a041:3b1d:ce00:a1e5:af73:6ded:393e","2a03:2880:f258:c8:face:b00c:0:167","TLSv1.2","170","Application Data"
"1288","67.339824","2a03:2880:f258:c8:face:b00c:0:167","2a00:a041:3b1d:ce00:a1e5:af73:6ded:393e","TCP","74","443  >  63153 [ACK] Seq=25655 Ack=39430 Win=1457 Len=0"
"1289","67.761851","2a03:2880:f258:c8:face:b00c:0:167","2a00:a041:3b1d:ce00:a1e5:af73:6ded:393e","TLSv1.2","171","Application Data"
"1291","67.795255","2a03:2880:f258:c8:face:b00c:0:167","2a00:a041:3b1d:ce00:a1e5:af73:6ded:393e","TLSv1.2","171","Application Data"
"1292","67.837885","2a00:a041:3b1d:ce00:a1e5:af73:6ded:393e","2a03:2880:f258:c8:face:b00c:0:167","TCP","74","[TCP Previous segment not captured] 63153  >  443 [ACK] Seq=42342 Ack=25849 Win=1027 Len=0"
"1293","67.867476","2a03:2880:f258:c8:face:b00c:0:167","2a00:a041:3b1d:ce00:a1e5:af73:6ded:393e","TCP","74","[TCP ACKed unseen segment] 443  >  63153 [ACK] Seq=25849 Ack=40822 Win=1468 Len=0"
"1294","67.868235","2a03:2880:f258:c8:face:b00c:0:167","2a00:a041:3b1d:ce00:a1e5:af73:6ded:393e","TCP","74","443  >  63153 [ACK] Seq=25849 Ack=42342 Win=1480 Len=0"
"1295","68.010680","2a03:2880:f258:c8:face:b00c:0:167","2a00:a041:3b1d:ce00:a1e5:af73:6ded:393e","TLSv1.2","188","Application Data"
"1296","68.023887","2a00:a041:3b1d:ce00:a1e5:af73:6ded:393e","2a03:2880:f258:c8:face:b00c:0:167","TLSv1.2","170","Application Data"
"1297","68.023954","2a00:a041:3b1d:ce00:a1e5:af73:6ded:393e","2a03:2880:f258:c8:face:b00c:0:167","TLSv1.2","170","Application Data"
"1300","68.104449","2a03:2880:f258:c8:face:b00c:0:167","2a00:a041:3b1d:ce00:a1e5:af73:6ded:393e","TCP","74","443  >  63153 [ACK] Seq=25963 Ack=42438 Win=1480 Len=0"
"1301","68.105229","2a03:2880:f258:c8:face:b00c:0:167","2a00:a041:3b1d:ce00:a1e5:af73:6ded:393e","TCP","74","443  >  63153 [ACK] Seq=25963 Ack=42534 Win=1480 Len=0"
"1302","68.311313","2a03:2880:f258:c8:face:b00c:0:167","2a00:a041:3b1d:ce00:a1e5:af73:6ded:393e","TLSv1.2","172","Application Data"
"1303","68.311313","2a03:2880:f258:c8:face:b00c:0:167","2a00:a041:3b1d:ce00:a1e5:af73:6ded:393e","TLSv1.2","198","Application Data"
"1304","68.311350","2a00:a041:3b1d:ce00:a1e5:af73:6ded:393e","2a03:2880:f258:c8:face:b00c:0:167","TCP","74","63153  >  443 [ACK] Seq=42534 Ack=26185 Win=1025 Len=0"
"1306","68.371377","2a03:2880:f258:c8:face:b00c:0:167","2a00:a041:3b1d:ce00:a1e5:af73:6ded:393e","TLSv1.2","198","Application Data"
"1307","68.415453","2a00:a041:3b1d:ce00:a1e5:af73:6ded:393e","2a03:2880:f258:c8:face:b00c:0:167","TCP","74","[TCP Previous segment not captured] 63153  >  443 [ACK] Seq=45446 Ack=26309 Win=1025 Len=0"
"1308","68.431835","2a03:2880:f258:c8:face:b00c:0:167","2a00:a041:3b1d:ce00:a1e5:af73:6ded:393e","TCP","74","[TCP ACKed unseen segment] 443  >  63153 [ACK] Seq=26309 Ack=45318 Win=1501 Len=0"
"1309","68.431835","2a03:2880:f258:c8:face:b00c:0:167","2a00:a041:3b1d:ce00:a1e5:af73:6ded:393e","TCP","74","443  >  63153 [ACK] Seq=26309 Ack=45446 Win=1501 Len=0"
"1312","68.593066","2a03:2880:f258:c8:face:b00c:0:167","2a00:a041:3b1d:ce00:a1e5:af73:6ded:393e","TLSv1.2","188","Application Data"
"1313","68.609640","2a00:a041:3b1d:ce00:a1e5:af73:6ded:393e","2a03:2880:f258:c8:face:b00c:0:167","TLSv1.2","170","Application Data"
"1314","68.609698","2a00:a041:3b1d:ce00:a1e5:af73:6ded:393e","2a03:2880:f258:c8:face:b00c:0:167","TLSv1.2","172","Application Data"
"1315","68.609718","2a00:a041:3b1d:ce00:a1e5:af73:6ded:393e","2a03:2880:f258:c8:face:b00c:0:167","TLSv1.2","172","Application Data"
"1317","68.691392","2a03:2880:f258:c8:face:b00c:0:167","2a00:a041:3b1d:ce00:a1e5:af73:6ded:393e","TCP","74","443  >  63153 [ACK] Seq=26423 Ack=45542 Win=1501 Len=0"
"1318","68.691392","2a03:2880:f258:c8:face:b00c:0:167","2a00:a041:3b1d:ce00:a1e5:af73:6ded:393e","TCP","74","443  >  63153 [ACK] Seq=26423 Ack=45640 Win=1501 Len=0"
"1319","68.691392","2a03:2880:f258:c8:face:b00c:0:167","2a00:a041:3b1d:ce00:a1e5:af73:6ded:393e","TCP","74","443  >  63153 [ACK] Seq=26423 Ack=45738 Win=1501 Len=0"
"1321","68.846239","2a03:2880:f258:c8:face:b00c:0:167","2a00:a041:3b1d:ce00:a1e5:af73:6ded:393e","TLSv1.2","172","Application Data"
"1322","68.848182","2a00:a041:3b1d:ce00:a1e5:af73:6ded:393e","2a03:2880:f258:c8:face:b00c:0:167","TLSv1.2","170","Application Data"
"1323","68.854606","2a03:2880:f258:c8:face:b00c:0:167","2a00:a041:3b1d:ce00:a1e5:af73:6ded:393e","TLSv1.2","171","Application Data"
"1324","68.860654","2a00:a041:3b1d:ce00:a1e5:af73:6ded:393e","2a03:2880:f258:c8:face:b00c:0:167","TLSv1.2","170","Application Data"
"1325","68.879210","2a03:2880:f258:c8:face:b00c:0:167","2a00:a041:3b1d:ce00:a1e5:af73:6ded:393e","TLSv1.2","174","Application Data"
"1326","68.883618","2a00:a041:3b1d:ce00:a1e5:af73:6ded:393e","2a03:2880:f258:c8:face:b00c:0:167","TLSv1.2","172","Application Data"
"1328","68.927563","2a03:2880:f258:c8:face:b00c:0:167","2a00:a041:3b1d:ce00:a1e5:af73:6ded:393e","TCP","74","443  >  63153 [ACK] Seq=26718 Ack=45834 Win=1501 Len=0"
"1329","68.940014","2a03:2880:f258:c8:face:b00c:0:167","2a00:a041:3b1d:ce00:a1e5:af73:6ded:393e","TCP","74","443  >  63153 [ACK] Seq=26718 Ack=45930 Win=1501 Len=0"
"1330","68.969980","2a03:2880:f258:c8:face:b00c:0:167","2a00:a041:3b1d:ce00:a1e5:af73:6ded:393e","TCP","74","443  >  63153 [ACK] Seq=26718 Ack=46028 Win=1501 Len=0"
"1331","69.114493","2a03:2880:f258:c8:face:b00c:0:167","2a00:a041:3b1d:ce00:a1e5:af73:6ded:393e","TCP","86","[TCP Retransmission] 443  >  64031 [SYN, ACK] Seq=0 Ack=1 Win=65535 Len=0 MSS=1392 SACK_PERM WS=256"
"1336","69.898476","2a03:2880:f258:c8:face:b00c:0:167","2a00:a041:3b1d:ce00:a1e5:af73:6ded:393e","TLSv1.2","171","Application Data"
"1337","69.901930","2a00:a041:3b1d:ce00:a1e5:af73:6ded:393e","2a03:2880:f258:c8:face:b00c:0:167","TLSv1.2","170","Application Data"
"1338","69.980710","2a03:2880:f258:c8:face:b00c:0:167","2a00:a041:3b1d:ce00:a1e5:af73:6ded:393e","TCP","74","443  >  63153 [ACK] Seq=26815 Ack=46124 Win=1501 Len=0"
