"No.","Time","Source","Destination","Protocol","Length","Info"
"3","0.047607","2a0d:6fc2:5560:c200:2108:9467:c6c8:5a90","2606:50c0:8002::154","TCP","75","52505  >  443 [ACK] Seq=1 Ack=1 Win=514 Len=1 [TCP segment of a reassembled PDU]"
"5","0.109919","2606:50c0:8002::154","2a0d:6fc2:5560:c200:2108:9467:c6c8:5a90","TCP","86","443  >  52505 [ACK] Seq=1 Ack=2 Win=286 Len=0 SLE=1 SRE=2"
"10","2.698909","192.168.1.174","20.189.173.6","TLSv1.2","912","Application Data"
"11","2.699021","192.168.1.174","20.189.173.6","TCP","1494","52588  >  443 [ACK] Seq=859 Ack=1 Win=1020 Len=1440 [TCP segment of a reassembled PDU]"
"12","2.699021","192.168.1.174","20.189.173.6","TCP","1494","52588  >  443 [ACK] Seq=2299 Ack=1 Win=1020 Len=1440 [TCP segment of a reassembled PDU]"
"13","2.699021","192.168.1.174","20.189.173.6","TLSv1.2","907","Application Data"
"16","2.934562","20.189.173.6","192.168.1.174","TLSv1.2","108","Application Data"
"17","2.934562","20.189.173.6","192.168.1.174","TCP","60","443  >  52588 [ACK] Seq=55 Ack=4592 Win=2053 Len=0"
"18","2.934562","20.189.173.6","192.168.1.174","TLSv1.2","507","Application Data"
"19","2.934668","192.168.1.174","20.189.173.6","TCP","54","52588  >  443 [ACK] Seq=4592 Ack=508 Win=1024 Len=0"
"25","4.946233","192.168.1.174","20.189.173.6","TLSv1.2","912","Application Data"
"26","4.946352","192.168.1.174","20.189.173.6","TCP","1494","52588  >  443 [ACK] Seq=5450 Ack=508 Win=1024 Len=1440 [TCP segment of a reassembled PDU]"
"27","4.946352","192.168.1.174","20.189.173.6","TCP","1494","52588  >  443 [ACK] Seq=6890 Ack=508 Win=1024 Len=1440 [TCP segment of a reassembled PDU]"
"28","4.946352","192.168.1.174","20.189.173.6","TLSv1.2","867","Application Data"
"36","5.154458","20.189.173.6","192.168.1.174","TCP","60","443  >  52588 [ACK] Seq=508 Ack=6890 Win=2053 Len=0"
"37","5.154458","20.189.173.6","192.168.1.174","TCP","60","443  >  52588 [ACK] Seq=508 Ack=9143 Win=2053 Len=0"
"38","5.155131","20.189.173.6","192.168.1.174","TLSv1.2","507","Application Data"
"39","5.155206","192.168.1.174","20.189.173.6","TCP","54","52588  >  443 [ACK] Seq=9143 Ack=961 Win=1022 Len=0"
"50","5.815584","192.168.1.174","20.199.120.151","TLSv1.2","98","Application Data"
"51","5.874004","20.199.120.151","192.168.1.174","TLSv1.2","229","Application Data"
"52","5.915424","192.168.1.174","20.199.120.151","TCP","54","54306  >  443 [ACK] Seq=45 Ack=176 Win=512 Len=0"
"107","7.870317","192.168.1.174","20.199.120.151","TLSv1.2","155","Application Data"
"108","7.948211","20.199.120.151","192.168.1.174","TLSv1.2","225","Application Data"
"109","7.992759","192.168.1.174","20.199.120.151","TCP","54","49421  >  443 [ACK] Seq=102 Ack=172 Win=512 Len=0"
"123","9.487828","2a03:2880:f277:cc:face:b00c:0:167","2a0d:6fc2:5560:c200:2108:9467:c6c8:5a90","TLSv1.2","281","Application Data"
"124","9.506039","2a0d:6fc2:5560:c200:2108:9467:c6c8:5a90","2a03:2880:f277:cc:face:b00c:0:167","TLSv1.2","162","Application Data"
"125","9.562182","2a03:2880:f277:cc:face:b00c:0:167","2a0d:6fc2:5560:c200:2108:9467:c6c8:5a90","TCP","74","443  >  52044 [ACK] Seq=208 Ack=89 Win=1617 Len=0"
"126","9.692732","2a03:2880:f277:cc:face:b00c:0:167","2a0d:6fc2:5560:c200:2108:9467:c6c8:5a90","TLSv1.2","249","Application Data"
"127","9.698758","2a0d:6fc2:5560:c200:2108:9467:c6c8:5a90","2a03:2880:f277:cc:face:b00c:0:167","TLSv1.2","148","Application Data"
"128","9.755928","2a03:2880:f277:cc:face:b00c:0:167","2a0d:6fc2:5560:c200:2108:9467:c6c8:5a90","TCP","74","443  >  52044 [ACK] Seq=383 Ack=163 Win=1617 Len=0"
"134","10.433574","140.82.112.25","192.168.1.174","TLSv1.2","80","Application Data"
"135","10.433797","192.168.1.174","140.82.112.25","TLSv1.2","84","Application Data"
"136","10.613313","140.82.112.25","192.168.1.174","TCP","60","443  >  52377 [ACK] Seq=27 Ack=31 Win=72 Len=0"
"137","10.614185","2a0d:6fc2:5560:c200:2108:9467:c6c8:5a90","2a03:2880:f277:cc:face:b00c:0:167","TCP","1466","52044  >  443 [ACK] Seq=163 Ack=383 Win=513 Len=1392 [TCP segment of a reassembled PDU]"
"138","10.614185","2a0d:6fc2:5560:c200:2108:9467:c6c8:5a90","2a03:2880:f277:cc:face:b00c:0:167","TCP","1466","52044  >  443 [ACK] Seq=1555 Ack=383 Win=513 Len=1392 [TCP segment of a reassembled PDU]"
"139","10.614185","2a0d:6fc2:5560:c200:2108:9467:c6c8:5a90","2a03:2880:f277:cc:face:b00c:0:167","TCP","1466","52044  >  443 [ACK] Seq=2947 Ack=383 Win=513 Len=1392 [TCP segment of a reassembled PDU]"
"140","10.614185","2a0d:6fc2:5560:c200:2108:9467:c6c8:5a90","2a03:2880:f277:cc:face:b00c:0:167","TCP","1466","52044  >  443 [ACK] Seq=4339 Ack=383 Win=513 Len=1392 [TCP segment of a reassembled PDU]"
"141","10.614185","2a0d:6fc2:5560:c200:2108:9467:c6c8:5a90","2a03:2880:f277:cc:face:b00c:0:167","TCP","1466","52044  >  443 [ACK] Seq=5731 Ack=383 Win=513 Len=1392 [TCP segment of a reassembled PDU]"
"142","10.614185","2a0d:6fc2:5560:c200:2108:9467:c6c8:5a90","2a03:2880:f277:cc:face:b00c:0:167","TCP","1466","52044  >  443 [ACK] Seq=7123 Ack=383 Win=513 Len=1392 [TCP segment of a reassembled PDU]"
"143","10.614185","2a0d:6fc2:5560:c200:2108:9467:c6c8:5a90","2a03:2880:f277:cc:face:b00c:0:167","TCP","1466","52044  >  443 [ACK] Seq=8515 Ack=383 Win=513 Len=1392 [TCP segment of a reassembled PDU]"
"144","10.614185","2a0d:6fc2:5560:c200:2108:9467:c6c8:5a90","2a03:2880:f277:cc:face:b00c:0:167","TCP","1466","52044  >  443 [ACK] Seq=9907 Ack=383 Win=513 Len=1392 [TCP segment of a reassembled PDU]"
"145","10.614185","2a0d:6fc2:5560:c200:2108:9467:c6c8:5a90","2a03:2880:f277:cc:face:b00c:0:167","TCP","1466","52044  >  443 [ACK] Seq=11299 Ack=383 Win=513 Len=1392 [TCP segment of a reassembled PDU]"
"146","10.614185","2a0d:6fc2:5560:c200:2108:9467:c6c8:5a90","2a03:2880:f277:cc:face:b00c:0:167","TCP","1466","52044  >  443 [ACK] Seq=12691 Ack=383 Win=513 Len=1392 [TCP segment of a reassembled PDU]"
"147","10.614185","2a0d:6fc2:5560:c200:2108:9467:c6c8:5a90","2a03:2880:f277:cc:face:b00c:0:167","TCP","1466","52044  >  443 [ACK] Seq=14083 Ack=383 Win=513 Len=1392 [TCP segment of a reassembled PDU]"
"148","10.614185","2a0d:6fc2:5560:c200:2108:9467:c6c8:5a90","2a03:2880:f277:cc:face:b00c:0:167","TLSv1.2","1168","Application Data"
"149","10.614326","2a0d:6fc2:5560:c200:2108:9467:c6c8:5a90","2a03:2880:f277:cc:face:b00c:0:167","TCP","1466","52044  >  443 [ACK] Seq=16569 Ack=383 Win=513 Len=1392 [TCP segment of a reassembled PDU]"
"150","10.614326","2a0d:6fc2:5560:c200:2108:9467:c6c8:5a90","2a03:2880:f277:cc:face:b00c:0:167","TCP","1466","52044  >  443 [ACK] Seq=17961 Ack=383 Win=513 Len=1392 [TCP segment of a reassembled PDU]"
"151","10.614326","2a0d:6fc2:5560:c200:2108:9467:c6c8:5a90","2a03:2880:f277:cc:face:b00c:0:167","TCP","1466","52044  >  443 [ACK] Seq=19353 Ack=383 Win=513 Len=1392 [TCP segment of a reassembled PDU]"
"152","10.614326","2a0d:6fc2:5560:c200:2108:9467:c6c8:5a90","2a03:2880:f277:cc:face:b00c:0:167","TLSv1.2","1349","Application Data"
"153","10.670279","2a03:2880:f277:cc:face:b00c:0:167","2a0d:6fc2:5560:c200:2108:9467:c6c8:5a90","TCP","74","443  >  52044 [ACK] Seq=383 Ack=1555 Win=1628 Len=0"
"154","10.675472","2a03:2880:f277:cc:face:b00c:0:167","2a0d:6fc2:5560:c200:2108:9467:c6c8:5a90","TCP","74","443  >  52044 [ACK] Seq=383 Ack=5731 Win=1661 Len=0"
"155","10.675472","2a03:2880:f277:cc:face:b00c:0:167","2a0d:6fc2:5560:c200:2108:9467:c6c8:5a90","TCP","74","443  >  52044 [ACK] Seq=383 Ack=16569 Win=1745 Len=0"
"156","10.675472","2a03:2880:f277:cc:face:b00c:0:167","2a0d:6fc2:5560:c200:2108:9467:c6c8:5a90","TCP","74","443  >  52044 [ACK] Seq=383 Ack=17961 Win=1756 Len=0"
"157","10.709576","2a03:2880:f277:cc:face:b00c:0:167","2a0d:6fc2:5560:c200:2108:9467:c6c8:5a90","TCP","74","443  >  52044 [ACK] Seq=383 Ack=22020 Win=1788 Len=0"
"158","10.796551","2a03:2880:f277:cc:face:b00c:0:167","2a0d:6fc2:5560:c200:2108:9467:c6c8:5a90","TLSv1.2","161","Application Data"
"159","10.841785","2a0d:6fc2:5560:c200:2108:9467:c6c8:5a90","2a03:2880:f277:cc:face:b00c:0:167","TCP","74","52044  >  443 [ACK] Seq=22020 Ack=470 Win=513 Len=0"
"160","11.126815","2a03:2880:f277:cc:face:b00c:0:167","2a0d:6fc2:5560:c200:2108:9467:c6c8:5a90","TLSv1.2","154","Application Data"
"161","11.126815","2a03:2880:f277:cc:face:b00c:0:167","2a0d:6fc2:5560:c200:2108:9467:c6c8:5a90","TLSv1.2","180","Application Data"
"162","11.126894","2a0d:6fc2:5560:c200:2108:9467:c6c8:5a90","2a03:2880:f277:cc:face:b00c:0:167","TCP","74","52044  >  443 [ACK] Seq=22020 Ack=656 Win=512 Len=0"
"163","11.130362","2a0d:6fc2:5560:c200:2108:9467:c6c8:5a90","2a03:2880:f277:cc:face:b00c:0:167","TLSv1.2","152","Application Data"
"164","11.140136","2a0d:6fc2:5560:c200:2108:9467:c6c8:5a90","2a03:2880:f277:cc:face:b00c:0:167","TLSv1.2","154","Application Data"
"165","11.186929","2a03:2880:f277:cc:face:b00c:0:167","2a0d:6fc2:5560:c200:2108:9467:c6c8:5a90","TCP","74","443  >  52044 [ACK] Seq=656 Ack=22098 Win=1788 Len=0"
"166","11.197279","2a03:2880:f277:cc:face:b00c:0:167","2a0d:6fc2:5560:c200:2108:9467:c6c8:5a90","TCP","74","443  >  52044 [ACK] Seq=656 Ack=22178 Win=1788 Len=0"
"187","14.096691","2a03:2880:f277:cc:face:b00c:0:167","2a0d:6fc2:5560:c200:2108:9467:c6c8:5a90","TLSv1.2","168","Application Data"
"188","14.131499","2a0d:6fc2:5560:c200:2108:9467:c6c8:5a90","2a03:2880:f277:cc:face:b00c:0:167","TLSv1.2","147","Application Data"
"189","14.188968","2a03:2880:f277:cc:face:b00c:0:167","2a0d:6fc2:5560:c200:2108:9467:c6c8:5a90","TCP","74","443  >  52044 [ACK] Seq=750 Ack=22251 Win=1788 Len=0"
"190","14.197229","2a03:2880:f277:cc:face:b00c:0:167","2a0d:6fc2:5560:c200:2108:9467:c6c8:5a90","TLSv1.2","137","Application Data"
"191","14.257606","2a0d:6fc2:5560:c200:2108:9467:c6c8:5a90","2a03:2880:f277:cc:face:b00c:0:167","TCP","74","52044  >  443 [ACK] Seq=22251 Ack=813 Win=511 Len=0"
"195","16.759351","2a03:2880:f277:cc:face:b00c:0:167","2a0d:6fc2:5560:c200:2108:9467:c6c8:5a90","TLSv1.2","137","Application Data"
"196","16.799309","2a0d:6fc2:5560:c200:2108:9467:c6c8:5a90","2a03:2880:f277:cc:face:b00c:0:167","TCP","74","52044  >  443 [ACK] Seq=22251 Ack=876 Win=511 Len=0"
"317","21.571628","13.107.42.12","192.168.1.174","TCP","60","443  >  52585 [RST, ACK] Seq=1 Ack=1 Win=0 Len=0"
"318","21.571628","2a03:2880:f277:cc:face:b00c:0:167","2a0d:6fc2:5560:c200:2108:9467:c6c8:5a90","TCP","1466","443  >  52044 [ACK] Seq=876 Ack=22251 Win=1788 Len=1392 [TCP segment of a reassembled PDU]"
"319","21.571628","2a03:2880:f277:cc:face:b00c:0:167","2a0d:6fc2:5560:c200:2108:9467:c6c8:5a90","TLSv1.2","145","Application Data"
"357","21.783482","2a03:2880:f277:cc:face:b00c:0:167","2a0d:6fc2:5560:c200:2108:9467:c6c8:5a90","TCP","145","[TCP Retransmission] 443  >  52044 [PSH, ACK] Seq=2268 Ack=22251 Win=1788 Len=71"
"524","22.047941","2a03:2880:f277:cc:face:b00c:0:167","2a0d:6fc2:5560:c200:2108:9467:c6c8:5a90","TCP","1466","[TCP Retransmission] 443  >  52044 [ACK] Seq=876 Ack=22251 Win=1788 Len=1392"
"527","22.595743","2a03:2880:f277:cc:face:b00c:0:167","2a0d:6fc2:5560:c200:2108:9467:c6c8:5a90","TCP","1466","[TCP Retransmission] 443  >  52044 [ACK] Seq=876 Ack=22251 Win=1788 Len=1392"
"545","22.689545","192.168.1.174","157.240.252.60","TCP","66","59818  >  443 [SYN] Seq=0 Win=64240 Len=0 MSS=1460 WS=256 SACK_PERM"
"553","22.749342","157.240.252.60","192.168.1.174","TCP","66","443  >  59818 [SYN, ACK] Seq=0 Ack=1 Win=65535 Len=0 MSS=1392 SACK_PERM WS=256"
"554","22.749486","192.168.1.174","157.240.252.60","TCP","54","59818  >  443 [ACK] Seq=1 Ack=1 Win=132096 Len=0"
"555","22.750018","192.168.1.174","157.240.252.60","TLSv1.3","571","Client Hello"
"558","22.810655","157.240.252.60","192.168.1.174","TCP","60","443  >  59818 [ACK] Seq=1 Ack=518 Win=66816 Len=0"
"559","22.810655","157.240.252.60","192.168.1.174","TLSv1.3","266","Server Hello, Change Cipher Spec, Application Data"
"560","22.814096","192.168.1.174","157.240.252.60","TLSv1.3","118","Change Cipher Spec, Application Data"
"561","22.814406","192.168.1.174","157.240.252.60","TLSv1.3","152","Application Data"
"562","22.814657","192.168.1.174","157.240.252.60","TLSv1.3","583","Application Data"
"563","22.814715","192.168.1.174","157.240.252.60","TLSv1.3","707","Application Data"
"564","22.873623","157.240.252.60","192.168.1.174","TCP","60","443  >  59818 [ACK] Seq=213 Ack=680 Win=66816 Len=0"
"565","22.873623","157.240.252.60","192.168.1.174","TCP","60","443  >  59818 [ACK] Seq=213 Ack=1862 Win=69120 Len=0"
"566","22.874290","157.240.252.60","192.168.1.174","TLSv1.3","225","Application Data"
"567","22.874442","157.240.252.60","192.168.1.174","TLSv1.3","128","Application Data"
"568","22.874442","157.240.252.60","192.168.1.174","TLSv1.3","98","Application Data"
"569","22.874469","192.168.1.174","157.240.252.60","TCP","54","59818  >  443 [ACK] Seq=1862 Ack=502 Win=131584 Len=0"
"570","22.874646","192.168.1.174","157.240.252.60","TLSv1.3","85","Application Data"
"571","23.005253","157.240.252.60","192.168.1.174","TCP","60","443  >  59818 [ACK] Seq=502 Ack=1893 Win=69120 Len=0"
"572","23.005253","157.240.252.60","192.168.1.174","TLSv1.3","629","Application Data"
"573","23.053671","192.168.1.174","157.240.252.60","TCP","54","59818  >  443 [ACK] Seq=1893 Ack=1077 Win=131072 Len=0"
"574","23.721947","2a03:2880:f277:cc:face:b00c:0:167","2a0d:6fc2:5560:c200:2108:9467:c6c8:5a90","TCP","1466","[TCP Retransmission] 443  >  52044 [ACK] Seq=876 Ack=22251 Win=1788 Len=1392"
"595","27.948364","192.168.1.174","20.199.120.151","TLSv1.2","155","Application Data"
"616","28.006465","20.199.120.151","192.168.1.174","TLSv1.2","225","Application Data"
"635","28.051822","192.168.1.174","20.199.120.151","TCP","54","49421  >  443 [ACK] Seq=203 Ack=343 Win=512 Len=0"
"773","29.130030","2a0d:6fc2:5560:c200:2108:9467:c6c8:5a90","2001:40a8:4400:4::d4c7:ca6a","TCP","86","59823  >  443 [SYN] Seq=0 Win=64400 Len=0 MSS=1400 WS=256 SACK_PERM"
"774","29.134800","2001:40a8:4400:4::d4c7:ca6a","2a0d:6fc2:5560:c200:2108:9467:c6c8:5a90","TCP","86","443  >  59823 [SYN, ACK] Seq=0 Ack=1 Win=64800 Len=0 MSS=1400 SACK_PERM WS=128"
"775","29.134878","2a0d:6fc2:5560:c200:2108:9467:c6c8:5a90","2001:40a8:4400:4::d4c7:ca6a","TCP","74","59823  >  443 [ACK] Seq=1 Ack=1 Win=131584 Len=0"
"776","29.136937","2a0d:6fc2:5560:c200:2108:9467:c6c8:5a90","2001:40a8:4400:4::d4c7:ca6a","TLSv1.2","280","Client Hello"
"777","29.138991","2001:40a8:4400:4::d4c7:ca6a","2a0d:6fc2:5560:c200:2108:9467:c6c8:5a90","TCP","74","443  >  59823 [ACK] Seq=1 Ack=207 Win=64640 Len=0"
"778","29.190227","2001:40a8:4400:4::d4c7:ca6a","2a0d:6fc2:5560:c200:2108:9467:c6c8:5a90","TLSv1.2","1474","Server Hello"
"779","29.190227","2001:40a8:4400:4::d4c7:ca6a","2a0d:6fc2:5560:c200:2108:9467:c6c8:5a90","TCP","1474","443  >  59823 [PSH, ACK] Seq=1401 Ack=207 Win=64640 Len=1400 [TCP segment of a reassembled PDU]"
"780","29.190227","2001:40a8:4400:4::d4c7:ca6a","2a0d:6fc2:5560:c200:2108:9467:c6c8:5a90","TLSv1.2","1016","Certificate, Certificate Status, Server Key Exchange, Server Hello Done"
"781","29.190318","2a0d:6fc2:5560:c200:2108:9467:c6c8:5a90","2001:40a8:4400:4::d4c7:ca6a","TCP","74","59823  >  443 [ACK] Seq=207 Ack=3743 Win=131584 Len=0"
"782","29.195665","2a0d:6fc2:5560:c200:2108:9467:c6c8:5a90","2001:40a8:4400:4::d4c7:ca6a","TLSv1.2","200","Client Key Exchange, Change Cipher Spec, Encrypted Handshake Message"
"783","29.197973","2001:40a8:4400:4::d4c7:ca6a","2a0d:6fc2:5560:c200:2108:9467:c6c8:5a90","TCP","74","443  >  59823 [ACK] Seq=3743 Ack=333 Win=64640 Len=0"
"784","29.197973","2001:40a8:4400:4::d4c7:ca6a","2a0d:6fc2:5560:c200:2108:9467:c6c8:5a90","TLSv1.2","348","New Session Ticket, Change Cipher Spec, Encrypted Handshake Message"
"788","29.219451","2a0d:6fc2:5560:c200:2108:9467:c6c8:5a90","2001:40a8:4400:4::d4c7:ca6a","TLSv1.2","254","Application Data"
"789","29.221907","2001:40a8:4400:4::d4c7:ca6a","2a0d:6fc2:5560:c200:2108:9467:c6c8:5a90","TCP","74","443  >  59823 [ACK] Seq=4017 Ack=513 Win=64512 Len=0"
"790","29.222619","2001:40a8:4400:4::d4c7:ca6a","2a0d:6fc2:5560:c200:2108:9467:c6c8:5a90","TCP","1474","443  >  59823 [ACK] Seq=4017 Ack=513 Win=64512 Len=1400 [TCP segment of a reassembled PDU]"
"791","29.223024","2001:40a8:4400:4::d4c7:ca6a","2a0d:6fc2:5560:c200:2108:9467:c6c8:5a90","TCP","1474","443  >  59823 [ACK] Seq=5417 Ack=513 Win=64512 Len=1400 [TCP segment of a reassembled PDU]"
"792","29.223070","2a0d:6fc2:5560:c200:2108:9467:c6c8:5a90","2001:40a8:4400:4::d4c7:ca6a","TCP","74","59823  >  443 [ACK] Seq=513 Ack=6817 Win=131584 Len=0"
"793","29.224505","2001:40a8:4400:4::d4c7:ca6a","2a0d:6fc2:5560:c200:2108:9467:c6c8:5a90","TCP","1474","443  >  59823 [ACK] Seq=6817 Ack=513 Win=64512 Len=1400 [TCP segment of a reassembled PDU]"
"794","29.224505","2001:40a8:4400:4::d4c7:ca6a","2a0d:6fc2:5560:c200:2108:9467:c6c8:5a90","TCP","1474","443  >  59823 [ACK] Seq=8217 Ack=513 Win=64512 Len=1400 [TCP segment of a reassembled PDU]"
"795","29.224505","2001:40a8:4400:4::d4c7:ca6a","2a0d:6fc2:5560:c200:2108:9467:c6c8:5a90","TCP","1474","443  >  59823 [ACK] Seq=9617 Ack=513 Win=64512 Len=1400 [TCP segment of a reassembled PDU]"
"796","29.224505","2001:40a8:4400:4::d4c7:ca6a","2a0d:6fc2:5560:c200:2108:9467:c6c8:5a90","TLSv1.2","1295","Application Data"
"797","29.224609","2a0d:6fc2:5560:c200:2108:9467:c6c8:5a90","2001:40a8:4400:4::d4c7:ca6a","TCP","74","59823  >  443 [ACK] Seq=513 Ack=12238 Win=131584 Len=0"
"798","29.232855","2a0d:6fc2:5560:c200:2108:9467:c6c8:5a90","2001:40a8:4400:4::d4c7:ca6a","TLSv1.2","252","Application Data"
"799","29.235242","2001:40a8:4400:4::d4c7:ca6a","2a0d:6fc2:5560:c200:2108:9467:c6c8:5a90","TCP","74","443  >  59823 [ACK] Seq=12238 Ack=691 Win=64384 Len=0"
"800","29.235381","2001:40a8:4400:4::d4c7:ca6a","2a0d:6fc2:5560:c200:2108:9467:c6c8:5a90","TCP","1474","443  >  59823 [ACK] Seq=12238 Ack=691 Win=64384 Len=1400 [TCP segment of a reassembled PDU]"
"801","29.236592","2001:40a8:4400:4::d4c7:ca6a","2a0d:6fc2:5560:c200:2108:9467:c6c8:5a90","TCP","1474","443  >  59823 [ACK] Seq=13638 Ack=691 Win=64384 Len=1400 [TCP segment of a reassembled PDU]"
"802","29.236592","2001:40a8:4400:4::d4c7:ca6a","2a0d:6fc2:5560:c200:2108:9467:c6c8:5a90","TCP","1474","443  >  59823 [ACK] Seq=15038 Ack=691 Win=64384 Len=1400 [TCP segment of a reassembled PDU]"
"803","29.236592","2001:40a8:4400:4::d4c7:ca6a","2a0d:6fc2:5560:c200:2108:9467:c6c8:5a90","TCP","1474","443  >  59823 [ACK] Seq=16438 Ack=691 Win=64384 Len=1400 [TCP segment of a reassembled PDU]"
"804","29.236592","2001:40a8:4400:4::d4c7:ca6a","2a0d:6fc2:5560:c200:2108:9467:c6c8:5a90","TCP","1474","443  >  59823 [ACK] Seq=17838 Ack=691 Win=64384 Len=1400 [TCP segment of a reassembled PDU]"
"805","29.236592","2001:40a8:4400:4::d4c7:ca6a","2a0d:6fc2:5560:c200:2108:9467:c6c8:5a90","TCP","1474","443  >  59823 [ACK] Seq=19238 Ack=691 Win=64384 Len=1400 [TCP segment of a reassembled PDU]"
"806","29.236592","2001:40a8:4400:4::d4c7:ca6a","2a0d:6fc2:5560:c200:2108:9467:c6c8:5a90","TLSv1.2","1313","Application Data"
"807","29.236668","2a0d:6fc2:5560:c200:2108:9467:c6c8:5a90","2001:40a8:4400:4::d4c7:ca6a","TCP","74","59823  >  443 [ACK] Seq=691 Ack=21877 Win=131584 Len=0"
"808","29.243751","2a0d:6fc2:5560:c200:2108:9467:c6c8:5a90","2001:40a8:4400:4::d4c7:ca6a","TLSv1.2","253","Application Data"
"809","29.247740","2001:40a8:4400:4::d4c7:ca6a","2a0d:6fc2:5560:c200:2108:9467:c6c8:5a90","TCP","1474","443  >  59823 [ACK] Seq=21877 Ack=870 Win=64256 Len=1400 [TCP segment of a reassembled PDU]"
"810","29.247740","2001:40a8:4400:4::d4c7:ca6a","2a0d:6fc2:5560:c200:2108:9467:c6c8:5a90","TCP","1474","443  >  59823 [ACK] Seq=23277 Ack=870 Win=64256 Len=1400 [TCP segment of a reassembled PDU]"
"811","29.247785","2a0d:6fc2:5560:c200:2108:9467:c6c8:5a90","2001:40a8:4400:4::d4c7:ca6a","TCP","74","59823  >  443 [ACK] Seq=870 Ack=24677 Win=131584 Len=0"
"812","29.248741","2001:40a8:4400:4::d4c7:ca6a","2a0d:6fc2:5560:c200:2108:9467:c6c8:5a90","TCP","1474","443  >  59823 [ACK] Seq=24677 Ack=870 Win=64256 Len=1400 [TCP segment of a reassembled PDU]"
"813","29.248741","2001:40a8:4400:4::d4c7:ca6a","2a0d:6fc2:5560:c200:2108:9467:c6c8:5a90","TCP","1474","443  >  59823 [ACK] Seq=26077 Ack=870 Win=64256 Len=1400 [TCP segment of a reassembled PDU]"
"814","29.248741","2001:40a8:4400:4::d4c7:ca6a","2a0d:6fc2:5560:c200:2108:9467:c6c8:5a90","TCP","1474","443  >  59823 [ACK] Seq=27477 Ack=870 Win=64256 Len=1400 [TCP segment of a reassembled PDU]"
"815","29.248741","2001:40a8:4400:4::d4c7:ca6a","2a0d:6fc2:5560:c200:2108:9467:c6c8:5a90","TLSv1.2","1130","Application Data"
"816","29.248805","2a0d:6fc2:5560:c200:2108:9467:c6c8:5a90","2001:40a8:4400:4::d4c7:ca6a","TCP","74","59823  >  443 [ACK] Seq=870 Ack=29933 Win=131584 Len=0"
"817","29.278666","2a0d:6fc2:5560:c200:2108:9467:c6c8:5a90","2001:40a8:4400:4::d4c7:ca6a","TLSv1.2","252","Application Data"
"818","29.281287","2001:40a8:4400:4::d4c7:ca6a","2a0d:6fc2:5560:c200:2108:9467:c6c8:5a90","TCP","1474","443  >  59823 [ACK] Seq=29933 Ack=1048 Win=64128 Len=1400 [TCP segment of a reassembled PDU]"
"819","29.281352","2001:40a8:4400:4::d4c7:ca6a","2a0d:6fc2:5560:c200:2108:9467:c6c8:5a90","TLSv1.2","733","Application Data"
"820","29.281374","2a0d:6fc2:5560:c200:2108:9467:c6c8:5a90","2001:40a8:4400:4::d4c7:ca6a","TCP","74","59823  >  443 [ACK] Seq=1048 Ack=31992 Win=131584 Len=0"
"821","29.328252","2a0d:6fc2:5560:c200:2108:9467:c6c8:5a90","2001:40a8:4400:4::d4c7:ca6a","TLSv1.2","261","Application Data"
"822","29.331022","2001:40a8:4400:4::d4c7:ca6a","2a0d:6fc2:5560:c200:2108:9467:c6c8:5a90","TCP","1474","443  >  59823 [ACK] Seq=31992 Ack=1235 Win=64128 Len=1400 [TCP segment of a reassembled PDU]"
"823","29.331419","2001:40a8:4400:4::d4c7:ca6a","2a0d:6fc2:5560:c200:2108:9467:c6c8:5a90","TCP","1474","443  >  59823 [ACK] Seq=33392 Ack=1235 Win=64128 Len=1400 [TCP segment of a reassembled PDU]"
"824","29.331419","2001:40a8:4400:4::d4c7:ca6a","2a0d:6fc2:5560:c200:2108:9467:c6c8:5a90","TCP","1474","443  >  59823 [ACK] Seq=34792 Ack=1235 Win=64128 Len=1400 [TCP segment of a reassembled PDU]"
"825","29.331460","2a0d:6fc2:5560:c200:2108:9467:c6c8:5a90","2001:40a8:4400:4::d4c7:ca6a","TCP","74","59823  >  443 [ACK] Seq=1235 Ack=36192 Win=131584 Len=0"
"826","29.333227","2001:40a8:4400:4::d4c7:ca6a","2a0d:6fc2:5560:c200:2108:9467:c6c8:5a90","TCP","1474","443  >  59823 [ACK] Seq=36192 Ack=1235 Win=64128 Len=1400 [TCP segment of a reassembled PDU]"
"827","29.333227","2001:40a8:4400:4::d4c7:ca6a","2a0d:6fc2:5560:c200:2108:9467:c6c8:5a90","TCP","1474","443  >  59823 [ACK] Seq=37592 Ack=1235 Win=64128 Len=1400 [TCP segment of a reassembled PDU]"
"828","29.333227","2001:40a8:4400:4::d4c7:ca6a","2a0d:6fc2:5560:c200:2108:9467:c6c8:5a90","TCP","1474","443  >  59823 [ACK] Seq=38992 Ack=1235 Win=64128 Len=1400 [TCP segment of a reassembled PDU]"
"829","29.333227","2001:40a8:4400:4::d4c7:ca6a","2a0d:6fc2:5560:c200:2108:9467:c6c8:5a90","TLSv1.2","1066","Application Data"
"830","29.333282","2a0d:6fc2:5560:c200:2108:9467:c6c8:5a90","2001:40a8:4400:4::d4c7:ca6a","TCP","74","59823  >  443 [ACK] Seq=1235 Ack=41384 Win=131584 Len=0"
"831","29.416187","2a0d:6fc2:5560:c200:2108:9467:c6c8:5a90","2001:40a8:4400:4::d4c7:ca6a","TLSv1.2","255","Application Data"
"832","29.418561","2001:40a8:4400:4::d4c7:ca6a","2a0d:6fc2:5560:c200:2108:9467:c6c8:5a90","TCP","1474","443  >  59823 [ACK] Seq=41384 Ack=1416 Win=64128 Len=1400 [TCP segment of a reassembled PDU]"
"833","29.418700","2001:40a8:4400:4::d4c7:ca6a","2a0d:6fc2:5560:c200:2108:9467:c6c8:5a90","TCP","1474","443  >  59823 [ACK] Seq=42784 Ack=1416 Win=64128 Len=1400 [TCP segment of a reassembled PDU]"
"834","29.418736","2a0d:6fc2:5560:c200:2108:9467:c6c8:5a90","2001:40a8:4400:4::d4c7:ca6a","TCP","74","59823  >  443 [ACK] Seq=1416 Ack=44184 Win=131584 Len=0"
"835","29.419209","2001:40a8:4400:4::d4c7:ca6a","2a0d:6fc2:5560:c200:2108:9467:c6c8:5a90","TCP","1474","443  >  59823 [ACK] Seq=44184 Ack=1416 Win=64128 Len=1400 [TCP segment of a reassembled PDU]"
"836","29.419209","2001:40a8:4400:4::d4c7:ca6a","2a0d:6fc2:5560:c200:2108:9467:c6c8:5a90","TLSv1.2","338","Application Data"
"837","29.419257","2a0d:6fc2:5560:c200:2108:9467:c6c8:5a90","2001:40a8:4400:4::d4c7:ca6a","TCP","74","59823  >  443 [ACK] Seq=1416 Ack=45848 Win=131584 Len=0"
"838","29.465389","2a0d:6fc2:5560:c200:2108:9467:c6c8:5a90","2001:40a8:4400:4::d4c7:ca6a","TLSv1.2","275","Application Data"
"839","29.469456","2001:40a8:4400:4::d4c7:ca6a","2a0d:6fc2:5560:c200:2108:9467:c6c8:5a90","TCP","1474","443  >  59823 [ACK] Seq=45848 Ack=1617 Win=64128 Len=1400 [TCP segment of a reassembled PDU]"
"840","29.469456","2001:40a8:4400:4::d4c7:ca6a","2a0d:6fc2:5560:c200:2108:9467:c6c8:5a90","TCP","1474","443  >  59823 [ACK] Seq=47248 Ack=1617 Win=64128 Len=1400 [TCP segment of a reassembled PDU]"
"841","29.469456","2001:40a8:4400:4::d4c7:ca6a","2a0d:6fc2:5560:c200:2108:9467:c6c8:5a90","TCP","1474","443  >  59823 [ACK] Seq=48648 Ack=1617 Win=64128 Len=1400 [TCP segment of a reassembled PDU]"
"842","29.469456","2001:40a8:4400:4::d4c7:ca6a","2a0d:6fc2:5560:c200:2108:9467:c6c8:5a90","TCP","1474","443  >  59823 [ACK] Seq=50048 Ack=1617 Win=64128 Len=1400 [TCP segment of a reassembled PDU]"
"843","29.469456","2001:40a8:4400:4::d4c7:ca6a","2a0d:6fc2:5560:c200:2108:9467:c6c8:5a90","TLSv1.2","753","Application Data"
"844","29.469512","2a0d:6fc2:5560:c200:2108:9467:c6c8:5a90","2001:40a8:4400:4::d4c7:ca6a","TCP","74","59823  >  443 [ACK] Seq=1617 Ack=52127 Win=131584 Len=0"
"845","29.509604","2a0d:6fc2:5560:c200:2108:9467:c6c8:5a90","2001:40a8:4400:4::d4c7:ca6a","TLSv1.2","262","Application Data"
"846","29.512819","2001:40a8:4400:4::d4c7:ca6a","2a0d:6fc2:5560:c200:2108:9467:c6c8:5a90","TCP","1474","443  >  59823 [ACK] Seq=52127 Ack=1805 Win=64128 Len=1400 [TCP segment of a reassembled PDU]"
"847","29.512819","2001:40a8:4400:4::d4c7:ca6a","2a0d:6fc2:5560:c200:2108:9467:c6c8:5a90","TCP","1474","443  >  59823 [ACK] Seq=53527 Ack=1805 Win=64128 Len=1400 [TCP segment of a reassembled PDU]"
"848","29.512865","2a0d:6fc2:5560:c200:2108:9467:c6c8:5a90","2001:40a8:4400:4::d4c7:ca6a","TCP","74","59823  >  443 [ACK] Seq=1805 Ack=54927 Win=131584 Len=0"
"849","29.518977","2001:40a8:4400:4::d4c7:ca6a","2a0d:6fc2:5560:c200:2108:9467:c6c8:5a90","TCP","1474","443  >  59823 [ACK] Seq=54927 Ack=1805 Win=64128 Len=1400 [TCP segment of a reassembled PDU]"
"850","29.518977","2001:40a8:4400:4::d4c7:ca6a","2a0d:6fc2:5560:c200:2108:9467:c6c8:5a90","TCP","1474","443  >  59823 [ACK] Seq=56327 Ack=1805 Win=64128 Len=1400 [TCP segment of a reassembled PDU]"
"851","29.518977","2001:40a8:4400:4::d4c7:ca6a","2a0d:6fc2:5560:c200:2108:9467:c6c8:5a90","TCP","1474","443  >  59823 [ACK] Seq=57727 Ack=1805 Win=64128 Len=1400 [TCP segment of a reassembled PDU]"
"852","29.518977","2001:40a8:4400:4::d4c7:ca6a","2a0d:6fc2:5560:c200:2108:9467:c6c8:5a90","TCP","1474","443  >  59823 [ACK] Seq=59127 Ack=1805 Win=64128 Len=1400 [TCP segment of a reassembled PDU]"
"853","29.518977","2001:40a8:4400:4::d4c7:ca6a","2a0d:6fc2:5560:c200:2108:9467:c6c8:5a90","TCP","1474","443  >  59823 [ACK] Seq=60527 Ack=1805 Win=64128 Len=1400 [TCP segment of a reassembled PDU]"
"854","29.518977","2001:40a8:4400:4::d4c7:ca6a","2a0d:6fc2:5560:c200:2108:9467:c6c8:5a90","TCP","1474","443  >  59823 [ACK] Seq=61927 Ack=1805 Win=64128 Len=1400 [TCP segment of a reassembled PDU]"
"855","29.518977","2001:40a8:4400:4::d4c7:ca6a","2a0d:6fc2:5560:c200:2108:9467:c6c8:5a90","TCP","1474","443  >  59823 [ACK] Seq=63327 Ack=1805 Win=64128 Len=1400 [TCP segment of a reassembled PDU]"
"856","29.518977","2001:40a8:4400:4::d4c7:ca6a","2a0d:6fc2:5560:c200:2108:9467:c6c8:5a90","TCP","1474","443  >  59823 [ACK] Seq=64727 Ack=1805 Win=64128 Len=1400 [TCP segment of a reassembled PDU]"
"857","29.518977","2001:40a8:4400:4::d4c7:ca6a","2a0d:6fc2:5560:c200:2108:9467:c6c8:5a90","TCP","1474","443  >  59823 [ACK] Seq=66127 Ack=1805 Win=64128 Len=1400 [TCP segment of a reassembled PDU]"
"858","29.518977","2001:40a8:4400:4::d4c7:ca6a","2a0d:6fc2:5560:c200:2108:9467:c6c8:5a90","TLSv1.2","1087","Application Data"
"859","29.518977","2001:40a8:4400:4::d4c7:ca6a","2a0d:6fc2:5560:c200:2108:9467:c6c8:5a90","TCP","1474","443  >  59823 [ACK] Seq=68540 Ack=1805 Win=64128 Len=1400 [TCP segment of a reassembled PDU]"
"860","29.518977","2001:40a8:4400:4::d4c7:ca6a","2a0d:6fc2:5560:c200:2108:9467:c6c8:5a90","TCP","1474","443  >  59823 [ACK] Seq=69940 Ack=1805 Win=64128 Len=1400 [TCP segment of a reassembled PDU]"
"861","29.518977","2001:40a8:4400:4::d4c7:ca6a","2a0d:6fc2:5560:c200:2108:9467:c6c8:5a90","TCP","1474","443  >  59823 [ACK] Seq=71340 Ack=1805 Win=64128 Len=1400 [TCP segment of a reassembled PDU]"
"862","29.518977","2001:40a8:4400:4::d4c7:ca6a","2a0d:6fc2:5560:c200:2108:9467:c6c8:5a90","TCP","1474","443  >  59823 [ACK] Seq=72740 Ack=1805 Win=64128 Len=1400 [TCP segment of a reassembled PDU]"
"863","29.518977","2001:40a8:4400:4::d4c7:ca6a","2a0d:6fc2:5560:c200:2108:9467:c6c8:5a90","TCP","1474","443  >  59823 [ACK] Seq=74140 Ack=1805 Win=64128 Len=1400 [TCP segment of a reassembled PDU]"
"864","29.518977","2001:40a8:4400:4::d4c7:ca6a","2a0d:6fc2:5560:c200:2108:9467:c6c8:5a90","TCP","1474","443  >  59823 [ACK] Seq=75540 Ack=1805 Win=64128 Len=1400 [TCP segment of a reassembled PDU]"
"865","29.518977","2001:40a8:4400:4::d4c7:ca6a","2a0d:6fc2:5560:c200:2108:9467:c6c8:5a90","TCP","1474","443  >  59823 [ACK] Seq=76940 Ack=1805 Win=64128 Len=1400 [TCP segment of a reassembled PDU]"
"866","29.518977","2001:40a8:4400:4::d4c7:ca6a","2a0d:6fc2:5560:c200:2108:9467:c6c8:5a90","TLSv1.2","299","Application Data"
"867","29.519195","2a0d:6fc2:5560:c200:2108:9467:c6c8:5a90","2001:40a8:4400:4::d4c7:ca6a","TCP","74","59823  >  443 [ACK] Seq=1805 Ack=78565 Win=131584 Len=0"
"868","29.615308","2a0d:6fc2:5560:c200:2108:9467:c6c8:5a90","2001:40a8:4400:4::d4c7:ca6a","TLSv1.2","266","Application Data"
"869","29.623874","2001:40a8:4400:4::d4c7:ca6a","2a0d:6fc2:5560:c200:2108:9467:c6c8:5a90","TCP","1474","443  >  59823 [ACK] Seq=78565 Ack=1997 Win=64128 Len=1400 [TCP segment of a reassembled PDU]"
"870","29.623874","2001:40a8:4400:4::d4c7:ca6a","2a0d:6fc2:5560:c200:2108:9467:c6c8:5a90","TLSv1.2","495","Application Data"
"871","29.623953","2a0d:6fc2:5560:c200:2108:9467:c6c8:5a90","2001:40a8:4400:4::d4c7:ca6a","TCP","74","59823  >  443 [ACK] Seq=1997 Ack=80386 Win=131584 Len=0"
"872","29.658580","2a0d:6fc2:5560:c200:2108:9467:c6c8:5a90","2001:40a8:4400:4::d4c7:ca6a","TLSv1.2","255","Application Data"
"873","29.661805","2001:40a8:4400:4::d4c7:ca6a","2a0d:6fc2:5560:c200:2108:9467:c6c8:5a90","TCP","1474","443  >  59823 [ACK] Seq=80386 Ack=2178 Win=64128 Len=1400 [TCP segment of a reassembled PDU]"
"874","29.662155","2001:40a8:4400:4::d4c7:ca6a","2a0d:6fc2:5560:c200:2108:9467:c6c8:5a90","TCP","1474","443  >  59823 [ACK] Seq=81786 Ack=2178 Win=64128 Len=1400 [TCP segment of a reassembled PDU]"
"875","29.662199","2a0d:6fc2:5560:c200:2108:9467:c6c8:5a90","2001:40a8:4400:4::d4c7:ca6a","TCP","74","59823  >  443 [ACK] Seq=2178 Ack=83186 Win=131584 Len=0"
"876","29.664487","2001:40a8:4400:4::d4c7:ca6a","2a0d:6fc2:5560:c200:2108:9467:c6c8:5a90","TCP","1474","443  >  59823 [ACK] Seq=83186 Ack=2178 Win=64128 Len=1400 [TCP segment of a reassembled PDU]"
"877","29.664487","2001:40a8:4400:4::d4c7:ca6a","2a0d:6fc2:5560:c200:2108:9467:c6c8:5a90","TCP","1474","443  >  59823 [ACK] Seq=84586 Ack=2178 Win=64128 Len=1400 [TCP segment of a reassembled PDU]"
"878","29.664487","2001:40a8:4400:4::d4c7:ca6a","2a0d:6fc2:5560:c200:2108:9467:c6c8:5a90","TCP","1474","443  >  59823 [ACK] Seq=85986 Ack=2178 Win=64128 Len=1400 [TCP segment of a reassembled PDU]"
"879","29.664487","2001:40a8:4400:4::d4c7:ca6a","2a0d:6fc2:5560:c200:2108:9467:c6c8:5a90","TCP","1474","443  >  59823 [ACK] Seq=87386 Ack=2178 Win=64128 Len=1400 [TCP segment of a reassembled PDU]"
"880","29.664487","2001:40a8:4400:4::d4c7:ca6a","2a0d:6fc2:5560:c200:2108:9467:c6c8:5a90","TCP","1474","443  >  59823 [ACK] Seq=88786 Ack=2178 Win=64128 Len=1400 [TCP segment of a reassembled PDU]"
"881","29.664487","2001:40a8:4400:4::d4c7:ca6a","2a0d:6fc2:5560:c200:2108:9467:c6c8:5a90","TCP","1474","443  >  59823 [ACK] Seq=90186 Ack=2178 Win=64128 Len=1400 [TCP segment of a reassembled PDU]"
"882","29.664487","2001:40a8:4400:4::d4c7:ca6a","2a0d:6fc2:5560:c200:2108:9467:c6c8:5a90","TCP","1474","443  >  59823 [ACK] Seq=91586 Ack=2178 Win=64128 Len=1400 [TCP segment of a reassembled PDU]"
"883","29.664487","2001:40a8:4400:4::d4c7:ca6a","2a0d:6fc2:5560:c200:2108:9467:c6c8:5a90","TCP","1474","443  >  59823 [ACK] Seq=92986 Ack=2178 Win=64128 Len=1400 [TCP segment of a reassembled PDU]"
"884","29.664487","2001:40a8:4400:4::d4c7:ca6a","2a0d:6fc2:5560:c200:2108:9467:c6c8:5a90","TCP","1474","443  >  59823 [ACK] Seq=94386 Ack=2178 Win=64128 Len=1400 [TCP segment of a reassembled PDU]"
"885","29.664487","2001:40a8:4400:4::d4c7:ca6a","2a0d:6fc2:5560:c200:2108:9467:c6c8:5a90","TLSv1.2","1087","Application Data"
"886","29.664487","2001:40a8:4400:4::d4c7:ca6a","2a0d:6fc2:5560:c200:2108:9467:c6c8:5a90","TCP","1474","443  >  59823 [ACK] Seq=96799 Ack=2178 Win=64128 Len=1400 [TCP segment of a reassembled PDU]"
"887","29.664487","2001:40a8:4400:4::d4c7:ca6a","2a0d:6fc2:5560:c200:2108:9467:c6c8:5a90","TCP","1474","443  >  59823 [ACK] Seq=98199 Ack=2178 Win=64128 Len=1400 [TCP segment of a reassembled PDU]"
"888","29.664487","2001:40a8:4400:4::d4c7:ca6a","2a0d:6fc2:5560:c200:2108:9467:c6c8:5a90","TCP","1474","443  >  59823 [ACK] Seq=99599 Ack=2178 Win=64128 Len=1400 [TCP segment of a reassembled PDU]"
"889","29.664487","2001:40a8:4400:4::d4c7:ca6a","2a0d:6fc2:5560:c200:2108:9467:c6c8:5a90","TCP","1474","443  >  59823 [ACK] Seq=100999 Ack=2178 Win=64128 Len=1400 [TCP segment of a reassembled PDU]"
"890","29.664487","2001:40a8:4400:4::d4c7:ca6a","2a0d:6fc2:5560:c200:2108:9467:c6c8:5a90","TCP","1474","443  >  59823 [ACK] Seq=102399 Ack=2178 Win=64128 Len=1400 [TCP segment of a reassembled PDU]"
"891","29.664487","2001:40a8:4400:4::d4c7:ca6a","2a0d:6fc2:5560:c200:2108:9467:c6c8:5a90","TCP","1474","443  >  59823 [ACK] Seq=103799 Ack=2178 Win=64128 Len=1400 [TCP segment of a reassembled PDU]"
"892","29.664581","2a0d:6fc2:5560:c200:2108:9467:c6c8:5a90","2001:40a8:4400:4::d4c7:ca6a","TCP","74","59823  >  443 [ACK] Seq=2178 Ack=105199 Win=131584 Len=0"
"893","29.665597","2001:40a8:4400:4::d4c7:ca6a","2a0d:6fc2:5560:c200:2108:9467:c6c8:5a90","TCP","1474","443  >  59823 [ACK] Seq=105199 Ack=2178 Win=64128 Len=1400 [TCP segment of a reassembled PDU]"
"894","29.665597","2001:40a8:4400:4::d4c7:ca6a","2a0d:6fc2:5560:c200:2108:9467:c6c8:5a90","TCP","1474","443  >  59823 [ACK] Seq=106599 Ack=2178 Win=64128 Len=1400 [TCP segment of a reassembled PDU]"
"895","29.665597","2001:40a8:4400:4::d4c7:ca6a","2a0d:6fc2:5560:c200:2108:9467:c6c8:5a90","TCP","1474","443  >  59823 [ACK] Seq=107999 Ack=2178 Win=64128 Len=1400 [TCP segment of a reassembled PDU]"
"896","29.665597","2001:40a8:4400:4::d4c7:ca6a","2a0d:6fc2:5560:c200:2108:9467:c6c8:5a90","TCP","1474","443  >  59823 [ACK] Seq=109399 Ack=2178 Win=64128 Len=1400 [TCP segment of a reassembled PDU]"
"897","29.665597","2001:40a8:4400:4::d4c7:ca6a","2a0d:6fc2:5560:c200:2108:9467:c6c8:5a90","TLSv1.2","467","Application Data"
"898","29.665630","2a0d:6fc2:5560:c200:2108:9467:c6c8:5a90","2001:40a8:4400:4::d4c7:ca6a","TCP","74","59823  >  443 [ACK] Seq=2178 Ack=111192 Win=131584 Len=0"
"899","29.750517","2a0d:6fc2:5560:c200:2108:9467:c6c8:5a90","2001:40a8:4400:4::d4c7:ca6a","TLSv1.2","246","Application Data"
"900","29.755160","2001:40a8:4400:4::d4c7:ca6a","2a0d:6fc2:5560:c200:2108:9467:c6c8:5a90","TCP","1474","443  >  59823 [ACK] Seq=111192 Ack=2350 Win=64128 Len=1400 [TCP segment of a reassembled PDU]"
"901","29.755160","2001:40a8:4400:4::d4c7:ca6a","2a0d:6fc2:5560:c200:2108:9467:c6c8:5a90","TCP","1474","443  >  59823 [ACK] Seq=112592 Ack=2350 Win=64128 Len=1400 [TCP segment of a reassembled PDU]"
"902","29.755261","2a0d:6fc2:5560:c200:2108:9467:c6c8:5a90","2001:40a8:4400:4::d4c7:ca6a","TCP","74","59823  >  443 [ACK] Seq=2350 Ack=113992 Win=131584 Len=0"
"903","29.757722","2001:40a8:4400:4::d4c7:ca6a","2a0d:6fc2:5560:c200:2108:9467:c6c8:5a90","TCP","1474","443  >  59823 [ACK] Seq=113992 Ack=2350 Win=64128 Len=1400 [TCP segment of a reassembled PDU]"
"904","29.757722","2001:40a8:4400:4::d4c7:ca6a","2a0d:6fc2:5560:c200:2108:9467:c6c8:5a90","TCP","1474","443  >  59823 [ACK] Seq=115392 Ack=2350 Win=64128 Len=1400 [TCP segment of a reassembled PDU]"
"905","29.757722","2001:40a8:4400:4::d4c7:ca6a","2a0d:6fc2:5560:c200:2108:9467:c6c8:5a90","TLSv1.2","393","Application Data"
"906","29.757816","2a0d:6fc2:5560:c200:2108:9467:c6c8:5a90","2001:40a8:4400:4::d4c7:ca6a","TCP","74","59823  >  443 [ACK] Seq=2350 Ack=117111 Win=131584 Len=0"
"907","29.838104","2a0d:6fc2:5560:c200:2108:9467:c6c8:5a90","2001:40a8:4400:4::d4c7:ca6a","TLSv1.2","249","Application Data"
"908","29.846930","2001:40a8:4400:4::d4c7:ca6a","2a0d:6fc2:5560:c200:2108:9467:c6c8:5a90","TCP","1474","443  >  59823 [ACK] Seq=117111 Ack=2525 Win=64128 Len=1400 [TCP segment of a reassembled PDU]"
"909","29.846930","2001:40a8:4400:4::d4c7:ca6a","2a0d:6fc2:5560:c200:2108:9467:c6c8:5a90","TCP","1474","443  >  59823 [ACK] Seq=118511 Ack=2525 Win=64128 Len=1400 [TCP segment of a reassembled PDU]"
"910","29.846930","2001:40a8:4400:4::d4c7:ca6a","2a0d:6fc2:5560:c200:2108:9467:c6c8:5a90","TCP","1474","443  >  59823 [ACK] Seq=119911 Ack=2525 Win=64128 Len=1400 [TCP segment of a reassembled PDU]"
"911","29.846930","2001:40a8:4400:4::d4c7:ca6a","2a0d:6fc2:5560:c200:2108:9467:c6c8:5a90","TCP","1474","443  >  59823 [ACK] Seq=121311 Ack=2525 Win=64128 Len=1400 [TCP segment of a reassembled PDU]"
"912","29.846930","2001:40a8:4400:4::d4c7:ca6a","2a0d:6fc2:5560:c200:2108:9467:c6c8:5a90","TCP","1474","443  >  59823 [ACK] Seq=122711 Ack=2525 Win=64128 Len=1400 [TCP segment of a reassembled PDU]"
"913","29.846930","2001:40a8:4400:4::d4c7:ca6a","2a0d:6fc2:5560:c200:2108:9467:c6c8:5a90","TCP","1474","443  >  59823 [ACK] Seq=124111 Ack=2525 Win=64128 Len=1400 [TCP segment of a reassembled PDU]"
"914","29.846930","2001:40a8:4400:4::d4c7:ca6a","2a0d:6fc2:5560:c200:2108:9467:c6c8:5a90","TCP","1474","443  >  59823 [ACK] Seq=125511 Ack=2525 Win=64128 Len=1400 [TCP segment of a reassembled PDU]"
"915","29.846930","2001:40a8:4400:4::d4c7:ca6a","2a0d:6fc2:5560:c200:2108:9467:c6c8:5a90","TLSv1.2","331","Application Data"
"916","29.846998","2a0d:6fc2:5560:c200:2108:9467:c6c8:5a90","2001:40a8:4400:4::d4c7:ca6a","TCP","74","59823  >  443 [ACK] Seq=2525 Ack=127168 Win=131584 Len=0"
"917","29.851103","2a0d:6fc2:5560:c200:2108:9467:c6c8:5a90","2001:40a8:4400:4::d4c7:ca6a","TLSv1.2","254","Application Data"
"918","29.853614","2001:40a8:4400:4::d4c7:ca6a","2a0d:6fc2:5560:c200:2108:9467:c6c8:5a90","TCP","1474","443  >  59823 [ACK] Seq=127168 Ack=2705 Win=64128 Len=1400 [TCP segment of a reassembled PDU]"
"919","29.853709","2001:40a8:4400:4::d4c7:ca6a","2a0d:6fc2:5560:c200:2108:9467:c6c8:5a90","TCP","1474","443  >  59823 [ACK] Seq=128568 Ack=2705 Win=64128 Len=1400 [TCP segment of a reassembled PDU]"
"920","29.853720","2a0d:6fc2:5560:c200:2108:9467:c6c8:5a90","2001:40a8:4400:4::d4c7:ca6a","TCP","74","59823  >  443 [ACK] Seq=2705 Ack=129968 Win=131584 Len=0"
"921","29.854626","2001:40a8:4400:4::d4c7:ca6a","2a0d:6fc2:5560:c200:2108:9467:c6c8:5a90","TCP","1474","443  >  59823 [ACK] Seq=129968 Ack=2705 Win=64128 Len=1400 [TCP segment of a reassembled PDU]"
"922","29.854626","2001:40a8:4400:4::d4c7:ca6a","2a0d:6fc2:5560:c200:2108:9467:c6c8:5a90","TCP","1474","443  >  59823 [ACK] Seq=131368 Ack=2705 Win=64128 Len=1400 [TCP segment of a reassembled PDU]"
"923","29.854626","2001:40a8:4400:4::d4c7:ca6a","2a0d:6fc2:5560:c200:2108:9467:c6c8:5a90","TCP","1474","443  >  59823 [ACK] Seq=132768 Ack=2705 Win=64128 Len=1400 [TCP segment of a reassembled PDU]"
"924","29.854626","2001:40a8:4400:4::d4c7:ca6a","2a0d:6fc2:5560:c200:2108:9467:c6c8:5a90","TLSv1.2","479","Application Data"
