"No.","Time","Source","Destination","Protocol","Length","Info"
"1","0.000000","192.168.1.174","34.0.64.255","UDP","227","64156  >  50001 Len=185"
"2","0.004308","34.0.64.255","192.168.1.174","UDP","84","50001  >  64156 Len=42"
"3","0.020180","192.168.1.174","34.0.64.255","UDP","225","64156  >  50001 Len=183"
"4","0.040574","192.168.1.174","34.0.64.255","UDP","219","64156  >  50001 Len=177"
"5","0.061052","192.168.1.174","34.0.64.255","UDP","221","64156  >  50001 Len=179"
"6","0.081398","192.168.1.174","34.0.64.255","UDP","77","64156  >  50001 Len=35"
"7","0.118802","172.217.22.46","192.168.1.174","UDP","79","443  >  50991 Len=37"
"8","0.121050","192.168.1.174","172.217.22.46","UDP","75","50991  >  443 Len=33"
"9","0.232446","192.168.1.174","162.159.137.234","TLSv1.2","115","Application Data"
"10","0.234553","162.159.137.234","192.168.1.174","TCP","60","443  >  53552 [ACK] Seq=1 Ack=62 Win=7 Len=0"
"11","0.279973","162.159.137.234","192.168.1.174","TLSv1.2","111","Application Data"
"12","0.320828","192.168.1.174","162.159.137.234","TCP","54","53552  >  443 [ACK] Seq=62 Ack=58 Win=511 Len=0"
"13","0.368056","192.168.1.174","162.159.137.234","TLSv1.2","142","Application Data"
"14","0.370108","162.159.137.234","192.168.1.174","TCP","60","443  >  53552 [ACK] Seq=58 Ack=150 Win=7 Len=0"
"15","0.460763","192.168.1.115","255.255.255.255","UDP","207","49156  >  20002 Len=165"
"16","0.481309","192.168.1.174","34.0.64.255","UDP","122","64156  >  50001 Len=80"
"17","0.486458","192.168.1.174","34.0.64.255","UDP","225","64156  >  50001 Len=183"
"18","0.498689","192.168.1.174","34.0.64.255","UDP","122","64156  >  50001 Len=80"
"19","0.503395","192.168.1.174","34.0.64.255","UDP","77","64156  >  50001 Len=35"
"20","0.505627","192.168.1.174","34.0.64.255","UDP","122","64156  >  50001 Len=80"
"21","0.841568","192.168.1.174","34.0.64.255","UDP","112","64156  >  50001 Len=70"
"22","0.901726","192.168.1.174","34.0.64.255","UDP","222","64156  >  50001 Len=180"
"23","0.921296","192.168.1.174","34.0.64.255","UDP","77","64156  >  50001 Len=35"
"24","0.952988","34.0.64.255","192.168.1.174","UDP","88","50001  >  64156 Len=46"
"25","1.151393","172.217.22.10","192.168.1.174","UDP","121","443  >  55693 Len=79"
"26","1.152945","192.168.1.174","172.217.22.10","UDP","75","55693  >  443 Len=33"
"27","1.280957","192.168.1.174","34.0.64.255","UDP","217","64156  >  50001 Len=175"
"28","1.300208","192.168.1.174","34.0.64.255","UDP","224","64156  >  50001 Len=182"
"29","1.306824","192.168.1.174","162.159.137.234","TLSv1.2","142","Application Data"
"30","1.309169","162.159.137.234","192.168.1.174","TCP","60","443  >  53552 [ACK] Seq=58 Ack=238 Win=7 Len=0"
"31","1.320053","192.168.1.174","34.0.64.255","UDP","229","64156  >  50001 Len=187"
"32","1.323981","34.0.64.255","192.168.1.174","UDP","88","50001  >  64156 Len=46"
"33","1.340216","192.168.1.174","34.0.64.255","UDP","245","64156  >  50001 Len=203"
"34","1.359864","192.168.1.174","34.0.64.255","UDP","235","64156  >  50001 Len=193"
"35","1.375756","2a0d:6fc2:5560:c200:15f4:c1ab:865a:2377","2a03:2880:f276:cd:face:b00c:0:167","TLSv1.2","134","Application Data"
"36","1.380408","192.168.1.174","34.0.64.255","UDP","226","64156  >  50001 Len=184"
"37","1.387806","192.168.1.174","34.0.64.255","UDP","88","64156  >  50001 Len=46"
"38","1.399934","192.168.1.174","34.0.64.255","UDP","219","64156  >  50001 Len=177"
"39","1.419832","192.168.1.174","34.0.64.255","UDP","219","64156  >  50001 Len=177"
"40","1.420643","2a0d:6fc2:5560:c200:15f4:c1ab:865a:2377","2a00:1450:4028:1::a","TCP","1474","51049  >  443 [ACK] Seq=1 Ack=1 Win=16504 Len=1400 [TCP segment of a reassembled PDU]"
"41","1.420643","2a0d:6fc2:5560:c200:15f4:c1ab:865a:2377","2a00:1450:4028:1::a","TLSv1.2","1057","Application Data"
"42","1.420688","2a0d:6fc2:5560:c200:15f4:c1ab:865a:2377","2a00:1450:4028:1::a","TLSv1.2","98","Application Data"
"43","1.424387","34.0.64.255","192.168.1.174","UDP","84","50001  >  64156 Len=42"
"44","1.424387","2a00:1450:4028:1::a","2a0d:6fc2:5560:c200:15f4:c1ab:865a:2377","TCP","74","443  >  51049 [ACK] Seq=1 Ack=2384 Win=541 Len=0"
"45","1.426307","2a00:1450:4028:1::a","2a0d:6fc2:5560:c200:15f4:c1ab:865a:2377","TLSv1.2","1294","Application Data, Application Data, Application Data, Application Data, Application Data"
"46","1.426307","2a00:1450:4028:1::a","2a0d:6fc2:5560:c200:15f4:c1ab:865a:2377","TLSv1.2","1294","Application Data"
"47","1.426307","2a00:1450:4028:1::a","2a0d:6fc2:5560:c200:15f4:c1ab:865a:2377","TCP","1294","443  >  51049 [ACK] Seq=2441 Ack=2408 Win=541 Len=1220 [TCP segment of a reassembled PDU]"
"48","1.426343","2a0d:6fc2:5560:c200:15f4:c1ab:865a:2377","2a00:1450:4028:1::a","TCP","74","51049  >  443 [ACK] Seq=2408 Ack=3661 Win=16504 Len=0"
"49","1.428769","2a00:1450:4028:1::a","2a0d:6fc2:5560:c200:15f4:c1ab:865a:2377","TCP","1294","443  >  51049 [ACK] Seq=3661 Ack=2408 Win=541 Len=1220 [TCP segment of a reassembled PDU]"
"50","1.428769","2a00:1450:4028:1::a","2a0d:6fc2:5560:c200:15f4:c1ab:865a:2377","TCP","1294","443  >  51049 [ACK] Seq=4881 Ack=2408 Win=541 Len=1220 [TCP segment of a reassembled PDU]"
"51","1.428769","2a00:1450:4028:1::a","2a0d:6fc2:5560:c200:15f4:c1ab:865a:2377","TCP","1294","443  >  51049 [ACK] Seq=6101 Ack=2408 Win=541 Len=1220 [TCP segment of a reassembled PDU]"
"52","1.428769","2a00:1450:4028:1::a","2a0d:6fc2:5560:c200:15f4:c1ab:865a:2377","TCP","1294","443  >  51049 [ACK] Seq=7321 Ack=2408 Win=541 Len=1220 [TCP segment of a reassembled PDU]"
"53","1.428769","2a00:1450:4028:1::a","2a0d:6fc2:5560:c200:15f4:c1ab:865a:2377","TCP","1294","443  >  51049 [ACK] Seq=8541 Ack=2408 Win=541 Len=1220 [TCP segment of a reassembled PDU]"
"54","1.428769","2a00:1450:4028:1::a","2a0d:6fc2:5560:c200:15f4:c1ab:865a:2377","TCP","1294","443  >  51049 [ACK] Seq=9761 Ack=2408 Win=541 Len=1220 [TCP segment of a reassembled PDU]"
"55","1.428769","2a00:1450:4028:1::a","2a0d:6fc2:5560:c200:15f4:c1ab:865a:2377","TCP","1294","443  >  51049 [ACK] Seq=10981 Ack=2408 Win=541 Len=1220 [TCP segment of a reassembled PDU]"
"56","1.428769","2a00:1450:4028:1::a","2a0d:6fc2:5560:c200:15f4:c1ab:865a:2377","TCP","1294","443  >  51049 [ACK] Seq=12201 Ack=2408 Win=541 Len=1220 [TCP segment of a reassembled PDU]"
"57","1.428769","2a00:1450:4028:1::a","2a0d:6fc2:5560:c200:15f4:c1ab:865a:2377","TCP","1294","443  >  51049 [ACK] Seq=13421 Ack=2408 Win=541 Len=1220 [TCP segment of a reassembled PDU]"
"58","1.428769","2a00:1450:4028:1::a","2a0d:6fc2:5560:c200:15f4:c1ab:865a:2377","TCP","1294","443  >  51049 [ACK] Seq=14641 Ack=2408 Win=541 Len=1220 [TCP segment of a reassembled PDU]"
"59","1.428769","2a00:1450:4028:1::a","2a0d:6fc2:5560:c200:15f4:c1ab:865a:2377","TCP","1294","443  >  51049 [ACK] Seq=15861 Ack=2408 Win=541 Len=1220 [TCP segment of a reassembled PDU]"
"60","1.428769","2a00:1450:4028:1::a","2a0d:6fc2:5560:c200:15f4:c1ab:865a:2377","TLSv1.2","1294","Application Data"
"61","1.428769","2a00:1450:4028:1::a","2a0d:6fc2:5560:c200:15f4:c1ab:865a:2377","TCP","1294","443  >  51049 [ACK] Seq=18301 Ack=2408 Win=541 Len=1220 [TCP segment of a reassembled PDU]"
"62","1.428769","2a00:1450:4028:1::a","2a0d:6fc2:5560:c200:15f4:c1ab:865a:2377","TCP","1294","443  >  51049 [ACK] Seq=19521 Ack=2408 Win=541 Len=1220 [TCP segment of a reassembled PDU]"
"63","1.428769","2a00:1450:4028:1::a","2a0d:6fc2:5560:c200:15f4:c1ab:865a:2377","TCP","1294","443  >  51049 [ACK] Seq=20741 Ack=2408 Win=541 Len=1220 [TCP segment of a reassembled PDU]"
"64","1.428769","2a00:1450:4028:1::a","2a0d:6fc2:5560:c200:15f4:c1ab:865a:2377","TCP","1294","443  >  51049 [PSH, ACK] Seq=21961 Ack=2408 Win=541 Len=1220 [TCP segment of a reassembled PDU]"
"65","1.428840","2a0d:6fc2:5560:c200:15f4:c1ab:865a:2377","2a00:1450:4028:1::a","TCP","74","51049  >  443 [ACK] Seq=2408 Ack=23181 Win=16504 Len=0"
"66","1.433941","2a00:1450:4028:1::a","2a0d:6fc2:5560:c200:15f4:c1ab:865a:2377","TCP","1294","443  >  51049 [ACK] Seq=23181 Ack=2408 Win=541 Len=1220 [TCP segment of a reassembled PDU]"
"67","1.433941","2a00:1450:4028:1::a","2a0d:6fc2:5560:c200:15f4:c1ab:865a:2377","TCP","1294","443  >  51049 [ACK] Seq=24401 Ack=2408 Win=541 Len=1220 [TCP segment of a reassembled PDU]"
"68","1.433941","2a00:1450:4028:1::a","2a0d:6fc2:5560:c200:15f4:c1ab:865a:2377","TCP","1294","443  >  51049 [ACK] Seq=25621 Ack=2408 Win=541 Len=1220 [TCP segment of a reassembled PDU]"
"69","1.433941","2a00:1450:4028:1::a","2a0d:6fc2:5560:c200:15f4:c1ab:865a:2377","TCP","1294","443  >  51049 [ACK] Seq=26841 Ack=2408 Win=541 Len=1220 [TCP segment of a reassembled PDU]"
"70","1.433941","2a00:1450:4028:1::a","2a0d:6fc2:5560:c200:15f4:c1ab:865a:2377","TCP","1294","443  >  51049 [ACK] Seq=28061 Ack=2408 Win=541 Len=1220 [TCP segment of a reassembled PDU]"
"71","1.433941","2a00:1450:4028:1::a","2a0d:6fc2:5560:c200:15f4:c1ab:865a:2377","TCP","1294","443  >  51049 [ACK] Seq=29281 Ack=2408 Win=541 Len=1220 [TCP segment of a reassembled PDU]"
"72","1.433941","2a00:1450:4028:1::a","2a0d:6fc2:5560:c200:15f4:c1ab:865a:2377","TCP","1294","443  >  51049 [ACK] Seq=30501 Ack=2408 Win=541 Len=1220 [TCP segment of a reassembled PDU]"
"73","1.433941","2a00:1450:4028:1::a","2a0d:6fc2:5560:c200:15f4:c1ab:865a:2377","TCP","1294","443  >  51049 [ACK] Seq=31721 Ack=2408 Win=541 Len=1220 [TCP segment of a reassembled PDU]"
"74","1.433941","2a00:1450:4028:1::a","2a0d:6fc2:5560:c200:15f4:c1ab:865a:2377","TLSv1.2","1294","Application Data"
"75","1.433941","2a00:1450:4028:1::a","2a0d:6fc2:5560:c200:15f4:c1ab:865a:2377","TCP","1294","443  >  51049 [ACK] Seq=34161 Ack=2408 Win=541 Len=1220 [TCP segment of a reassembled PDU]"
"76","1.433941","2a00:1450:4028:1::a","2a0d:6fc2:5560:c200:15f4:c1ab:865a:2377","TCP","1294","443  >  51049 [ACK] Seq=35381 Ack=2408 Win=541 Len=1220 [TCP segment of a reassembled PDU]"
"77","1.433941","2a00:1450:4028:1::a","2a0d:6fc2:5560:c200:15f4:c1ab:865a:2377","TCP","1294","443  >  51049 [ACK] Seq=36601 Ack=2408 Win=541 Len=1220 [TCP segment of a reassembled PDU]"
"78","1.433941","2a00:1450:4028:1::a","2a0d:6fc2:5560:c200:15f4:c1ab:865a:2377","TCP","1294","443  >  51049 [ACK] Seq=37821 Ack=2408 Win=541 Len=1220 [TCP segment of a reassembled PDU]"
"79","1.433941","2a00:1450:4028:1::a","2a0d:6fc2:5560:c200:15f4:c1ab:865a:2377","TCP","1294","443  >  51049 [ACK] Seq=39041 Ack=2408 Win=541 Len=1220 [TCP segment of a reassembled PDU]"
"80","1.433941","2a00:1450:4028:1::a","2a0d:6fc2:5560:c200:15f4:c1ab:865a:2377","TCP","1294","443  >  51049 [ACK] Seq=40261 Ack=2408 Win=541 Len=1220 [TCP segment of a reassembled PDU]"
"81","1.433941","2a00:1450:4028:1::a","2a0d:6fc2:5560:c200:15f4:c1ab:865a:2377","TCP","1294","443  >  51049 [ACK] Seq=41481 Ack=2408 Win=541 Len=1220 [TCP segment of a reassembled PDU]"
"82","1.433941","2a00:1450:4028:1::a","2a0d:6fc2:5560:c200:15f4:c1ab:865a:2377","TCP","1294","443  >  51049 [ACK] Seq=42701 Ack=2408 Win=541 Len=1220 [TCP segment of a reassembled PDU]"
"83","1.433941","2a00:1450:4028:1::a","2a0d:6fc2:5560:c200:15f4:c1ab:865a:2377","TCP","1294","443  >  51049 [ACK] Seq=43921 Ack=2408 Win=541 Len=1220 [TCP segment of a reassembled PDU]"
"84","1.433941","2a00:1450:4028:1::a","2a0d:6fc2:5560:c200:15f4:c1ab:865a:2377","TCP","1294","443  >  51049 [PSH, ACK] Seq=45141 Ack=2408 Win=541 Len=1220 [TCP segment of a reassembled PDU]"
"85","1.433941","2a00:1450:4028:1::a","2a0d:6fc2:5560:c200:15f4:c1ab:865a:2377","TCP","1294","443  >  51049 [ACK] Seq=46361 Ack=2408 Win=541 Len=1220 [TCP segment of a reassembled PDU]"
"86","1.433941","2a00:1450:4028:1::a","2a0d:6fc2:5560:c200:15f4:c1ab:865a:2377","TCP","1294","443  >  51049 [ACK] Seq=47581 Ack=2408 Win=541 Len=1220 [TCP segment of a reassembled PDU]"
"87","1.433941","2a00:1450:4028:1::a","2a0d:6fc2:5560:c200:15f4:c1ab:865a:2377","TCP","1294","443  >  51049 [ACK] Seq=48801 Ack=2408 Win=541 Len=1220 [TCP segment of a reassembled PDU]"
"88","1.433941","2a00:1450:4028:1::a","2a0d:6fc2:5560:c200:15f4:c1ab:865a:2377","TLSv1.2","1294","Application Data"
"89","1.433941","2a00:1450:4028:1::a","2a0d:6fc2:5560:c200:15f4:c1ab:865a:2377","TCP","1294","443  >  51049 [ACK] Seq=51241 Ack=2408 Win=541 Len=1220 [TCP segment of a reassembled PDU]"
"90","1.433941","2a00:1450:4028:1::a","2a0d:6fc2:5560:c200:15f4:c1ab:865a:2377","TCP","1294","443  >  51049 [ACK] Seq=52461 Ack=2408 Win=541 Len=1220 [TCP segment of a reassembled PDU]"
"91","1.433941","2a00:1450:4028:1::a","2a0d:6fc2:5560:c200:15f4:c1ab:865a:2377","TCP","1294","443  >  51049 [ACK] Seq=53681 Ack=2408 Win=541 Len=1220 [TCP segment of a reassembled PDU]"
"92","1.433941","2a00:1450:4028:1::a","2a0d:6fc2:5560:c200:15f4:c1ab:865a:2377","TCP","1294","443  >  51049 [ACK] Seq=54901 Ack=2408 Win=541 Len=1220 [TCP segment of a reassembled PDU]"
"93","1.433941","2a00:1450:4028:1::a","2a0d:6fc2:5560:c200:15f4:c1ab:865a:2377","TCP","1294","443  >  51049 [ACK] Seq=56121 Ack=2408 Win=541 Len=1220 [TCP segment of a reassembled PDU]"
"94","1.433941","2a00:1450:4028:1::a","2a0d:6fc2:5560:c200:15f4:c1ab:865a:2377","TCP","1294","443  >  51049 [ACK] Seq=57341 Ack=2408 Win=541 Len=1220 [TCP segment of a reassembled PDU]"
"95","1.433941","2a00:1450:4028:1::a","2a0d:6fc2:5560:c200:15f4:c1ab:865a:2377","TCP","1294","443  >  51049 [ACK] Seq=58561 Ack=2408 Win=541 Len=1220 [TCP segment of a reassembled PDU]"
"96","1.433941","2a00:1450:4028:1::a","2a0d:6fc2:5560:c200:15f4:c1ab:865a:2377","TCP","1294","443  >  51049 [ACK] Seq=59781 Ack=2408 Win=541 Len=1220 [TCP segment of a reassembled PDU]"
"97","1.433941","2a00:1450:4028:1::a","2a0d:6fc2:5560:c200:15f4:c1ab:865a:2377","TCP","1294","443  >  51049 [ACK] Seq=61001 Ack=2408 Win=541 Len=1220 [TCP segment of a reassembled PDU]"
"98","1.434030","2a0d:6fc2:5560:c200:15f4:c1ab:865a:2377","2a00:1450:4028:1::a","TCP","74","51049  >  443 [ACK] Seq=2408 Ack=62221 Win=16504 Len=0"
"99","1.434072","2a00:1450:4028:1::a","2a0d:6fc2:5560:c200:15f4:c1ab:865a:2377","TCP","1294","443  >  51049 [ACK] Seq=62221 Ack=2408 Win=541 Len=1220 [TCP segment of a reassembled PDU]"
"100","1.434072","2a00:1450:4028:1::a","2a0d:6fc2:5560:c200:15f4:c1ab:865a:2377","TCP","1294","443  >  51049 [ACK] Seq=63441 Ack=2408 Win=541 Len=1220 [TCP segment of a reassembled PDU]"
"101","1.434072","2a00:1450:4028:1::a","2a0d:6fc2:5560:c200:15f4:c1ab:865a:2377","TCP","1294","443  >  51049 [ACK] Seq=64661 Ack=2408 Win=541 Len=1220 [TCP segment of a reassembled PDU]"
"102","1.434072","2a00:1450:4028:1::a","2a0d:6fc2:5560:c200:15f4:c1ab:865a:2377","TLSv1.2","1294","Application Data"
"103","1.434072","2a00:1450:4028:1::a","2a0d:6fc2:5560:c200:15f4:c1ab:865a:2377","TCP","1294","443  >  51049 [ACK] Seq=67101 Ack=2408 Win=541 Len=1220 [TCP segment of a reassembled PDU]"
"104","1.434072","2a00:1450:4028:1::a","2a0d:6fc2:5560:c200:15f4:c1ab:865a:2377","TCP","1294","443  >  51049 [PSH, ACK] Seq=68321 Ack=2408 Win=541 Len=1220 [TCP segment of a reassembled PDU]"
"105","1.434072","2a00:1450:4028:1::a","2a0d:6fc2:5560:c200:15f4:c1ab:865a:2377","TCP","1294","443  >  51049 [ACK] Seq=69541 Ack=2408 Win=541 Len=1220 [TCP segment of a reassembled PDU]"
"106","1.434072","2a00:1450:4028:1::a","2a0d:6fc2:5560:c200:15f4:c1ab:865a:2377","TCP","1294","443  >  51049 [ACK] Seq=70761 Ack=2408 Win=541 Len=1220 [TCP segment of a reassembled PDU]"
"107","1.434072","2a00:1450:4028:1::a","2a0d:6fc2:5560:c200:15f4:c1ab:865a:2377","TCP","1294","443  >  51049 [ACK] Seq=71981 Ack=2408 Win=541 Len=1220 [TCP segment of a reassembled PDU]"
"108","1.434072","2a00:1450:4028:1::a","2a0d:6fc2:5560:c200:15f4:c1ab:865a:2377","TCP","1294","443  >  51049 [ACK] Seq=73201 Ack=2408 Win=541 Len=1220 [TCP segment of a reassembled PDU]"
"109","1.434072","2a00:1450:4028:1::a","2a0d:6fc2:5560:c200:15f4:c1ab:865a:2377","TCP","1294","443  >  51049 [ACK] Seq=74421 Ack=2408 Win=541 Len=1220 [TCP segment of a reassembled PDU]"
"110","1.434072","2a00:1450:4028:1::a","2a0d:6fc2:5560:c200:15f4:c1ab:865a:2377","TCP","1294","443  >  51049 [ACK] Seq=75641 Ack=2408 Win=541 Len=1220 [TCP segment of a reassembled PDU]"
"111","1.434072","2a00:1450:4028:1::a","2a0d:6fc2:5560:c200:15f4:c1ab:865a:2377","TCP","1294","443  >  51049 [ACK] Seq=76861 Ack=2408 Win=541 Len=1220 [TCP segment of a reassembled PDU]"
"112","1.434072","2a00:1450:4028:1::a","2a0d:6fc2:5560:c200:15f4:c1ab:865a:2377","TCP","1294","443  >  51049 [ACK] Seq=78081 Ack=2408 Win=541 Len=1220 [TCP segment of a reassembled PDU]"
"113","1.434072","2a00:1450:4028:1::a","2a0d:6fc2:5560:c200:15f4:c1ab:865a:2377","TCP","1294","443  >  51049 [ACK] Seq=79301 Ack=2408 Win=541 Len=1220 [TCP segment of a reassembled PDU]"
"114","1.434072","2a00:1450:4028:1::a","2a0d:6fc2:5560:c200:15f4:c1ab:865a:2377","TCP","1294","443  >  51049 [ACK] Seq=80521 Ack=2408 Win=541 Len=1220 [TCP segment of a reassembled PDU]"
"115","1.434072","2a00:1450:4028:1::a","2a0d:6fc2:5560:c200:15f4:c1ab:865a:2377","TCP","1294","443  >  51049 [ACK] Seq=81741 Ack=2408 Win=541 Len=1220 [TCP segment of a reassembled PDU]"
"116","1.434072","2a00:1450:4028:1::a","2a0d:6fc2:5560:c200:15f4:c1ab:865a:2377","TLSv1.2","1294","Application Data"
"117","1.434072","2a00:1450:4028:1::a","2a0d:6fc2:5560:c200:15f4:c1ab:865a:2377","TCP","1294","443  >  51049 [ACK] Seq=84181 Ack=2408 Win=541 Len=1220 [TCP segment of a reassembled PDU]"
"118","1.434072","2a00:1450:4028:1::a","2a0d:6fc2:5560:c200:15f4:c1ab:865a:2377","TLSv1.2","904","Application Data, Application Data"
"119","1.434110","2a0d:6fc2:5560:c200:15f4:c1ab:865a:2377","2a00:1450:4028:1::a","TCP","74","51049  >  443 [ACK] Seq=2408 Ack=86231 Win=16504 Len=0"
"120","1.435017","2a03:2880:f276:cd:face:b00c:0:167","2a0d:6fc2:5560:c200:15f4:c1ab:865a:2377","TCP","74","443  >  51017 [ACK] Seq=1 Ack=61 Win=5500 Len=0"
"121","1.440235","192.168.1.174","34.0.64.255","UDP","228","64156  >  50001 Len=186"
"122","1.450979","2a00:1450:4028:1::a","2a0d:6fc2:5560:c200:15f4:c1ab:865a:2377","TLSv1.2","1294","Application Data, Application Data"
"123","1.450979","2a00:1450:4028:1::a","2a0d:6fc2:5560:c200:15f4:c1ab:865a:2377","TCP","1294","443  >  51049 [ACK] Seq=87451 Ack=2408 Win=541 Len=1220 [TCP segment of a reassembled PDU]"
"124","1.450979","2a00:1450:4028:1::a","2a0d:6fc2:5560:c200:15f4:c1ab:865a:2377","TCP","1294","443  >  51049 [ACK] Seq=88671 Ack=2408 Win=541 Len=1220 [TCP segment of a reassembled PDU]"
"125","1.450979","2a00:1450:4028:1::a","2a0d:6fc2:5560:c200:15f4:c1ab:865a:2377","TCP","1294","443  >  51049 [ACK] Seq=89891 Ack=2408 Win=541 Len=1220 [TCP segment of a reassembled PDU]"
"126","1.450979","2a00:1450:4028:1::a","2a0d:6fc2:5560:c200:15f4:c1ab:865a:2377","TCP","1294","443  >  51049 [ACK] Seq=91111 Ack=2408 Win=541 Len=1220 [TCP segment of a reassembled PDU]"
"127","1.450979","2a00:1450:4028:1::a","2a0d:6fc2:5560:c200:15f4:c1ab:865a:2377","TCP","1294","443  >  51049 [ACK] Seq=92331 Ack=2408 Win=541 Len=1220 [TCP segment of a reassembled PDU]"
"128","1.450979","2a00:1450:4028:1::a","2a0d:6fc2:5560:c200:15f4:c1ab:865a:2377","TCP","1294","443  >  51049 [ACK] Seq=93551 Ack=2408 Win=541 Len=1220 [TCP segment of a reassembled PDU]"
"129","1.450979","2a00:1450:4028:1::a","2a0d:6fc2:5560:c200:15f4:c1ab:865a:2377","TCP","1294","443  >  51049 [ACK] Seq=94771 Ack=2408 Win=541 Len=1220 [TCP segment of a reassembled PDU]"
"130","1.450979","2a00:1450:4028:1::a","2a0d:6fc2:5560:c200:15f4:c1ab:865a:2377","TCP","1294","443  >  51049 [ACK] Seq=95991 Ack=2408 Win=541 Len=1220 [TCP segment of a reassembled PDU]"
"131","1.450979","2a00:1450:4028:1::a","2a0d:6fc2:5560:c200:15f4:c1ab:865a:2377","TCP","1294","443  >  51049 [ACK] Seq=97211 Ack=2408 Win=541 Len=1220 [TCP segment of a reassembled PDU]"
"132","1.450979","2a00:1450:4028:1::a","2a0d:6fc2:5560:c200:15f4:c1ab:865a:2377","TCP","1294","443  >  51049 [ACK] Seq=98431 Ack=2408 Win=541 Len=1220 [TCP segment of a reassembled PDU]"
"133","1.451063","2a0d:6fc2:5560:c200:15f4:c1ab:865a:2377","2a00:1450:4028:1::a","TCP","74","51049  >  443 [ACK] Seq=2408 Ack=99651 Win=16504 Len=0"
"134","1.457006","2a00:1450:4028:1::a","2a0d:6fc2:5560:c200:15f4:c1ab:865a:2377","TCP","1294","443  >  51049 [ACK] Seq=99651 Ack=2408 Win=541 Len=1220 [TCP segment of a reassembled PDU]"
"135","1.457006","2a00:1450:4028:1::a","2a0d:6fc2:5560:c200:15f4:c1ab:865a:2377","TCP","1294","443  >  51049 [ACK] Seq=100871 Ack=2408 Win=541 Len=1220 [TCP segment of a reassembled PDU]"
"136","1.457006","2a00:1450:4028:1::a","2a0d:6fc2:5560:c200:15f4:c1ab:865a:2377","TLSv1.2","1294","Application Data"
"137","1.457006","2a00:1450:4028:1::a","2a0d:6fc2:5560:c200:15f4:c1ab:865a:2377","TCP","1294","443  >  51049 [ACK] Seq=103311 Ack=2408 Win=541 Len=1220 [TCP segment of a reassembled PDU]"
"138","1.457006","2a00:1450:4028:1::a","2a0d:6fc2:5560:c200:15f4:c1ab:865a:2377","TCP","1294","443  >  51049 [ACK] Seq=104531 Ack=2408 Win=541 Len=1220 [TCP segment of a reassembled PDU]"
"139","1.457006","2a00:1450:4028:1::a","2a0d:6fc2:5560:c200:15f4:c1ab:865a:2377","TCP","1294","443  >  51049 [ACK] Seq=105751 Ack=2408 Win=541 Len=1220 [TCP segment of a reassembled PDU]"
"140","1.457006","2a00:1450:4028:1::a","2a0d:6fc2:5560:c200:15f4:c1ab:865a:2377","TCP","1294","443  >  51049 [ACK] Seq=106971 Ack=2408 Win=541 Len=1220 [TCP segment of a reassembled PDU]"
"141","1.457006","2a00:1450:4028:1::a","2a0d:6fc2:5560:c200:15f4:c1ab:865a:2377","TCP","1294","443  >  51049 [PSH, ACK] Seq=108191 Ack=2408 Win=541 Len=1220 [TCP segment of a reassembled PDU]"
"142","1.457006","2a00:1450:4028:1::a","2a0d:6fc2:5560:c200:15f4:c1ab:865a:2377","TCP","1294","443  >  51049 [ACK] Seq=109411 Ack=2408 Win=541 Len=1220 [TCP segment of a reassembled PDU]"
"143","1.457006","2a00:1450:4028:1::a","2a0d:6fc2:5560:c200:15f4:c1ab:865a:2377","TCP","1294","443  >  51049 [ACK] Seq=110631 Ack=2408 Win=541 Len=1220 [TCP segment of a reassembled PDU]"
"144","1.457006","2a00:1450:4028:1::a","2a0d:6fc2:5560:c200:15f4:c1ab:865a:2377","TCP","1294","443  >  51049 [ACK] Seq=111851 Ack=2408 Win=541 Len=1220 [TCP segment of a reassembled PDU]"
"145","1.457006","2a00:1450:4028:1::a","2a0d:6fc2:5560:c200:15f4:c1ab:865a:2377","TCP","1294","443  >  51049 [ACK] Seq=113071 Ack=2408 Win=541 Len=1220 [TCP segment of a reassembled PDU]"
"146","1.457006","2a00:1450:4028:1::a","2a0d:6fc2:5560:c200:15f4:c1ab:865a:2377","TCP","1294","443  >  51049 [ACK] Seq=114291 Ack=2408 Win=541 Len=1220 [TCP segment of a reassembled PDU]"
"147","1.457006","2a00:1450:4028:1::a","2a0d:6fc2:5560:c200:15f4:c1ab:865a:2377","TCP","1294","443  >  51049 [ACK] Seq=115511 Ack=2408 Win=541 Len=1220 [TCP segment of a reassembled PDU]"
"148","1.457006","2a00:1450:4028:1::a","2a0d:6fc2:5560:c200:15f4:c1ab:865a:2377","TCP","1294","443  >  51049 [ACK] Seq=116731 Ack=2408 Win=541 Len=1220 [TCP segment of a reassembled PDU]"
"149","1.457006","2a00:1450:4028:1::a","2a0d:6fc2:5560:c200:15f4:c1ab:865a:2377","TLSv1.2","1294","Application Data"
"150","1.457006","2a00:1450:4028:1::a","2a0d:6fc2:5560:c200:15f4:c1ab:865a:2377","TCP","1294","443  >  51049 [ACK] Seq=119171 Ack=2408 Win=541 Len=1220 [TCP segment of a reassembled PDU]"
"151","1.457006","2a00:1450:4028:1::a","2a0d:6fc2:5560:c200:15f4:c1ab:865a:2377","TCP","1294","443  >  51049 [ACK] Seq=120391 Ack=2408 Win=541 Len=1220 [TCP segment of a reassembled PDU]"
"152","1.457006","2a00:1450:4028:1::a","2a0d:6fc2:5560:c200:15f4:c1ab:865a:2377","TCP","1294","443  >  51049 [ACK] Seq=121611 Ack=2408 Win=541 Len=1220 [TCP segment of a reassembled PDU]"
"153","1.457006","2a00:1450:4028:1::a","2a0d:6fc2:5560:c200:15f4:c1ab:865a:2377","TCP","1294","443  >  51049 [ACK] Seq=122831 Ack=2408 Win=541 Len=1220 [TCP segment of a reassembled PDU]"
"154","1.457006","2a00:1450:4028:1::a","2a0d:6fc2:5560:c200:15f4:c1ab:865a:2377","TCP","1294","443  >  51049 [ACK] Seq=124051 Ack=2408 Win=541 Len=1220 [TCP segment of a reassembled PDU]"
"155","1.457006","2a00:1450:4028:1::a","2a0d:6fc2:5560:c200:15f4:c1ab:865a:2377","TCP","1294","443  >  51049 [ACK] Seq=125271 Ack=2408 Win=541 Len=1220 [TCP segment of a reassembled PDU]"
"156","1.457006","2a00:1450:4028:1::a","2a0d:6fc2:5560:c200:15f4:c1ab:865a:2377","TCP","1294","443  >  51049 [ACK] Seq=126491 Ack=2408 Win=541 Len=1220 [TCP segment of a reassembled PDU]"
"157","1.457006","2a00:1450:4028:1::a","2a0d:6fc2:5560:c200:15f4:c1ab:865a:2377","TCP","1294","443  >  51049 [ACK] Seq=127711 Ack=2408 Win=541 Len=1220 [TCP segment of a reassembled PDU]"
"158","1.457006","2a00:1450:4028:1::a","2a0d:6fc2:5560:c200:15f4:c1ab:865a:2377","TCP","1294","443  >  51049 [ACK] Seq=128931 Ack=2408 Win=541 Len=1220 [TCP segment of a reassembled PDU]"
"159","1.457006","2a00:1450:4028:1::a","2a0d:6fc2:5560:c200:15f4:c1ab:865a:2377","TCP","1294","443  >  51049 [ACK] Seq=130151 Ack=2408 Win=541 Len=1220 [TCP segment of a reassembled PDU]"
"160","1.457006","2a00:1450:4028:1::a","2a0d:6fc2:5560:c200:15f4:c1ab:865a:2377","TCP","1294","443  >  51049 [PSH, ACK] Seq=131371 Ack=2408 Win=541 Len=1220 [TCP segment of a reassembled PDU]"
"161","1.457006","2a00:1450:4028:1::a","2a0d:6fc2:5560:c200:15f4:c1ab:865a:2377","TCP","1294","443  >  51049 [ACK] Seq=132591 Ack=2408 Win=541 Len=1220 [TCP segment of a reassembled PDU]"
"162","1.457006","2a00:1450:4028:1::a","2a0d:6fc2:5560:c200:15f4:c1ab:865a:2377","TCP","1294","443  >  51049 [ACK] Seq=133811 Ack=2408 Win=541 Len=1220 [TCP segment of a reassembled PDU]"
"163","1.457006","2a00:1450:4028:1::a","2a0d:6fc2:5560:c200:15f4:c1ab:865a:2377","TLSv1.2","1294","Application Data"
"164","1.457006","2a00:1450:4028:1::a","2a0d:6fc2:5560:c200:15f4:c1ab:865a:2377","TCP","1294","443  >  51049 [ACK] Seq=136251 Ack=2408 Win=541 Len=1220 [TCP segment of a reassembled PDU]"
"165","1.457006","2a00:1450:4028:1::a","2a0d:6fc2:5560:c200:15f4:c1ab:865a:2377","TCP","1294","443  >  51049 [ACK] Seq=137471 Ack=2408 Win=541 Len=1220 [TCP segment of a reassembled PDU]"
"166","1.457122","2a0d:6fc2:5560:c200:15f4:c1ab:865a:2377","2a00:1450:4028:1::a","TCP","74","51049  >  443 [ACK] Seq=2408 Ack=138691 Win=16504 Len=0"
"167","1.457178","2a00:1450:4028:1::a","2a0d:6fc2:5560:c200:15f4:c1ab:865a:2377","TCP","1294","443  >  51049 [ACK] Seq=138691 Ack=2408 Win=541 Len=1220 [TCP segment of a reassembled PDU]"
"168","1.457178","2a00:1450:4028:1::a","2a0d:6fc2:5560:c200:15f4:c1ab:865a:2377","TCP","1294","443  >  51049 [ACK] Seq=139911 Ack=2408 Win=541 Len=1220 [TCP segment of a reassembled PDU]"
"169","1.457178","2a00:1450:4028:1::a","2a0d:6fc2:5560:c200:15f4:c1ab:865a:2377","TCP","1294","443  >  51049 [ACK] Seq=141131 Ack=2408 Win=541 Len=1220 [TCP segment of a reassembled PDU]"
"170","1.457178","2a00:1450:4028:1::a","2a0d:6fc2:5560:c200:15f4:c1ab:865a:2377","TCP","1294","443  >  51049 [ACK] Seq=142351 Ack=2408 Win=541 Len=1220 [TCP segment of a reassembled PDU]"
"171","1.457178","2a00:1450:4028:1::a","2a0d:6fc2:5560:c200:15f4:c1ab:865a:2377","TCP","1294","443  >  51049 [ACK] Seq=143571 Ack=2408 Win=541 Len=1220 [TCP segment of a reassembled PDU]"
"172","1.457178","2a00:1450:4028:1::a","2a0d:6fc2:5560:c200:15f4:c1ab:865a:2377","TCP","1294","443  >  51049 [ACK] Seq=144791 Ack=2408 Win=541 Len=1220 [TCP segment of a reassembled PDU]"
"173","1.457178","2a00:1450:4028:1::a","2a0d:6fc2:5560:c200:15f4:c1ab:865a:2377","TCP","1294","443  >  51049 [ACK] Seq=146011 Ack=2408 Win=541 Len=1220 [TCP segment of a reassembled PDU]"
"174","1.457178","2a00:1450:4028:1::a","2a0d:6fc2:5560:c200:15f4:c1ab:865a:2377","TCP","1294","443  >  51049 [ACK] Seq=147231 Ack=2408 Win=541 Len=1220 [TCP segment of a reassembled PDU]"
"175","1.457178","2a00:1450:4028:1::a","2a0d:6fc2:5560:c200:15f4:c1ab:865a:2377","TCP","1294","443  >  51049 [ACK] Seq=148451 Ack=2408 Win=541 Len=1220 [TCP segment of a reassembled PDU]"
"176","1.457178","2a00:1450:4028:1::a","2a0d:6fc2:5560:c200:15f4:c1ab:865a:2377","TCP","1294","443  >  51049 [ACK] Seq=149671 Ack=2408 Win=541 Len=1220 [TCP segment of a reassembled PDU]"
"177","1.457178","2a00:1450:4028:1::a","2a0d:6fc2:5560:c200:15f4:c1ab:865a:2377","TLSv1.2","1294","Application Data"
"178","1.457178","2a00:1450:4028:1::a","2a0d:6fc2:5560:c200:15f4:c1ab:865a:2377","TCP","1294","443  >  51049 [ACK] Seq=152111 Ack=2408 Win=541 Len=1220 [TCP segment of a reassembled PDU]"
"179","1.457203","2a0d:6fc2:5560:c200:15f4:c1ab:865a:2377","2a00:1450:4028:1::a","TCP","74","51049  >  443 [ACK] Seq=2408 Ack=153331 Win=16504 Len=0"
"180","1.460488","192.168.1.174","34.0.64.255","UDP","239","64156  >  50001 Len=197"
"181","1.465242","2a00:1450:4028:1::a","2a0d:6fc2:5560:c200:15f4:c1ab:865a:2377","TCP","1294","443  >  51049 [ACK] Seq=153331 Ack=2408 Win=541 Len=1220 [TCP segment of a reassembled PDU]"
"182","1.465242","2a00:1450:4028:1::a","2a0d:6fc2:5560:c200:15f4:c1ab:865a:2377","TCP","1294","443  >  51049 [PSH, ACK] Seq=154551 Ack=2408 Win=541 Len=1220 [TCP segment of a reassembled PDU]"
"183","1.465242","2a00:1450:4028:1::a","2a0d:6fc2:5560:c200:15f4:c1ab:865a:2377","TCP","1294","443  >  51049 [ACK] Seq=155771 Ack=2408 Win=541 Len=1220 [TCP segment of a reassembled PDU]"
"184","1.465242","2a00:1450:4028:1::a","2a0d:6fc2:5560:c200:15f4:c1ab:865a:2377","TCP","1294","443  >  51049 [ACK] Seq=156991 Ack=2408 Win=541 Len=1220 [TCP segment of a reassembled PDU]"
"185","1.465242","2a00:1450:4028:1::a","2a0d:6fc2:5560:c200:15f4:c1ab:865a:2377","TCP","1294","443  >  51049 [ACK] Seq=158211 Ack=2408 Win=541 Len=1220 [TCP segment of a reassembled PDU]"
"186","1.465242","2a00:1450:4028:1::a","2a0d:6fc2:5560:c200:15f4:c1ab:865a:2377","TCP","1294","443  >  51049 [ACK] Seq=159431 Ack=2408 Win=541 Len=1220 [TCP segment of a reassembled PDU]"
"187","1.465242","2a00:1450:4028:1::a","2a0d:6fc2:5560:c200:15f4:c1ab:865a:2377","TCP","1294","443  >  51049 [ACK] Seq=160651 Ack=2408 Win=541 Len=1220 [TCP segment of a reassembled PDU]"
"188","1.465242","2a00:1450:4028:1::a","2a0d:6fc2:5560:c200:15f4:c1ab:865a:2377","TCP","1294","443  >  51049 [ACK] Seq=161871 Ack=2408 Win=541 Len=1220 [TCP segment of a reassembled PDU]"
"189","1.465242","2a00:1450:4028:1::a","2a0d:6fc2:5560:c200:15f4:c1ab:865a:2377","TCP","1294","443  >  51049 [ACK] Seq=163091 Ack=2408 Win=541 Len=1220 [TCP segment of a reassembled PDU]"
"190","1.465242","2a00:1450:4028:1::a","2a0d:6fc2:5560:c200:15f4:c1ab:865a:2377","TCP","1294","443  >  51049 [ACK] Seq=164311 Ack=2408 Win=541 Len=1220 [TCP segment of a reassembled PDU]"
"191","1.465242","2a00:1450:4028:1::a","2a0d:6fc2:5560:c200:15f4:c1ab:865a:2377","TCP","1294","443  >  51049 [ACK] Seq=165531 Ack=2408 Win=541 Len=1220 [TCP segment of a reassembled PDU]"
"192","1.465242","2a00:1450:4028:1::a","2a0d:6fc2:5560:c200:15f4:c1ab:865a:2377","TCP","1294","443  >  51049 [ACK] Seq=166751 Ack=2408 Win=541 Len=1220 [TCP segment of a reassembled PDU]"
"193","1.465242","2a00:1450:4028:1::a","2a0d:6fc2:5560:c200:15f4:c1ab:865a:2377","TLSv1.2","1294","Application Data"
"194","1.465242","2a00:1450:4028:1::a","2a0d:6fc2:5560:c200:15f4:c1ab:865a:2377","TCP","1294","443  >  51049 [ACK] Seq=169191 Ack=2408 Win=541 Len=1220 [TCP segment of a reassembled PDU]"
"195","1.465242","2a00:1450:4028:1::a","2a0d:6fc2:5560:c200:15f4:c1ab:865a:2377","TCP","1294","443  >  51049 [ACK] Seq=170411 Ack=2408 Win=541 Len=1220 [TCP segment of a reassembled PDU]"
"196","1.465242","2a00:1450:4028:1::a","2a0d:6fc2:5560:c200:15f4:c1ab:865a:2377","TCP","1294","443  >  51049 [ACK] Seq=171631 Ack=2408 Win=541 Len=1220 [TCP segment of a reassembled PDU]"
"197","1.465242","2a00:1450:4028:1::a","2a0d:6fc2:5560:c200:15f4:c1ab:865a:2377","TCP","1294","443  >  51049 [ACK] Seq=172851 Ack=2408 Win=541 Len=1220 [TCP segment of a reassembled PDU]"
"198","1.465242","2a00:1450:4028:1::a","2a0d:6fc2:5560:c200:15f4:c1ab:865a:2377","TCP","1294","443  >  51049 [ACK] Seq=174071 Ack=2408 Win=541 Len=1220 [TCP segment of a reassembled PDU]"
"199","1.465242","2a00:1450:4028:1::a","2a0d:6fc2:5560:c200:15f4:c1ab:865a:2377","TCP","1294","443  >  51049 [ACK] Seq=175291 Ack=2408 Win=541 Len=1220 [TCP segment of a reassembled PDU]"
"200","1.465242","2a00:1450:4028:1::a","2a0d:6fc2:5560:c200:15f4:c1ab:865a:2377","TCP","1294","443  >  51049 [ACK] Seq=176511 Ack=2408 Win=541 Len=1220 [TCP segment of a reassembled PDU]"
"201","1.465242","2a00:1450:4028:1::a","2a0d:6fc2:5560:c200:15f4:c1ab:865a:2377","TCP","1294","443  >  51049 [PSH, ACK] Seq=177731 Ack=2408 Win=541 Len=1220 [TCP segment of a reassembled PDU]"
"202","1.465242","2a00:1450:4028:1::a","2a0d:6fc2:5560:c200:15f4:c1ab:865a:2377","TCP","1294","443  >  51049 [ACK] Seq=178951 Ack=2408 Win=541 Len=1220 [TCP segment of a reassembled PDU]"
"203","1.465242","2a00:1450:4028:1::a","2a0d:6fc2:5560:c200:15f4:c1ab:865a:2377","TCP","1294","443  >  51049 [ACK] Seq=180171 Ack=2408 Win=541 Len=1220 [TCP segment of a reassembled PDU]"
"204","1.465242","2a00:1450:4028:1::a","2a0d:6fc2:5560:c200:15f4:c1ab:865a:2377","TCP","1294","443  >  51049 [ACK] Seq=181391 Ack=2408 Win=541 Len=1220 [TCP segment of a reassembled PDU]"
"205","1.465242","2a00:1450:4028:1::a","2a0d:6fc2:5560:c200:15f4:c1ab:865a:2377","TCP","1294","443  >  51049 [ACK] Seq=182611 Ack=2408 Win=541 Len=1220 [TCP segment of a reassembled PDU]"
"206","1.465242","2a00:1450:4028:1::a","2a0d:6fc2:5560:c200:15f4:c1ab:865a:2377","TLSv1.2","1294","Application Data"
"207","1.465242","2a00:1450:4028:1::a","2a0d:6fc2:5560:c200:15f4:c1ab:865a:2377","TCP","1294","443  >  51049 [ACK] Seq=185051 Ack=2408 Win=541 Len=1220 [TCP segment of a reassembled PDU]"
"208","1.465242","2a00:1450:4028:1::a","2a0d:6fc2:5560:c200:15f4:c1ab:865a:2377","TCP","1294","443  >  51049 [ACK] Seq=186271 Ack=2408 Win=541 Len=1220 [TCP segment of a reassembled PDU]"
"209","1.465242","2a00:1450:4028:1::a","2a0d:6fc2:5560:c200:15f4:c1ab:865a:2377","TCP","1294","443  >  51049 [ACK] Seq=187491 Ack=2408 Win=541 Len=1220 [TCP segment of a reassembled PDU]"
"210","1.465242","2a00:1450:4028:1::a","2a0d:6fc2:5560:c200:15f4:c1ab:865a:2377","TCP","1294","443  >  51049 [ACK] Seq=188711 Ack=2408 Win=541 Len=1220 [TCP segment of a reassembled PDU]"
"211","1.465242","2a00:1450:4028:1::a","2a0d:6fc2:5560:c200:15f4:c1ab:865a:2377","TCP","1294","443  >  51049 [ACK] Seq=189931 Ack=2408 Win=541 Len=1220 [TCP segment of a reassembled PDU]"
"212","1.465242","2a00:1450:4028:1::a","2a0d:6fc2:5560:c200:15f4:c1ab:865a:2377","TCP","1294","443  >  51049 [ACK] Seq=191151 Ack=2408 Win=541 Len=1220 [TCP segment of a reassembled PDU]"
"213","1.465360","2a0d:6fc2:5560:c200:15f4:c1ab:865a:2377","2a00:1450:4028:1::a","TCP","74","51049  >  443 [ACK] Seq=2408 Ack=192371 Win=16504 Len=0"
"214","1.465424","2a00:1450:4028:1::a","2a0d:6fc2:5560:c200:15f4:c1ab:865a:2377","TCP","1294","443  >  51049 [ACK] Seq=192371 Ack=2408 Win=541 Len=1220 [TCP segment of a reassembled PDU]"
"215","1.465424","2a00:1450:4028:1::a","2a0d:6fc2:5560:c200:15f4:c1ab:865a:2377","TCP","1294","443  >  51049 [ACK] Seq=193591 Ack=2408 Win=541 Len=1220 [TCP segment of a reassembled PDU]"
"216","1.465424","2a00:1450:4028:1::a","2a0d:6fc2:5560:c200:15f4:c1ab:865a:2377","TCP","1294","443  >  51049 [ACK] Seq=194811 Ack=2408 Win=541 Len=1220 [TCP segment of a reassembled PDU]"
"217","1.465424","2a00:1450:4028:1::a","2a0d:6fc2:5560:c200:15f4:c1ab:865a:2377","TCP","1294","443  >  51049 [ACK] Seq=196031 Ack=2408 Win=541 Len=1220 [TCP segment of a reassembled PDU]"
"218","1.465424","2a00:1450:4028:1::a","2a0d:6fc2:5560:c200:15f4:c1ab:865a:2377","TCP","1294","443  >  51049 [ACK] Seq=197251 Ack=2408 Win=541 Len=1220 [TCP segment of a reassembled PDU]"
"219","1.465424","2a00:1450:4028:1::a","2a0d:6fc2:5560:c200:15f4:c1ab:865a:2377","TCP","1294","443  >  51049 [ACK] Seq=198471 Ack=2408 Win=541 Len=1220 [TCP segment of a reassembled PDU]"
"220","1.465424","2a00:1450:4028:1::a","2a0d:6fc2:5560:c200:15f4:c1ab:865a:2377","TCP","1294","443  >  51049 [ACK] Seq=199691 Ack=2408 Win=541 Len=1220 [TCP segment of a reassembled PDU]"
"221","1.465424","2a00:1450:4028:1::a","2a0d:6fc2:5560:c200:15f4:c1ab:865a:2377","TLSv1.2","1294","Application Data"
"222","1.465424","2a00:1450:4028:1::a","2a0d:6fc2:5560:c200:15f4:c1ab:865a:2377","TCP","1294","443  >  51049 [ACK] Seq=202131 Ack=2408 Win=541 Len=1220 [TCP segment of a reassembled PDU]"
"223","1.465424","2a00:1450:4028:1::a","2a0d:6fc2:5560:c200:15f4:c1ab:865a:2377","TCP","1294","443  >  51049 [ACK] Seq=203351 Ack=2408 Win=541 Len=1220 [TCP segment of a reassembled PDU]"
"224","1.465424","2a00:1450:4028:1::a","2a0d:6fc2:5560:c200:15f4:c1ab:865a:2377","TCP","1294","443  >  51049 [ACK] Seq=204571 Ack=2408 Win=541 Len=1220 [TCP segment of a reassembled PDU]"
"225","1.465424","2a00:1450:4028:1::a","2a0d:6fc2:5560:c200:15f4:c1ab:865a:2377","TCP","1294","443  >  51049 [ACK] Seq=205791 Ack=2408 Win=541 Len=1220 [TCP segment of a reassembled PDU]"
"226","1.465424","2a00:1450:4028:1::a","2a0d:6fc2:5560:c200:15f4:c1ab:865a:2377","TCP","1294","443  >  51049 [ACK] Seq=207011 Ack=2408 Win=541 Len=1220 [TCP segment of a reassembled PDU]"
"227","1.465424","2a00:1450:4028:1::a","2a0d:6fc2:5560:c200:15f4:c1ab:865a:2377","TCP","1294","443  >  51049 [ACK] Seq=208231 Ack=2408 Win=541 Len=1220 [TCP segment of a reassembled PDU]"
"228","1.465424","2a00:1450:4028:1::a","2a0d:6fc2:5560:c200:15f4:c1ab:865a:2377","TCP","1294","443  >  51049 [ACK] Seq=209451 Ack=2408 Win=541 Len=1220 [TCP segment of a reassembled PDU]"
"229","1.465424","2a00:1450:4028:1::a","2a0d:6fc2:5560:c200:15f4:c1ab:865a:2377","TCP","1294","443  >  51049 [ACK] Seq=210671 Ack=2408 Win=541 Len=1220 [TCP segment of a reassembled PDU]"
"230","1.465424","2a00:1450:4028:1::a","2a0d:6fc2:5560:c200:15f4:c1ab:865a:2377","TCP","1294","443  >  51049 [ACK] Seq=211891 Ack=2408 Win=541 Len=1220 [TCP segment of a reassembled PDU]"
"231","1.465424","2a00:1450:4028:1::a","2a0d:6fc2:5560:c200:15f4:c1ab:865a:2377","TCP","1294","443  >  51049 [ACK] Seq=213111 Ack=2408 Win=541 Len=1220 [TCP segment of a reassembled PDU]"
"232","1.465424","2a00:1450:4028:1::a","2a0d:6fc2:5560:c200:15f4:c1ab:865a:2377","TCP","1294","443  >  51049 [ACK] Seq=214331 Ack=2408 Win=541 Len=1220 [TCP segment of a reassembled PDU]"
"233","1.465424","2a00:1450:4028:1::a","2a0d:6fc2:5560:c200:15f4:c1ab:865a:2377","TCP","1294","443  >  51049 [ACK] Seq=215551 Ack=2408 Win=541 Len=1220 [TCP segment of a reassembled PDU]"
"234","1.465424","2a00:1450:4028:1::a","2a0d:6fc2:5560:c200:15f4:c1ab:865a:2377","TLSv1.2","1294","Application Data"
"235","1.465424","2a00:1450:4028:1::a","2a0d:6fc2:5560:c200:15f4:c1ab:865a:2377","TCP","1294","443  >  51049 [ACK] Seq=217991 Ack=2408 Win=541 Len=1220 [TCP segment of a reassembled PDU]"
"236","1.465424","2a00:1450:4028:1::a","2a0d:6fc2:5560:c200:15f4:c1ab:865a:2377","TCP","1294","443  >  51049 [ACK] Seq=219211 Ack=2408 Win=541 Len=1220 [TCP segment of a reassembled PDU]"
"237","1.465424","2a00:1450:4028:1::a","2a0d:6fc2:5560:c200:15f4:c1ab:865a:2377","TCP","1294","443  >  51049 [ACK] Seq=220431 Ack=2408 Win=541 Len=1220 [TCP segment of a reassembled PDU]"
"238","1.465424","2a00:1450:4028:1::a","2a0d:6fc2:5560:c200:15f4:c1ab:865a:2377","TCP","1294","443  >  51049 [ACK] Seq=221651 Ack=2408 Win=541 Len=1220 [TCP segment of a reassembled PDU]"
"239","1.465424","2a00:1450:4028:1::a","2a0d:6fc2:5560:c200:15f4:c1ab:865a:2377","TCP","1294","443  >  51049 [ACK] Seq=222871 Ack=2408 Win=541 Len=1220 [TCP segment of a reassembled PDU]"
"240","1.465424","2a00:1450:4028:1::a","2a0d:6fc2:5560:c200:15f4:c1ab:865a:2377","TCP","1294","443  >  51049 [PSH, ACK] Seq=224091 Ack=2408 Win=541 Len=1220 [TCP segment of a reassembled PDU]"
"241","1.465424","2a00:1450:4028:1::a","2a0d:6fc2:5560:c200:15f4:c1ab:865a:2377","TCP","1294","443  >  51049 [ACK] Seq=225311 Ack=2408 Win=541 Len=1220 [TCP segment of a reassembled PDU]"
"242","1.465424","2a00:1450:4028:1::a","2a0d:6fc2:5560:c200:15f4:c1ab:865a:2377","TCP","1294","443  >  51049 [ACK] Seq=226531 Ack=2408 Win=541 Len=1220 [TCP segment of a reassembled PDU]"
