"No.","Time","Source","Destination","Protocol","Length","Info"
"95","4.823447","2a03:2880:f276:cd:face:b00c:0:167","2a0d:6fc2:5560:c200:15f4:c1ab:865a:2377","TLSv1.2","182","Application Data"
"96","4.840343","2a0d:6fc2:5560:c200:15f4:c1ab:865a:2377","2a03:2880:f276:cd:face:b00c:0:167","TLSv1.2","148","Application Data"
"97","4.897663","2a03:2880:f276:cd:face:b00c:0:167","2a0d:6fc2:5560:c200:15f4:c1ab:865a:2377","TCP","74","443  >  51017 [ACK] Seq=109 Ack=75 Win=5500 Len=0"
"101","6.880730","2a03:2880:f276:cd:face:b00c:0:167","2a0d:6fc2:5560:c200:15f4:c1ab:865a:2377","TLSv1.2","862","Application Data"
"102","6.927997","2a0d:6fc2:5560:c200:15f4:c1ab:865a:2377","2a03:2880:f276:cd:face:b00c:0:167","TCP","74","51017  >  443 [ACK] Seq=75 Ack=897 Win=1033 Len=0"
"103","6.970971","2a0d:6fc2:5560:c200:15f4:c1ab:865a:2377","2a03:2880:f276:cd:face:b00c:0:167","TLSv1.2","173","Application Data"
"104","7.027078","2a03:2880:f276:cd:face:b00c:0:167","2a0d:6fc2:5560:c200:15f4:c1ab:865a:2377","TCP","74","443  >  51017 [ACK] Seq=897 Ack=174 Win=5500 Len=0"
"123","7.688185","2a03:2880:f276:cd:face:b00c:0:167","2a0d:6fc2:5560:c200:15f4:c1ab:865a:2377","TLSv1.2","171","Application Data"
"124","7.689785","2a0d:6fc2:5560:c200:15f4:c1ab:865a:2377","2a03:2880:f276:cd:face:b00c:0:167","TLSv1.2","170","Application Data"
"126","7.745617","2a03:2880:f276:cd:face:b00c:0:167","2a0d:6fc2:5560:c200:15f4:c1ab:865a:2377","TCP","74","443  >  51017 [ACK] Seq=994 Ack=270 Win=5500 Len=0"
"591","16.687670","2a03:2880:f276:cd:face:b00c:0:167","2a0d:6fc2:5560:c200:15f4:c1ab:865a:2377","TCP","1466","443  >  51017 [ACK] Seq=994 Ack=270 Win=5500 Len=1392 [TCP segment of a reassembled PDU]"
"592","16.687670","2a03:2880:f276:cd:face:b00c:0:167","2a0d:6fc2:5560:c200:15f4:c1ab:865a:2377","TLSv1.2","132","Application Data"
"593","16.687670","2a03:2880:f276:cd:face:b00c:0:167","2a0d:6fc2:5560:c200:15f4:c1ab:865a:2377","TCP","1466","443  >  51017 [ACK] Seq=2444 Ack=270 Win=5500 Len=1392 [TCP segment of a reassembled PDU]"
"594","16.687670","2a03:2880:f276:cd:face:b00c:0:167","2a0d:6fc2:5560:c200:15f4:c1ab:865a:2377","TLSv1.2","195","Application Data"
"595","16.687711","2a0d:6fc2:5560:c200:15f4:c1ab:865a:2377","2a03:2880:f276:cd:face:b00c:0:167","TCP","74","51017  >  443 [ACK] Seq=270 Ack=3957 Win=1033 Len=0"
"596","16.688738","2a03:2880:f276:cd:face:b00c:0:167","2a0d:6fc2:5560:c200:15f4:c1ab:865a:2377","TCP","1466","443  >  51017 [ACK] Seq=3957 Ack=270 Win=5500 Len=1392 [TCP segment of a reassembled PDU]"
"597","16.688738","2a03:2880:f276:cd:face:b00c:0:167","2a0d:6fc2:5560:c200:15f4:c1ab:865a:2377","TLSv1.2","1466","Application Data"
"598","16.688738","2a03:2880:f276:cd:face:b00c:0:167","2a0d:6fc2:5560:c200:15f4:c1ab:865a:2377","TLSv1.2","551","Application Data"
"599","16.688761","2a0d:6fc2:5560:c200:15f4:c1ab:865a:2377","2a03:2880:f276:cd:face:b00c:0:167","TCP","74","51017  >  443 [ACK] Seq=270 Ack=7218 Win=1033 Len=0"
"603","16.810102","2a0d:6fc2:5560:c200:15f4:c1ab:865a:2377","2a03:2880:f276:cd:face:b00c:0:167","TLSv1.2","165","Application Data"
"605","16.868533","2a03:2880:f276:cd:face:b00c:0:167","2a0d:6fc2:5560:c200:15f4:c1ab:865a:2377","TCP","74","443  >  51017 [ACK] Seq=7218 Ack=361 Win=5500 Len=0"
"606","16.879561","2a0d:6fc2:5560:c200:15f4:c1ab:865a:2377","2a03:2880:f276:cd:face:b00c:0:167","TLSv1.2","177","Application Data"
"611","16.935405","2a03:2880:f276:cd:face:b00c:0:167","2a0d:6fc2:5560:c200:15f4:c1ab:865a:2377","TCP","74","443  >  51017 [ACK] Seq=7218 Ack=464 Win=5500 Len=0"
"612","17.037347","2a03:2880:f276:cd:face:b00c:0:167","2a0d:6fc2:5560:c200:15f4:c1ab:865a:2377","TLSv1.2","164","Application Data"
"613","17.090520","2a0d:6fc2:5560:c200:15f4:c1ab:865a:2377","2a03:2880:f276:cd:face:b00c:0:167","TCP","74","51017  >  443 [ACK] Seq=464 Ack=7308 Win=1032 Len=0"
"661","21.062528","2a0d:6fc2:5560:c200:15f4:c1ab:865a:2377","2a03:2880:f276:cd:face:b00c:0:167","TCP","75","61902  >  443 [ACK] Seq=1 Ack=1 Win=511 Len=1 [TCP segment of a reassembled PDU]"
"662","21.118304","2a03:2880:f276:cd:face:b00c:0:167","2a0d:6fc2:5560:c200:15f4:c1ab:865a:2377","TCP","74","443  >  61902 [ACK] Seq=1 Ack=2 Win=283 Len=0"
"702","24.875094","2a03:2880:f276:cd:face:b00c:0:167","2a0d:6fc2:5560:c200:15f4:c1ab:865a:2377","TLSv1.2","351","Application Data"
"703","24.919644","2a0d:6fc2:5560:c200:15f4:c1ab:865a:2377","2a03:2880:f276:cd:face:b00c:0:167","TCP","74","51017  >  443 [ACK] Seq=464 Ack=7585 Win=1031 Len=0"
"704","24.929152","2a0d:6fc2:5560:c200:15f4:c1ab:865a:2377","2a03:2880:f276:cd:face:b00c:0:167","TLSv1.2","146","Application Data"
"705","24.985472","2a03:2880:f276:cd:face:b00c:0:167","2a0d:6fc2:5560:c200:15f4:c1ab:865a:2377","TCP","74","443  >  51017 [ACK] Seq=7585 Ack=536 Win=5500 Len=0"
"709","26.547077","2a03:2880:f276:cd:face:b00c:0:167","2a0d:6fc2:5560:c200:15f4:c1ab:865a:2377","TLSv1.2","154","Application Data"
"710","26.587563","2a0d:6fc2:5560:c200:15f4:c1ab:865a:2377","2a03:2880:f276:cd:face:b00c:0:167","TCP","74","51017  >  443 [ACK] Seq=536 Ack=7665 Win=1031 Len=0"
"25511","34.381036","2a03:2880:f276:cd:face:b00c:0:167","2a0d:6fc2:5560:c200:15f4:c1ab:865a:2377","TLSv1.2","162","Application Data"
"25531","34.383292","2a0d:6fc2:5560:c200:15f4:c1ab:865a:2377","2a03:2880:f276:cd:face:b00c:0:167","TLSv1.2","146","Application Data"
"26017","34.439216","2a03:2880:f276:cd:face:b00c:0:167","2a0d:6fc2:5560:c200:15f4:c1ab:865a:2377","TCP","74","443  >  51017 [ACK] Seq=7753 Ack=608 Win=5500 Len=0"
"33570","35.370159","2a03:2880:f276:cd:face:b00c:0:167","2a0d:6fc2:5560:c200:15f4:c1ab:865a:2377","TLSv1.2","154","Application Data"
"33863","35.416110","2a0d:6fc2:5560:c200:15f4:c1ab:865a:2377","2a03:2880:f276:cd:face:b00c:0:167","TCP","74","51017  >  443 [ACK] Seq=608 Ack=7833 Win=1030 Len=0"
"38053","35.936367","2a03:2880:f276:cd:face:b00c:0:167","2a0d:6fc2:5560:c200:15f4:c1ab:865a:2377","TLSv1.2","271","Application Data"
"38172","35.962459","2a0d:6fc2:5560:c200:15f4:c1ab:865a:2377","2a03:2880:f276:cd:face:b00c:0:167","TLSv1.2","163","Application Data"
"38341","36.018866","2a03:2880:f276:cd:face:b00c:0:167","2a0d:6fc2:5560:c200:15f4:c1ab:865a:2377","TCP","74","443  >  51017 [ACK] Seq=8030 Ack=697 Win=5500 Len=0"
"51649","37.921592","2a03:2880:f276:cd:face:b00c:0:167","2a0d:6fc2:5560:c200:15f4:c1ab:865a:2377","TLSv1.2","162","Application Data"
"51650","37.925178","2a0d:6fc2:5560:c200:15f4:c1ab:865a:2377","2a03:2880:f276:cd:face:b00c:0:167","TLSv1.2","146","Application Data"
"51652","37.981068","2a03:2880:f276:cd:face:b00c:0:167","2a0d:6fc2:5560:c200:15f4:c1ab:865a:2377","TCP","74","443  >  51017 [ACK] Seq=8118 Ack=769 Win=5500 Len=0"
"51666","38.847612","2a0d:6fc2:5560:c200:15f4:c1ab:865a:2377","2a03:2880:f276:cd:face:b00c:0:167","TCP","1466","51017  >  443 [ACK] Seq=769 Ack=8118 Win=1029 Len=1392 [TCP segment of a reassembled PDU]"
"51667","38.847612","2a0d:6fc2:5560:c200:15f4:c1ab:865a:2377","2a03:2880:f276:cd:face:b00c:0:167","TCP","1466","51017  >  443 [ACK] Seq=2161 Ack=8118 Win=1029 Len=1392 [TCP segment of a reassembled PDU]"
"51668","38.847612","2a0d:6fc2:5560:c200:15f4:c1ab:865a:2377","2a03:2880:f276:cd:face:b00c:0:167","TCP","1466","51017  >  443 [ACK] Seq=3553 Ack=8118 Win=1029 Len=1392 [TCP segment of a reassembled PDU]"
"51669","38.847612","2a0d:6fc2:5560:c200:15f4:c1ab:865a:2377","2a03:2880:f276:cd:face:b00c:0:167","TCP","1466","51017  >  443 [ACK] Seq=4945 Ack=8118 Win=1029 Len=1392 [TCP segment of a reassembled PDU]"
"51670","38.847612","2a0d:6fc2:5560:c200:15f4:c1ab:865a:2377","2a03:2880:f276:cd:face:b00c:0:167","TCP","1466","51017  >  443 [ACK] Seq=6337 Ack=8118 Win=1029 Len=1392 [TCP segment of a reassembled PDU]"
"51671","38.847612","2a0d:6fc2:5560:c200:15f4:c1ab:865a:2377","2a03:2880:f276:cd:face:b00c:0:167","TCP","1466","51017  >  443 [ACK] Seq=7729 Ack=8118 Win=1029 Len=1392 [TCP segment of a reassembled PDU]"
"51672","38.847612","2a0d:6fc2:5560:c200:15f4:c1ab:865a:2377","2a03:2880:f276:cd:face:b00c:0:167","TCP","1466","51017  >  443 [ACK] Seq=9121 Ack=8118 Win=1029 Len=1392 [TCP segment of a reassembled PDU]"
"51673","38.847612","2a0d:6fc2:5560:c200:15f4:c1ab:865a:2377","2a03:2880:f276:cd:face:b00c:0:167","TCP","1466","51017  >  443 [ACK] Seq=10513 Ack=8118 Win=1029 Len=1392 [TCP segment of a reassembled PDU]"
"51674","38.857956","2a03:2880:f276:cd:face:b00c:0:167","2a0d:6fc2:5560:c200:15f4:c1ab:865a:2377","TLSv1.2","154","Application Data"
"51675","38.903645","2a03:2880:f276:cd:face:b00c:0:167","2a0d:6fc2:5560:c200:15f4:c1ab:865a:2377","TCP","74","443  >  51017 [ACK] Seq=8198 Ack=4945 Win=5484 Len=0"
"51676","38.903694","2a0d:6fc2:5560:c200:15f4:c1ab:865a:2377","2a03:2880:f276:cd:face:b00c:0:167","TLSv1.2","1126","Application Data"
"51677","38.904561","2a03:2880:f276:cd:face:b00c:0:167","2a0d:6fc2:5560:c200:15f4:c1ab:865a:2377","TCP","74","443  >  51017 [ACK] Seq=8198 Ack=11905 Win=5468 Len=0"
"51678","38.960305","2a03:2880:f276:cd:face:b00c:0:167","2a0d:6fc2:5560:c200:15f4:c1ab:865a:2377","TCP","74","443  >  51017 [ACK] Seq=8198 Ack=12957 Win=5500 Len=0"
"51679","39.089978","2a03:2880:f276:cd:face:b00c:0:167","2a0d:6fc2:5560:c200:15f4:c1ab:865a:2377","TLSv1.2","185","Application Data"
"51681","39.133631","2a0d:6fc2:5560:c200:15f4:c1ab:865a:2377","2a03:2880:f276:cd:face:b00c:0:167","TCP","74","51017  >  443 [ACK] Seq=12957 Ack=8309 Win=1028 Len=0"
"51683","39.378413","2a03:2880:f276:cd:face:b00c:0:167","2a0d:6fc2:5560:c200:15f4:c1ab:865a:2377","TLSv1.2","169","Application Data"
"51684","39.380409","2a0d:6fc2:5560:c200:15f4:c1ab:865a:2377","2a03:2880:f276:cd:face:b00c:0:167","TLSv1.2","167","Application Data"
"51685","39.399241","2a03:2880:f276:cd:face:b00c:0:167","2a0d:6fc2:5560:c200:15f4:c1ab:865a:2377","TLSv1.2","171","Application Data"
"51686","39.403237","2a0d:6fc2:5560:c200:15f4:c1ab:865a:2377","2a03:2880:f276:cd:face:b00c:0:167","TLSv1.2","169","Application Data"
"51687","39.436821","2a03:2880:f276:cd:face:b00c:0:167","2a0d:6fc2:5560:c200:15f4:c1ab:865a:2377","TCP","74","443  >  51017 [ACK] Seq=8501 Ack=13050 Win=5500 Len=0"
"51688","39.459168","2a03:2880:f276:cd:face:b00c:0:167","2a0d:6fc2:5560:c200:15f4:c1ab:865a:2377","TCP","74","443  >  51017 [ACK] Seq=8501 Ack=13145 Win=5500 Len=0"
"51696","40.068428","2a03:2880:f276:cd:face:b00c:0:167","2a0d:6fc2:5560:c200:15f4:c1ab:865a:2377","TLSv1.2","168","Application Data"
"51697","40.069863","2a0d:6fc2:5560:c200:15f4:c1ab:865a:2377","2a03:2880:f276:cd:face:b00c:0:167","TLSv1.2","167","Application Data"
"51698","40.136054","2a03:2880:f276:cd:face:b00c:0:167","2a0d:6fc2:5560:c200:15f4:c1ab:865a:2377","TCP","74","443  >  51017 [ACK] Seq=8595 Ack=13238 Win=5500 Len=0"
"51699","40.226888","2a03:2880:f276:cd:face:b00c:0:167","2a0d:6fc2:5560:c200:15f4:c1ab:865a:2377","TLSv1.2","671","Application Data"
"51700","40.271882","2a0d:6fc2:5560:c200:15f4:c1ab:865a:2377","2a03:2880:f276:cd:face:b00c:0:167","TCP","74","51017  >  443 [ACK] Seq=13238 Ack=9192 Win=1033 Len=0"
"51701","40.275462","2a0d:6fc2:5560:c200:15f4:c1ab:865a:2377","2a03:2880:f276:cd:face:b00c:0:167","TLSv1.2","173","Application Data"
"51702","40.337052","2a03:2880:f276:cd:face:b00c:0:167","2a0d:6fc2:5560:c200:15f4:c1ab:865a:2377","TLSv1.2","154","Application Data"
"51703","40.337052","2a03:2880:f276:cd:face:b00c:0:167","2a0d:6fc2:5560:c200:15f4:c1ab:865a:2377","TCP","74","443  >  51017 [ACK] Seq=9272 Ack=13337 Win=5500 Len=0"
"51704","40.387016","2a0d:6fc2:5560:c200:15f4:c1ab:865a:2377","2a03:2880:f276:cd:face:b00c:0:167","TCP","74","51017  >  443 [ACK] Seq=13337 Ack=9272 Win=1032 Len=0"
"51715","40.776259","2a03:2880:f276:cd:face:b00c:0:167","2a0d:6fc2:5560:c200:15f4:c1ab:865a:2377","TLSv1.2","154","Application Data"
"51716","40.822026","2a0d:6fc2:5560:c200:15f4:c1ab:865a:2377","2a03:2880:f276:cd:face:b00c:0:167","TCP","74","51017  >  443 [ACK] Seq=13337 Ack=9352 Win=1032 Len=0"
"51717","41.012920","2a03:2880:f276:cd:face:b00c:0:167","2a0d:6fc2:5560:c200:15f4:c1ab:865a:2377","TLSv1.2","113","Application Data"
"51718","41.013150","2a0d:6fc2:5560:c200:15f4:c1ab:865a:2377","2a03:2880:f276:cd:face:b00c:0:167","TCP","74","61902  >  443 [FIN, ACK] Seq=2 Ack=40 Win=511 Len=0"
"51719","41.013565","2a03:2880:f276:cd:face:b00c:0:167","2a0d:6fc2:5560:c200:15f4:c1ab:865a:2377","TCP","74","443  >  61902 [FIN, ACK] Seq=40 Ack=2 Win=283 Len=0"
"51720","41.013584","2a0d:6fc2:5560:c200:15f4:c1ab:865a:2377","2a03:2880:f276:cd:face:b00c:0:167","TCP","74","61902  >  443 [ACK] Seq=3 Ack=41 Win=511 Len=0"
"51721","41.080411","2a03:2880:f276:cd:face:b00c:0:167","2a0d:6fc2:5560:c200:15f4:c1ab:865a:2377","TCP","74","443  >  61902 [ACK] Seq=41 Ack=3 Win=283 Len=0"
"51722","41.217730","2a03:2880:f276:cd:face:b00c:0:167","2a0d:6fc2:5560:c200:15f4:c1ab:865a:2377","TLSv1.2","171","Application Data"
"51723","41.219508","2a0d:6fc2:5560:c200:15f4:c1ab:865a:2377","2a03:2880:f276:cd:face:b00c:0:167","TLSv1.2","170","Application Data"
"51724","41.306053","2a03:2880:f276:cd:face:b00c:0:167","2a0d:6fc2:5560:c200:15f4:c1ab:865a:2377","TCP","74","443  >  51017 [ACK] Seq=9449 Ack=13433 Win=5500 Len=0"
"51736","44.431264","2a03:2880:f276:cd:face:b00c:0:167","2a0d:6fc2:5560:c200:15f4:c1ab:865a:2377","TLSv1.2","154","Application Data"
"51737","44.491863","2a0d:6fc2:5560:c200:15f4:c1ab:865a:2377","2a03:2880:f276:cd:face:b00c:0:167","TCP","74","51017  >  443 [ACK] Seq=13433 Ack=9529 Win=1031 Len=0"
"51738","44.637318","2a03:2880:f276:cd:face:b00c:0:167","2a0d:6fc2:5560:c200:15f4:c1ab:865a:2377","TLSv1.2","154","Application Data"
"51739","44.685836","2a0d:6fc2:5560:c200:15f4:c1ab:865a:2377","2a03:2880:f276:cd:face:b00c:0:167","TCP","74","51017  >  443 [ACK] Seq=13433 Ack=9609 Win=1031 Len=0"
"51745","48.209261","2a03:2880:f276:cd:face:b00c:0:167","2a0d:6fc2:5560:c200:15f4:c1ab:865a:2377","TLSv1.2","154","Application Data"
"51746","48.254429","2a0d:6fc2:5560:c200:15f4:c1ab:865a:2377","2a03:2880:f276:cd:face:b00c:0:167","TCP","74","51017  >  443 [ACK] Seq=13433 Ack=9689 Win=1031 Len=0"
"51755","50.432384","2a03:2880:f276:cd:face:b00c:0:167","2a0d:6fc2:5560:c200:15f4:c1ab:865a:2377","TCP","1466","443  >  51017 [ACK] Seq=9689 Ack=13433 Win=5500 Len=1392 [TCP segment of a reassembled PDU]"
"51756","50.432384","2a03:2880:f276:cd:face:b00c:0:167","2a0d:6fc2:5560:c200:15f4:c1ab:865a:2377","TLSv1.2","132","Application Data"
"51757","50.432384","2a03:2880:f276:cd:face:b00c:0:167","2a0d:6fc2:5560:c200:15f4:c1ab:865a:2377","TCP","1466","443  >  51017 [ACK] Seq=11139 Ack=13433 Win=5500 Len=1392 [TCP segment of a reassembled PDU]"
"51758","50.432384","2a03:2880:f276:cd:face:b00c:0:167","2a0d:6fc2:5560:c200:15f4:c1ab:865a:2377","TLSv1.2","195","Application Data"
"51759","50.432384","2a03:2880:f276:cd:face:b00c:0:167","2a0d:6fc2:5560:c200:15f4:c1ab:865a:2377","TCP","1466","443  >  51017 [ACK] Seq=12652 Ack=13433 Win=5500 Len=1392 [TCP segment of a reassembled PDU]"
"51760","50.432384","2a03:2880:f276:cd:face:b00c:0:167","2a0d:6fc2:5560:c200:15f4:c1ab:865a:2377","TLSv1.2","1466","Application Data"
"51761","50.432384","2a03:2880:f276:cd:face:b00c:0:167","2a0d:6fc2:5560:c200:15f4:c1ab:865a:2377","TLSv1.2","551","Application Data"
"51762","50.432483","2a0d:6fc2:5560:c200:15f4:c1ab:865a:2377","2a03:2880:f276:cd:face:b00c:0:167","TCP","74","51017  >  443 [ACK] Seq=13433 Ack=15913 Win=1033 Len=0"
"51763","50.545349","2a0d:6fc2:5560:c200:15f4:c1ab:865a:2377","2a03:2880:f276:cd:face:b00c:0:167","TLSv1.2","165","Application Data"
"51764","50.601701","2a03:2880:f276:cd:face:b00c:0:167","2a0d:6fc2:5560:c200:15f4:c1ab:865a:2377","TCP","74","443  >  51017 [ACK] Seq=15913 Ack=13524 Win=5500 Len=0"
"51765","50.612599","2a0d:6fc2:5560:c200:15f4:c1ab:865a:2377","2a03:2880:f276:cd:face:b00c:0:167","TLSv1.2","177","Application Data"
"51766","50.668490","2a03:2880:f276:cd:face:b00c:0:167","2a0d:6fc2:5560:c200:15f4:c1ab:865a:2377","TCP","74","443  >  51017 [ACK] Seq=15913 Ack=13627 Win=5500 Len=0"
"51767","50.770713","2a03:2880:f276:cd:face:b00c:0:167","2a0d:6fc2:5560:c200:15f4:c1ab:865a:2377","TLSv1.2","164","Application Data"
"51768","50.819058","2a0d:6fc2:5560:c200:15f4:c1ab:865a:2377","2a03:2880:f276:cd:face:b00c:0:167","TCP","74","51017  >  443 [ACK] Seq=13627 Ack=16003 Win=1032 Len=0"
"51825","55.130818","2a03:2880:f276:cd:face:b00c:0:167","2a0d:6fc2:5560:c200:15f4:c1ab:865a:2377","TLSv1.2","154","Application Data"
"51826","55.187137","2a0d:6fc2:5560:c200:15f4:c1ab:865a:2377","2a03:2880:f276:cd:face:b00c:0:167","TCP","74","51017  >  443 [ACK] Seq=13627 Ack=16083 Win=1032 Len=0"
"51833","56.095079","2a03:2880:f276:cd:face:b00c:0:167","2a0d:6fc2:5560:c200:15f4:c1ab:865a:2377","TLSv1.2","154","Application Data"
"51834","56.138655","2a0d:6fc2:5560:c200:15f4:c1ab:865a:2377","2a03:2880:f276:cd:face:b00c:0:167","TCP","74","51017  >  443 [ACK] Seq=13627 Ack=16163 Win=1032 Len=0"
"51840","57.167755","2a03:2880:f276:cd:face:b00c:0:167","2a0d:6fc2:5560:c200:15f4:c1ab:865a:2377","TLSv1.2","154","Application Data"
"51841","57.220192","2a0d:6fc2:5560:c200:15f4:c1ab:865a:2377","2a03:2880:f276:cd:face:b00c:0:167","TCP","74","51017  >  443 [ACK] Seq=13627 Ack=16243 Win=1031 Len=0"
"51850","59.643611","2a03:2880:f276:cd:face:b00c:0:167","2a0d:6fc2:5560:c200:15f4:c1ab:865a:2377","TLSv1.2","154","Application Data"
"51851","59.703720","2a0d:6fc2:5560:c200:15f4:c1ab:865a:2377","2a03:2880:f276:cd:face:b00c:0:167","TCP","74","51017  >  443 [ACK] Seq=13627 Ack=16323 Win=1031 Len=0"
"51861","61.684599","2a03:2880:f276:cd:face:b00c:0:167","2a0d:6fc2:5560:c200:15f4:c1ab:865a:2377","TLSv1.2","154","Application Data"
"51862","61.738732","2a0d:6fc2:5560:c200:15f4:c1ab:865a:2377","2a03:2880:f276:cd:face:b00c:0:167","TCP","74","51017  >  443 [ACK] Seq=13627 Ack=16403 Win=1031 Len=0"
"51960","64.663291","2a03:2880:f276:cd:face:b00c:0:167","2a0d:6fc2:5560:c200:15f4:c1ab:865a:2377","TLSv1.2","740","Application Data"
"51961","64.718231","2a0d:6fc2:5560:c200:15f4:c1ab:865a:2377","2a03:2880:f276:cd:face:b00c:0:167","TCP","74","51017  >  443 [ACK] Seq=13627 Ack=17069 Win=1028 Len=0"
"51962","64.720059","2a0d:6fc2:5560:c200:15f4:c1ab:865a:2377","2a03:2880:f276:cd:face:b00c:0:167","TLSv1.2","167","Application Data"
"51963","64.775531","2a03:2880:f276:cd:face:b00c:0:167","2a0d:6fc2:5560:c200:15f4:c1ab:865a:2377","TCP","74","443  >  51017 [ACK] Seq=17069 Ack=13720 Win=5500 Len=0"
"51964","65.059783","2a03:2880:f276:cd:face:b00c:0:167","2a0d:6fc2:5560:c200:15f4:c1ab:865a:2377","TLSv1.2","154","Application Data"
"51965","65.101430","2a0d:6fc2:5560:c200:15f4:c1ab:865a:2377","2a03:2880:f276:cd:face:b00c:0:167","TCP","74","51017  >  443 [ACK] Seq=13720 Ack=17149 Win=1028 Len=0"
"51966","65.325462","2a0d:6fc2:5560:c200:15f4:c1ab:865a:2377","2a03:2880:f276:cd:face:b00c:0:167","TCP","1466","51017  >  443 [ACK] Seq=13720 Ack=17149 Win=1028 Len=1392 [TCP segment of a reassembled PDU]"
"51967","65.325462","2a0d:6fc2:5560:c200:15f4:c1ab:865a:2377","2a03:2880:f276:cd:face:b00c:0:167","TCP","1466","51017  >  443 [ACK] Seq=15112 Ack=17149 Win=1028 Len=1392 [TCP segment of a reassembled PDU]"
"51968","65.325462","2a0d:6fc2:5560:c200:15f4:c1ab:865a:2377","2a03:2880:f276:cd:face:b00c:0:167","TCP","1466","51017  >  443 [ACK] Seq=16504 Ack=17149 Win=1028 Len=1392 [TCP segment of a reassembled PDU]"
"51969","65.325462","2a0d:6fc2:5560:c200:15f4:c1ab:865a:2377","2a03:2880:f276:cd:face:b00c:0:167","TCP","1466","51017  >  443 [ACK] Seq=17896 Ack=17149 Win=1028 Len=1392 [TCP segment of a reassembled PDU]"
"51970","65.325462","2a0d:6fc2:5560:c200:15f4:c1ab:865a:2377","2a03:2880:f276:cd:face:b00c:0:167","TCP","1466","51017  >  443 [ACK] Seq=19288 Ack=17149 Win=1028 Len=1392 [TCP segment of a reassembled PDU]"
"51971","65.325462","2a0d:6fc2:5560:c200:15f4:c1ab:865a:2377","2a03:2880:f276:cd:face:b00c:0:167","TCP","1466","51017  >  443 [ACK] Seq=20680 Ack=17149 Win=1028 Len=1392 [TCP segment of a reassembled PDU]"
"51972","65.325462","2a0d:6fc2:5560:c200:15f4:c1ab:865a:2377","2a03:2880:f276:cd:face:b00c:0:167","TCP","1466","51017  >  443 [ACK] Seq=22072 Ack=17149 Win=1028 Len=1392 [TCP segment of a reassembled PDU]"
"51973","65.325462","2a0d:6fc2:5560:c200:15f4:c1ab:865a:2377","2a03:2880:f276:cd:face:b00c:0:167","TCP","1466","51017  >  443 [ACK] Seq=23464 Ack=17149 Win=1028 Len=1392 [TCP segment of a reassembled PDU]"
"51974","65.381396","2a03:2880:f276:cd:face:b00c:0:167","2a0d:6fc2:5560:c200:15f4:c1ab:865a:2377","TCP","74","443  >  51017 [ACK] Seq=17149 Ack=15112 Win=5500 Len=0"
"51975","65.381396","2a03:2880:f276:cd:face:b00c:0:167","2a0d:6fc2:5560:c200:15f4:c1ab:865a:2377","TCP","74","443  >  51017 [ACK] Seq=17149 Ack=17896 Win=5490 Len=0"
"51976","65.381454","2a0d:6fc2:5560:c200:15f4:c1ab:865a:2377","2a03:2880:f276:cd:face:b00c:0:167","TLSv1.2","1126","Application Data"
"51977","65.381888","2a03:2880:f276:cd:face:b00c:0:167","2a0d:6fc2:5560:c200:15f4:c1ab:865a:2377","TCP","74","443  >  51017 [ACK] Seq=17149 Ack=19288 Win=5500 Len=0"
"51978","65.383159","2a03:2880:f276:cd:face:b00c:0:167","2a0d:6fc2:5560:c200:15f4:c1ab:865a:2377","TCP","74","443  >  51017 [ACK] Seq=17149 Ack=24856 Win=5479 Len=0"
"51979","65.437878","2a03:2880:f276:cd:face:b00c:0:167","2a0d:6fc2:5560:c200:15f4:c1ab:865a:2377","TCP","74","443  >  51017 [ACK] Seq=17149 Ack=25908 Win=5500 Len=0"
"51980","65.548230","2a03:2880:f276:cd:face:b00c:0:167","2a0d:6fc2:5560:c200:15f4:c1ab:865a:2377","TLSv1.2","185","Application Data"
"51981","65.605692","2a0d:6fc2:5560:c200:15f4:c1ab:865a:2377","2a03:2880:f276:cd:face:b00c:0:167","TCP","74","51017  >  443 [ACK] Seq=25908 Ack=17260 Win=1027 Len=0"
"51982","65.823182","2a03:2880:f276:cd:face:b00c:0:167","2a0d:6fc2:5560:c200:15f4:c1ab:865a:2377","TLSv1.2","169","Application Data"
"51983","65.824871","2a0d:6fc2:5560:c200:15f4:c1ab:865a:2377","2a03:2880:f276:cd:face:b00c:0:167","TLSv1.2","167","Application Data"
"51984","65.825896","2a03:2880:f276:cd:face:b00c:0:167","2a0d:6fc2:5560:c200:15f4:c1ab:865a:2377","TLSv1.2","171","Application Data"
"51985","65.827059","2a0d:6fc2:5560:c200:15f4:c1ab:865a:2377","2a03:2880:f276:cd:face:b00c:0:167","TLSv1.2","169","Application Data"
"51986","65.881118","2a03:2880:f276:cd:face:b00c:0:167","2a0d:6fc2:5560:c200:15f4:c1ab:865a:2377","TCP","74","443  >  51017 [ACK] Seq=17452 Ack=26001 Win=5500 Len=0"
"51987","65.882900","2a03:2880:f276:cd:face:b00c:0:167","2a0d:6fc2:5560:c200:15f4:c1ab:865a:2377","TCP","74","443  >  51017 [ACK] Seq=17452 Ack=26096 Win=5500 Len=0"
"51988","66.942598","2a03:2880:f276:cd:face:b00c:0:167","2a0d:6fc2:5560:c200:15f4:c1ab:865a:2377","TLSv1.2","168","Application Data"
"51989","66.944990","2a0d:6fc2:5560:c200:15f4:c1ab:865a:2377","2a03:2880:f276:cd:face:b00c:0:167","TLSv1.2","167","Application Data"
"51990","67.018872","2a03:2880:f276:cd:face:b00c:0:167","2a0d:6fc2:5560:c200:15f4:c1ab:865a:2377","TCP","74","443  >  51017 [ACK] Seq=17546 Ack=26189 Win=5500 Len=0"
"52005","69.372512","2a03:2880:f276:cd:face:b00c:0:167","2a0d:6fc2:5560:c200:15f4:c1ab:865a:2377","TLSv1.2","154","Application Data"
"52006","69.430722","2a0d:6fc2:5560:c200:15f4:c1ab:865a:2377","2a03:2880:f276:cd:face:b00c:0:167","TCP","74","51017  >  443 [ACK] Seq=26189 Ack=17626 Win=1032 Len=0"
"52025","77.941768","2a03:2880:f276:cd:face:b00c:0:167","2a0d:6fc2:5560:c200:15f4:c1ab:865a:2377","TLSv1.2","154","Application Data"
"52026","77.991950","2a0d:6fc2:5560:c200:15f4:c1ab:865a:2377","2a03:2880:f276:cd:face:b00c:0:167","TCP","74","51017  >  443 [ACK] Seq=26189 Ack=17706 Win=1031 Len=0"
"52031","78.775653","2a03:2880:f276:cd:face:b00c:0:167","2a0d:6fc2:5560:c200:15f4:c1ab:865a:2377","TLSv1.2","154","Application Data"
"52032","78.823958","2a0d:6fc2:5560:c200:15f4:c1ab:865a:2377","2a03:2880:f276:cd:face:b00c:0:167","TCP","74","51017  >  443 [ACK] Seq=26189 Ack=17786 Win=1031 Len=0"
"52033","78.994069","2a03:2880:f276:cd:face:b00c:0:167","2a0d:6fc2:5560:c200:15f4:c1ab:865a:2377","TLSv1.2","154","Application Data"
"52034","79.041948","2a0d:6fc2:5560:c200:15f4:c1ab:865a:2377","2a03:2880:f276:cd:face:b00c:0:167","TCP","74","51017  >  443 [ACK] Seq=26189 Ack=17866 Win=1031 Len=0"
"52050","81.201303","2a03:2880:f276:cd:face:b00c:0:167","2a0d:6fc2:5560:c200:15f4:c1ab:865a:2377","TLSv1.2","154","Application Data"
"52051","81.254595","2a0d:6fc2:5560:c200:15f4:c1ab:865a:2377","2a03:2880:f276:cd:face:b00c:0:167","TCP","74","51017  >  443 [ACK] Seq=26189 Ack=17946 Win=1030 Len=0"
"52056","84.012585","2a0d:6fc2:5560:c200:15f4:c1ab:865a:2377","2a03:2880:f276:cd:face:b00c:0:167","TLSv1.2","144","Application Data"
"52058","84.068602","2a03:2880:f276:cd:face:b00c:0:167","2a0d:6fc2:5560:c200:15f4:c1ab:865a:2377","TCP","74","443  >  51017 [ACK] Seq=17946 Ack=26259 Win=5500 Len=0"
"52059","84.169704","2a03:2880:f276:cd:face:b00c:0:167","2a0d:6fc2:5560:c200:15f4:c1ab:865a:2377","TLSv1.2","146","Application Data"
"52062","84.216594","2a0d:6fc2:5560:c200:15f4:c1ab:865a:2377","2a03:2880:f276:cd:face:b00c:0:167","TCP","74","51017  >  443 [ACK] Seq=26259 Ack=18018 Win=1030 Len=0"
"52067","84.588335","2a03:2880:f276:cd:face:b00c:0:167","2a0d:6fc2:5560:c200:15f4:c1ab:865a:2377","TLSv1.2","154","Application Data"
"52068","84.636266","2a0d:6fc2:5560:c200:15f4:c1ab:865a:2377","2a03:2880:f276:cd:face:b00c:0:167","TCP","74","51017  >  443 [ACK] Seq=26259 Ack=18098 Win=1030 Len=0"
"52073","85.715317","2a03:2880:f276:cd:face:b00c:0:167","2a0d:6fc2:5560:c200:15f4:c1ab:865a:2377","TLSv1.2","154","Application Data"
"52074","85.769711","2a0d:6fc2:5560:c200:15f4:c1ab:865a:2377","2a03:2880:f276:cd:face:b00c:0:167","TCP","74","51017  >  443 [ACK] Seq=26259 Ack=18178 Win=1029 Len=0"
"52075","86.708705","2a03:2880:f276:cd:face:b00c:0:167","2a0d:6fc2:5560:c200:15f4:c1ab:865a:2377","TLSv1.2","832","Application Data"
"52076","86.761861","2a0d:6fc2:5560:c200:15f4:c1ab:865a:2377","2a03:2880:f276:cd:face:b00c:0:167","TCP","74","51017  >  443 [ACK] Seq=26259 Ack=18936 Win=1033 Len=0"
"52077","86.808058","2a0d:6fc2:5560:c200:15f4:c1ab:865a:2377","2a03:2880:f276:cd:face:b00c:0:167","TLSv1.2","173","Application Data"
"52078","86.864703","2a03:2880:f276:cd:face:b00c:0:167","2a0d:6fc2:5560:c200:15f4:c1ab:865a:2377","TCP","74","443  >  51017 [ACK] Seq=18936 Ack=26358 Win=5500 Len=0"
"52079","87.642326","2a03:2880:f276:cd:face:b00c:0:167","2a0d:6fc2:5560:c200:15f4:c1ab:865a:2377","TLSv1.2","171","Application Data"
"52080","87.645268","2a0d:6fc2:5560:c200:15f4:c1ab:865a:2377","2a03:2880:f276:cd:face:b00c:0:167","TLSv1.2","170","Application Data"
"52081","87.701189","2a03:2880:f276:cd:face:b00c:0:167","2a0d:6fc2:5560:c200:15f4:c1ab:865a:2377","TCP","74","443  >  51017 [ACK] Seq=19033 Ack=26454 Win=5500 Len=0"
"52083","88.458799","2a03:2880:f276:cd:face:b00c:0:167","2a0d:6fc2:5560:c200:15f4:c1ab:865a:2377","TLSv1.2","604","Application Data"
"52084","88.491675","2a0d:6fc2:5560:c200:15f4:c1ab:865a:2377","2a03:2880:f276:cd:face:b00c:0:167","TLSv1.2","173","Application Data"
"52085","88.548179","2a03:2880:f276:cd:face:b00c:0:167","2a0d:6fc2:5560:c200:15f4:c1ab:865a:2377","TCP","74","443  >  51017 [ACK] Seq=19563 Ack=26553 Win=5500 Len=0"
"52101","92.314031","2a03:2880:f276:cd:face:b00c:0:167","2a0d:6fc2:5560:c200:15f4:c1ab:865a:2377","TLSv1.2","154","Application Data"
"52102","92.364193","2a0d:6fc2:5560:c200:15f4:c1ab:865a:2377","2a03:2880:f276:cd:face:b00c:0:167","TCP","74","51017  >  443 [ACK] Seq=26553 Ack=19643 Win=1030 Len=0"
"52107","94.814799","2a03:2880:f276:cd:face:b00c:0:167","2a0d:6fc2:5560:c200:15f4:c1ab:865a:2377","TCP","1466","443  >  51017 [ACK] Seq=19643 Ack=26553 Win=5500 Len=1392 [TCP segment of a reassembled PDU]"
"52108","94.814799","2a03:2880:f276:cd:face:b00c:0:167","2a0d:6fc2:5560:c200:15f4:c1ab:865a:2377","TLSv1.2","1466","Application Data"
"52109","94.814799","2a03:2880:f276:cd:face:b00c:0:167","2a0d:6fc2:5560:c200:15f4:c1ab:865a:2377","TLSv1.2","1466","Application Data"
"52110","94.814901","2a0d:6fc2:5560:c200:15f4:c1ab:865a:2377","2a03:2880:f276:cd:face:b00c:0:167","TCP","74","51017  >  443 [ACK] Seq=26553 Ack=23819 Win=1033 Len=0"
"52111","94.816531","2a03:2880:f276:cd:face:b00c:0:167","2a0d:6fc2:5560:c200:15f4:c1ab:865a:2377","TLSv1.2","1466","Application Data"
"52112","94.816531","2a03:2880:f276:cd:face:b00c:0:167","2a0d:6fc2:5560:c200:15f4:c1ab:865a:2377","TLSv1.2","730","Application Data"
"52113","94.816615","2a0d:6fc2:5560:c200:15f4:c1ab:865a:2377","2a03:2880:f276:cd:face:b00c:0:167","TCP","74","51017  >  443 [ACK] Seq=26553 Ack=25867 Win=1033 Len=0"
"52114","94.897126","2a0d:6fc2:5560:c200:15f4:c1ab:865a:2377","2a03:2880:f276:cd:face:b00c:0:167","TLSv1.2","165","Application Data"
"52115","94.932371","2a0d:6fc2:5560:c200:15f4:c1ab:865a:2377","2a03:2880:f276:cd:face:b00c:0:167","TLSv1.2","177","Application Data"
"52116","94.953069","2a03:2880:f276:cd:face:b00c:0:167","2a0d:6fc2:5560:c200:15f4:c1ab:865a:2377","TCP","74","443  >  51017 [ACK] Seq=25867 Ack=26644 Win=5500 Len=0"
"52117","94.988807","2a03:2880:f276:cd:face:b00c:0:167","2a0d:6fc2:5560:c200:15f4:c1ab:865a:2377","TCP","74","443  >  51017 [ACK] Seq=25867 Ack=26747 Win=5500 Len=0"
"52118","95.090640","2a03:2880:f276:cd:face:b00c:0:167","2a0d:6fc2:5560:c200:15f4:c1ab:865a:2377","TLSv1.2","164","Application Data"
"52119","95.138706","2a0d:6fc2:5560:c200:15f4:c1ab:865a:2377","2a03:2880:f276:cd:face:b00c:0:167","TCP","74","51017  >  443 [ACK] Seq=26747 Ack=25957 Win=1032 Len=0"
"52144","101.151345","2a03:2880:f276:cd:face:b00c:0:167","2a0d:6fc2:5560:c200:15f4:c1ab:865a:2377","TLSv1.2","511","Application Data"
"52145","101.192647","2a0d:6fc2:5560:c200:15f4:c1ab:865a:2377","2a03:2880:f276:cd:face:b00c:0:167","TCP","74","51017  >  443 [ACK] Seq=26747 Ack=26394 Win=1031 Len=0"
"52146","101.195030","2a0d:6fc2:5560:c200:15f4:c1ab:865a:2377","2a03:2880:f276:cd:face:b00c:0:167","TLSv1.2","173","Application Data"
"52147","101.252550","2a03:2880:f276:cd:face:b00c:0:167","2a0d:6fc2:5560:c200:15f4:c1ab:865a:2377","TCP","74","443  >  51017 [ACK] Seq=26394 Ack=26846 Win=5500 Len=0"
"52148","101.352364","2a03:2880:f276:cd:face:b00c:0:167","2a0d:6fc2:5560:c200:15f4:c1ab:865a:2377","TLSv1.2","154","Application Data"
"52149","101.402094","2a0d:6fc2:5560:c200:15f4:c1ab:865a:2377","2a03:2880:f276:cd:face:b00c:0:167","TCP","74","51017  >  443 [ACK] Seq=26846 Ack=26474 Win=1030 Len=0"
"52152","103.399091","2a03:2880:f276:cd:face:b00c:0:167","2a0d:6fc2:5560:c200:15f4:c1ab:865a:2377","TLSv1.2","154","Application Data"
"52153","103.453692","2a0d:6fc2:5560:c200:15f4:c1ab:865a:2377","2a03:2880:f276:cd:face:b00c:0:167","TCP","74","51017  >  443 [ACK] Seq=26846 Ack=26554 Win=1030 Len=0"
"52154","103.467825","2a03:2880:f276:cd:face:b00c:0:167","2a0d:6fc2:5560:c200:15f4:c1ab:865a:2377","TLSv1.2","154","Application Data"
"52155","103.534878","2a0d:6fc2:5560:c200:15f4:c1ab:865a:2377","2a03:2880:f276:cd:face:b00c:0:167","TCP","74","51017  >  443 [ACK] Seq=26846 Ack=26634 Win=1030 Len=0"
"52177","105.969832","2a03:2880:f276:cd:face:b00c:0:167","2a0d:6fc2:5560:c200:15f4:c1ab:865a:2377","TLSv1.2","332","Application Data"
"52178","106.004184","2a0d:6fc2:5560:c200:15f4:c1ab:865a:2377","2a03:2880:f276:cd:face:b00c:0:167","TLSv1.2","173","Application Data"
"52179","106.060122","2a03:2880:f276:cd:face:b00c:0:167","2a0d:6fc2:5560:c200:15f4:c1ab:865a:2377","TCP","74","443  >  51017 [ACK] Seq=26892 Ack=26945 Win=5500 Len=0"
"52187","107.981445","2a03:2880:f276:cd:face:b00c:0:167","2a0d:6fc2:5560:c200:15f4:c1ab:865a:2377","TLSv1.2","154","Application Data"
"52188","108.035355","2a0d:6fc2:5560:c200:15f4:c1ab:865a:2377","2a03:2880:f276:cd:face:b00c:0:167","TCP","74","51017  >  443 [ACK] Seq=26945 Ack=26972 Win=1028 Len=0"
"52194","110.857076","2a0d:6fc2:5560:c200:15f4:c1ab:865a:2377","2a03:2880:f276:cd:face:b00c:0:167","TCP","1466","51017  >  443 [ACK] Seq=26945 Ack=26972 Win=1028 Len=1392 [TCP segment of a reassembled PDU]"
"52195","110.857076","2a0d:6fc2:5560:c200:15f4:c1ab:865a:2377","2a03:2880:f276:cd:face:b00c:0:167","TCP","1466","51017  >  443 [ACK] Seq=28337 Ack=26972 Win=1028 Len=1392 [TCP segment of a reassembled PDU]"
"52196","110.857076","2a0d:6fc2:5560:c200:15f4:c1ab:865a:2377","2a03:2880:f276:cd:face:b00c:0:167","TCP","1466","51017  >  443 [ACK] Seq=29729 Ack=26972 Win=1028 Len=1392 [TCP segment of a reassembled PDU]"
"52197","110.857076","2a0d:6fc2:5560:c200:15f4:c1ab:865a:2377","2a03:2880:f276:cd:face:b00c:0:167","TCP","1466","51017  >  443 [ACK] Seq=31121 Ack=26972 Win=1028 Len=1392 [TCP segment of a reassembled PDU]"
"52198","110.857076","2a0d:6fc2:5560:c200:15f4:c1ab:865a:2377","2a03:2880:f276:cd:face:b00c:0:167","TCP","1466","51017  >  443 [ACK] Seq=32513 Ack=26972 Win=1028 Len=1392 [TCP segment of a reassembled PDU]"
"52199","110.857076","2a0d:6fc2:5560:c200:15f4:c1ab:865a:2377","2a03:2880:f276:cd:face:b00c:0:167","TCP","1466","51017  >  443 [ACK] Seq=33905 Ack=26972 Win=1028 Len=1392 [TCP segment of a reassembled PDU]"
"52200","110.857076","2a0d:6fc2:5560:c200:15f4:c1ab:865a:2377","2a03:2880:f276:cd:face:b00c:0:167","TCP","1466","51017  >  443 [ACK] Seq=35297 Ack=26972 Win=1028 Len=1392 [TCP segment of a reassembled PDU]"
"52201","110.857076","2a0d:6fc2:5560:c200:15f4:c1ab:865a:2377","2a03:2880:f276:cd:face:b00c:0:167","TCP","1466","51017  >  443 [ACK] Seq=36689 Ack=26972 Win=1028 Len=1392 [TCP segment of a reassembled PDU]"
"52202","110.918545","2a03:2880:f276:cd:face:b00c:0:167","2a0d:6fc2:5560:c200:15f4:c1ab:865a:2377","TCP","74","443  >  51017 [ACK] Seq=26972 Ack=32513 Win=5479 Len=0"
"52203","110.918624","2a0d:6fc2:5560:c200:15f4:c1ab:865a:2377","2a03:2880:f276:cd:face:b00c:0:167","TLSv1.2","1206","Application Data"
"52204","110.918737","2a03:2880:f276:cd:face:b00c:0:167","2a0d:6fc2:5560:c200:15f4:c1ab:865a:2377","TCP","74","443  >  51017 [ACK] Seq=26972 Ack=33905 Win=5474 Len=0"
"52205","110.918737","2a03:2880:f276:cd:face:b00c:0:167","2a0d:6fc2:5560:c200:15f4:c1ab:865a:2377","TCP","74","443  >  51017 [ACK] Seq=26972 Ack=36689 Win=5492 Len=0"
"52206","110.918737","2a03:2880:f276:cd:face:b00c:0:167","2a0d:6fc2:5560:c200:15f4:c1ab:865a:2377","TCP","74","443  >  51017 [ACK] Seq=26972 Ack=38081 Win=5500 Len=0"
"52207","110.988314","2a03:2880:f276:cd:face:b00c:0:167","2a0d:6fc2:5560:c200:15f4:c1ab:865a:2377","TCP","74","443  >  51017 [ACK] Seq=26972 Ack=39213 Win=5500 Len=0"
"52208","111.125235","2a03:2880:f276:cd:face:b00c:0:167","2a0d:6fc2:5560:c200:15f4:c1ab:865a:2377","TLSv1.2","185","Application Data"
"52209","111.168500","2a0d:6fc2:5560:c200:15f4:c1ab:865a:2377","2a03:2880:f276:cd:face:b00c:0:167","TCP","74","51017  >  443 [ACK] Seq=39213 Ack=27083 Win=1028 Len=0"
"52210","111.353732","2a03:2880:f276:cd:face:b00c:0:167","2a0d:6fc2:5560:c200:15f4:c1ab:865a:2377","TLSv1.2","169","Application Data"
"52211","111.355358","2a0d:6fc2:5560:c200:15f4:c1ab:865a:2377","2a03:2880:f276:cd:face:b00c:0:167","TLSv1.2","167","Application Data"
"52212","111.402204","2a03:2880:f276:cd:face:b00c:0:167","2a0d:6fc2:5560:c200:15f4:c1ab:865a:2377","TLSv1.2","171","Application Data"
"52213","111.402246","2a0d:6fc2:5560:c200:15f4:c1ab:865a:2377","2a03:2880:f276:cd:face:b00c:0:167","TCP","74","51017  >  443 [ACK] Seq=39306 Ack=27275 Win=1033 Len=0"
"52214","111.407265","2a0d:6fc2:5560:c200:15f4:c1ab:865a:2377","2a03:2880:f276:cd:face:b00c:0:167","TLSv1.2","169","Application Data"
"52215","111.414591","2a03:2880:f276:cd:face:b00c:0:167","2a0d:6fc2:5560:c200:15f4:c1ab:865a:2377","TCP","74","443  >  51017 [ACK] Seq=27275 Ack=39306 Win=5500 Len=0"
"52216","111.470438","2a03:2880:f276:cd:face:b00c:0:167","2a0d:6fc2:5560:c200:15f4:c1ab:865a:2377","TCP","74","443  >  51017 [ACK] Seq=27275 Ack=39401 Win=5500 Len=0"
"52255","111.543072","2a03:2880:f276:cd:face:b00c:0:167","2a0d:6fc2:5560:c200:15f4:c1ab:865a:2377","TLSv1.2","395","Application Data"
"52265","111.580378","2a0d:6fc2:5560:c200:15f4:c1ab:865a:2377","2a03:2880:f276:cd:face:b00c:0:167","TLSv1.2","173","Application Data"
"52278","111.659641","2a03:2880:f276:cd:face:b00c:0:167","2a0d:6fc2:5560:c200:15f4:c1ab:865a:2377","TCP","74","443  >  51017 [ACK] Seq=27596 Ack=39500 Win=5500 Len=0"
"52283","112.174418","2a03:2880:f276:cd:face:b00c:0:167","2a0d:6fc2:5560:c200:15f4:c1ab:865a:2377","TLSv1.2","168","Application Data"
"52284","112.176488","2a0d:6fc2:5560:c200:15f4:c1ab:865a:2377","2a03:2880:f276:cd:face:b00c:0:167","TLSv1.2","167","Application Data"
"52285","112.233372","2a03:2880:f276:cd:face:b00c:0:167","2a0d:6fc2:5560:c200:15f4:c1ab:865a:2377","TCP","74","443  >  51017 [ACK] Seq=27690 Ack=39593 Win=5500 Len=0"
"52286","112.486907","2a03:2880:f276:cd:face:b00c:0:167","2a0d:6fc2:5560:c200:15f4:c1ab:865a:2377","TLSv1.2","171","Application Data"
"52287","112.489356","2a0d:6fc2:5560:c200:15f4:c1ab:865a:2377","2a03:2880:f276:cd:face:b00c:0:167","TLSv1.2","170","Application Data"
"52288","112.545313","2a03:2880:f276:cd:face:b00c:0:167","2a0d:6fc2:5560:c200:15f4:c1ab:865a:2377","TCP","74","443  >  51017 [ACK] Seq=27787 Ack=39689 Win=5500 Len=0"
"52332","117.699120","2a03:2880:f276:cd:face:b00c:0:167","2a0d:6fc2:5560:c200:15f4:c1ab:865a:2377","TLSv1.2","154","Application Data"
"52334","117.763335","2a0d:6fc2:5560:c200:15f4:c1ab:865a:2377","2a03:2880:f276:cd:face:b00c:0:167","TCP","74","51017  >  443 [ACK] Seq=39689 Ack=27867 Win=1030 Len=0"
"52337","119.076162","2a03:2880:f276:cd:face:b00c:0:167","2a0d:6fc2:5560:c200:15f4:c1ab:865a:2377","TLSv1.2","154","Application Data"
"52338","119.117344","2a0d:6fc2:5560:c200:15f4:c1ab:865a:2377","2a03:2880:f276:cd:face:b00c:0:167","TCP","74","51017  >  443 [ACK] Seq=39689 Ack=27947 Win=1030 Len=0"
