"No.","Time","Source","Destination","Protocol","Length","Info"
"1","0.000000","18.184.238.147","192.168.1.174","TCP","60","443  >  51298 [ACK] Seq=1 Ack=1 Win=12 Len=0"
"2","0.000047","192.168.1.174","18.184.238.147","TCP","54","[TCP ACKed unseen segment] 51298  >  443 [ACK] Seq=1 Ack=2 Win=513 Len=0"
"3","0.046656","2a0d:6fc2:5560:c200:15f4:c1ab:865a:2377","2a03:2880:f276:cd:face:b00c:0:167","TLSv1.2","134","Application Data"
"4","0.102617","2a03:2880:f276:cd:face:b00c:0:167","2a0d:6fc2:5560:c200:15f4:c1ab:865a:2377","TCP","74","443  >  51017 [ACK] Seq=1 Ack=61 Win=5500 Len=0"
"5","0.681354","38.106.231.204","192.168.1.174","TLSv1.2","85","Encrypted Alert"
"6","0.681791","38.106.231.204","192.168.1.174","TCP","60","443  >  51276 [FIN, ACK] Seq=32 Ack=1 Win=73 Len=0"
"7","0.681829","192.168.1.174","38.106.231.204","TCP","54","51276  >  443 [ACK] Seq=1 Ack=33 Win=512 Len=0"
"16","1.525865","2a0d:6fc2:5560:c200:15f4:c1ab:865a:2377","2a03:2880:f276:cd:face:b00c:0:167","TLSv1.2","134","Application Data"
"17","1.581598","2a03:2880:f276:cd:face:b00c:0:167","2a0d:6fc2:5560:c200:15f4:c1ab:865a:2377","TCP","74","443  >  51017 [ACK] Seq=1 Ack=121 Win=5500 Len=0"
"20","1.676392","2a03:2880:f276:cd:face:b00c:0:167","2a0d:6fc2:5560:c200:15f4:c1ab:865a:2377","TLSv1.2","132","Application Data"
"21","1.740591","2a0d:6fc2:5560:c200:15f4:c1ab:865a:2377","2a03:2880:f276:cd:face:b00c:0:167","TCP","74","51017  >  443 [ACK] Seq=121 Ack=59 Win=1032 Len=0"
"30","3.306824","2a0d:6fc2:5560:c200:15f4:c1ab:865a:2377","2606:2800:233:66b5:799a:7cd3:f74d:7071","TCP","75","51319  >  443 [ACK] Seq=1 Ack=1 Win=512 Len=1 [TCP segment of a reassembled PDU]"
"31","3.362765","2606:2800:233:66b5:799a:7cd3:f74d:7071","2a0d:6fc2:5560:c200:15f4:c1ab:865a:2377","TCP","86","443  >  51319 [ACK] Seq=1 Ack=2 Win=142 Len=0 SLE=1 SRE=2"
"32","3.368860","2a0d:6fc2:5560:c200:15f4:c1ab:865a:2377","2001:40a8:4400:3::5266:9841","TCP","75","51328  >  443 [ACK] Seq=1 Ack=1 Win=514 Len=1 [TCP segment of a reassembled PDU]"
"33","3.370311","2001:40a8:4400:3::5266:9841","2a0d:6fc2:5560:c200:15f4:c1ab:865a:2377","TCP","86","443  >  51328 [ACK] Seq=1 Ack=2 Win=501 Len=0 SLE=1 SRE=2"
"34","3.587589","18.196.158.34","192.168.1.174","TCP","60","443  >  51294 [ACK] Seq=1 Ack=1 Win=16 Len=0"
"35","3.587626","192.168.1.174","18.196.158.34","TCP","54","[TCP ACKed unseen segment] 51294  >  443 [ACK] Seq=1 Ack=2 Win=513 Len=0"
"62","5.121824","192.168.1.174","162.159.133.232","TCP","55","51261  >  443 [ACK] Seq=1 Ack=1 Win=8279 Len=1 [TCP segment of a reassembled PDU]"
"63","5.124557","162.159.133.232","192.168.1.174","TCP","66","443  >  51261 [ACK] Seq=1 Ack=2 Win=8 Len=0 SLE=1 SRE=2"
"94","7.901999","2620:1ec:21::14","2a0d:6fc2:5560:c200:15f4:c1ab:865a:2377","TLSv1.2","120","Application Data"
"95","7.903605","2a0d:6fc2:5560:c200:15f4:c1ab:865a:2377","2620:1ec:21::14","TLSv1.2","116","Application Data"
"96","7.903681","2a0d:6fc2:5560:c200:15f4:c1ab:865a:2377","2620:1ec:21::14","TLSv1.2","116","Application Data"
"97","7.906086","2620:1ec:21::14","2a0d:6fc2:5560:c200:15f4:c1ab:865a:2377","TCP","74","443  >  50974 [ACK] Seq=47 Ack=43 Win=16379 Len=0"
"98","7.906224","2620:1ec:21::14","2a0d:6fc2:5560:c200:15f4:c1ab:865a:2377","TCP","74","443  >  50974 [ACK] Seq=47 Ack=85 Win=16379 Len=0"
"99","8.185542","192.168.1.174","140.82.113.25","TCP","55","50971  >  443 [ACK] Seq=1 Ack=1 Win=512 Len=1 [TCP segment of a reassembled PDU]"
"100","8.449952","140.82.113.25","192.168.1.174","TCP","66","443  >  50971 [ACK] Seq=1 Ack=2 Win=70 Len=0 SLE=1 SRE=2"
"103","8.954188","2a0d:6fc2:5560:c200:15f4:c1ab:865a:2377","2a03:2880:f276:cd:face:b00c:0:167","TLSv1.2","144","Application Data"
"104","9.119444","2a03:2880:f276:cd:face:b00c:0:167","2a0d:6fc2:5560:c200:15f4:c1ab:865a:2377","TCP","74","443  >  51017 [ACK] Seq=59 Ack=191 Win=5500 Len=0"
"107","9.269552","2a03:2880:f276:cd:face:b00c:0:167","2a0d:6fc2:5560:c200:15f4:c1ab:865a:2377","TLSv1.2","146","Application Data"
"109","9.318714","2a0d:6fc2:5560:c200:15f4:c1ab:865a:2377","2a03:2880:f276:cd:face:b00c:0:167","TCP","74","51017  >  443 [ACK] Seq=191 Ack=131 Win=1031 Len=0"
"113","10.542081","2a03:2880:f276:cd:face:b00c:0:167","2a0d:6fc2:5560:c200:15f4:c1ab:865a:2377","TCP","1466","443  >  51017 [ACK] Seq=131 Ack=191 Win=5500 Len=1392 [TCP segment of a reassembled PDU]"
"114","10.542081","2a03:2880:f276:cd:face:b00c:0:167","2a0d:6fc2:5560:c200:15f4:c1ab:865a:2377","TLSv1.2","746","Application Data, Application Data"
"115","10.542167","2a0d:6fc2:5560:c200:15f4:c1ab:865a:2377","2a03:2880:f276:cd:face:b00c:0:167","TCP","74","51017  >  443 [ACK] Seq=191 Ack=2195 Win=1033 Len=0"
"116","10.653470","2a0d:6fc2:5560:c200:15f4:c1ab:865a:2377","2a03:2880:f276:cd:face:b00c:0:167","TLSv1.2","165","Application Data"
"117","10.699012","2a0d:6fc2:5560:c200:15f4:c1ab:865a:2377","2a03:2880:f276:cd:face:b00c:0:167","TLSv1.2","177","Application Data"
"118","10.773899","2a03:2880:f276:cd:face:b00c:0:167","2a0d:6fc2:5560:c200:15f4:c1ab:865a:2377","TCP","74","443  >  51017 [ACK] Seq=2195 Ack=282 Win=5500 Len=0"
"119","10.773899","2a03:2880:f276:cd:face:b00c:0:167","2a0d:6fc2:5560:c200:15f4:c1ab:865a:2377","TCP","74","443  >  51017 [ACK] Seq=2195 Ack=385 Win=5500 Len=0"
"124","10.816811","192.168.1.174","68.219.103.34","TCP","66","51367  >  443 [SYN] Seq=0 Win=64240 Len=0 MSS=1460 WS=256 SACK_PERM"
"125","10.822068","2a0d:6fc2:5560:c200:15f4:c1ab:865a:2377","2620:1ec:21::14","TCP","75","51046  >  443 [ACK] Seq=1 Ack=1 Win=512 Len=1 [TCP segment of a reassembled PDU]"
"126","10.824731","2620:1ec:21::14","2a0d:6fc2:5560:c200:15f4:c1ab:865a:2377","TCP","86","443  >  51046 [ACK] Seq=1 Ack=2 Win=16384 Len=0 SLE=1 SRE=2"
"127","10.870336","2a03:2880:f276:cd:face:b00c:0:167","2a0d:6fc2:5560:c200:15f4:c1ab:865a:2377","TLSv1.2","164","Application Data"
"128","10.886964","68.219.103.34","192.168.1.174","TCP","66","443  >  51367 [SYN, ACK] Seq=0 Ack=1 Win=65535 Len=0 MSS=1440 WS=256 SACK_PERM"
"129","10.887037","192.168.1.174","68.219.103.34","TCP","54","51367  >  443 [ACK] Seq=1 Ack=1 Win=132352 Len=0"
"130","10.887386","192.168.1.174","68.219.103.34","TLSv1.2","266","Client Hello"
"131","10.924966","2a0d:6fc2:5560:c200:15f4:c1ab:865a:2377","2a03:2880:f276:cd:face:b00c:0:167","TCP","74","51017  >  443 [ACK] Seq=385 Ack=2285 Win=1032 Len=0"
"132","10.959027","68.219.103.34","192.168.1.174","TCP","1506","443  >  51367 [ACK] Seq=1 Ack=213 Win=525312 Len=1452 [TCP segment of a reassembled PDU]"
"133","10.959027","68.219.103.34","192.168.1.174","TCP","1506","443  >  51367 [ACK] Seq=1453 Ack=213 Win=525312 Len=1452 [TCP segment of a reassembled PDU]"
"134","10.959075","192.168.1.174","68.219.103.34","TCP","54","51367  >  443 [ACK] Seq=213 Ack=2905 Win=132352 Len=0"
"135","10.960721","68.219.103.34","192.168.1.174","TCP","1506","443  >  51367 [ACK] Seq=2905 Ack=213 Win=525312 Len=1452 [TCP segment of a reassembled PDU]"
"136","10.960721","68.219.103.34","192.168.1.174","TCP","1506","443  >  51367 [ACK] Seq=4357 Ack=213 Win=525312 Len=1452 [TCP segment of a reassembled PDU]"
"137","10.960721","68.219.103.34","192.168.1.174","TLSv1.2","187","Server Hello, Certificate, Certificate Status, Server Key Exchange, Server Hello Done"
"138","10.960775","192.168.1.174","68.219.103.34","TCP","54","51367  >  443 [ACK] Seq=213 Ack=5942 Win=132352 Len=0"
"139","10.967833","192.168.1.174","68.219.103.34","TLSv1.2","212","Client Key Exchange, Change Cipher Spec, Encrypted Handshake Message"
"140","11.039010","68.219.103.34","192.168.1.174","TLSv1.2","105","Change Cipher Spec, Encrypted Handshake Message"
"141","11.039221","68.219.103.34","192.168.1.174","TLSv1.2","123","Application Data"
"142","11.039273","192.168.1.174","68.219.103.34","TCP","54","51367  >  443 [ACK] Seq=371 Ack=6062 Win=132352 Len=0"
"143","11.051044","192.168.1.174","68.219.103.34","TLSv1.2","141","Application Data"
"144","11.051168","192.168.1.174","68.219.103.34","TLSv1.2","214","Application Data"
"145","11.051253","192.168.1.174","68.219.103.34","TLSv1.2","92","Application Data"
"146","11.051420","192.168.1.174","68.219.103.34","TLSv1.2","728","Application Data"
"147","11.121064","68.219.103.34","192.168.1.174","TCP","60","443  >  51367 [ACK] Seq=6062 Ack=618 Win=524800 Len=0"
"148","11.121885","68.219.103.34","192.168.1.174","TLSv1.2","92","Application Data"
"149","11.122259","68.219.103.34","192.168.1.174","TCP","60","443  >  51367 [ACK] Seq=6100 Ack=1330 Win=524288 Len=0"
"150","11.122259","68.219.103.34","192.168.1.174","TLSv1.2","96","Application Data"
"151","11.122326","192.168.1.174","68.219.103.34","TCP","54","51367  >  443 [ACK] Seq=1330 Ack=6142 Win=132096 Len=0"
"152","11.185262","68.219.103.34","192.168.1.174","TLSv1.2","585","Application Data"
"153","11.186442","192.168.1.174","68.219.103.34","TCP","54","51367  >  443 [FIN, ACK] Seq=1330 Ack=6673 Win=131584 Len=0"
"154","11.200523","192.168.1.174","68.219.103.34","TCP","66","51368  >  443 [SYN] Seq=0 Win=64240 Len=0 MSS=1460 WS=256 SACK_PERM"
"155","11.256439","68.219.103.34","192.168.1.174","TLSv1.2","96","Application Data"
"156","11.256506","192.168.1.174","68.219.103.34","TCP","54","51367  >  443 [RST, ACK] Seq=1331 Ack=6715 Win=0 Len=0"
"157","11.256754","68.219.103.34","192.168.1.174","TCP","60","443  >  51367 [FIN, ACK] Seq=6715 Ack=1331 Win=524288 Len=0"
"158","11.271961","68.219.103.34","192.168.1.174","TCP","66","443  >  51368 [SYN, ACK] Seq=0 Ack=1 Win=65535 Len=0 MSS=1440 WS=256 SACK_PERM"
"159","11.272060","192.168.1.174","68.219.103.34","TCP","54","51368  >  443 [ACK] Seq=1 Ack=1 Win=132352 Len=0"
"160","11.272509","192.168.1.174","68.219.103.34","TLSv1.2","266","Client Hello"
"161","11.345807","68.219.103.34","192.168.1.174","TCP","1506","443  >  51368 [ACK] Seq=1 Ack=213 Win=525312 Len=1452 [TCP segment of a reassembled PDU]"
"162","11.345807","68.219.103.34","192.168.1.174","TCP","1506","443  >  51368 [ACK] Seq=1453 Ack=213 Win=525312 Len=1452 [TCP segment of a reassembled PDU]"
"163","11.345807","68.219.103.34","192.168.1.174","TCP","1506","443  >  51368 [ACK] Seq=2905 Ack=213 Win=525312 Len=1452 [TCP segment of a reassembled PDU]"
"164","11.345905","192.168.1.174","68.219.103.34","TCP","54","51368  >  443 [ACK] Seq=213 Ack=4357 Win=132352 Len=0"
"165","11.346834","68.219.103.34","192.168.1.174","TCP","1506","443  >  51368 [ACK] Seq=4357 Ack=213 Win=525312 Len=1452 [TCP segment of a reassembled PDU]"
"166","11.346834","68.219.103.34","192.168.1.174","TLSv1.2","187","Server Hello, Certificate, Certificate Status, Server Key Exchange, Server Hello Done"
"167","11.346891","192.168.1.174","68.219.103.34","TCP","54","51368  >  443 [ACK] Seq=213 Ack=5942 Win=132352 Len=0"
"168","11.351688","192.168.1.174","68.219.103.34","TLSv1.2","212","Client Key Exchange, Change Cipher Spec, Encrypted Handshake Message"
"169","11.423533","68.219.103.34","192.168.1.174","TLSv1.2","105","Change Cipher Spec, Encrypted Handshake Message"
"170","11.424596","192.168.1.174","68.219.103.34","TLSv1.2","141","Application Data"
"171","11.424680","192.168.1.174","68.219.103.34","TLSv1.2","209","Application Data"
"172","11.424815","192.168.1.174","68.219.103.34","TLSv1.2","750","Application Data"
"173","11.425402","68.219.103.34","192.168.1.174","TLSv1.2","123","Application Data"
"174","11.425518","192.168.1.174","68.219.103.34","TLSv1.2","92","Application Data"
"175","11.497645","68.219.103.34","192.168.1.174","TCP","60","443  >  51368 [ACK] Seq=6062 Ack=613 Win=524800 Len=0"
"176","11.497645","68.219.103.34","192.168.1.174","TLSv1.2","92","Application Data"
"177","11.501989","68.219.103.34","192.168.1.174","TLSv1.2","96","Application Data"
"178","11.501989","68.219.103.34","192.168.1.174","TCP","1506","443  >  51368 [ACK] Seq=6142 Ack=1347 Win=524032 Len=1452 [TCP segment of a reassembled PDU]"
"179","11.502041","192.168.1.174","68.219.103.34","TCP","54","51368  >  443 [ACK] Seq=1347 Ack=7594 Win=132352 Len=0"
"180","11.504311","68.219.103.34","192.168.1.174","TCP","1506","443  >  51368 [ACK] Seq=7594 Ack=1347 Win=524032 Len=1452 [TCP segment of a reassembled PDU]"
"181","11.504311","68.219.103.34","192.168.1.174","TCP","1506","443  >  51368 [ACK] Seq=9046 Ack=1347 Win=524032 Len=1452 [TCP segment of a reassembled PDU]"
"182","11.504311","68.219.103.34","192.168.1.174","TCP","1506","443  >  51368 [ACK] Seq=10498 Ack=1347 Win=524032 Len=1452 [TCP segment of a reassembled PDU]"
"183","11.504311","68.219.103.34","192.168.1.174","TCP","1506","443  >  51368 [ACK] Seq=11950 Ack=1347 Win=524032 Len=1452 [TCP segment of a reassembled PDU]"
"184","11.504311","68.219.103.34","192.168.1.174","TLSv1.2","746","Application Data"
"185","11.504311","68.219.103.34","192.168.1.174","TLSv1.2","92","Application Data"
"186","11.504365","192.168.1.174","68.219.103.34","TCP","54","51368  >  443 [ACK] Seq=1347 Ack=14132 Win=132352 Len=0"
"187","11.506586","192.168.1.174","68.219.103.34","TCP","54","51368  >  443 [FIN, ACK] Seq=1347 Ack=14132 Win=132352 Len=0"
"188","11.577407","68.219.103.34","192.168.1.174","TCP","60","443  >  51368 [FIN, ACK] Seq=14132 Ack=1348 Win=524032 Len=0"
"189","11.577494","192.168.1.174","68.219.103.34","TCP","54","51368  >  443 [ACK] Seq=1348 Ack=14133 Win=132352 Len=0"
"190","11.656651","2a0d:6fc2:5560:c200:15f4:c1ab:865a:2377","2620:1ec:21::14","TLSv1.2","1474","Ignored Unknown Record"
"191","11.656651","2a0d:6fc2:5560:c200:15f4:c1ab:865a:2377","2620:1ec:21::14","TLSv1.2","1474","Ignored Unknown Record"
"192","11.656651","2a0d:6fc2:5560:c200:15f4:c1ab:865a:2377","2620:1ec:21::14","TLSv1.2","1474","Ignored Unknown Record"
"193","11.656651","2a0d:6fc2:5560:c200:15f4:c1ab:865a:2377","2620:1ec:21::14","TLSv1.2","528","Ignored Unknown Record"
"194","11.656731","2a0d:6fc2:5560:c200:15f4:c1ab:865a:2377","2620:1ec:21::14","TLSv1.2","120","Application Data"
"195","11.656749","2a0d:6fc2:5560:c200:15f4:c1ab:865a:2377","2620:1ec:21::14","TLSv1.2","442","Application Data"
"196","11.659396","2620:1ec:21::14","2a0d:6fc2:5560:c200:15f4:c1ab:865a:2377","TCP","74","443  >  51046 [ACK] Seq=1 Ack=2802 Win=16384 Len=0"
"197","11.659396","2620:1ec:21::14","2a0d:6fc2:5560:c200:15f4:c1ab:865a:2377","TCP","74","443  >  51046 [ACK] Seq=1 Ack=4202 Win=16384 Len=0"
"198","11.659520","2620:1ec:21::14","2a0d:6fc2:5560:c200:15f4:c1ab:865a:2377","TCP","74","443  >  51046 [ACK] Seq=1 Ack=4656 Win=16382 Len=0"
"199","11.659876","2620:1ec:21::14","2a0d:6fc2:5560:c200:15f4:c1ab:865a:2377","TCP","74","443  >  51046 [ACK] Seq=1 Ack=5070 Win=16380 Len=0"
"200","11.660260","2620:1ec:21::14","2a0d:6fc2:5560:c200:15f4:c1ab:865a:2377","TLSv1.2","120","Application Data"
"201","11.672915","2a0d:6fc2:5560:c200:15f4:c1ab:865a:2377","2a00:1450:4028:803::2005","TCP","1474","51240  >  443 [ACK] Seq=1 Ack=1 Win=512 Len=1400 [TCP segment of a reassembled PDU]"
"202","11.672915","2a0d:6fc2:5560:c200:15f4:c1ab:865a:2377","2a00:1450:4028:803::2005","TCP","1474","51240  >  443 [ACK] Seq=1401 Ack=1 Win=512 Len=1400 [TCP segment of a reassembled PDU]"
"203","11.672915","2a0d:6fc2:5560:c200:15f4:c1ab:865a:2377","2a00:1450:4028:803::2005","TCP","1474","51240  >  443 [ACK] Seq=2801 Ack=1 Win=512 Len=1400 [TCP segment of a reassembled PDU]"
"204","11.672915","2a0d:6fc2:5560:c200:15f4:c1ab:865a:2377","2a00:1450:4028:803::2005","TLSv1.2","787","Application Data"
"205","11.672989","2a0d:6fc2:5560:c200:15f4:c1ab:865a:2377","2a00:1450:4028:803::2005","TLSv1.2","113","Application Data"
"206","11.673004","2a0d:6fc2:5560:c200:15f4:c1ab:865a:2377","2a00:1450:4028:803::2005","TLSv1.2","127","Application Data"
"207","11.674783","2a00:1450:4028:803::2005","2a0d:6fc2:5560:c200:15f4:c1ab:865a:2377","TCP","74","443  >  51240 [ACK] Seq=1 Ack=1401 Win=352 Len=0"
"208","11.674923","2a00:1450:4028:803::2005","2a0d:6fc2:5560:c200:15f4:c1ab:865a:2377","TCP","74","443  >  51240 [ACK] Seq=1 Ack=2801 Win=363 Len=0"
"209","11.675599","2a00:1450:4028:803::2005","2a0d:6fc2:5560:c200:15f4:c1ab:865a:2377","TCP","74","443  >  51240 [ACK] Seq=1 Ack=4201 Win=374 Len=0"
"210","11.675599","2a00:1450:4028:803::2005","2a0d:6fc2:5560:c200:15f4:c1ab:865a:2377","TCP","74","443  >  51240 [ACK] Seq=1 Ack=4914 Win=385 Len=0"
"211","11.675599","2a00:1450:4028:803::2005","2a0d:6fc2:5560:c200:15f4:c1ab:865a:2377","TCP","74","443  >  51240 [ACK] Seq=1 Ack=4953 Win=385 Len=0"
"212","11.675599","2a00:1450:4028:803::2005","2a0d:6fc2:5560:c200:15f4:c1ab:865a:2377","TCP","74","443  >  51240 [ACK] Seq=1 Ack=5006 Win=385 Len=0"
"216","11.693802","2a00:1450:4028:803::2005","2a0d:6fc2:5560:c200:15f4:c1ab:865a:2377","TLSv1.2","113","Application Data"
"243","11.707219","2a0d:6fc2:5560:c200:15f4:c1ab:865a:2377","2620:1ec:21::14","TCP","74","51046  >  443 [ACK] Seq=5070 Ack=47 Win=511 Len=0"
"250","11.737524","2a0d:6fc2:5560:c200:15f4:c1ab:865a:2377","2a00:1450:4028:803::2005","TCP","74","51240  >  443 [ACK] Seq=5006 Ack=40 Win=512 Len=0"
"268","11.816680","2620:1ec:21::14","2a0d:6fc2:5560:c200:15f4:c1ab:865a:2377","TCP","1474","443  >  51046 [ACK] Seq=47 Ack=5070 Win=16380 Len=1400 [TCP segment of a reassembled PDU]"
"269","11.816680","2620:1ec:21::14","2a0d:6fc2:5560:c200:15f4:c1ab:865a:2377","TLSv1.2","999","Application Data"
"270","11.816749","2a0d:6fc2:5560:c200:15f4:c1ab:865a:2377","2620:1ec:21::14","TCP","74","51046  >  443 [ACK] Seq=5070 Ack=2372 Win=514 Len=0"
"276","11.910066","2a00:1450:4028:803::2005","2a0d:6fc2:5560:c200:15f4:c1ab:865a:2377","TLSv1.2","685","Application Data"
"277","11.910066","2a00:1450:4028:803::2005","2a0d:6fc2:5560:c200:15f4:c1ab:865a:2377","TLSv1.2","212","Application Data"
"278","11.910150","2a0d:6fc2:5560:c200:15f4:c1ab:865a:2377","2a00:1450:4028:803::2005","TCP","74","51240  >  443 [ACK] Seq=5006 Ack=789 Win=509 Len=0"
"279","11.910679","2a0d:6fc2:5560:c200:15f4:c1ab:865a:2377","2a00:1450:4028:803::2005","TLSv1.2","109","Application Data"
"280","11.913037","2a00:1450:4028:803::2005","2a0d:6fc2:5560:c200:15f4:c1ab:865a:2377","TLSv1.2","207","Application Data"
"281","11.913669","2a00:1450:4028:803::2005","2a0d:6fc2:5560:c200:15f4:c1ab:865a:2377","TLSv1.2","265","Application Data"
"282","11.913721","2a0d:6fc2:5560:c200:15f4:c1ab:865a:2377","2a00:1450:4028:803::2005","TCP","74","51240  >  443 [ACK] Seq=5041 Ack=1113 Win=514 Len=0"
"283","11.913818","2a00:1450:4028:803::2005","2a0d:6fc2:5560:c200:15f4:c1ab:865a:2377","TLSv1.2","113","Application Data"
"284","11.914346","2a0d:6fc2:5560:c200:15f4:c1ab:865a:2377","2a00:1450:4028:803::2005","TLSv1.2","113","Application Data"
"285","11.921980","2a00:1450:4028:803::2005","2a0d:6fc2:5560:c200:15f4:c1ab:865a:2377","TCP","74","443  >  51240 [ACK] Seq=1152 Ack=5080 Win=385 Len=0"
"294","12.906850","192.168.1.174","20.189.173.11","TCP","66","51372  >  443 [SYN] Seq=0 Win=64240 Len=0 MSS=1460 WS=256 SACK_PERM"
"295","13.111934","20.189.173.11","192.168.1.174","TCP","66","443  >  51372 [SYN, ACK] Seq=0 Ack=1 Win=65535 Len=0 MSS=1440 WS=256 SACK_PERM"
"296","13.112136","192.168.1.174","20.189.173.11","TCP","54","51372  >  443 [ACK] Seq=1 Ack=1 Win=132352 Len=0"
"297","13.112711","192.168.1.174","20.189.173.11","TLSv1.2","268","Client Hello"
"298","13.318799","20.189.173.11","192.168.1.174","TCP","1506","443  >  51372 [ACK] Seq=1 Ack=215 Win=525312 Len=1452 [TCP segment of a reassembled PDU]"
"299","13.318799","20.189.173.11","192.168.1.174","TCP","1506","443  >  51372 [ACK] Seq=1453 Ack=215 Win=525312 Len=1452 [TCP segment of a reassembled PDU]"
"300","13.318799","20.189.173.11","192.168.1.174","TCP","1506","443  >  51372 [ACK] Seq=2905 Ack=215 Win=525312 Len=1452 [TCP segment of a reassembled PDU]"
"301","13.318799","20.189.173.11","192.168.1.174","TLSv1.2","191","Server Hello, Certificate, Server Key Exchange, Server Hello Done"
"302","13.318916","192.168.1.174","20.189.173.11","TCP","54","51372  >  443 [ACK] Seq=215 Ack=4494 Win=132352 Len=0"
"303","13.324543","192.168.1.174","20.189.173.11","TLSv1.2","212","Client Key Exchange, Change Cipher Spec, Encrypted Handshake Message"
"304","13.537836","20.189.173.11","192.168.1.174","TLSv1.2","105","Change Cipher Spec, Encrypted Handshake Message"
"305","13.539022","192.168.1.174","20.189.173.11","TLSv1.2","141","Application Data"
"306","13.539152","192.168.1.174","20.189.173.11","TLSv1.2","699","Application Data"
"307","13.539306","192.168.1.174","20.189.173.11","TLSv1.2","1369","Application Data"
"308","13.540157","20.189.173.11","192.168.1.174","TLSv1.2","123","Application Data"
"309","13.540333","192.168.1.174","20.189.173.11","TLSv1.2","92","Application Data"
"310","13.743491","20.189.173.11","192.168.1.174","TCP","60","443  >  51372 [ACK] Seq=4614 Ack=1105 Win=524288 Len=0"
"311","13.743491","20.189.173.11","192.168.1.174","TLSv1.2","92","Application Data"
"312","13.744219","20.189.173.11","192.168.1.174","TLSv1.2","96","Application Data"
"313","13.744279","192.168.1.174","20.189.173.11","TCP","54","51372  >  443 [ACK] Seq=2458 Ack=4694 Win=132096 Len=0"
"314","13.745559","20.189.173.11","192.168.1.174","TLSv1.2","338","Application Data"
"315","13.758236","192.168.1.174","20.189.173.11","TCP","54","51372  >  443 [FIN, ACK] Seq=2458 Ack=4978 Win=131840 Len=0"
"316","13.962808","20.189.173.11","192.168.1.174","TLSv1.2","96","Application Data"
"317","13.962808","20.189.173.11","192.168.1.174","TCP","60","443  >  51372 [FIN, ACK] Seq=5020 Ack=2459 Win=525568 Len=0"
"318","13.962912","192.168.1.174","20.189.173.11","TCP","54","51372  >  443 [RST, ACK] Seq=2459 Ack=5020 Win=0 Len=0"
"322","15.549465","192.168.1.174","185.199.110.154","TCP","55","51103  >  443 [ACK] Seq=1 Ack=1 Win=2094 Len=1 [TCP segment of a reassembled PDU]"
"323","15.613613","185.199.110.154","192.168.1.174","TCP","66","443  >  51103 [ACK] Seq=1 Ack=2 Win=336 Len=0 SLE=1 SRE=2"
"324","16.303131","2a0d:6fc2:5560:c200:15f4:c1ab:865a:2377","2606:50c0:8001::154","TCP","75","51104  >  443 [ACK] Seq=1 Ack=1 Win=514 Len=1 [TCP segment of a reassembled PDU]"
"325","16.364546","2606:50c0:8001::154","2a0d:6fc2:5560:c200:15f4:c1ab:865a:2377","TCP","86","443  >  51104 [ACK] Seq=1 Ack=2 Win=288 Len=0 SLE=1 SRE=2"
"343","21.260855","192.168.1.174","140.82.121.5","TCP","55","51345  >  443 [ACK] Seq=1 Ack=1 Win=511 Len=1 [TCP segment of a reassembled PDU]"
"344","21.322309","140.82.121.5","192.168.1.174","TCP","66","443  >  51345 [ACK] Seq=1 Ack=2 Win=68 Len=0 SLE=1 SRE=2"
"347","21.554775","192.168.1.174","140.82.113.22","TCP","55","51346  >  443 [ACK] Seq=1 Ack=1 Win=514 Len=1 [TCP segment of a reassembled PDU]"
"348","21.688339","140.82.113.22","192.168.1.174","TCP","66","443  >  51346 [ACK] Seq=1 Ack=2 Win=70 Len=0 SLE=1 SRE=2"
"357","22.526998","18.184.238.147","192.168.1.174","TCP","60","[TCP Dup ACK 1#1] 443  >  51298 [ACK] Seq=1 Ack=1 Win=12 Len=0"
"358","22.527060","192.168.1.174","18.184.238.147","TCP","54","[TCP Dup ACK 2#1] 51298  >  443 [ACK] Seq=1 Ack=2 Win=513 Len=0"
"376","22.817208","2620:1ec:21::14","2a0d:6fc2:5560:c200:15f4:c1ab:865a:2377","TLSv1.2","120","Application Data"
"377","22.818881","2a0d:6fc2:5560:c200:15f4:c1ab:865a:2377","2620:1ec:21::14","TLSv1.2","116","Application Data"
"378","22.818981","2a0d:6fc2:5560:c200:15f4:c1ab:865a:2377","2620:1ec:21::14","TLSv1.2","116","Application Data"
"379","22.821421","2620:1ec:21::14","2a0d:6fc2:5560:c200:15f4:c1ab:865a:2377","TCP","74","443  >  50974 [ACK] Seq=93 Ack=169 Win=16384 Len=0"
"380","23.038094","140.82.113.25","192.168.1.174","TLSv1.2","80","Application Data"
"381","23.038367","192.168.1.174","140.82.113.25","TLSv1.2","84","Ignored Unknown Record"
"382","23.173493","140.82.113.25","192.168.1.174","TCP","60","443  >  50971 [ACK] Seq=27 Ack=32 Win=70 Len=0"
"582","25.271869","192.168.1.174","18.184.238.147","TCP","55","[TCP Keep-Alive] 51298  >  443 [ACK] Seq=0 Ack=2 Win=513 Len=1"
"725","25.336319","18.184.238.147","192.168.1.174","TCP","66","[TCP Previous segment not captured] 443  >  51298 [ACK] Seq=2 Ack=1 Win=12 Len=0 SLE=0 SRE=1"
"732","25.666026","2a0d:6fc2:5560:c200:15f4:c1ab:865a:2377","2620:1ec:21::14","TLSv1.2","373","Application Data"
"733","25.666091","2a0d:6fc2:5560:c200:15f4:c1ab:865a:2377","2620:1ec:21::14","TLSv1.2","120","Application Data"
"734","25.666106","2a0d:6fc2:5560:c200:15f4:c1ab:865a:2377","2620:1ec:21::14","TLSv1.2","1136","Application Data"
"735","25.669015","2620:1ec:21::14","2a0d:6fc2:5560:c200:15f4:c1ab:865a:2377","TCP","74","443  >  51046 [ACK] Seq=2372 Ack=6477 Win=16384 Len=0"
"736","25.669258","2620:1ec:21::14","2a0d:6fc2:5560:c200:15f4:c1ab:865a:2377","TLSv1.2","120","Application Data"
"737","25.721427","2a0d:6fc2:5560:c200:15f4:c1ab:865a:2377","2620:1ec:21::14","TCP","74","51046  >  443 [ACK] Seq=6477 Ack=2418 Win=513 Len=0"
"738","25.822613","2620:1ec:21::14","2a0d:6fc2:5560:c200:15f4:c1ab:865a:2377","TLSv1.2","549","Application Data"
"741","25.872501","2a0d:6fc2:5560:c200:15f4:c1ab:865a:2377","2620:1ec:21::14","TCP","74","51046  >  443 [ACK] Seq=6477 Ack=2893 Win=512 Len=0"
"742","26.116546","18.196.158.34","192.168.1.174","TCP","60","[TCP Dup ACK 34#1] 443  >  51294 [ACK] Seq=1 Ack=1 Win=16 Len=0"
"743","26.116612","192.168.1.174","18.196.158.34","TCP","54","[TCP Dup ACK 35#1] 51294  >  443 [ACK] Seq=1 Ack=2 Win=513 Len=0"
"746","26.670933","2a0d:6fc2:5560:c200:15f4:c1ab:865a:2377","2a00:1450:4028:803::2005","TCP","1474","51240  >  443 [ACK] Seq=5080 Ack=1152 Win=513 Len=1400 [TCP segment of a reassembled PDU]"
"747","26.670933","2a0d:6fc2:5560:c200:15f4:c1ab:865a:2377","2a00:1450:4028:803::2005","TCP","1474","51240  >  443 [ACK] Seq=6480 Ack=1152 Win=513 Len=1400 [TCP segment of a reassembled PDU]"
"748","26.670933","2a0d:6fc2:5560:c200:15f4:c1ab:865a:2377","2a00:1450:4028:803::2005","TLSv1.2","555","Application Data"
"749","26.671043","2a0d:6fc2:5560:c200:15f4:c1ab:865a:2377","2a00:1450:4028:803::2005","TLSv1.2","113","Application Data"
"750","26.671057","2a0d:6fc2:5560:c200:15f4:c1ab:865a:2377","2a00:1450:4028:803::2005","TLSv1.2","184","Application Data"
"751","26.674231","2a00:1450:4028:803::2005","2a0d:6fc2:5560:c200:15f4:c1ab:865a:2377","TCP","74","443  >  51240 [ACK] Seq=1152 Ack=6480 Win=396 Len=0"
"752","26.674231","2a00:1450:4028:803::2005","2a0d:6fc2:5560:c200:15f4:c1ab:865a:2377","TCP","74","443  >  51240 [ACK] Seq=1152 Ack=7880 Win=407 Len=0"
"753","26.674231","2a00:1450:4028:803::2005","2a0d:6fc2:5560:c200:15f4:c1ab:865a:2377","TCP","74","443  >  51240 [ACK] Seq=1152 Ack=8361 Win=418 Len=0"
"754","26.674231","2a00:1450:4028:803::2005","2a0d:6fc2:5560:c200:15f4:c1ab:865a:2377","TCP","74","443  >  51240 [ACK] Seq=1152 Ack=8400 Win=418 Len=0"
"755","26.674943","2a00:1450:4028:803::2005","2a0d:6fc2:5560:c200:15f4:c1ab:865a:2377","TCP","74","443  >  51240 [ACK] Seq=1152 Ack=8510 Win=418 Len=0"
"756","26.674943","2a00:1450:4028:803::2005","2a0d:6fc2:5560:c200:15f4:c1ab:865a:2377","TLSv1.2","113","Application Data"
"757","26.721402","2a0d:6fc2:5560:c200:15f4:c1ab:865a:2377","2a00:1450:4028:803::2005","TCP","74","51240  >  443 [ACK] Seq=8510 Ack=1191 Win=513 Len=0"
"758","26.957204","2a00:1450:4028:803::2005","2a0d:6fc2:5560:c200:15f4:c1ab:865a:2377","TLSv1.2","615","Application Data"
"759","26.957863","2a00:1450:4028:803::2005","2a0d:6fc2:5560:c200:15f4:c1ab:865a:2377","TLSv1.2","514","Application Data"
"760","26.957897","2a0d:6fc2:5560:c200:15f4:c1ab:865a:2377","2a00:1450:4028:803::2005","TCP","74","51240  >  443 [ACK] Seq=8510 Ack=2172 Win=509 Len=0"
"761","26.958212","2a0d:6fc2:5560:c200:15f4:c1ab:865a:2377","2a00:1450:4028:803::2005","TLSv1.2","109","Application Data"
"762","26.958946","2a00:1450:4028:803::2005","2a0d:6fc2:5560:c200:15f4:c1ab:865a:2377","TLSv1.2","125","Application Data"
"763","26.962906","2a00:1450:4028:803::2005","2a0d:6fc2:5560:c200:15f4:c1ab:865a:2377","TLSv1.2","313","Application Data"
"764","26.962948","2a0d:6fc2:5560:c200:15f4:c1ab:865a:2377","2a00:1450:4028:803::2005","TCP","74","51240  >  443 [ACK] Seq=8545 Ack=2462 Win=508 Len=0"
"765","26.962997","2a00:1450:4028:803::2005","2a0d:6fc2:5560:c200:15f4:c1ab:865a:2377","TLSv1.2","113","Application Data"
"766","26.963348","2a0d:6fc2:5560:c200:15f4:c1ab:865a:2377","2a00:1450:4028:803::2005","TLSv1.2","113","Application Data"
"767","26.969905","2a00:1450:4028:803::2005","2a0d:6fc2:5560:c200:15f4:c1ab:865a:2377","TCP","74","443  >  51240 [ACK] Seq=2501 Ack=8584 Win=418 Len=0"
"768","26.987043","2a0d:6fc2:5560:c200:15f4:c1ab:865a:2377","2a03:2880:f276:cd:face:b00c:0:167","TLSv1.2","160","Application Data"
"769","27.042936","2a03:2880:f276:cd:face:b00c:0:167","2a0d:6fc2:5560:c200:15f4:c1ab:865a:2377","TCP","74","443  >  51017 [ACK] Seq=2285 Ack=471 Win=5500 Len=0"
"770","27.066978","2a0d:6fc2:5560:c200:15f4:c1ab:865a:2377","2a03:2880:f276:cd:face:b00c:0:167","TCP","1466","51017  >  443 [ACK] Seq=471 Ack=2285 Win=1032 Len=1392 [TCP segment of a reassembled PDU]"
"771","27.066978","2a0d:6fc2:5560:c200:15f4:c1ab:865a:2377","2a03:2880:f276:cd:face:b00c:0:167","TCP","1466","51017  >  443 [ACK] Seq=1863 Ack=2285 Win=1032 Len=1392 [TCP segment of a reassembled PDU]"
"772","27.066978","2a0d:6fc2:5560:c200:15f4:c1ab:865a:2377","2a03:2880:f276:cd:face:b00c:0:167","TLSv1.2","1183","Application Data"
"775","27.122898","2a03:2880:f276:cd:face:b00c:0:167","2a0d:6fc2:5560:c200:15f4:c1ab:865a:2377","TCP","74","443  >  51017 [ACK] Seq=2285 Ack=1863 Win=5500 Len=0"
"776","27.122898","2a03:2880:f276:cd:face:b00c:0:167","2a0d:6fc2:5560:c200:15f4:c1ab:865a:2377","TCP","74","443  >  51017 [ACK] Seq=2285 Ack=4364 Win=5492 Len=0"
"777","27.291548","2a03:2880:f276:cd:face:b00c:0:167","2a0d:6fc2:5560:c200:15f4:c1ab:865a:2377","TLSv1.2","185","Application Data"
"778","27.291702","2a03:2880:f276:cd:face:b00c:0:167","2a0d:6fc2:5560:c200:15f4:c1ab:865a:2377","TLSv1.2","148","Application Data"
"779","27.291723","2a0d:6fc2:5560:c200:15f4:c1ab:865a:2377","2a03:2880:f276:cd:face:b00c:0:167","TCP","74","51017  >  443 [ACK] Seq=4364 Ack=2470 Win=1032 Len=0"
"780","27.590189","2a03:2880:f276:cd:face:b00c:0:167","2a0d:6fc2:5560:c200:15f4:c1ab:865a:2377","TLSv1.2","169","Application Data"
"781","27.592214","2a0d:6fc2:5560:c200:15f4:c1ab:865a:2377","2a03:2880:f276:cd:face:b00c:0:167","TLSv1.2","167","Application Data"
"782","27.613061","2a03:2880:f276:cd:face:b00c:0:167","2a0d:6fc2:5560:c200:15f4:c1ab:865a:2377","TLSv1.2","171","Application Data"
"783","27.617512","2a0d:6fc2:5560:c200:15f4:c1ab:865a:2377","2a03:2880:f276:cd:face:b00c:0:167","TLSv1.2","169","Application Data"
"784","27.648506","2a03:2880:f276:cd:face:b00c:0:167","2a0d:6fc2:5560:c200:15f4:c1ab:865a:2377","TCP","74","443  >  51017 [ACK] Seq=2662 Ack=4457 Win=5500 Len=0"
"785","27.674705","2a03:2880:f276:cd:face:b00c:0:167","2a0d:6fc2:5560:c200:15f4:c1ab:865a:2377","TCP","74","443  >  51017 [ACK] Seq=2662 Ack=4552 Win=5500 Len=0"
"787","28.364663","2a03:2880:f276:cd:face:b00c:0:167","2a0d:6fc2:5560:c200:15f4:c1ab:865a:2377","TLSv1.2","168","Application Data"
"788","28.367366","2a0d:6fc2:5560:c200:15f4:c1ab:865a:2377","2a03:2880:f276:cd:face:b00c:0:167","TLSv1.2","167","Application Data"
"789","28.424481","2a03:2880:f276:cd:face:b00c:0:167","2a0d:6fc2:5560:c200:15f4:c1ab:865a:2377","TCP","74","443  >  51017 [ACK] Seq=2756 Ack=4645 Win=5500 Len=0"
"812","33.476015","192.168.1.174","20.199.120.151","TLSv1.2","97","Application Data"
"813","33.532247","20.199.120.151","192.168.1.174","TLSv1.2","228","Application Data"
"814","33.580002","192.168.1.174","20.199.120.151","TCP","54","50948  >  443 [ACK] Seq=44 Ack=175 Win=512 Len=0"
"865","34.561193","13.107.42.12","192.168.1.174","TCP","60","443  >  51332 [RST, ACK] Seq=1 Ack=1 Win=0 Len=0"
"930","35.040509","2a0d:6fc2:5560:c200:15f4:c1ab:865a:2377","2600:1901:0:92a9::","TLSv1.2","113","Application Data"
"931","35.040588","192.168.1.174","34.98.75.36","TLSv1.2","93","Application Data"
"932","35.040625","192.168.1.174","34.120.208.123","TLSv1.2","100","Application Data"
"933","35.040729","2a0d:6fc2:5560:c200:15f4:c1ab:865a:2377","2600:1901:0:92a9::","TLSv1.2","113","Application Data"
"934","35.040771","192.168.1.174","34.98.75.36","TLSv1.2","93","Application Data"
"935","35.040810","192.168.1.174","34.120.208.123","TLSv1.2","100","Application Data"
"936","35.040853","192.168.1.174","35.201.103.21","TLSv1.2","93","Application Data"
"937","35.041034","192.168.1.174","34.120.208.123","TLSv1.2","85","Encrypted Alert"
"938","35.041055","192.168.1.174","34.120.208.123","TCP","54","51265  >  443 [FIN, ACK] Seq=124 Ack=1 Win=508 Len=0"
"939","35.041211","2a0d:6fc2:5560:c200:15f4:c1ab:865a:2377","2600:1901:0:92a9::","TLSv1.2","98","Application Data"
"940","35.041230","2a0d:6fc2:5560:c200:15f4:c1ab:865a:2377","2600:1901:0:92a9::","TCP","74","51264  >  443 [FIN, ACK] Seq=103 Ack=1 Win=510 Len=0"
"941","35.041367","192.168.1.174","34.98.75.36","TLSv1.2","78","Application Data"
"942","35.041382","192.168.1.174","34.98.75.36","TCP","54","51263  >  443 [FIN, ACK] Seq=103 Ack=1 Win=508 Len=0"
"943","35.041508","192.168.1.174","35.201.103.21","TLSv1.2","78","Application Data"
"944","35.041528","192.168.1.174","35.201.103.21","TCP","54","51262  >  443 [FIN, ACK] Seq=64 Ack=1 Win=512 Len=0"
"945","35.043269","34.120.208.123","192.168.1.174","TLSv1.2","100","Application Data"
"946","35.043269","34.98.75.36","192.168.1.174","TLSv1.2","93","Application Data"
"947","35.043326","192.168.1.174","34.120.208.123","TCP","54","51265  >  443 [RST, ACK] Seq=125 Ack=47 Win=0 Len=0"
"948","35.043384","192.168.1.174","34.98.75.36","TCP","54","51263  >  443 [RST, ACK] Seq=104 Ack=40 Win=0 Len=0"
"949","35.043885","34.120.208.123","192.168.1.174","TCP","60","443  >  51265 [ACK] Seq=47 Ack=124 Win=324 Len=0"
"950","35.044157","34.120.208.123","192.168.1.174","TCP","60","[TCP Previous segment not captured] 443  >  51265 [ACK] Seq=48 Ack=125 Win=324 Len=0"
"951","35.044157","2600:1901:0:92a9::","2a0d:6fc2:5560:c200:15f4:c1ab:865a:2377","TLSv1.2","113","Application Data"
"952","35.044221","2a0d:6fc2:5560:c200:15f4:c1ab:865a:2377","2600:1901:0:92a9::","TCP","74","51264  >  443 [RST, ACK] Seq=104 Ack=40 Win=0 Len=0"
"953","35.044980","34.120.208.123","192.168.1.174","TCP","60","[TCP Retransmission] 443  >  51265 [FIN, ACK] Seq=47 Ack=124 Win=324 Len=0"
"954","35.044980","34.98.75.36","192.168.1.174","TCP","60","443  >  51263 [ACK] Seq=40 Ack=103 Win=269 Len=0"
"955","35.045114","34.98.75.36","192.168.1.174","TCP","60","443  >  51263 [FIN, ACK] Seq=40 Ack=103 Win=269 Len=0"
"956","35.045424","2600:1901:0:92a9::","2a0d:6fc2:5560:c200:15f4:c1ab:865a:2377","TCP","74","443  >  51264 [ACK] Seq=40 Ack=103 Win=267 Len=0"
"957","35.045424","2600:1901:0:92a9::","2a0d:6fc2:5560:c200:15f4:c1ab:865a:2377","TCP","74","443  >  51264 [FIN, ACK] Seq=40 Ack=103 Win=267 Len=0"
"958","35.045924","34.98.75.36","192.168.1.174","TCP","60","443  >  51263 [ACK] Seq=41 Ack=104 Win=269 Len=0"
"959","35.045924","2600:1901:0:92a9::","2a0d:6fc2:5560:c200:15f4:c1ab:865a:2377","TCP","74","443  >  51264 [ACK] Seq=41 Ack=104 Win=267 Len=0"
"960","35.045924","35.201.103.21","192.168.1.174","TCP","60","443  >  51262 [ACK] Seq=1 Ack=64 Win=269 Len=0"
"961","35.045924","35.201.103.21","192.168.1.174","TCP","60","443  >  51262 [FIN, ACK] Seq=1 Ack=64 Win=269 Len=0"
"962","35.045972","192.168.1.174","35.201.103.21","TCP","54","51262  >  443 [ACK] Seq=65 Ack=2 Win=512 Len=0"
"963","35.046826","35.201.103.21","192.168.1.174","TCP","60","443  >  51262 [ACK] Seq=2 Ack=65 Win=269 Len=0"
"969","35.555978","192.168.1.174","20.199.120.182","TLSv1.2","154","Application Data"
"970","35.611899","20.199.120.182","192.168.1.174","TLSv1.2","225","Application Data"
"971","35.655726","192.168.1.174","20.199.120.182","TCP","54","49429  >  443 [ACK] Seq=101 Ack=172 Win=512 Len=0"
"979","36.390588","192.168.1.174","20.42.73.24","TCP","54","51283  >  443 [FIN, ACK] Seq=1 Ack=1 Win=1020 Len=0"
"980","36.391295","192.168.1.174","20.42.73.24","TCP","66","51382  >  443 [SYN] Seq=0 Win=65535 Len=0 MSS=1460 WS=256 SACK_PERM"
"981","36.524744","20.42.73.24","192.168.1.174","TCP","66","443  >  51382 [SYN, ACK] Seq=0 Ack=1 Win=65535 Len=0 MSS=1440 WS=256 SACK_PERM"
"982","36.524871","192.168.1.174","20.42.73.24","TCP","54","51382  >  443 [ACK] Seq=1 Ack=1 Win=262144 Len=0"
"983","36.525303","192.168.1.174","20.42.73.24","TLSv1.2","283","Client Hello"
"984","36.527214","20.42.73.24","192.168.1.174","TCP","60","443  >  51283 [FIN, ACK] Seq=1 Ack=2 Win=2053 Len=0"
"985","36.527302","192.168.1.174","20.42.73.24","TCP","54","51283  >  443 [ACK] Seq=2 Ack=2 Win=1020 Len=0"
"988","36.659955","20.42.73.24","192.168.1.174","TCP","1506","443  >  51382 [ACK] Seq=1 Ack=230 Win=525312 Len=1452 [TCP segment of a reassembled PDU]"
"989","36.660049","192.168.1.174","20.42.73.24","TCP","54","51382  >  443 [ACK] Seq=230 Ack=1453 Win=262144 Len=0"
"990","36.660758","20.42.73.24","192.168.1.174","TCP","1506","443  >  51382 [ACK] Seq=1453 Ack=230 Win=525312 Len=1452 [TCP segment of a reassembled PDU]"
"991","36.660758","20.42.73.24","192.168.1.174","TCP","1506","443  >  51382 [ACK] Seq=2905 Ack=230 Win=525312 Len=1452 [TCP segment of a reassembled PDU]"
"992","36.660758","20.42.73.24","192.168.1.174","TCP","1506","443  >  51382 [ACK] Seq=4357 Ack=230 Win=525312 Len=1452 [TCP segment of a reassembled PDU]"
"993","36.660758","20.42.73.24","192.168.1.174","TLSv1.2","539","Server Hello, Certificate, Certificate Status, Server Key Exchange, Server Hello Done"
"994","36.660831","192.168.1.174","20.42.73.24","TCP","54","51382  >  443 [ACK] Seq=230 Ack=6294 Win=262144 Len=0"
"997","36.666038","192.168.1.174","20.42.73.24","TLSv1.2","212","Client Key Exchange, Change Cipher Spec, Encrypted Handshake Message"
"1004","36.807179","20.42.73.24","192.168.1.174","TLSv1.2","105","Change Cipher Spec, Encrypted Handshake Message"
"1005","36.807267","192.168.1.174","20.42.73.24","TCP","54","51382  >  443 [ACK] Seq=388 Ack=6345 Win=261888 Len=0"
"1006","36.808096","192.168.1.174","20.42.73.24","TLSv1.2","912","Application Data"
"1007","36.808188","192.168.1.174","20.42.73.24","TCP","1494","51382  >  443 [ACK] Seq=1246 Ack=6345 Win=261888 Len=1440 [TCP segment of a reassembled PDU]"
"1008","36.808188","192.168.1.174","20.42.73.24","TCP","1494","51382  >  443 [ACK] Seq=2686 Ack=6345 Win=261888 Len=1440 [TCP segment of a reassembled PDU]"
"1009","36.808188","192.168.1.174","20.42.73.24","TLSv1.2","873","Application Data"
"1012","36.942455","20.42.73.24","192.168.1.174","TCP","60","443  >  51382 [ACK] Seq=6345 Ack=2686 Win=525568 Len=0"
"1013","36.942455","20.42.73.24","192.168.1.174","TCP","60","443  >  51382 [ACK] Seq=6345 Ack=4945 Win=525568 Len=0"
"1014","36.946728","20.42.73.24","192.168.1.174","TLSv1.2","508","Application Data"
"1015","36.946815","192.168.1.174","20.42.73.24","TCP","54","51382  >  443 [ACK] Seq=4945 Ack=6799 Win=261632 Len=0"
"1043","37.807580","2620:1ec:21::14","2a0d:6fc2:5560:c200:15f4:c1ab:865a:2377","TLSv1.2","120","Application Data"
"1044","37.809191","2a0d:6fc2:5560:c200:15f4:c1ab:865a:2377","2620:1ec:21::14","TLSv1.2","116","Application Data"
"1045","37.809296","2a0d:6fc2:5560:c200:15f4:c1ab:865a:2377","2620:1ec:21::14","TLSv1.2","116","Application Data"
"1046","37.812913","2620:1ec:21::14","2a0d:6fc2:5560:c200:15f4:c1ab:865a:2377","TCP","74","443  >  50974 [ACK] Seq=139 Ack=253 Win=16384 Len=0"
"1100","40.713079","192.168.1.174","38.106.231.204","TCP","54","51276  >  443 [RST, ACK] Seq=1 Ack=33 Win=0 Len=0"
"1202","45.054842","18.184.238.147","192.168.1.174","TCP","60","[TCP Keep-Alive] 443  >  51298 [ACK] Seq=1 Ack=1 Win=12 Len=0"
"1203","45.054917","192.168.1.174","18.184.238.147","TCP","54","[TCP Keep-Alive ACK] 51298  >  443 [ACK] Seq=1 Ack=2 Win=513 Len=0"
"1209","45.597890","2a03:2880:f276:cd:face:b00c:0:167","2a0d:6fc2:5560:c200:15f4:c1ab:865a:2377","TCP","1466","443  >  51017 [ACK] Seq=2756 Ack=4645 Win=5500 Len=1392 [TCP segment of a reassembled PDU]"
"1210","45.597890","2a03:2880:f276:cd:face:b00c:0:167","2a0d:6fc2:5560:c200:15f4:c1ab:865a:2377","TLSv1.2","132","Application Data"
"1211","45.597890","2a03:2880:f276:cd:face:b00c:0:167","2a0d:6fc2:5560:c200:15f4:c1ab:865a:2377","TLSv1.2","452","Application Data"
"1212","45.598001","2a0d:6fc2:5560:c200:15f4:c1ab:865a:2377","2a03:2880:f276:cd:face:b00c:0:167","TCP","74","51017  >  443 [ACK] Seq=4645 Ack=4584 Win=1033 Len=0"
"1215","45.677960","2a0d:6fc2:5560:c200:15f4:c1ab:865a:2377","2a03:2880:f276:cd:face:b00c:0:167","TLSv1.2","165","Application Data"
"1216","45.722703","2a0d:6fc2:5560:c200:15f4:c1ab:865a:2377","2a03:2880:f276:cd:face:b00c:0:167","TLSv1.2","177","Application Data"
"1217","45.734667","2a03:2880:f276:cd:face:b00c:0:167","2a0d:6fc2:5560:c200:15f4:c1ab:865a:2377","TCP","74","443  >  51017 [ACK] Seq=4584 Ack=4736 Win=5500 Len=0"
"1218","45.778515","2a03:2880:f276:cd:face:b00c:0:167","2a0d:6fc2:5560:c200:15f4:c1ab:865a:2377","TCP","74","443  >  51017 [ACK] Seq=4584 Ack=4839 Win=5500 Len=0"
"1221","45.874577","2a03:2880:f276:cd:face:b00c:0:167","2a0d:6fc2:5560:c200:15f4:c1ab:865a:2377","TLSv1.2","164","Application Data"
"1222","45.918221","2a0d:6fc2:5560:c200:15f4:c1ab:865a:2377","2a03:2880:f276:cd:face:b00c:0:167","TCP","74","51017  >  443 [ACK] Seq=4839 Ack=4674 Win=1032 Len=0"
"1231","46.484516","2a03:2880:f276:cd:face:b00c:0:167","2a0d:6fc2:5560:c200:15f4:c1ab:865a:2377","TLSv1.2","171","Application Data"
"1232","46.487241","2a0d:6fc2:5560:c200:15f4:c1ab:865a:2377","2a03:2880:f276:cd:face:b00c:0:167","TLSv1.2","170","Application Data"
"1233","46.544393","2a03:2880:f276:cd:face:b00c:0:167","2a0d:6fc2:5560:c200:15f4:c1ab:865a:2377","TCP","74","443  >  51017 [ACK] Seq=4771 Ack=4935 Win=5500 Len=0"
"1240","47.582475","192.168.1.174","52.137.103.96","TCP","66","51386  >  443 [SYN] Seq=0 Win=64240 Len=0 MSS=1460 WS=256 SACK_PERM"
"1241","47.590918","192.168.1.174","52.137.103.96","TCP","66","51387  >  443 [SYN] Seq=0 Win=64240 Len=0 MSS=1460 WS=256 SACK_PERM"
"1242","47.597773","192.168.1.174","52.137.103.96","TCP","66","51388  >  443 [SYN] Seq=0 Win=64240 Len=0 MSS=1460 WS=256 SACK_PERM"
"1243","47.605379","192.168.1.174","52.137.103.96","TCP","66","51389  >  443 [SYN] Seq=0 Win=64240 Len=0 MSS=1460 WS=256 SACK_PERM"
"1245","47.784999","52.137.103.96","192.168.1.174","TCP","66","443  >  51386 [SYN, ACK] Seq=0 Ack=1 Win=65535 Len=0 MSS=1440 WS=256 SACK_PERM"
"1246","47.785113","192.168.1.174","52.137.103.96","TCP","54","51386  >  443 [ACK] Seq=1 Ack=1 Win=132352 Len=0"
"1247","47.785696","192.168.1.174","52.137.103.96","TLSv1.2","276","Client Hello"
"1248","47.790570","52.137.103.96","192.168.1.174","TCP","66","443  >  51387 [SYN, ACK] Seq=0 Ack=1 Win=65535 Len=0 MSS=1440 WS=256 SACK_PERM"
"1249","47.790745","192.168.1.174","52.137.103.96","TCP","54","51387  >  443 [ACK] Seq=1 Ack=1 Win=132352 Len=0"
"1250","47.791322","192.168.1.174","52.137.103.96","TLSv1.2","276","Client Hello"
"1251","47.797335","52.137.103.96","192.168.1.174","TCP","66","443  >  51388 [SYN, ACK] Seq=0 Ack=1 Win=65535 Len=0 MSS=1440 WS=256 SACK_PERM"
"1252","47.797465","192.168.1.174","52.137.103.96","TCP","54","51388  >  443 [ACK] Seq=1 Ack=1 Win=132352 Len=0"
"1253","47.798012","192.168.1.174","52.137.103.96","TLSv1.2","276","Client Hello"
"1254","47.808415","52.137.103.96","192.168.1.174","TCP","66","443  >  51389 [SYN, ACK] Seq=0 Ack=1 Win=65535 Len=0 MSS=1440 WS=256 SACK_PERM"
"1255","47.808568","192.168.1.174","52.137.103.96","TCP","54","51389  >  443 [ACK] Seq=1 Ack=1 Win=132352 Len=0"
"1256","47.809141","192.168.1.174","52.137.103.96","TLSv1.2","276","Client Hello"
"1259","47.987484","52.137.103.96","192.168.1.174","TCP","1506","443  >  51386 [ACK] Seq=1 Ack=223 Win=525312 Len=1452 [TCP segment of a reassembled PDU]"
"1260","47.987484","52.137.103.96","192.168.1.174","TLSv1.2","1033","Server Hello, Certificate, Server Key Exchange, Server Hello Done"
"1261","47.987581","192.168.1.174","52.137.103.96","TCP","54","51386  >  443 [ACK] Seq=223 Ack=2432 Win=132352 Len=0"
"1262","47.990482","52.137.103.96","192.168.1.174","TCP","1506","443  >  51387 [ACK] Seq=1 Ack=223 Win=525312 Len=1452 [TCP segment of a reassembled PDU]"
"1263","47.990482","52.137.103.96","192.168.1.174","TLSv1.2","1034","Server Hello, Certificate, Server Key Exchange, Server Hello Done"
"1264","47.990553","192.168.1.174","52.137.103.96","TCP","54","51387  >  443 [ACK] Seq=223 Ack=2433 Win=132352 Len=0"
"1265","47.995017","192.168.1.174","52.137.103.96","TLSv1.2","212","Client Key Exchange, Change Cipher Spec, Encrypted Handshake Message"
"1266","47.997389","52.137.103.96","192.168.1.174","TCP","1506","443  >  51388 [ACK] Seq=1 Ack=223 Win=525312 Len=1452 [TCP segment of a reassembled PDU]"
"1267","47.997389","52.137.103.96","192.168.1.174","TLSv1.2","1033","Server Hello, Certificate, Server Key Exchange, Server Hello Done"
"1268","47.997454","192.168.1.174","52.137.103.96","TCP","54","51388  >  443 [ACK] Seq=223 Ack=2432 Win=132352 Len=0"
"1269","47.997781","192.168.1.174","52.137.103.96","TLSv1.2","212","Client Key Exchange, Change Cipher Spec, Encrypted Handshake Message"
"1270","48.002734","192.168.1.174","52.137.103.96","TLSv1.2","212","Client Key Exchange, Change Cipher Spec, Encrypted Handshake Message"
"1271","48.013295","52.137.103.96","192.168.1.174","TCP","1506","443  >  51389 [ACK] Seq=1 Ack=223 Win=525312 Len=1452 [TCP segment of a reassembled PDU]"
"1272","48.013295","52.137.103.96","192.168.1.174","TLSv1.2","1034","Server Hello, Certificate, Server Key Exchange, Server Hello Done"
"1273","48.013385","192.168.1.174","52.137.103.96","TCP","54","51389  >  443 [ACK] Seq=223 Ack=2433 Win=132352 Len=0"
"1274","48.018794","192.168.1.174","52.137.103.96","TLSv1.2","212","Client Key Exchange, Change Cipher Spec, Encrypted Handshake Message"
"1275","48.196431","52.137.103.96","192.168.1.174","TLSv1.2","105","Change Cipher Spec, Encrypted Handshake Message"
"1276","48.196898","52.137.103.96","192.168.1.174","TLSv1.2","123","Application Data"
"1277","48.196919","192.168.1.174","52.137.103.96","TCP","54","51386  >  443 [ACK] Seq=381 Ack=2552 Win=132352 Len=0"
"1278","48.197070","192.168.1.174","52.137.103.96","TLSv1.2","141","Application Data"
"1279","48.197104","192.168.1.174","52.137.103.96","TLSv1.2","204","Application Data"
"1280","48.197120","192.168.1.174","52.137.103.96","TLSv1.2","92","Application Data"
"1281","48.197153","192.168.1.174","52.137.103.96","TLSv1.2","706","Application Data"
"1282","48.197669","52.137.103.96","192.168.1.174","TLSv1.2","105","Change Cipher Spec, Encrypted Handshake Message"
"1283","48.197669","52.137.103.96","192.168.1.174","TLSv1.2","123","Application Data"
"1284","48.197695","192.168.1.174","52.137.103.96","TCP","54","51387  >  443 [ACK] Seq=381 Ack=2553 Win=132352 Len=0"
"1285","48.198119","192.168.1.174","52.137.103.96","TLSv1.2","141","Application Data"
"1286","48.198159","192.168.1.174","52.137.103.96","TLSv1.2","92","Application Data"
"1287","48.198176","192.168.1.174","52.137.103.96","TLSv1.2","194","Application Data"
"1288","48.198197","192.168.1.174","52.137.103.96","TLSv1.2","731","Application Data"
"1289","48.202197","52.137.103.96","192.168.1.174","TLSv1.2","105","Change Cipher Spec, Encrypted Handshake Message"
"1290","48.202197","52.137.103.96","192.168.1.174","TLSv1.2","123","Application Data"
"1291","48.202246","192.168.1.174","52.137.103.96","TCP","54","51388  >  443 [ACK] Seq=381 Ack=2552 Win=132352 Len=0"
"1292","48.202704","192.168.1.174","52.137.103.96","TLSv1.2","141","Application Data"
"1293","48.202735","192.168.1.174","52.137.103.96","TLSv1.2","92","Application Data"
"1294","48.202760","192.168.1.174","52.137.103.96","TLSv1.2","194","Application Data"
"1295","48.202780","192.168.1.174","52.137.103.96","TLSv1.2","753","Application Data"
"1296","48.221729","52.137.103.96","192.168.1.174","TLSv1.2","105","Change Cipher Spec, Encrypted Handshake Message"
"1297","48.221729","52.137.103.96","192.168.1.174","TLSv1.2","123","Application Data"
"1298","48.221785","192.168.1.174","52.137.103.96","TCP","54","51389  >  443 [ACK] Seq=381 Ack=2553 Win=132352 Len=0"
"1299","48.222358","192.168.1.174","52.137.103.96","TLSv1.2","141","Application Data"
"1300","48.222394","192.168.1.174","52.137.103.96","TLSv1.2","92","Application Data"
"1301","48.222427","192.168.1.174","52.137.103.96","TLSv1.2","194","Application Data"
"1302","48.222457","192.168.1.174","52.137.103.96","TLSv1.2","749","Application Data"
"1303","48.370841","2a0d:6fc2:5560:c200:15f4:c1ab:865a:2377","2001:40a8:4400:3::5266:9841","TCP","75","[TCP Keep-Alive] 51328  >  443 [ACK] Seq=1 Ack=1 Win=514 Len=1"
"1304","48.370879","2a0d:6fc2:5560:c200:15f4:c1ab:865a:2377","2606:2800:233:66b5:799a:7cd3:f74d:7071","TCP","75","[TCP Keep-Alive] 51319  >  443 [ACK] Seq=1 Ack=1 Win=512 Len=1"
"1305","48.373696","2001:40a8:4400:3::5266:9841","2a0d:6fc2:5560:c200:15f4:c1ab:865a:2377","TCP","86","[TCP Keep-Alive ACK] 443  >  51328 [ACK] Seq=1 Ack=2 Win=501 Len=0 SLE=1 SRE=2"
"1306","48.396938","52.137.103.96","192.168.1.174","TLSv1.2","92","Application Data"
"1307","48.396938","52.137.103.96","192.168.1.174","TCP","60","443  >  51387 [ACK] Seq=2591 Ack=646 Win=524800 Len=0"
"1308","48.396938","52.137.103.96","192.168.1.174","TLSv1.2","96","Application Data"
"1309","48.397043","192.168.1.174","52.137.103.96","TCP","54","51387  >  443 [ACK] Seq=1323 Ack=2633 Win=132096 Len=0"
"1310","48.397529","52.137.103.96","192.168.1.174","TCP","60","443  >  51386 [ACK] Seq=2552 Ack=618 Win=524800 Len=0"
"1311","48.397928","52.137.103.96","192.168.1.174","TLSv1.2","92","Application Data"
"1312","48.397928","52.137.103.96","192.168.1.174","TLSv1.2","522","Application Data"
"1313","48.397928","52.137.103.96","192.168.1.174","TCP","60","443  >  51386 [ACK] Seq=2590 Ack=1308 Win=524288 Len=0"
"1314","48.398827","52.137.103.96","192.168.1.174","TLSv1.2","96","Application Data"
"1315","48.398882","192.168.1.174","52.137.103.96","TCP","54","51386  >  443 [ACK] Seq=1308 Ack=2632 Win=132096 Len=0"
"1316","48.398981","52.137.103.96","192.168.1.174","TLSv1.2","523","Application Data"
"1317","48.400455","52.137.103.96","192.168.1.174","TCP","60","443  >  51388 [ACK] Seq=2552 Ack=506 Win=525056 Len=0"
"1318","48.400671","52.137.103.96","192.168.1.174","TLSv1.2","92","Application Data"
"1319","48.400671","52.137.103.96","192.168.1.174","TCP","60","443  >  51388 [ACK] Seq=2590 Ack=1345 Win=524032 Len=0"
"1320","48.400936","52.137.103.96","192.168.1.174","TLSv1.2","96","Application Data"
"1321","48.400984","192.168.1.174","52.137.103.96","TCP","54","51388  >  443 [ACK] Seq=1345 Ack=2632 Win=132096 Len=0"
"1322","48.401773","52.137.103.96","192.168.1.174","TLSv1.2","522","Application Data"
"1323","48.424195","52.137.103.96","192.168.1.174","TCP","60","443  >  51389 [ACK] Seq=2553 Ack=506 Win=525056 Len=0"
"1324","48.424195","52.137.103.96","192.168.1.174","TLSv1.2","92","Application Data"
"1325","48.424195","52.137.103.96","192.168.1.174","TCP","60","443  >  51389 [ACK] Seq=2591 Ack=1341 Win=524032 Len=0"
"1326","48.424195","52.137.103.96","192.168.1.174","TLSv1.2","96","Application Data"
"1327","48.424303","192.168.1.174","52.137.103.96","TCP","54","51389  >  443 [ACK] Seq=1341 Ack=2633 Win=132096 Len=0"
"1328","48.424854","52.137.103.96","192.168.1.174","TLSv1.2","522","Application Data"
"1329","48.427646","2606:2800:233:66b5:799a:7cd3:f74d:7071","2a0d:6fc2:5560:c200:15f4:c1ab:865a:2377","TCP","86","[TCP Keep-Alive ACK] 443  >  51319 [ACK] Seq=1 Ack=2 Win=142 Len=0 SLE=1 SRE=2"
"1330","48.458017","192.168.1.174","52.137.103.96","TCP","54","51386  >  443 [ACK] Seq=1308 Ack=3101 Win=131584 Len=0"
"1331","48.458096","192.168.1.174","52.137.103.96","TCP","54","51387  >  443 [ACK] Seq=1323 Ack=3101 Win=131584 Len=0"
"1332","48.458122","192.168.1.174","52.137.103.96","TCP","54","51388  >  443 [ACK] Seq=1345 Ack=3100 Win=131584 Len=0"
"1333","48.473705","192.168.1.174","52.137.103.96","TCP","54","51389  >  443 [ACK] Seq=1341 Ack=3101 Win=131584 Len=0"
"1334","48.642881","18.196.158.34","192.168.1.174","TCP","60","[TCP Dup ACK 34#1] 443  >  51294 [ACK] Seq=1 Ack=1 Win=16 Len=0"
"1335","48.642923","192.168.1.174","18.196.158.34","TCP","54","[TCP Dup ACK 35#2] 51294  >  443 [ACK] Seq=1 Ack=2 Win=513 Len=0"
"1339","50.139079","192.168.1.174","162.159.133.232","TCP","55","[TCP Keep-Alive] 51261  >  443 [ACK] Seq=1 Ack=1 Win=8279 Len=1"
"1340","50.141953","162.159.133.232","192.168.1.174","TCP","66","[TCP Keep-Alive ACK] 443  >  51261 [ACK] Seq=1 Ack=2 Win=8 Len=0 SLE=1 SRE=2"
"1360","52.818454","2620:1ec:21::14","2a0d:6fc2:5560:c200:15f4:c1ab:865a:2377","TLSv1.2","120","Application Data"
"1361","52.820204","2a0d:6fc2:5560:c200:15f4:c1ab:865a:2377","2620:1ec:21::14","TLSv1.2","116","Application Data"
"1362","52.820311","2a0d:6fc2:5560:c200:15f4:c1ab:865a:2377","2620:1ec:21::14","TLSv1.2","116","Application Data"
"1363","52.824159","2620:1ec:21::14","2a0d:6fc2:5560:c200:15f4:c1ab:865a:2377","TCP","74","443  >  50974 [ACK] Seq=185 Ack=337 Win=16383 Len=0"
"1391","60.151562","2a0d:6fc2:5560:c200:15f4:c1ab:865a:2377","2a03:2880:f276:cd:face:b00c:0:167","TCP","1466","51017  >  443 [ACK] Seq=4935 Ack=4771 Win=1032 Len=1392 [TCP segment of a reassembled PDU]"
"1392","60.151562","2a0d:6fc2:5560:c200:15f4:c1ab:865a:2377","2a03:2880:f276:cd:face:b00c:0:167","TLSv1.2","438","Application Data"
"1393","60.207680","2a03:2880:f276:cd:face:b00c:0:167","2a0d:6fc2:5560:c200:15f4:c1ab:865a:2377","TCP","74","443  >  51017 [ACK] Seq=4771 Ack=6691 Win=5494 Len=0"
"1394","60.308319","2a03:2880:f276:cd:face:b00c:0:167","2a0d:6fc2:5560:c200:15f4:c1ab:865a:2377","TLSv1.2","185","Application Data"
"1395","60.353122","2a0d:6fc2:5560:c200:15f4:c1ab:865a:2377","2a03:2880:f276:cd:face:b00c:0:167","TCP","74","51017  >  443 [ACK] Seq=6691 Ack=4882 Win=1031 Len=0"
"1399","60.612902","2a03:2880:f276:cd:face:b00c:0:167","2a0d:6fc2:5560:c200:15f4:c1ab:865a:2377","TLSv1.2","169","Application Data"
"1400","60.612982","192.168.1.174","185.199.110.154","TCP","55","[TCP Keep-Alive] 51103  >  443 [ACK] Seq=1 Ack=1 Win=2094 Len=1"
"1401","60.614522","2a0d:6fc2:5560:c200:15f4:c1ab:865a:2377","2a03:2880:f276:cd:face:b00c:0:167","TLSv1.2","167","Application Data"
"1402","60.633456","2a03:2880:f276:cd:face:b00c:0:167","2a0d:6fc2:5560:c200:15f4:c1ab:865a:2377","TLSv1.2","171","Application Data"
"1403","60.637972","2a0d:6fc2:5560:c200:15f4:c1ab:865a:2377","2a03:2880:f276:cd:face:b00c:0:167","TLSv1.2","169","Application Data"
"1404","60.670887","2a03:2880:f276:cd:face:b00c:0:167","2a0d:6fc2:5560:c200:15f4:c1ab:865a:2377","TCP","74","443  >  51017 [ACK] Seq=5074 Ack=6784 Win=5500 Len=0"
"1405","60.676032","185.199.110.154","192.168.1.174","TCP","66","[TCP Keep-Alive ACK] 443  >  51103 [ACK] Seq=1 Ack=2 Win=336 Len=0 SLE=1 SRE=2"
"1406","60.694012","2a03:2880:f276:cd:face:b00c:0:167","2a0d:6fc2:5560:c200:15f4:c1ab:865a:2377","TCP","74","443  >  51017 [ACK] Seq=5074 Ack=6879 Win=5500 Len=0"
"1407","61.329153","2a03:2880:f276:cd:face:b00c:0:167","2a0d:6fc2:5560:c200:15f4:c1ab:865a:2377","TLSv1.2","168","Application Data"
"1408","61.330792","2a0d:6fc2:5560:c200:15f4:c1ab:865a:2377","2a03:2880:f276:cd:face:b00c:0:167","TLSv1.2","167","Application Data"
"1409","61.382564","2a0d:6fc2:5560:c200:15f4:c1ab:865a:2377","2606:50c0:8001::154","TCP","75","[TCP Keep-Alive] 51104  >  443 [ACK] Seq=1 Ack=1 Win=514 Len=1"
"1410","61.387497","2a03:2880:f276:cd:face:b00c:0:167","2a0d:6fc2:5560:c200:15f4:c1ab:865a:2377","TCP","74","443  >  51017 [ACK] Seq=5168 Ack=6972 Win=5500 Len=0"
"1411","61.440632","2606:50c0:8001::154","2a0d:6fc2:5560:c200:15f4:c1ab:865a:2377","TCP","86","[TCP Keep-Alive ACK] 443  >  51104 [ACK] Seq=1 Ack=2 Win=288 Len=0 SLE=1 SRE=2"
"1438","65.633856","192.168.1.174","23.48.108.214","TCP","66","51390  >  443 [SYN] Seq=0 Win=64240 Len=0 MSS=1460 WS=256 SACK_PERM"
"1439","65.636753","23.48.108.214","192.168.1.174","TCP","66","443  >  51390 [SYN, ACK] Seq=0 Ack=1 Win=64240 Len=0 MSS=1452 SACK_PERM WS=128"
"1440","65.636869","192.168.1.174","23.48.108.214","TCP","54","51390  >  443 [ACK] Seq=1 Ack=1 Win=132096 Len=0"
"1441","65.637671","192.168.1.174","23.48.108.214","TLSv1.2","237","Client Hello"
"1442","65.640472","23.48.108.214","192.168.1.174","TCP","60","443  >  51390 [ACK] Seq=1 Ack=184 Win=64128 Len=0"
"1443","65.643231","23.48.108.214","192.168.1.174","TLSv1.2","1506","Server Hello"
"1444","65.643231","23.48.108.214","192.168.1.174","TLSv1.2","1506","Certificate"
"1445","65.643323","192.168.1.174","23.48.108.214","TCP","54","51390  >  443 [ACK] Seq=184 Ack=2905 Win=132096 Len=0"
"1446","65.644400","23.48.108.214","192.168.1.174","TLSv1.2","158","Server Key Exchange, Server Hello Done"
"1447","65.647725","192.168.1.174","23.48.108.214","TLSv1.2","180","Client Key Exchange, Change Cipher Spec, Encrypted Handshake Message"
"1448","65.650095","23.48.108.214","192.168.1.174","TCP","60","443  >  51390 [ACK] Seq=3009 Ack=310 Win=64128 Len=0"
"1449","65.650332","23.48.108.214","192.168.1.174","TLSv1.2","312","New Session Ticket, Change Cipher Spec, Encrypted Handshake Message"
"1450","65.652087","192.168.1.174","23.48.108.214","TLSv1.2","231","Application Data"
"1451","65.654782","23.48.108.214","192.168.1.174","TCP","60","443  >  51390 [ACK] Seq=3267 Ack=487 Win=64128 Len=0"
"1452","65.662603","23.48.108.214","192.168.1.174","TLSv1.2","826","Application Data"
"1453","65.662603","23.48.108.214","192.168.1.174","TLSv1.2","85","Encrypted Alert"
"1454","65.662603","23.48.108.214","192.168.1.174","TCP","60","443  >  51390 [FIN, ACK] Seq=4070 Ack=487 Win=64128 Len=0"
"1455","65.662693","192.168.1.174","23.48.108.214","TCP","54","51390  >  443 [ACK] Seq=487 Ack=4071 Win=130816 Len=0"
"1456","65.663496","192.168.1.174","23.48.108.214","TCP","54","51390  >  443 [RST, ACK] Seq=487 Ack=4071 Win=0 Len=0"
"1479","66.326428","192.168.1.174","140.82.121.5","TCP","55","[TCP Keep-Alive] 51345  >  443 [ACK] Seq=1 Ack=1 Win=511 Len=1"
"1480","66.387208","140.82.121.5","192.168.1.174","TCP","66","[TCP Keep-Alive ACK] 443  >  51345 [ACK] Seq=1 Ack=2 Win=68 Len=0 SLE=1 SRE=2"
"1487","66.695902","192.168.1.174","140.82.113.22","TCP","55","[TCP Keep-Alive] 51346  >  443 [ACK] Seq=1 Ack=1 Win=514 Len=1"
"1489","66.829234","140.82.113.22","192.168.1.174","TCP","66","[TCP Keep-Alive ACK] 443  >  51346 [ACK] Seq=1 Ack=2 Win=70 Len=0 SLE=1 SRE=2"
"1496","67.582206","18.184.238.147","192.168.1.174","TCP","60","[TCP Keep-Alive] 443  >  51298 [ACK] Seq=1 Ack=1 Win=12 Len=0"
"1497","67.582289","192.168.1.174","18.184.238.147","TCP","54","[TCP Keep-Alive ACK] 51298  >  443 [ACK] Seq=1 Ack=2 Win=513 Len=0"
"1502","67.807400","2620:1ec:21::14","2a0d:6fc2:5560:c200:15f4:c1ab:865a:2377","TLSv1.2","120","Application Data"
"1503","67.809113","2a0d:6fc2:5560:c200:15f4:c1ab:865a:2377","2620:1ec:21::14","TLSv1.2","116","Application Data"
"1504","67.809229","2a0d:6fc2:5560:c200:15f4:c1ab:865a:2377","2620:1ec:21::14","TLSv1.2","116","Application Data"
"1505","67.812532","2620:1ec:21::14","2a0d:6fc2:5560:c200:15f4:c1ab:865a:2377","TCP","74","443  >  50974 [ACK] Seq=231 Ack=421 Win=16383 Len=0"
"1506","68.177836","192.168.1.174","140.82.113.25","TCP","55","[TCP Keep-Alive] 50971  >  443 [ACK] Seq=31 Ack=27 Win=512 Len=1[Reassembly error, protocol TCP: New fragment overlaps old data (retransmission?)]"
"1507","68.312503","140.82.113.25","192.168.1.174","TCP","66","[TCP Keep-Alive ACK] 443  >  50971 [ACK] Seq=27 Ack=32 Win=70 Len=0 SLE=31 SRE=32"
"1513","70.349522","192.168.1.174","18.184.238.147","TCP","55","[TCP Keep-Alive] 51298  >  443 [ACK] Seq=0 Ack=2 Win=513 Len=1"
"1514","70.411359","18.184.238.147","192.168.1.174","TCP","66","[TCP Keep-Alive ACK] 443  >  51298 [ACK] Seq=2 Ack=1 Win=12 Len=0 SLE=0 SRE=1"
"1517","70.833872","2a0d:6fc2:5560:c200:15f4:c1ab:865a:2377","2620:1ec:21::14","TCP","75","[TCP Keep-Alive] 51046  >  443 [ACK] Seq=6476 Ack=2893 Win=512 Len=1"
"1519","70.836517","2620:1ec:21::14","2a0d:6fc2:5560:c200:15f4:c1ab:865a:2377","TCP","86","[TCP Keep-Alive ACK] 443  >  51046 [ACK] Seq=2893 Ack=6477 Win=16384 Len=0 SLE=6476 SRE=6477"
"1520","71.170722","18.196.158.34","192.168.1.174","TCP","60","[TCP Dup ACK 34#1] 443  >  51294 [ACK] Seq=1 Ack=1 Win=16 Len=0"
"1521","71.170781","192.168.1.174","18.196.158.34","TCP","54","[TCP Dup ACK 35#3] 51294  >  443 [ACK] Seq=1 Ack=2 Win=513 Len=0"
"1522","71.658568","2a0d:6fc2:5560:c200:15f4:c1ab:865a:2377","2620:1ec:21::14","TCP","1474","51046  >  443 [ACK] Seq=6477 Ack=2893 Win=512 Len=1400 [TCP segment of a reassembled PDU]"
"1523","71.658568","2a0d:6fc2:5560:c200:15f4:c1ab:865a:2377","2620:1ec:21::14","TCP","1474","51046  >  443 [ACK] Seq=7877 Ack=2893 Win=512 Len=1400 [TCP segment of a reassembled PDU]"
"1524","71.658568","2a0d:6fc2:5560:c200:15f4:c1ab:865a:2377","2620:1ec:21::14","TCP","1474","51046  >  443 [ACK] Seq=9277 Ack=2893 Win=512 Len=1400 [TCP segment of a reassembled PDU]"
"1525","71.658568","2a0d:6fc2:5560:c200:15f4:c1ab:865a:2377","2620:1ec:21::14","TLSv1.2","528","Application Data"
"1526","71.658836","2a0d:6fc2:5560:c200:15f4:c1ab:865a:2377","2620:1ec:21::14","TLSv1.2","120","Application Data"
"1527","71.658914","2a0d:6fc2:5560:c200:15f4:c1ab:865a:2377","2620:1ec:21::14","TLSv1.2","442","Application Data"
"1528","71.661420","2620:1ec:21::14","2a0d:6fc2:5560:c200:15f4:c1ab:865a:2377","TCP","74","443  >  51046 [ACK] Seq=2893 Ack=7877 Win=16384 Len=0"
"1529","71.661767","2620:1ec:21::14","2a0d:6fc2:5560:c200:15f4:c1ab:865a:2377","TCP","74","443  >  51046 [ACK] Seq=2893 Ack=11131 Win=16384 Len=0"
"1530","71.661919","2620:1ec:21::14","2a0d:6fc2:5560:c200:15f4:c1ab:865a:2377","TCP","74","443  >  51046 [ACK] Seq=2893 Ack=11545 Win=16382 Len=0"
"1531","71.662492","2620:1ec:21::14","2a0d:6fc2:5560:c200:15f4:c1ab:865a:2377","TLSv1.2","120","Application Data"
"1548","71.704301","2a0d:6fc2:5560:c200:15f4:c1ab:865a:2377","2620:1ec:21::14","TCP","74","51046  >  443 [ACK] Seq=11545 Ack=2939 Win=511 Len=0"
"1558","71.820375","2620:1ec:21::14","2a0d:6fc2:5560:c200:15f4:c1ab:865a:2377","TCP","1474","443  >  51046 [ACK] Seq=2939 Ack=11545 Win=16382 Len=1400 [TCP segment of a reassembled PDU]"
"1559","71.820375","2620:1ec:21::14","2a0d:6fc2:5560:c200:15f4:c1ab:865a:2377","TLSv1.2","1000","Application Data"
"1560","71.820461","2a0d:6fc2:5560:c200:15f4:c1ab:865a:2377","2620:1ec:21::14","TCP","74","51046  >  443 [ACK] Seq=11545 Ack=5265 Win=514 Len=0"
"1561","71.983355","2a0d:6fc2:5560:c200:15f4:c1ab:865a:2377","2a00:1450:4028:803::2005","TCP","75","[TCP Keep-Alive] 51240  >  443 [ACK] Seq=8583 Ack=2501 Win=508 Len=1"
"1562","71.985746","2a00:1450:4028:803::2005","2a0d:6fc2:5560:c200:15f4:c1ab:865a:2377","TCP","86","[TCP Keep-Alive ACK] 443  >  51240 [ACK] Seq=2501 Ack=8584 Win=418 Len=0 SLE=8583 SRE=8584"
"1566","75.843500","2a03:2880:f276:cd:face:b00c:0:167","2a0d:6fc2:5560:c200:15f4:c1ab:865a:2377","TCP","1466","443  >  51017 [ACK] Seq=5168 Ack=6972 Win=5500 Len=1392 [TCP segment of a reassembled PDU]"
"1567","75.843500","2a03:2880:f276:cd:face:b00c:0:167","2a0d:6fc2:5560:c200:15f4:c1ab:865a:2377","TLSv1.2","510","Application Data, Application Data"
"1568","75.843588","2a0d:6fc2:5560:c200:15f4:c1ab:865a:2377","2a03:2880:f276:cd:face:b00c:0:167","TCP","74","51017  >  443 [ACK] Seq=6972 Ack=6996 Win=1033 Len=0"
"1571","75.950580","2a0d:6fc2:5560:c200:15f4:c1ab:865a:2377","2a03:2880:f276:cd:face:b00c:0:167","TLSv1.2","165","Application Data"
"1572","76.007401","2a03:2880:f276:cd:face:b00c:0:167","2a0d:6fc2:5560:c200:15f4:c1ab:865a:2377","TCP","74","443  >  51017 [ACK] Seq=6996 Ack=7063 Win=5500 Len=0"
"1573","76.031307","2a0d:6fc2:5560:c200:15f4:c1ab:865a:2377","2a03:2880:f276:cd:face:b00c:0:167","TLSv1.2","177","Application Data"
"1574","76.087093","2a03:2880:f276:cd:face:b00c:0:167","2a0d:6fc2:5560:c200:15f4:c1ab:865a:2377","TCP","74","443  >  51017 [ACK] Seq=6996 Ack=7166 Win=5500 Len=0"
"1575","76.184351","2a03:2880:f276:cd:face:b00c:0:167","2a0d:6fc2:5560:c200:15f4:c1ab:865a:2377","TLSv1.2","164","Application Data"
"1576","76.234404","2a0d:6fc2:5560:c200:15f4:c1ab:865a:2377","2a03:2880:f276:cd:face:b00c:0:167","TCP","74","51017  >  443 [ACK] Seq=7166 Ack=7086 Win=1032 Len=0"
"1577","76.743104","2a03:2880:f276:cd:face:b00c:0:167","2a0d:6fc2:5560:c200:15f4:c1ab:865a:2377","TLSv1.2","171","Application Data"
"1578","76.745683","2a0d:6fc2:5560:c200:15f4:c1ab:865a:2377","2a03:2880:f276:cd:face:b00c:0:167","TLSv1.2","170","Application Data"
"1579","76.802777","2a03:2880:f276:cd:face:b00c:0:167","2a0d:6fc2:5560:c200:15f4:c1ab:865a:2377","TCP","74","443  >  51017 [ACK] Seq=7183 Ack=7262 Win=5500 Len=0"
"1581","78.344621","2001:40a8:4400:3::5266:9841","2a0d:6fc2:5560:c200:15f4:c1ab:865a:2377","TLSv1.2","98","Application Data"
"1582","78.344839","2a0d:6fc2:5560:c200:15f4:c1ab:865a:2377","2001:40a8:4400:3::5266:9841","TCP","74","51328  >  443 [FIN, ACK] Seq=2 Ack=25 Win=513 Len=0"
"1583","78.345639","2001:40a8:4400:3::5266:9841","2a0d:6fc2:5560:c200:15f4:c1ab:865a:2377","TCP","74","443  >  51328 [FIN, ACK] Seq=25 Ack=2 Win=501 Len=0"
"1584","78.345666","2a0d:6fc2:5560:c200:15f4:c1ab:865a:2377","2001:40a8:4400:3::5266:9841","TCP","74","51328  >  443 [ACK] Seq=3 Ack=26 Win=513 Len=0"
"1585","78.347847","2001:40a8:4400:3::5266:9841","2a0d:6fc2:5560:c200:15f4:c1ab:865a:2377","TCP","74","443  >  51328 [ACK] Seq=26 Ack=3 Win=501 Len=0"
"1586","78.488927","192.168.1.174","20.199.120.151","TLSv1.2","97","Application Data"
"1587","78.545669","20.199.120.151","192.168.1.174","TLSv1.2","228","Application Data"
"1588","78.587497","192.168.1.174","20.199.120.151","TCP","54","50948  >  443 [ACK] Seq=87 Ack=349 Win=517 Len=0"
"1618","82.817354","2620:1ec:21::14","2a0d:6fc2:5560:c200:15f4:c1ab:865a:2377","TLSv1.2","120","Application Data"
"1619","82.818799","2a0d:6fc2:5560:c200:15f4:c1ab:865a:2377","2620:1ec:21::14","TLSv1.2","116","Application Data"
"1620","82.818851","2a0d:6fc2:5560:c200:15f4:c1ab:865a:2377","2620:1ec:21::14","TLSv1.2","116","Application Data"
"1621","82.822401","2620:1ec:21::14","2a0d:6fc2:5560:c200:15f4:c1ab:865a:2377","TCP","74","443  >  50974 [ACK] Seq=277 Ack=505 Win=16383 Len=0"
"1624","83.036020","140.82.113.25","192.168.1.174","TLSv1.2","80","Application Data"
"1625","83.036175","192.168.1.174","140.82.113.25","TLSv1.2","84","Application Data"
"1626","83.171570","140.82.113.25","192.168.1.174","TCP","60","443  >  50971 [ACK] Seq=53 Ack=62 Win=70 Len=0"
"1650","85.675574","2a0d:6fc2:5560:c200:15f4:c1ab:865a:2377","2620:1ec:21::14","TLSv1.2","373","Application Data"
"1651","85.675701","2a0d:6fc2:5560:c200:15f4:c1ab:865a:2377","2620:1ec:21::14","TLSv1.2","120","Application Data"
"1652","85.675740","2a0d:6fc2:5560:c200:15f4:c1ab:865a:2377","2620:1ec:21::14","TLSv1.2","1134","Application Data"
"1653","85.678586","2620:1ec:21::14","2a0d:6fc2:5560:c200:15f4:c1ab:865a:2377","TCP","74","443  >  51046 [ACK] Seq=5265 Ack=11890 Win=16381 Len=0"
"1654","85.678586","2620:1ec:21::14","2a0d:6fc2:5560:c200:15f4:c1ab:865a:2377","TLSv1.2","120","Application Data"
"1655","85.679497","2620:1ec:21::14","2a0d:6fc2:5560:c200:15f4:c1ab:865a:2377","TCP","74","443  >  51046 [ACK] Seq=5311 Ack=12950 Win=16384 Len=0"
"1657","85.718322","2a0d:6fc2:5560:c200:15f4:c1ab:865a:2377","2620:1ec:21::14","TCP","74","51046  >  443 [ACK] Seq=12950 Ack=5311 Win=513 Len=0"
"1673","85.832833","2620:1ec:21::14","2a0d:6fc2:5560:c200:15f4:c1ab:865a:2377","TLSv1.2","550","Application Data"
"1674","85.886268","2a0d:6fc2:5560:c200:15f4:c1ab:865a:2377","2620:1ec:21::14","TCP","74","51046  >  443 [ACK] Seq=12950 Ack=5787 Win=512 Len=0"
"1700","89.917804","2a0d:6fc2:5560:c200:15f4:c1ab:865a:2377","2a03:2880:f276:cd:face:b00c:0:167","TCP","1466","51017  >  443 [ACK] Seq=7262 Ack=7183 Win=1032 Len=1392 [TCP segment of a reassembled PDU]"
"1701","89.917804","2a0d:6fc2:5560:c200:15f4:c1ab:865a:2377","2a03:2880:f276:cd:face:b00c:0:167","TLSv1.2","438","Application Data"
"1702","89.974506","2a03:2880:f276:cd:face:b00c:0:167","2a0d:6fc2:5560:c200:15f4:c1ab:865a:2377","TCP","74","443  >  51017 [ACK] Seq=7183 Ack=9018 Win=5494 Len=0"
"1703","90.053595","192.168.1.174","35.160.17.77","TCP","54","51299  >  443 [FIN, ACK] Seq=1 Ack=1 Win=511 Len=0"
"1704","90.074461","2a03:2880:f276:cd:face:b00c:0:167","2a0d:6fc2:5560:c200:15f4:c1ab:865a:2377","TLSv1.2","185","Application Data"
"1707","90.108254","18.184.238.147","192.168.1.174","TCP","60","[TCP Keep-Alive] 443  >  51298 [ACK] Seq=1 Ack=1 Win=12 Len=0"
"1708","90.108276","192.168.1.174","18.184.238.147","TCP","54","[TCP Keep-Alive ACK] 51298  >  443 [ACK] Seq=1 Ack=2 Win=513 Len=0"
"1709","90.128641","2a0d:6fc2:5560:c200:15f4:c1ab:865a:2377","2a03:2880:f276:cd:face:b00c:0:167","TCP","74","51017  >  443 [ACK] Seq=9018 Ack=7294 Win=1031 Len=0"
"1710","90.276297","35.160.17.77","192.168.1.174","TCP","60","443  >  51299 [FIN, ACK] Seq=1 Ack=2 Win=254 Len=0"
"1711","90.276384","192.168.1.174","35.160.17.77","TCP","54","51299  >  443 [ACK] Seq=2 Ack=2 Win=511 Len=0"
"1712","90.375459","2a03:2880:f276:cd:face:b00c:0:167","2a0d:6fc2:5560:c200:15f4:c1ab:865a:2377","TLSv1.2","169","Application Data"
"1713","90.377565","2a0d:6fc2:5560:c200:15f4:c1ab:865a:2377","2a03:2880:f276:cd:face:b00c:0:167","TLSv1.2","167","Application Data"
"1714","90.386510","2a03:2880:f276:cd:face:b00c:0:167","2a0d:6fc2:5560:c200:15f4:c1ab:865a:2377","TLSv1.2","171","Application Data"
"1715","90.393321","2a0d:6fc2:5560:c200:15f4:c1ab:865a:2377","2a03:2880:f276:cd:face:b00c:0:167","TLSv1.2","169","Application Data"
"1716","90.434463","2a03:2880:f276:cd:face:b00c:0:167","2a0d:6fc2:5560:c200:15f4:c1ab:865a:2377","TCP","74","443  >  51017 [ACK] Seq=7486 Ack=9111 Win=5500 Len=0"
"1717","90.449373","2a03:2880:f276:cd:face:b00c:0:167","2a0d:6fc2:5560:c200:15f4:c1ab:865a:2377","TCP","74","443  >  51017 [ACK] Seq=7486 Ack=9206 Win=5500 Len=0"
"1718","90.552923","192.168.1.174","35.160.17.77","TCP","54","51293  >  443 [FIN, ACK] Seq=1 Ack=1 Win=511 Len=0"
"1721","90.779268","35.160.17.77","192.168.1.174","TCP","60","443  >  51293 [FIN, ACK] Seq=1 Ack=2 Win=425 Len=0"
"1722","90.779357","192.168.1.174","35.160.17.77","TCP","54","51293  >  443 [ACK] Seq=2 Ack=2 Win=511 Len=0"
"1724","91.006642","2a03:2880:f276:cd:face:b00c:0:167","2a0d:6fc2:5560:c200:15f4:c1ab:865a:2377","TLSv1.2","168","Application Data"
"1725","91.009278","2a0d:6fc2:5560:c200:15f4:c1ab:865a:2377","2a03:2880:f276:cd:face:b00c:0:167","TLSv1.2","167","Application Data"
"1726","91.066437","2a03:2880:f276:cd:face:b00c:0:167","2a0d:6fc2:5560:c200:15f4:c1ab:865a:2377","TCP","74","443  >  51017 [ACK] Seq=7580 Ack=9299 Win=5500 Len=0"
"1731","93.435654","2a0d:6fc2:5560:c200:15f4:c1ab:865a:2377","2606:2800:233:66b5:799a:7cd3:f74d:7071","TCP","75","[TCP Keep-Alive] 51319  >  443 [ACK] Seq=1 Ack=1 Win=512 Len=1"
"1732","93.492741","2606:2800:233:66b5:799a:7cd3:f74d:7071","2a0d:6fc2:5560:c200:15f4:c1ab:865a:2377","TCP","86","[TCP Keep-Alive ACK] 443  >  51319 [ACK] Seq=1 Ack=2 Win=142 Len=0 SLE=1 SRE=2"
"1733","93.698205","18.196.158.34","192.168.1.174","TCP","60","[TCP Dup ACK 34#1] 443  >  51294 [ACK] Seq=1 Ack=1 Win=16 Len=0"
"1734","93.698268","192.168.1.174","18.196.158.34","TCP","54","[TCP Dup ACK 35#4] 51294  >  443 [ACK] Seq=1 Ack=2 Win=513 Len=0"
"1748","95.156283","192.168.1.174","162.159.133.232","TCP","55","[TCP Keep-Alive] 51261  >  443 [ACK] Seq=1 Ack=1 Win=8279 Len=1"
"1749","95.159116","162.159.133.232","192.168.1.174","TCP","66","[TCP Keep-Alive ACK] 443  >  51261 [ACK] Seq=1 Ack=2 Win=8 Len=0 SLE=1 SRE=2"
"1750","95.564445","192.168.1.174","20.199.120.182","TLSv1.2","155","Application Data"
"1751","95.619553","20.199.120.182","192.168.1.174","TLSv1.2","225","Application Data"
"1752","95.663922","192.168.1.174","20.199.120.182","TCP","54","49429  >  443 [ACK] Seq=202 Ack=343 Win=517 Len=0"
"1754","96.252902","140.82.121.5","192.168.1.174","TLSv1.2","93","Application Data"
"1755","96.252902","140.82.121.5","192.168.1.174","TLSv1.2","78","Application Data"
"1756","96.252902","140.82.121.5","192.168.1.174","TCP","60","443  >  51345 [FIN, ACK] Seq=64 Ack=2 Win=68 Len=0"
"1757","96.253011","192.168.1.174","140.82.121.5","TCP","54","51345  >  443 [ACK] Seq=2 Ack=65 Win=510 Len=0"
"1758","96.253295","192.168.1.174","140.82.121.5","TCP","54","51345  >  443 [FIN, ACK] Seq=2 Ack=65 Win=510 Len=0"
"1760","96.315085","140.82.121.5","192.168.1.174","TCP","60","443  >  51345 [ACK] Seq=65 Ack=3 Win=68 Len=0"
"1764","96.509809","140.82.113.22","192.168.1.174","TLSv1.2","93","Application Data"
"1765","96.509809","140.82.113.22","192.168.1.174","TLSv1.2","78","Application Data"
"1766","96.509809","140.82.113.22","192.168.1.174","TCP","60","443  >  51346 [FIN, ACK] Seq=64 Ack=2 Win=70 Len=0"
"1767","96.509861","192.168.1.174","140.82.113.22","TCP","54","51346  >  443 [ACK] Seq=2 Ack=65 Win=513 Len=0"
"1768","96.510060","192.168.1.174","140.82.113.22","TCP","54","51346  >  443 [FIN, ACK] Seq=2 Ack=65 Win=513 Len=0"
"1769","96.644908","140.82.113.22","192.168.1.174","TCP","60","443  >  51346 [ACK] Seq=65 Ack=3 Win=70 Len=0"
"1771","97.809927","2620:1ec:21::14","2a0d:6fc2:5560:c200:15f4:c1ab:865a:2377","TLSv1.2","120","Application Data"
"1772","97.812343","2a0d:6fc2:5560:c200:15f4:c1ab:865a:2377","2620:1ec:21::14","TLSv1.2","116","Application Data"
"1773","97.812449","2a0d:6fc2:5560:c200:15f4:c1ab:865a:2377","2620:1ec:21::14","TLSv1.2","116","Application Data"
"1774","97.815300","2620:1ec:21::14","2a0d:6fc2:5560:c200:15f4:c1ab:865a:2377","TCP","74","443  >  50974 [ACK] Seq=323 Ack=547 Win=16382 Len=0"
"1775","97.815300","2620:1ec:21::14","2a0d:6fc2:5560:c200:15f4:c1ab:865a:2377","TCP","74","443  >  50974 [ACK] Seq=323 Ack=589 Win=16382 Len=0"
"1779","100.922675","192.168.1.174","20.223.46.67","TCP","54","51365  >  443 [FIN, ACK] Seq=1 Ack=1 Win=516 Len=0"
"1780","100.994266","20.223.46.67","192.168.1.174","TCP","60","443  >  51365 [ACK] Seq=1 Ack=2 Win=2053 Len=0"
"1781","100.995735","20.223.46.67","192.168.1.174","TCP","60","443  >  51365 [FIN, ACK] Seq=1 Ack=2 Win=2053 Len=0"
"1782","100.995822","192.168.1.174","20.223.46.67","TCP","54","51365  >  443 [ACK] Seq=2 Ack=2 Win=516 Len=0"
"1853","103.683754","192.168.1.174","18.196.158.34","TCP","54","51294  >  443 [FIN, ACK] Seq=1 Ack=2 Win=513 Len=0"
"1856","103.745733","18.196.158.34","192.168.1.174","TLSv1.2","85","[TCP Previous segment not captured] , Encrypted Alert"
"1857","103.745733","18.196.158.34","192.168.1.174","TCP","60","443  >  51294 [FIN, ACK] Seq=33 Ack=2 Win=16 Len=0"
"1858","103.745845","192.168.1.174","18.196.158.34","TCP","54","[TCP ACKed unseen segment] 51294  >  443 [RST, ACK] Seq=2 Ack=33 Win=0 Len=0"
"1869","105.688679","192.168.1.174","185.199.110.154","TCP","55","[TCP Keep-Alive] 51103  >  443 [ACK] Seq=1 Ack=1 Win=2094 Len=1"
"1870","105.751760","185.199.110.154","192.168.1.174","TCP","66","[TCP Keep-Alive ACK] 443  >  51103 [ACK] Seq=1 Ack=2 Win=336 Len=0 SLE=1 SRE=2"
"1873","105.843984","2a03:2880:f276:cd:face:b00c:0:167","2a0d:6fc2:5560:c200:15f4:c1ab:865a:2377","TCP","1466","443  >  51017 [ACK] Seq=7580 Ack=9299 Win=5500 Len=1392 [TCP segment of a reassembled PDU]"
"1874","105.843984","2a03:2880:f276:cd:face:b00c:0:167","2a0d:6fc2:5560:c200:15f4:c1ab:865a:2377","TLSv1.2","510","Application Data, Application Data"
"1875","105.844077","2a0d:6fc2:5560:c200:15f4:c1ab:865a:2377","2a03:2880:f276:cd:face:b00c:0:167","TCP","74","51017  >  443 [ACK] Seq=9299 Ack=9408 Win=1033 Len=0"
"1876","105.930854","2a0d:6fc2:5560:c200:15f4:c1ab:865a:2377","2a03:2880:f276:cd:face:b00c:0:167","TLSv1.2","165","Application Data"
"1877","105.960870","2a0d:6fc2:5560:c200:15f4:c1ab:865a:2377","2a03:2880:f276:cd:face:b00c:0:167","TLSv1.2","177","Application Data"
"1878","105.987174","2a03:2880:f276:cd:face:b00c:0:167","2a0d:6fc2:5560:c200:15f4:c1ab:865a:2377","TCP","74","443  >  51017 [ACK] Seq=9408 Ack=9390 Win=5500 Len=0"
"1879","106.017204","2a03:2880:f276:cd:face:b00c:0:167","2a0d:6fc2:5560:c200:15f4:c1ab:865a:2377","TCP","74","443  >  51017 [ACK] Seq=9408 Ack=9493 Win=5500 Len=0"
"1880","106.099948","2a03:2880:f276:cd:face:b00c:0:167","2a0d:6fc2:5560:c200:15f4:c1ab:865a:2377","TCP","1466","443  >  51017 [ACK] Seq=9408 Ack=9493 Win=5500 Len=1392 [TCP segment of a reassembled PDU]"
"1881","106.099948","2a03:2880:f276:cd:face:b00c:0:167","2a0d:6fc2:5560:c200:15f4:c1ab:865a:2377","TLSv1.2","510","Application Data, Application Data"
"1882","106.100050","2a0d:6fc2:5560:c200:15f4:c1ab:865a:2377","2a03:2880:f276:cd:face:b00c:0:167","TCP","74","51017  >  443 [ACK] Seq=9493 Ack=11236 Win=1033 Len=0"
"1883","106.113303","2a03:2880:f276:cd:face:b00c:0:167","2a0d:6fc2:5560:c200:15f4:c1ab:865a:2377","TLSv1.2","164","Application Data"
"1884","106.161110","2a0d:6fc2:5560:c200:15f4:c1ab:865a:2377","2a03:2880:f276:cd:face:b00c:0:167","TCP","74","51017  >  443 [ACK] Seq=9493 Ack=11326 Win=1032 Len=0"
"1885","106.178190","2a0d:6fc2:5560:c200:15f4:c1ab:865a:2377","2a03:2880:f276:cd:face:b00c:0:167","TLSv1.2","165","Application Data"
"1886","106.189512","2a0d:6fc2:5560:c200:15f4:c1ab:865a:2377","2a03:2880:f276:cd:face:b00c:0:167","TLSv1.2","177","Application Data"
"1887","106.234956","2a03:2880:f276:cd:face:b00c:0:167","2a0d:6fc2:5560:c200:15f4:c1ab:865a:2377","TCP","74","443  >  51017 [ACK] Seq=11326 Ack=9584 Win=5500 Len=0"
"1888","106.246360","2a03:2880:f276:cd:face:b00c:0:167","2a0d:6fc2:5560:c200:15f4:c1ab:865a:2377","TCP","74","443  >  51017 [ACK] Seq=11326 Ack=9687 Win=5500 Len=0"
"1889","106.342132","2a03:2880:f276:cd:face:b00c:0:167","2a0d:6fc2:5560:c200:15f4:c1ab:865a:2377","TLSv1.2","164","Application Data"
"1890","106.390963","2a0d:6fc2:5560:c200:15f4:c1ab:865a:2377","2a03:2880:f276:cd:face:b00c:0:167","TCP","74","51017  >  443 [ACK] Seq=9687 Ack=11416 Win=1032 Len=0"
"1892","106.451669","2a0d:6fc2:5560:c200:15f4:c1ab:865a:2377","2606:50c0:8001::154","TCP","75","[TCP Keep-Alive] 51104  >  443 [ACK] Seq=1 Ack=1 Win=514 Len=1"
"1893","106.508618","2606:50c0:8001::154","2a0d:6fc2:5560:c200:15f4:c1ab:865a:2377","TCP","86","[TCP Keep-Alive ACK] 443  >  51104 [ACK] Seq=1 Ack=2 Win=288 Len=0 SLE=1 SRE=2"
"1896","106.635898","2a03:2880:f276:cd:face:b00c:0:167","2a0d:6fc2:5560:c200:15f4:c1ab:865a:2377","TLSv1.2","171","Application Data"
"1897","106.638231","2a0d:6fc2:5560:c200:15f4:c1ab:865a:2377","2a03:2880:f276:cd:face:b00c:0:167","TLSv1.2","170","Application Data"
"1898","106.694338","2a03:2880:f276:cd:face:b00c:0:167","2a0d:6fc2:5560:c200:15f4:c1ab:865a:2377","TCP","74","443  >  51017 [ACK] Seq=11513 Ack=9783 Win=5500 Len=0"
