"No.","Time","Source","Destination","Protocol","Length","Info"
"10","1.250469","2a0d:6fc2:5560:c200:15f4:c1ab:865a:2377","2a03:2880:f276:cd:face:b00c:0:167","TLSv1.2","144","Application Data"
"11","1.307314","2a03:2880:f276:cd:face:b00c:0:167","2a0d:6fc2:5560:c200:15f4:c1ab:865a:2377","TCP","74","443  >  51017 [ACK] Seq=1 Ack=71 Win=5500 Len=0"
"12","1.402615","2a03:2880:f276:cd:face:b00c:0:167","2a0d:6fc2:5560:c200:15f4:c1ab:865a:2377","TLSv1.2","146","Application Data"
"13","1.449894","2a0d:6fc2:5560:c200:15f4:c1ab:865a:2377","2a03:2880:f276:cd:face:b00c:0:167","TCP","74","51017  >  443 [ACK] Seq=71 Ack=73 Win=1028 Len=0"
"180","5.530842","2a0d:6fc2:5560:c200:15f4:c1ab:865a:2377","2a03:2880:f276:cd:face:b00c:0:167","TLSv1.2","146","Application Data"
"181","5.586565","2a03:2880:f276:cd:face:b00c:0:167","2a0d:6fc2:5560:c200:15f4:c1ab:865a:2377","TCP","74","443  >  51017 [ACK] Seq=73 Ack=143 Win=5500 Len=0"
"223","15.134453","2a0d:6fc2:5560:c200:15f4:c1ab:865a:2377","2a03:2880:f276:cd:face:b00c:0:167","TLSv1.2","144","Application Data"
"224","15.190983","2a03:2880:f276:cd:face:b00c:0:167","2a0d:6fc2:5560:c200:15f4:c1ab:865a:2377","TCP","74","443  >  51017 [ACK] Seq=73 Ack=213 Win=5500 Len=0"
"308","15.869017","2a0d:6fc2:5560:c200:15f4:c1ab:865a:2377","2a03:2880:f276:cd:face:b00c:0:167","TCP","1466","51017  >  443 [ACK] Seq=213 Ack=73 Win=1028 Len=1392 [TCP segment of a reassembled PDU]"
"309","15.869017","2a0d:6fc2:5560:c200:15f4:c1ab:865a:2377","2a03:2880:f276:cd:face:b00c:0:167","TLSv1.2","641","Application Data"
"310","15.925300","2a03:2880:f276:cd:face:b00c:0:167","2a0d:6fc2:5560:c200:15f4:c1ab:865a:2377","TCP","74","443  >  51017 [ACK] Seq=73 Ack=2172 Win=5493 Len=0"
"311","16.107822","2a03:2880:f276:cd:face:b00c:0:167","2a0d:6fc2:5560:c200:15f4:c1ab:865a:2377","TLSv1.2","199","Application Data"
"312","16.139317","2a0d:6fc2:5560:c200:15f4:c1ab:865a:2377","2a03:2880:f276:cd:face:b00c:0:167","TLSv1.2","160","Application Data"
"313","16.195672","2a03:2880:f276:cd:face:b00c:0:167","2a0d:6fc2:5560:c200:15f4:c1ab:865a:2377","TCP","74","443  >  51017 [ACK] Seq=198 Ack=2258 Win=5500 Len=0"
"314","16.295027","2a03:2880:f276:cd:face:b00c:0:167","2a0d:6fc2:5560:c200:15f4:c1ab:865a:2377","TLSv1.2","397","Application Data"
"315","16.297589","2a0d:6fc2:5560:c200:15f4:c1ab:865a:2377","2a03:2880:f276:cd:face:b00c:0:167","TLSv1.2","271","Application Data"
"316","16.354255","2a03:2880:f276:cd:face:b00c:0:167","2a0d:6fc2:5560:c200:15f4:c1ab:865a:2377","TCP","74","443  >  51017 [ACK] Seq=521 Ack=2455 Win=5500 Len=0"
"318","16.451364","2a03:2880:f276:cd:face:b00c:0:167","2a0d:6fc2:5560:c200:15f4:c1ab:865a:2377","TLSv1.2","194","Application Data"
"319","16.469868","2a03:2880:f276:cd:face:b00c:0:167","2a0d:6fc2:5560:c200:15f4:c1ab:865a:2377","TLSv1.2","169","Application Data"
"320","16.469913","2a0d:6fc2:5560:c200:15f4:c1ab:865a:2377","2a03:2880:f276:cd:face:b00c:0:167","TCP","74","51017  >  443 [ACK] Seq=2455 Ack=736 Win=1032 Len=0"
"321","16.485335","2a0d:6fc2:5560:c200:15f4:c1ab:865a:2377","2a03:2880:f276:cd:face:b00c:0:167","TLSv1.2","167","Application Data"
"322","16.502320","2a03:2880:f276:cd:face:b00c:0:167","2a0d:6fc2:5560:c200:15f4:c1ab:865a:2377","TLSv1.2","171","Application Data"
"323","16.506043","2a0d:6fc2:5560:c200:15f4:c1ab:865a:2377","2a03:2880:f276:cd:face:b00c:0:167","TLSv1.2","169","Application Data"
"324","16.512990","2a03:2880:f276:cd:face:b00c:0:167","2a0d:6fc2:5560:c200:15f4:c1ab:865a:2377","TLSv1.2","153","Application Data"
"325","16.524774","2a0d:6fc2:5560:c200:15f4:c1ab:865a:2377","2a03:2880:f276:cd:face:b00c:0:167","TCP","1466","51017  >  443 [ACK] Seq=2643 Ack=912 Win=1031 Len=1392 [TCP segment of a reassembled PDU]"
"326","16.524774","2a0d:6fc2:5560:c200:15f4:c1ab:865a:2377","2a03:2880:f276:cd:face:b00c:0:167","TLSv1.2","1283","Application Data"
"327","16.541428","2a03:2880:f276:cd:face:b00c:0:167","2a0d:6fc2:5560:c200:15f4:c1ab:865a:2377","TCP","74","443  >  51017 [ACK] Seq=912 Ack=2548 Win=5500 Len=0"
"328","16.562104","2a03:2880:f276:cd:face:b00c:0:167","2a0d:6fc2:5560:c200:15f4:c1ab:865a:2377","TCP","74","443  >  51017 [ACK] Seq=912 Ack=2643 Win=5500 Len=0"
"329","16.581868","2a03:2880:f276:cd:face:b00c:0:167","2a0d:6fc2:5560:c200:15f4:c1ab:865a:2377","TCP","74","443  >  51017 [ACK] Seq=912 Ack=4035 Win=5500 Len=0"
"330","16.581868","2a03:2880:f276:cd:face:b00c:0:167","2a0d:6fc2:5560:c200:15f4:c1ab:865a:2377","TCP","74","443  >  51017 [ACK] Seq=912 Ack=5244 Win=5500 Len=0"
"331","16.789693","2a03:2880:f276:cd:face:b00c:0:167","2a0d:6fc2:5560:c200:15f4:c1ab:865a:2377","TLSv1.2","183","Application Data"
"332","16.842575","2a0d:6fc2:5560:c200:15f4:c1ab:865a:2377","2a03:2880:f276:cd:face:b00c:0:167","TCP","74","51017  >  443 [ACK] Seq=5244 Ack=1021 Win=1031 Len=0"
"532","26.536146","2a03:2880:f276:cd:face:b00c:0:167","2a0d:6fc2:5560:c200:15f4:c1ab:865a:2377","TLSv1.2","153","Application Data"
"533","26.591125","2a0d:6fc2:5560:c200:15f4:c1ab:865a:2377","2a03:2880:f276:cd:face:b00c:0:167","TCP","74","51017  >  443 [ACK] Seq=5244 Ack=1100 Win=1030 Len=0"
"633","29.547032","2a03:2880:f276:cd:face:b00c:0:167","2a0d:6fc2:5560:c200:15f4:c1ab:865a:2377","TLSv1.2","151","Application Data"
"634","29.598806","2a0d:6fc2:5560:c200:15f4:c1ab:865a:2377","2a03:2880:f276:cd:face:b00c:0:167","TCP","74","51017  >  443 [ACK] Seq=5244 Ack=1177 Win=1030 Len=0"
"641","30.686904","2a03:2880:f276:cd:face:b00c:0:167","2a0d:6fc2:5560:c200:15f4:c1ab:865a:2377","TLSv1.2","839","Application Data"
"642","30.734334","2a0d:6fc2:5560:c200:15f4:c1ab:865a:2377","2a03:2880:f276:cd:face:b00c:0:167","TCP","74","51017  >  443 [ACK] Seq=5244 Ack=1942 Win=1033 Len=0"
"643","30.770037","2a0d:6fc2:5560:c200:15f4:c1ab:865a:2377","2a03:2880:f276:cd:face:b00c:0:167","TLSv1.2","165","Application Data"
"665","30.800719","2a0d:6fc2:5560:c200:15f4:c1ab:865a:2377","2a03:2880:f276:cd:face:b00c:0:167","TLSv1.2","177","Application Data"
"677","30.826049","2a03:2880:f276:cd:face:b00c:0:167","2a0d:6fc2:5560:c200:15f4:c1ab:865a:2377","TCP","74","443  >  51017 [ACK] Seq=1942 Ack=5335 Win=5500 Len=0"
"682","30.893181","2a03:2880:f276:cd:face:b00c:0:167","2a0d:6fc2:5560:c200:15f4:c1ab:865a:2377","TCP","74","443  >  51017 [ACK] Seq=1942 Ack=5438 Win=5500 Len=0"
"694","30.974848","2a03:2880:f276:cd:face:b00c:0:167","2a0d:6fc2:5560:c200:15f4:c1ab:865a:2377","TLSv1.2","164","Application Data"
"695","31.027224","2a0d:6fc2:5560:c200:15f4:c1ab:865a:2377","2a03:2880:f276:cd:face:b00c:0:167","TCP","74","51017  >  443 [ACK] Seq=5438 Ack=2032 Win=1032 Len=0"
"734","31.596943","2a03:2880:f276:cd:face:b00c:0:167","2a0d:6fc2:5560:c200:15f4:c1ab:865a:2377","TLSv1.2","171","Application Data"
"735","31.597910","2a0d:6fc2:5560:c200:15f4:c1ab:865a:2377","2a03:2880:f276:cd:face:b00c:0:167","TLSv1.2","170","Application Data"
"736","31.654486","2a03:2880:f276:cd:face:b00c:0:167","2a0d:6fc2:5560:c200:15f4:c1ab:865a:2377","TCP","74","443  >  51017 [ACK] Seq=2129 Ack=5534 Win=5500 Len=0"
"740","33.035637","2a0d:6fc2:5560:c200:15f4:c1ab:865a:2377","2a03:2880:f276:cd:face:b00c:0:167","TLSv1.2","146","Application Data"
"741","33.145625","2a03:2880:f276:cd:face:b00c:0:167","2a0d:6fc2:5560:c200:15f4:c1ab:865a:2377","TCP","74","443  >  51017 [ACK] Seq=2129 Ack=5606 Win=5500 Len=0"
"801","43.064093","2a0d:6fc2:5560:c200:15f4:c1ab:865a:2377","2a03:2880:f276:cd:face:b00c:0:167","TLSv1.2","146","Application Data"
"802","43.120114","2a03:2880:f276:cd:face:b00c:0:167","2a0d:6fc2:5560:c200:15f4:c1ab:865a:2377","TCP","74","443  >  51017 [ACK] Seq=2129 Ack=5678 Win=5500 Len=0"
"810","44.896097","2a0d:6fc2:5560:c200:15f4:c1ab:865a:2377","2a03:2880:f276:cd:face:b00c:0:167","TLSv1.2","144","Application Data"
"811","44.951965","2a03:2880:f276:cd:face:b00c:0:167","2a0d:6fc2:5560:c200:15f4:c1ab:865a:2377","TCP","74","443  >  51017 [ACK] Seq=2129 Ack=5748 Win=5500 Len=0"
"867","45.671222","2a0d:6fc2:5560:c200:15f4:c1ab:865a:2377","2a03:2880:f276:cd:face:b00c:0:167","TCP","1466","51017  >  443 [ACK] Seq=5748 Ack=2129 Win=1032 Len=1392 [TCP segment of a reassembled PDU]"
"868","45.671222","2a0d:6fc2:5560:c200:15f4:c1ab:865a:2377","2a03:2880:f276:cd:face:b00c:0:167","TLSv1.2","518","Application Data"
"869","45.726950","2a03:2880:f276:cd:face:b00c:0:167","2a0d:6fc2:5560:c200:15f4:c1ab:865a:2377","TCP","74","443  >  51017 [ACK] Seq=2129 Ack=7584 Win=5493 Len=0"
"871","45.909069","2a03:2880:f276:cd:face:b00c:0:167","2a0d:6fc2:5560:c200:15f4:c1ab:865a:2377","TLSv1.2","185","Application Data"
"872","45.960054","2a0d:6fc2:5560:c200:15f4:c1ab:865a:2377","2a03:2880:f276:cd:face:b00c:0:167","TCP","74","51017  >  443 [ACK] Seq=7584 Ack=2240 Win=1031 Len=0"
"875","46.250355","2a03:2880:f276:cd:face:b00c:0:167","2a0d:6fc2:5560:c200:15f4:c1ab:865a:2377","TLSv1.2","169","Application Data"
"876","46.252181","2a0d:6fc2:5560:c200:15f4:c1ab:865a:2377","2a03:2880:f276:cd:face:b00c:0:167","TLSv1.2","167","Application Data"
"877","46.272661","2a03:2880:f276:cd:face:b00c:0:167","2a0d:6fc2:5560:c200:15f4:c1ab:865a:2377","TLSv1.2","171","Application Data"
"878","46.278709","2a0d:6fc2:5560:c200:15f4:c1ab:865a:2377","2a03:2880:f276:cd:face:b00c:0:167","TLSv1.2","169","Application Data"
"879","46.308269","2a03:2880:f276:cd:face:b00c:0:167","2a0d:6fc2:5560:c200:15f4:c1ab:865a:2377","TCP","74","443  >  51017 [ACK] Seq=2432 Ack=7677 Win=5500 Len=0"
"880","46.334520","2a03:2880:f276:cd:face:b00c:0:167","2a0d:6fc2:5560:c200:15f4:c1ab:865a:2377","TCP","74","443  >  51017 [ACK] Seq=2432 Ack=7772 Win=5500 Len=0"
"883","47.163412","2a03:2880:f276:cd:face:b00c:0:167","2a0d:6fc2:5560:c200:15f4:c1ab:865a:2377","TLSv1.2","153","Application Data"
"884","47.204122","2a0d:6fc2:5560:c200:15f4:c1ab:865a:2377","2a03:2880:f276:cd:face:b00c:0:167","TCP","74","51017  >  443 [ACK] Seq=7772 Ack=2511 Win=1030 Len=0"
"930","57.163911","2a03:2880:f276:cd:face:b00c:0:167","2a0d:6fc2:5560:c200:15f4:c1ab:865a:2377","TLSv1.2","153","Application Data"
"931","57.225463","2a0d:6fc2:5560:c200:15f4:c1ab:865a:2377","2a03:2880:f276:cd:face:b00c:0:167","TCP","74","51017  >  443 [ACK] Seq=7772 Ack=2590 Win=1030 Len=0"
"963","60.408264","2a03:2880:f276:cd:face:b00c:0:167","2a0d:6fc2:5560:c200:15f4:c1ab:865a:2377","TLSv1.2","151","Application Data"
"964","60.449708","2a0d:6fc2:5560:c200:15f4:c1ab:865a:2377","2a03:2880:f276:cd:face:b00c:0:167","TCP","74","51017  >  443 [ACK] Seq=7772 Ack=2667 Win=1030 Len=0"
"973","61.408225","2a03:2880:f276:cd:face:b00c:0:167","2a0d:6fc2:5560:c200:15f4:c1ab:865a:2377","TLSv1.2","839","Application Data"
"974","61.460302","2a0d:6fc2:5560:c200:15f4:c1ab:865a:2377","2a03:2880:f276:cd:face:b00c:0:167","TCP","74","51017  >  443 [ACK] Seq=7772 Ack=3432 Win=1033 Len=0"
"975","61.506476","2a0d:6fc2:5560:c200:15f4:c1ab:865a:2377","2a03:2880:f276:cd:face:b00c:0:167","TLSv1.2","165","Application Data"
"979","61.547277","2a0d:6fc2:5560:c200:15f4:c1ab:865a:2377","2a03:2880:f276:cd:face:b00c:0:167","TLSv1.2","177","Application Data"
"980","61.576130","2a03:2880:f276:cd:face:b00c:0:167","2a0d:6fc2:5560:c200:15f4:c1ab:865a:2377","TCP","74","443  >  51017 [ACK] Seq=3432 Ack=7863 Win=5500 Len=0"
"988","61.603474","2a03:2880:f276:cd:face:b00c:0:167","2a0d:6fc2:5560:c200:15f4:c1ab:865a:2377","TCP","74","443  >  51017 [ACK] Seq=3432 Ack=7966 Win=5500 Len=0"
"993","61.700401","2a03:2880:f276:cd:face:b00c:0:167","2a0d:6fc2:5560:c200:15f4:c1ab:865a:2377","TLSv1.2","164","Application Data"
"994","61.744463","2a0d:6fc2:5560:c200:15f4:c1ab:865a:2377","2a03:2880:f276:cd:face:b00c:0:167","TCP","74","51017  >  443 [ACK] Seq=7966 Ack=3522 Win=1032 Len=0"
"1034","62.249592","2a03:2880:f276:cd:face:b00c:0:167","2a0d:6fc2:5560:c200:15f4:c1ab:865a:2377","TLSv1.2","171","Application Data"
"1035","62.252321","2a0d:6fc2:5560:c200:15f4:c1ab:865a:2377","2a03:2880:f276:cd:face:b00c:0:167","TLSv1.2","170","Application Data"
"1036","62.309351","2a03:2880:f276:cd:face:b00c:0:167","2a0d:6fc2:5560:c200:15f4:c1ab:865a:2377","TCP","74","443  >  51017 [ACK] Seq=3619 Ack=8062 Win=5500 Len=0"
"1100","67.900084","2a0d:6fc2:5560:c200:15f4:c1ab:865a:2377","2a03:2880:f276:cd:face:b00c:0:167","TLSv1.2","134","Application Data"
"1103","67.958108","2a03:2880:f276:cd:face:b00c:0:167","2a0d:6fc2:5560:c200:15f4:c1ab:865a:2377","TCP","74","443  >  51017 [ACK] Seq=3619 Ack=8122 Win=5500 Len=0"
"1116","69.435146","2a0d:6fc2:5560:c200:15f4:c1ab:865a:2377","2a03:2880:f276:cd:face:b00c:0:167","TLSv1.2","146","Application Data"
"1117","69.490996","2a03:2880:f276:cd:face:b00c:0:167","2a0d:6fc2:5560:c200:15f4:c1ab:865a:2377","TCP","74","443  >  51017 [ACK] Seq=3619 Ack=8194 Win=5500 Len=0"
"1128","71.525713","2a0d:6fc2:5560:c200:15f4:c1ab:865a:2377","2a03:2880:f276:cd:face:b00c:0:167","TCP","1466","51017  >  443 [ACK] Seq=8194 Ack=3619 Win=1032 Len=1392 [TCP segment of a reassembled PDU]"
"1129","71.525713","2a0d:6fc2:5560:c200:15f4:c1ab:865a:2377","2a03:2880:f276:cd:face:b00c:0:167","TCP","1466","51017  >  443 [ACK] Seq=9586 Ack=3619 Win=1032 Len=1392 [TCP segment of a reassembled PDU]"
"1130","71.525713","2a0d:6fc2:5560:c200:15f4:c1ab:865a:2377","2a03:2880:f276:cd:face:b00c:0:167","TCP","1466","51017  >  443 [ACK] Seq=10978 Ack=3619 Win=1032 Len=1392 [TCP segment of a reassembled PDU]"
"1131","71.525713","2a0d:6fc2:5560:c200:15f4:c1ab:865a:2377","2a03:2880:f276:cd:face:b00c:0:167","TCP","1466","51017  >  443 [ACK] Seq=12370 Ack=3619 Win=1032 Len=1392 [TCP segment of a reassembled PDU]"
"1132","71.525713","2a0d:6fc2:5560:c200:15f4:c1ab:865a:2377","2a03:2880:f276:cd:face:b00c:0:167","TLSv1.2","537","Application Data"
"1162","71.547675","2a0d:6fc2:5560:c200:15f4:c1ab:865a:2377","2a03:2880:f276:cd:face:b00c:0:167","TCP","86","61180  >  443 [SYN] Seq=0 Win=64400 Len=0 MSS=1400 WS=256 SACK_PERM"
"1167","71.582271","2a03:2880:f276:cd:face:b00c:0:167","2a0d:6fc2:5560:c200:15f4:c1ab:865a:2377","TCP","74","443  >  51017 [ACK] Seq=3619 Ack=9586 Win=5500 Len=0"
"1168","71.582423","2a03:2880:f276:cd:face:b00c:0:167","2a0d:6fc2:5560:c200:15f4:c1ab:865a:2377","TCP","74","443  >  51017 [ACK] Seq=3619 Ack=10978 Win=5500 Len=0"
"1169","71.582423","2a03:2880:f276:cd:face:b00c:0:167","2a0d:6fc2:5560:c200:15f4:c1ab:865a:2377","TCP","74","443  >  51017 [ACK] Seq=3619 Ack=12370 Win=5500 Len=0"
"1171","71.602048","2a03:2880:f276:cd:face:b00c:0:167","2a0d:6fc2:5560:c200:15f4:c1ab:865a:2377","TCP","74","443  >  51017 [ACK] Seq=3619 Ack=14225 Win=5493 Len=0"
"1172","71.605807","2a03:2880:f276:cd:face:b00c:0:167","2a0d:6fc2:5560:c200:15f4:c1ab:865a:2377","TCP","86","443  >  61180 [SYN, ACK] Seq=0 Ack=1 Win=65535 Len=0 MSS=1392 SACK_PERM WS=256"
"1174","71.605901","2a0d:6fc2:5560:c200:15f4:c1ab:865a:2377","2a03:2880:f276:cd:face:b00c:0:167","TCP","74","61180  >  443 [ACK] Seq=1 Ack=1 Win=132096 Len=0"
"1175","71.606205","2a0d:6fc2:5560:c200:15f4:c1ab:865a:2377","2a03:2880:f276:cd:face:b00c:0:167","TLSv1.3","591","Client Hello"
"1176","71.663305","2a03:2880:f276:cd:face:b00c:0:167","2a0d:6fc2:5560:c200:15f4:c1ab:865a:2377","TCP","74","443  >  61180 [ACK] Seq=1 Ack=518 Win=66816 Len=0"
"1177","71.664005","2a03:2880:f276:cd:face:b00c:0:167","2a0d:6fc2:5560:c200:15f4:c1ab:865a:2377","TLSv1.3","286","Server Hello, Change Cipher Spec, Application Data"
"1178","71.664343","2a0d:6fc2:5560:c200:15f4:c1ab:865a:2377","2a03:2880:f276:cd:face:b00c:0:167","TLSv1.3","138","Change Cipher Spec, Application Data"
"1179","71.664508","2a0d:6fc2:5560:c200:15f4:c1ab:865a:2377","2a03:2880:f276:cd:face:b00c:0:167","TLSv1.3","172","Application Data"
"1180","71.665045","2a0d:6fc2:5560:c200:15f4:c1ab:865a:2377","2a03:2880:f276:cd:face:b00c:0:167","TLSv1.3","544","Application Data"
"1181","71.665163","2a0d:6fc2:5560:c200:15f4:c1ab:865a:2377","2a03:2880:f276:cd:face:b00c:0:167","TLSv1.3","948","Application Data"
"1182","71.665362","2a0d:6fc2:5560:c200:15f4:c1ab:865a:2377","2a03:2880:f276:cd:face:b00c:0:167","TLSv1.3","197","Application Data"
"1183","71.665407","2a0d:6fc2:5560:c200:15f4:c1ab:865a:2377","2a03:2880:f276:cd:face:b00c:0:167","TLSv1.3","948","Application Data"
"1184","71.679625","2a03:2880:f276:cd:face:b00c:0:167","2a0d:6fc2:5560:c200:15f4:c1ab:865a:2377","TLSv1.2","138","Application Data"
"1185","71.721742","2a03:2880:f276:cd:face:b00c:0:167","2a0d:6fc2:5560:c200:15f4:c1ab:865a:2377","TCP","74","443  >  61180 [ACK] Seq=213 Ack=680 Win=66816 Len=0"
"1186","71.721742","2a03:2880:f276:cd:face:b00c:0:167","2a0d:6fc2:5560:c200:15f4:c1ab:865a:2377","TLSv1.3","245","Application Data"
"1187","71.722644","2a03:2880:f276:cd:face:b00c:0:167","2a0d:6fc2:5560:c200:15f4:c1ab:865a:2377","TLSv1.3","148","Application Data"
"1188","71.722644","2a03:2880:f276:cd:face:b00c:0:167","2a0d:6fc2:5560:c200:15f4:c1ab:865a:2377","TLSv1.3","105","Application Data"
"1189","71.722723","2a0d:6fc2:5560:c200:15f4:c1ab:865a:2377","2a03:2880:f276:cd:face:b00c:0:167","TCP","74","61180  >  443 [ACK] Seq=3021 Ack=489 Win=131584 Len=0"
"1190","71.723049","2a0d:6fc2:5560:c200:15f4:c1ab:865a:2377","2a03:2880:f276:cd:face:b00c:0:167","TLSv1.3","105","Application Data"
"1191","71.724413","2a0d:6fc2:5560:c200:15f4:c1ab:865a:2377","2a03:2880:f276:cd:face:b00c:0:167","TCP","74","51017  >  443 [ACK] Seq=14225 Ack=3683 Win=1032 Len=0"
"1192","71.725564","2a03:2880:f276:cd:face:b00c:0:167","2a0d:6fc2:5560:c200:15f4:c1ab:865a:2377","TLSv1.3","109","Application Data"
"1193","71.725564","2a03:2880:f276:cd:face:b00c:0:167","2a0d:6fc2:5560:c200:15f4:c1ab:865a:2377","TCP","74","443  >  61180 [ACK] Seq=524 Ack=2147 Win=69632 Len=0"
"1194","71.725564","2a03:2880:f276:cd:face:b00c:0:167","2a0d:6fc2:5560:c200:15f4:c1ab:865a:2377","TLSv1.3","109","Application Data"
"1195","71.725649","2a0d:6fc2:5560:c200:15f4:c1ab:865a:2377","2a03:2880:f276:cd:face:b00c:0:167","TCP","74","61180  >  443 [ACK] Seq=3052 Ack=559 Win=131584 Len=0"
"1196","71.745702","2a03:2880:f276:cd:face:b00c:0:167","2a0d:6fc2:5560:c200:15f4:c1ab:865a:2377","TLSv1.3","562","Application Data"
"1197","71.800267","2a0d:6fc2:5560:c200:15f4:c1ab:865a:2377","2a03:2880:f276:cd:face:b00c:0:167","TCP","74","61180  >  443 [ACK] Seq=3052 Ack=1047 Win=131072 Len=0"
"1198","71.821081","2a03:2880:f276:cd:face:b00c:0:167","2a0d:6fc2:5560:c200:15f4:c1ab:865a:2377","TCP","74","443  >  61180 [ACK] Seq=1047 Ack=3052 Win=71424 Len=0"
"1199","71.948958","2a03:2880:f276:cd:face:b00c:0:167","2a0d:6fc2:5560:c200:15f4:c1ab:865a:2377","TLSv1.3","289","Application Data"
"1200","72.007990","2a0d:6fc2:5560:c200:15f4:c1ab:865a:2377","2a03:2880:f276:cd:face:b00c:0:167","TCP","74","61180  >  443 [ACK] Seq=3052 Ack=1262 Win=130816 Len=0"
"1206","74.787719","2a0d:6fc2:5560:c200:15f4:c1ab:865a:2377","2a03:2880:f276:cd:face:b00c:0:167","TLSv1.2","134","Application Data"
"1207","74.787807","2a0d:6fc2:5560:c200:15f4:c1ab:865a:2377","2a03:2880:f276:cd:face:b00c:0:167","TLSv1.2","144","Application Data"
"1210","74.843607","2a03:2880:f276:cd:face:b00c:0:167","2a0d:6fc2:5560:c200:15f4:c1ab:865a:2377","TCP","74","443  >  51017 [ACK] Seq=3683 Ack=14285 Win=5500 Len=0"
"1211","74.843607","2a03:2880:f276:cd:face:b00c:0:167","2a0d:6fc2:5560:c200:15f4:c1ab:865a:2377","TCP","74","443  >  51017 [ACK] Seq=3683 Ack=14355 Win=5500 Len=0"
"1212","74.939206","2a03:2880:f276:cd:face:b00c:0:167","2a0d:6fc2:5560:c200:15f4:c1ab:865a:2377","TLSv1.2","134","Application Data"
"1213","74.992167","2a0d:6fc2:5560:c200:15f4:c1ab:865a:2377","2a03:2880:f276:cd:face:b00c:0:167","TCP","74","51017  >  443 [ACK] Seq=14355 Ack=3743 Win=1031 Len=0"
"1236","78.385628","2a0d:6fc2:5560:c200:15f4:c1ab:865a:2377","2a03:2880:f276:cd:face:b00c:0:167","TLSv1.2","146","Application Data"
"1237","78.441312","2a03:2880:f276:cd:face:b00c:0:167","2a0d:6fc2:5560:c200:15f4:c1ab:865a:2377","TCP","74","443  >  51017 [ACK] Seq=3743 Ack=14427 Win=5500 Len=0"
"1379","88.355821","2a0d:6fc2:5560:c200:15f4:c1ab:865a:2377","2a03:2880:f276:cd:face:b00c:0:167","TLSv1.2","144","Application Data"
"1380","88.386273","2a0d:6fc2:5560:c200:15f4:c1ab:865a:2377","2a03:2880:f276:cd:face:b00c:0:167","TLSv1.2","146","Application Data"
"1388","88.498329","2a03:2880:f276:cd:face:b00c:0:167","2a0d:6fc2:5560:c200:15f4:c1ab:865a:2377","TCP","74","443  >  51017 [ACK] Seq=3743 Ack=14497 Win=5500 Len=0"
"1389","88.498329","2a03:2880:f276:cd:face:b00c:0:167","2a0d:6fc2:5560:c200:15f4:c1ab:865a:2377","TCP","74","443  >  51017 [ACK] Seq=3743 Ack=14569 Win=5500 Len=0"
"1390","88.647069","2a03:2880:f276:cd:face:b00c:0:167","2a0d:6fc2:5560:c200:15f4:c1ab:865a:2377","TLSv1.2","146","Application Data"
"1393","88.697036","2a0d:6fc2:5560:c200:15f4:c1ab:865a:2377","2a03:2880:f276:cd:face:b00c:0:167","TCP","74","51017  >  443 [ACK] Seq=14569 Ack=3815 Win=1031 Len=0"
"1400","89.338095","2a0d:6fc2:5560:c200:15f4:c1ab:865a:2377","2a03:2880:f276:cd:face:b00c:0:167","TLSv1.2","144","Application Data"
"1405","89.466378","2a03:2880:f276:cd:face:b00c:0:167","2a0d:6fc2:5560:c200:15f4:c1ab:865a:2377","TCP","74","443  >  51017 [ACK] Seq=3815 Ack=14639 Win=5500 Len=0"
"1501","90.433596","2a0d:6fc2:5560:c200:15f4:c1ab:865a:2377","2a03:2880:f276:cd:face:b00c:0:167","TLSv1.2","805","Application Data"
"1502","90.489675","2a03:2880:f276:cd:face:b00c:0:167","2a0d:6fc2:5560:c200:15f4:c1ab:865a:2377","TCP","74","443  >  51017 [ACK] Seq=3815 Ack=15370 Win=5500 Len=0"
"1503","90.728524","2a03:2880:f276:cd:face:b00c:0:167","2a0d:6fc2:5560:c200:15f4:c1ab:865a:2377","TLSv1.2","185","Application Data"
"1504","90.775189","2a0d:6fc2:5560:c200:15f4:c1ab:865a:2377","2a03:2880:f276:cd:face:b00c:0:167","TCP","74","51017  >  443 [ACK] Seq=15370 Ack=3926 Win=1031 Len=0"
"1508","91.031742","2a03:2880:f276:cd:face:b00c:0:167","2a0d:6fc2:5560:c200:15f4:c1ab:865a:2377","TLSv1.2","169","Application Data"
"1509","91.034743","2a0d:6fc2:5560:c200:15f4:c1ab:865a:2377","2a03:2880:f276:cd:face:b00c:0:167","TLSv1.2","167","Application Data"
"1510","91.035760","2a03:2880:f276:cd:face:b00c:0:167","2a0d:6fc2:5560:c200:15f4:c1ab:865a:2377","TLSv1.2","171","Application Data"
"1511","91.040460","2a0d:6fc2:5560:c200:15f4:c1ab:865a:2377","2a03:2880:f276:cd:face:b00c:0:167","TLSv1.2","169","Application Data"
"1512","91.090714","2a03:2880:f276:cd:face:b00c:0:167","2a0d:6fc2:5560:c200:15f4:c1ab:865a:2377","TCP","74","443  >  51017 [ACK] Seq=4118 Ack=15463 Win=5500 Len=0"
"1513","91.096345","2a03:2880:f276:cd:face:b00c:0:167","2a0d:6fc2:5560:c200:15f4:c1ab:865a:2377","TCP","74","443  >  51017 [ACK] Seq=4118 Ack=15558 Win=5500 Len=0"
"1526","94.076904","2a03:2880:f276:cd:face:b00c:0:167","2a0d:6fc2:5560:c200:15f4:c1ab:865a:2377","TLSv1.2","153","Application Data"
"1527","94.125210","2a0d:6fc2:5560:c200:15f4:c1ab:865a:2377","2a03:2880:f276:cd:face:b00c:0:167","TCP","74","51017  >  443 [ACK] Seq=15558 Ack=4197 Win=1030 Len=0"
"1566","104.061251","2a03:2880:f276:cd:face:b00c:0:167","2a0d:6fc2:5560:c200:15f4:c1ab:865a:2377","TLSv1.2","153","Application Data"
"1567","104.117537","2a0d:6fc2:5560:c200:15f4:c1ab:865a:2377","2a03:2880:f276:cd:face:b00c:0:167","TCP","74","51017  >  443 [ACK] Seq=15558 Ack=4276 Win=1029 Len=0"
"1573","104.418367","2a03:2880:f276:cd:face:b00c:0:167","2a0d:6fc2:5560:c200:15f4:c1ab:865a:2377","TLSv1.2","151","Application Data"
"1574","104.459591","2a0d:6fc2:5560:c200:15f4:c1ab:865a:2377","2a03:2880:f276:cd:face:b00c:0:167","TCP","74","51017  >  443 [ACK] Seq=15558 Ack=4353 Win=1029 Len=0"
"1576","105.508035","2a03:2880:f276:cd:face:b00c:0:167","2a0d:6fc2:5560:c200:15f4:c1ab:865a:2377","TLSv1.2","839","Application Data"
"1577","105.555438","2a0d:6fc2:5560:c200:15f4:c1ab:865a:2377","2a03:2880:f276:cd:face:b00c:0:167","TCP","74","51017  >  443 [ACK] Seq=15558 Ack=5118 Win=1033 Len=0"
"1581","105.630627","2a0d:6fc2:5560:c200:15f4:c1ab:865a:2377","2a03:2880:f276:cd:face:b00c:0:167","TLSv1.2","165","Application Data"
"1615","105.683229","2a0d:6fc2:5560:c200:15f4:c1ab:865a:2377","2a03:2880:f276:cd:face:b00c:0:167","TLSv1.2","177","Application Data"
"1616","105.686476","2a03:2880:f276:cd:face:b00c:0:167","2a0d:6fc2:5560:c200:15f4:c1ab:865a:2377","TCP","74","443  >  51017 [ACK] Seq=5118 Ack=15649 Win=5500 Len=0"
"1624","105.739084","2a03:2880:f276:cd:face:b00c:0:167","2a0d:6fc2:5560:c200:15f4:c1ab:865a:2377","TCP","74","443  >  51017 [ACK] Seq=5118 Ack=15752 Win=5500 Len=0"
"1629","105.835492","2a03:2880:f276:cd:face:b00c:0:167","2a0d:6fc2:5560:c200:15f4:c1ab:865a:2377","TLSv1.2","164","Application Data"
"1655","105.878081","2a0d:6fc2:5560:c200:15f4:c1ab:865a:2377","2a03:2880:f276:cd:face:b00c:0:167","TCP","74","51017  >  443 [ACK] Seq=15752 Ack=5208 Win=1032 Len=0"
"1667","106.364365","2a03:2880:f276:cd:face:b00c:0:167","2a0d:6fc2:5560:c200:15f4:c1ab:865a:2377","TLSv1.2","171","Application Data"
"1668","106.367749","2a0d:6fc2:5560:c200:15f4:c1ab:865a:2377","2a03:2880:f276:cd:face:b00c:0:167","TLSv1.2","170","Application Data"
"1669","106.423897","2a03:2880:f276:cd:face:b00c:0:167","2a0d:6fc2:5560:c200:15f4:c1ab:865a:2377","TCP","74","443  >  51017 [ACK] Seq=5305 Ack=15848 Win=5500 Len=0"
"1765","113.896024","2a0d:6fc2:5560:c200:15f4:c1ab:865a:2377","2a03:2880:f276:cd:face:b00c:0:167","TLSv1.2","146","Application Data"
"1766","113.951982","2a03:2880:f276:cd:face:b00c:0:167","2a0d:6fc2:5560:c200:15f4:c1ab:865a:2377","TCP","74","443  >  51017 [ACK] Seq=5305 Ack=15920 Win=5500 Len=0"
"1774","116.950582","2a0d:6fc2:5560:c200:15f4:c1ab:865a:2377","2a03:2880:f276:cd:face:b00c:0:167","TCP","75","[TCP Keep-Alive] 61180  >  443 [ACK] Seq=3051 Ack=1262 Win=130816 Len=1"
"1775","117.006836","2a03:2880:f276:cd:face:b00c:0:167","2a0d:6fc2:5560:c200:15f4:c1ab:865a:2377","TCP","74","[TCP Keep-Alive ACK] 443  >  61180 [ACK] Seq=1262 Ack=3052 Win=71424 Len=0"
"1786","119.790005","2a0d:6fc2:5560:c200:15f4:c1ab:865a:2377","2a03:2880:f276:cd:face:b00c:0:167","TLSv1.2","144","Application Data"
"1787","119.845868","2a03:2880:f276:cd:face:b00c:0:167","2a0d:6fc2:5560:c200:15f4:c1ab:865a:2377","TCP","74","443  >  51017 [ACK] Seq=5305 Ack=15990 Win=5500 Len=0"
"1840","120.701944","2a0d:6fc2:5560:c200:15f4:c1ab:865a:2377","2a03:2880:f276:cd:face:b00c:0:167","TLSv1.2","805","Application Data"
"1841","120.759082","2a03:2880:f276:cd:face:b00c:0:167","2a0d:6fc2:5560:c200:15f4:c1ab:865a:2377","TCP","74","443  >  51017 [ACK] Seq=5305 Ack=16721 Win=5500 Len=0"
"1845","120.986963","2a03:2880:f276:cd:face:b00c:0:167","2a0d:6fc2:5560:c200:15f4:c1ab:865a:2377","TLSv1.2","185","Application Data"
"1848","121.041601","2a0d:6fc2:5560:c200:15f4:c1ab:865a:2377","2a03:2880:f276:cd:face:b00c:0:167","TCP","74","51017  >  443 [ACK] Seq=16721 Ack=5416 Win=1031 Len=0"
"1849","121.306281","2a03:2880:f276:cd:face:b00c:0:167","2a0d:6fc2:5560:c200:15f4:c1ab:865a:2377","TLSv1.2","169","Application Data"
"1850","121.308169","2a0d:6fc2:5560:c200:15f4:c1ab:865a:2377","2a03:2880:f276:cd:face:b00c:0:167","TLSv1.2","167","Application Data"
"1851","121.333423","2a03:2880:f276:cd:face:b00c:0:167","2a0d:6fc2:5560:c200:15f4:c1ab:865a:2377","TLSv1.2","171","Application Data"
"1852","121.337675","2a0d:6fc2:5560:c200:15f4:c1ab:865a:2377","2a03:2880:f276:cd:face:b00c:0:167","TLSv1.2","169","Application Data"
"1853","121.364278","2a03:2880:f276:cd:face:b00c:0:167","2a0d:6fc2:5560:c200:15f4:c1ab:865a:2377","TCP","74","443  >  51017 [ACK] Seq=5608 Ack=16814 Win=5500 Len=0"
"1854","121.394208","2a03:2880:f276:cd:face:b00c:0:167","2a0d:6fc2:5560:c200:15f4:c1ab:865a:2377","TCP","74","443  >  51017 [ACK] Seq=5608 Ack=16909 Win=5500 Len=0"
